{
    "componentChunkName": "component---src-templates-post-template-js",
    "path": "/blog/todd-coxeter/",
    "result": {"data":{"mdx":{"frontmatter":{"title":"A Graphical Explanation of the Todd-Coxeter Algorithm","date":"2022-05-03","tags":["math","algorithms"],"attachments":null},"body":"var _excluded = [\"components\"];\n\nfunction _extends() { _extends = Object.assign || function (target) { for (var i = 1; i < arguments.length; i++) { var source = arguments[i]; for (var key in source) { if (Object.prototype.hasOwnProperty.call(source, key)) { target[key] = source[key]; } } } return target; }; return _extends.apply(this, arguments); }\n\nfunction _objectWithoutProperties(source, excluded) { if (source == null) return {}; var target = _objectWithoutPropertiesLoose(source, excluded); var key, i; if (Object.getOwnPropertySymbols) { var sourceSymbolKeys = Object.getOwnPropertySymbols(source); for (i = 0; i < sourceSymbolKeys.length; i++) { key = sourceSymbolKeys[i]; if (excluded.indexOf(key) >= 0) continue; if (!Object.prototype.propertyIsEnumerable.call(source, key)) continue; target[key] = source[key]; } } return target; }\n\nfunction _objectWithoutPropertiesLoose(source, excluded) { if (source == null) return {}; var target = {}; var sourceKeys = Object.keys(source); var key, i; for (i = 0; i < sourceKeys.length; i++) { key = sourceKeys[i]; if (excluded.indexOf(key) >= 0) continue; target[key] = source[key]; } return target; }\n\n/* @jsxRuntime classic */\n\n/* @jsx mdx */\nvar _frontmatter = {\n  \"date\": \"2022-05-03\",\n  \"title\": \"A Graphical Explanation of the Todd-Coxeter Algorithm\",\n  \"tags\": [\"math\", \"algorithms\"],\n  \"excerpt\": \"An explanation covering group presentations, group actions, Schreier graphs, the concepts behind the Todd-Coxeter Algorithm, and an implementation of that algorithm\"\n};\nvar layoutProps = {\n  _frontmatter: _frontmatter\n};\nvar MDXLayout = \"wrapper\";\nreturn function MDXContent(_ref) {\n  var components = _ref.components,\n      props = _objectWithoutProperties(_ref, _excluded);\n\n  return mdx(MDXLayout, _extends({}, layoutProps, props, {\n    components: components,\n    mdxType: \"MDXLayout\"\n  }), mdx(\"p\", null, \"Using a group presentation is often the most compact and elegant way to define a group, and in some cases it is also the most natural\", mdx(RefLink, {\n    href: \"#resources\",\n    mdxType: \"RefLink\"\n  }, \"1\"), \". However, it is in general quite difficult to analyze groups written in this form. In fact, it is impossible to create an algorithm that determines whether a group is finite, trivial, or abelian from its group presentation alone\", mdx(RefLink, {\n    href: \"#resources\",\n    mdxType: \"RefLink\"\n  }, \"1\"), \".\"), mdx(\"p\", null, \"We can, however, analyze the cosets within these groups. The Todd-Coxeter Algorithm, which was originally created by J. A. Todd and H. S. M. Coxeter in the 1930s\", mdx(RefLink, {\n    href: \"#resources\",\n    mdxType: \"RefLink\"\n  }, \"2\"), \", is a clever and surprisingly simple algorithm that enumerates the cosets of a given subgroup using only the presentation of the parent group and the generators of the subgroup. In this post, I will endevour to explain the concepts behind this algorithm, the procedure itself, and the inner workings of an implementation of this algorithm.\"), mdx(\"h2\", {\n    \"id\": \"group-presentations\",\n    \"style\": {\n      \"position\": \"relative\"\n    }\n  }, mdx(\"a\", {\n    parentName: \"h2\",\n    \"href\": \"#group-presentations\",\n    \"aria-label\": \"group presentations permalink\",\n    \"className\": \"anchor before\"\n  }, mdx(\"svg\", {\n    parentName: \"a\",\n    \"aria-hidden\": \"true\",\n    \"focusable\": \"false\",\n    \"height\": \"16\",\n    \"version\": \"1.1\",\n    \"viewBox\": \"0 0 16 16\",\n    \"width\": \"16\"\n  }, mdx(\"path\", {\n    parentName: \"svg\",\n    \"fillRule\": \"evenodd\",\n    \"d\": \"M4 9h1v1H4c-1.5 0-3-1.69-3-3.5S2.55 3 4 3h4c1.45 0 3 1.69 3 3.5 0 1.41-.91 2.72-2 3.25V8.59c.58-.45 1-1.27 1-2.09C10 5.22 8.98 4 8 4H4c-.98 0-2 1.22-2 2.5S3 9 4 9zm9-3h-1v1h1c1 0 2 1.22 2 2.5S13.98 12 13 12H9c-.98 0-2-1.22-2-2.5 0-.83.42-1.64 1-2.09V6.25c-1.09.53-2 1.84-2 3.25C6 11.31 7.55 13 9 13h4c1.45 0 3-1.69 3-3.5S14.5 6 13 6z\"\n  }))), \"Group Presentations\"), mdx(\"p\", null, \"Before we continue, we need to nail down a working definition for group presentations. As taken from Derek Holt's lecture notes\", mdx(RefLink, {\n    href: \"#resources\",\n    mdxType: \"RefLink\"\n  }, \"1\"), \", if \", mdx(\"span\", {\n    parentName: \"p\",\n    \"className\": \"math math-inline\"\n  }, mdx(\"span\", {\n    parentName: \"span\",\n    \"className\": \"katex\"\n  }, mdx(\"span\", {\n    parentName: \"span\",\n    \"className\": \"katex-mathml\"\n  }, mdx(\"math\", {\n    parentName: \"span\",\n    \"xmlns\": \"http://www.w3.org/1998/Math/MathML\"\n  }, mdx(\"semantics\", {\n    parentName: \"math\"\n  }, mdx(\"mrow\", {\n    parentName: \"semantics\"\n  }, mdx(\"mo\", {\n    parentName: \"mrow\",\n    \"stretchy\": \"false\"\n  }, \"\\u27E8\"), mdx(\"mi\", {\n    parentName: \"mrow\"\n  }, \"X\"), mdx(\"mo\", {\n    parentName: \"mrow\"\n  }, \"\\u2223\"), mdx(\"mi\", {\n    parentName: \"mrow\"\n  }, \"R\"), mdx(\"mo\", {\n    parentName: \"mrow\",\n    \"stretchy\": \"false\"\n  }, \"\\u27E9\")), mdx(\"annotation\", {\n    parentName: \"semantics\",\n    \"encoding\": \"application/x-tex\"\n  }, \"\\\\langle X \\\\mid R \\\\rangle\")))), mdx(\"span\", {\n    parentName: \"span\",\n    \"className\": \"katex-html\",\n    \"aria-hidden\": \"true\"\n  }, mdx(\"span\", {\n    parentName: \"span\",\n    \"className\": \"base\"\n  }, mdx(\"span\", {\n    parentName: \"span\",\n    \"className\": \"strut\",\n    \"style\": {\n      \"height\": \"1em\",\n      \"verticalAlign\": \"-0.25em\"\n    }\n  }), mdx(\"span\", {\n    parentName: \"span\",\n    \"className\": \"mopen\"\n  }, \"\\u27E8\"), mdx(\"span\", {\n    parentName: \"span\",\n    \"className\": \"mord mathnormal\",\n    \"style\": {\n      \"marginRight\": \"0.07847em\"\n    }\n  }, \"X\"), mdx(\"span\", {\n    parentName: \"span\",\n    \"className\": \"mspace\",\n    \"style\": {\n      \"marginRight\": \"0.2777777777777778em\"\n    }\n  }), mdx(\"span\", {\n    parentName: \"span\",\n    \"className\": \"mrel\"\n  }, \"\\u2223\"), mdx(\"span\", {\n    parentName: \"span\",\n    \"className\": \"mspace\",\n    \"style\": {\n      \"marginRight\": \"0.2777777777777778em\"\n    }\n  })), mdx(\"span\", {\n    parentName: \"span\",\n    \"className\": \"base\"\n  }, mdx(\"span\", {\n    parentName: \"span\",\n    \"className\": \"strut\",\n    \"style\": {\n      \"height\": \"1em\",\n      \"verticalAlign\": \"-0.25em\"\n    }\n  }), mdx(\"span\", {\n    parentName: \"span\",\n    \"className\": \"mord mathnormal\",\n    \"style\": {\n      \"marginRight\": \"0.00773em\"\n    }\n  }, \"R\"), mdx(\"span\", {\n    parentName: \"span\",\n    \"className\": \"mclose\"\n  }, \"\\u27E9\"))))), \" is a presentation of the group \", mdx(\"span\", {\n    parentName: \"p\",\n    \"className\": \"math math-inline\"\n  }, mdx(\"span\", {\n    parentName: \"span\",\n    \"className\": \"katex\"\n  }, mdx(\"span\", {\n    parentName: \"span\",\n    \"className\": \"katex-mathml\"\n  }, mdx(\"math\", {\n    parentName: \"span\",\n    \"xmlns\": \"http://www.w3.org/1998/Math/MathML\"\n  }, mdx(\"semantics\", {\n    parentName: \"math\"\n  }, mdx(\"mrow\", {\n    parentName: \"semantics\"\n  }, mdx(\"mi\", {\n    parentName: \"mrow\"\n  }, \"G\")), mdx(\"annotation\", {\n    parentName: \"semantics\",\n    \"encoding\": \"application/x-tex\"\n  }, \"G\")))), mdx(\"span\", {\n    parentName: \"span\",\n    \"className\": \"katex-html\",\n    \"aria-hidden\": \"true\"\n  }, mdx(\"span\", {\n    parentName: \"span\",\n    \"className\": \"base\"\n  }, mdx(\"span\", {\n    parentName: \"span\",\n    \"className\": \"strut\",\n    \"style\": {\n      \"height\": \"0.68333em\",\n      \"verticalAlign\": \"0em\"\n    }\n  }), mdx(\"span\", {\n    parentName: \"span\",\n    \"className\": \"mord mathnormal\"\n  }, \"G\"))))), \", then \", mdx(\"span\", {\n    parentName: \"p\",\n    \"className\": \"math math-inline\"\n  }, mdx(\"span\", {\n    parentName: \"span\",\n    \"className\": \"katex\"\n  }, mdx(\"span\", {\n    parentName: \"span\",\n    \"className\": \"katex-mathml\"\n  }, mdx(\"math\", {\n    parentName: \"span\",\n    \"xmlns\": \"http://www.w3.org/1998/Math/MathML\"\n  }, mdx(\"semantics\", {\n    parentName: \"math\"\n  }, mdx(\"mrow\", {\n    parentName: \"semantics\"\n  }, mdx(\"mi\", {\n    parentName: \"mrow\"\n  }, \"G\")), mdx(\"annotation\", {\n    parentName: \"semantics\",\n    \"encoding\": \"application/x-tex\"\n  }, \"G\")))), mdx(\"span\", {\n    parentName: \"span\",\n    \"className\": \"katex-html\",\n    \"aria-hidden\": \"true\"\n  }, mdx(\"span\", {\n    parentName: \"span\",\n    \"className\": \"base\"\n  }, mdx(\"span\", {\n    parentName: \"span\",\n    \"className\": \"strut\",\n    \"style\": {\n      \"height\": \"0.68333em\",\n      \"verticalAlign\": \"0em\"\n    }\n  }), mdx(\"span\", {\n    parentName: \"span\",\n    \"className\": \"mord mathnormal\"\n  }, \"G\"))))), \" is the \\\"largest\\\" group generated by the elements of \", mdx(\"span\", {\n    parentName: \"p\",\n    \"className\": \"math math-inline\"\n  }, mdx(\"span\", {\n    parentName: \"span\",\n    \"className\": \"katex\"\n  }, mdx(\"span\", {\n    parentName: \"span\",\n    \"className\": \"katex-mathml\"\n  }, mdx(\"math\", {\n    parentName: \"span\",\n    \"xmlns\": \"http://www.w3.org/1998/Math/MathML\"\n  }, mdx(\"semantics\", {\n    parentName: \"math\"\n  }, mdx(\"mrow\", {\n    parentName: \"semantics\"\n  }, mdx(\"mi\", {\n    parentName: \"mrow\"\n  }, \"X\")), mdx(\"annotation\", {\n    parentName: \"semantics\",\n    \"encoding\": \"application/x-tex\"\n  }, \"X\")))), mdx(\"span\", {\n    parentName: \"span\",\n    \"className\": \"katex-html\",\n    \"aria-hidden\": \"true\"\n  }, mdx(\"span\", {\n    parentName: \"span\",\n    \"className\": \"base\"\n  }, mdx(\"span\", {\n    parentName: \"span\",\n    \"className\": \"strut\",\n    \"style\": {\n      \"height\": \"0.68333em\",\n      \"verticalAlign\": \"0em\"\n    }\n  }), mdx(\"span\", {\n    parentName: \"span\",\n    \"className\": \"mord mathnormal\",\n    \"style\": {\n      \"marginRight\": \"0.07847em\"\n    }\n  }, \"X\"))))), \" for which the relations in \", mdx(\"span\", {\n    parentName: \"p\",\n    \"className\": \"math math-inline\"\n  }, mdx(\"span\", {\n    parentName: \"span\",\n    \"className\": \"katex\"\n  }, mdx(\"span\", {\n    parentName: \"span\",\n    \"className\": \"katex-mathml\"\n  }, mdx(\"math\", {\n    parentName: \"span\",\n    \"xmlns\": \"http://www.w3.org/1998/Math/MathML\"\n  }, mdx(\"semantics\", {\n    parentName: \"math\"\n  }, mdx(\"mrow\", {\n    parentName: \"semantics\"\n  }, mdx(\"mi\", {\n    parentName: \"mrow\"\n  }, \"R\")), mdx(\"annotation\", {\n    parentName: \"semantics\",\n    \"encoding\": \"application/x-tex\"\n  }, \"R\")))), mdx(\"span\", {\n    parentName: \"span\",\n    \"className\": \"katex-html\",\n    \"aria-hidden\": \"true\"\n  }, mdx(\"span\", {\n    parentName: \"span\",\n    \"className\": \"base\"\n  }, mdx(\"span\", {\n    parentName: \"span\",\n    \"className\": \"strut\",\n    \"style\": {\n      \"height\": \"0.68333em\",\n      \"verticalAlign\": \"0em\"\n    }\n  }), mdx(\"span\", {\n    parentName: \"span\",\n    \"className\": \"mord mathnormal\",\n    \"style\": {\n      \"marginRight\": \"0.00773em\"\n    }\n  }, \"R\"))))), \" hold in \", mdx(\"span\", {\n    parentName: \"p\",\n    \"className\": \"math math-inline\"\n  }, mdx(\"span\", {\n    parentName: \"span\",\n    \"className\": \"katex\"\n  }, mdx(\"span\", {\n    parentName: \"span\",\n    \"className\": \"katex-mathml\"\n  }, mdx(\"math\", {\n    parentName: \"span\",\n    \"xmlns\": \"http://www.w3.org/1998/Math/MathML\"\n  }, mdx(\"semantics\", {\n    parentName: \"math\"\n  }, mdx(\"mrow\", {\n    parentName: \"semantics\"\n  }, mdx(\"mi\", {\n    parentName: \"mrow\"\n  }, \"G\")), mdx(\"annotation\", {\n    parentName: \"semantics\",\n    \"encoding\": \"application/x-tex\"\n  }, \"G\")))), mdx(\"span\", {\n    parentName: \"span\",\n    \"className\": \"katex-html\",\n    \"aria-hidden\": \"true\"\n  }, mdx(\"span\", {\n    parentName: \"span\",\n    \"className\": \"base\"\n  }, mdx(\"span\", {\n    parentName: \"span\",\n    \"className\": \"strut\",\n    \"style\": {\n      \"height\": \"0.68333em\",\n      \"verticalAlign\": \"0em\"\n    }\n  }), mdx(\"span\", {\n    parentName: \"span\",\n    \"className\": \"mord mathnormal\"\n  }, \"G\"))))), \". For example, \", mdx(\"span\", {\n    parentName: \"p\",\n    \"className\": \"math math-inline\"\n  }, mdx(\"span\", {\n    parentName: \"span\",\n    \"className\": \"katex\"\n  }, mdx(\"span\", {\n    parentName: \"span\",\n    \"className\": \"katex-mathml\"\n  }, mdx(\"math\", {\n    parentName: \"span\",\n    \"xmlns\": \"http://www.w3.org/1998/Math/MathML\"\n  }, mdx(\"semantics\", {\n    parentName: \"math\"\n  }, mdx(\"mrow\", {\n    parentName: \"semantics\"\n  }, mdx(\"mo\", {\n    parentName: \"mrow\",\n    \"stretchy\": \"false\"\n  }, \"\\u27E8\"), mdx(\"mi\", {\n    parentName: \"mrow\"\n  }, \"r\"), mdx(\"mo\", {\n    parentName: \"mrow\",\n    \"separator\": \"true\"\n  }, \",\"), mdx(\"mi\", {\n    parentName: \"mrow\"\n  }, \"s\"), mdx(\"mo\", {\n    parentName: \"mrow\"\n  }, \"\\u2223\"), mdx(\"msup\", {\n    parentName: \"mrow\"\n  }, mdx(\"mi\", {\n    parentName: \"msup\"\n  }, \"r\"), mdx(\"mn\", {\n    parentName: \"msup\"\n  }, \"6\")), mdx(\"mo\", {\n    parentName: \"mrow\"\n  }, \"=\"), mdx(\"msup\", {\n    parentName: \"mrow\"\n  }, mdx(\"mi\", {\n    parentName: \"msup\"\n  }, \"s\"), mdx(\"mn\", {\n    parentName: \"msup\"\n  }, \"2\")), mdx(\"mo\", {\n    parentName: \"mrow\"\n  }, \"=\"), mdx(\"mo\", {\n    parentName: \"mrow\",\n    \"stretchy\": \"false\"\n  }, \"(\"), mdx(\"mi\", {\n    parentName: \"mrow\"\n  }, \"r\"), mdx(\"mi\", {\n    parentName: \"mrow\"\n  }, \"s\"), mdx(\"msup\", {\n    parentName: \"mrow\"\n  }, mdx(\"mo\", {\n    parentName: \"msup\",\n    \"stretchy\": \"false\"\n  }, \")\"), mdx(\"mn\", {\n    parentName: \"msup\"\n  }, \"2\")), mdx(\"mo\", {\n    parentName: \"mrow\"\n  }, \"=\"), mdx(\"mi\", {\n    parentName: \"mrow\"\n  }, \"e\"), mdx(\"mo\", {\n    parentName: \"mrow\",\n    \"stretchy\": \"false\"\n  }, \"\\u27E9\")), mdx(\"annotation\", {\n    parentName: \"semantics\",\n    \"encoding\": \"application/x-tex\"\n  }, \"\\\\langle r,s \\\\mid r^6 = s^2 = (rs)^2 = e \\\\rangle\")))), mdx(\"span\", {\n    parentName: \"span\",\n    \"className\": \"katex-html\",\n    \"aria-hidden\": \"true\"\n  }, mdx(\"span\", {\n    parentName: \"span\",\n    \"className\": \"base\"\n  }, mdx(\"span\", {\n    parentName: \"span\",\n    \"className\": \"strut\",\n    \"style\": {\n      \"height\": \"1em\",\n      \"verticalAlign\": \"-0.25em\"\n    }\n  }), mdx(\"span\", {\n    parentName: \"span\",\n    \"className\": \"mopen\"\n  }, \"\\u27E8\"), mdx(\"span\", {\n    parentName: \"span\",\n    \"className\": \"mord mathnormal\",\n    \"style\": {\n      \"marginRight\": \"0.02778em\"\n    }\n  }, \"r\"), mdx(\"span\", {\n    parentName: \"span\",\n    \"className\": \"mpunct\"\n  }, \",\"), mdx(\"span\", {\n    parentName: \"span\",\n    \"className\": \"mspace\",\n    \"style\": {\n      \"marginRight\": \"0.16666666666666666em\"\n    }\n  }), mdx(\"span\", {\n    parentName: \"span\",\n    \"className\": \"mord mathnormal\"\n  }, \"s\"), mdx(\"span\", {\n    parentName: \"span\",\n    \"className\": \"mspace\",\n    \"style\": {\n      \"marginRight\": \"0.2777777777777778em\"\n    }\n  }), mdx(\"span\", {\n    parentName: \"span\",\n    \"className\": \"mrel\"\n  }, \"\\u2223\"), mdx(\"span\", {\n    parentName: \"span\",\n    \"className\": \"mspace\",\n    \"style\": {\n      \"marginRight\": \"0.2777777777777778em\"\n    }\n  })), mdx(\"span\", {\n    parentName: \"span\",\n    \"className\": \"base\"\n  }, mdx(\"span\", {\n    parentName: \"span\",\n    \"className\": \"strut\",\n    \"style\": {\n      \"height\": \"0.8141079999999999em\",\n      \"verticalAlign\": \"0em\"\n    }\n  }), mdx(\"span\", {\n    parentName: \"span\",\n    \"className\": \"mord\"\n  }, mdx(\"span\", {\n    parentName: \"span\",\n    \"className\": \"mord mathnormal\",\n    \"style\": {\n      \"marginRight\": \"0.02778em\"\n    }\n  }, \"r\"), mdx(\"span\", {\n    parentName: \"span\",\n    \"className\": \"msupsub\"\n  }, mdx(\"span\", {\n    parentName: \"span\",\n    \"className\": \"vlist-t\"\n  }, mdx(\"span\", {\n    parentName: \"span\",\n    \"className\": \"vlist-r\"\n  }, mdx(\"span\", {\n    parentName: \"span\",\n    \"className\": \"vlist\",\n    \"style\": {\n      \"height\": \"0.8141079999999999em\"\n    }\n  }, mdx(\"span\", {\n    parentName: \"span\",\n    \"style\": {\n      \"top\": \"-3.063em\",\n      \"marginRight\": \"0.05em\"\n    }\n  }, mdx(\"span\", {\n    parentName: \"span\",\n    \"className\": \"pstrut\",\n    \"style\": {\n      \"height\": \"2.7em\"\n    }\n  }), mdx(\"span\", {\n    parentName: \"span\",\n    \"className\": \"sizing reset-size6 size3 mtight\"\n  }, mdx(\"span\", {\n    parentName: \"span\",\n    \"className\": \"mord mtight\"\n  }, \"6\")))))))), mdx(\"span\", {\n    parentName: \"span\",\n    \"className\": \"mspace\",\n    \"style\": {\n      \"marginRight\": \"0.2777777777777778em\"\n    }\n  }), mdx(\"span\", {\n    parentName: \"span\",\n    \"className\": \"mrel\"\n  }, \"=\"), mdx(\"span\", {\n    parentName: \"span\",\n    \"className\": \"mspace\",\n    \"style\": {\n      \"marginRight\": \"0.2777777777777778em\"\n    }\n  })), mdx(\"span\", {\n    parentName: \"span\",\n    \"className\": \"base\"\n  }, mdx(\"span\", {\n    parentName: \"span\",\n    \"className\": \"strut\",\n    \"style\": {\n      \"height\": \"0.8141079999999999em\",\n      \"verticalAlign\": \"0em\"\n    }\n  }), mdx(\"span\", {\n    parentName: \"span\",\n    \"className\": \"mord\"\n  }, mdx(\"span\", {\n    parentName: \"span\",\n    \"className\": \"mord mathnormal\"\n  }, \"s\"), mdx(\"span\", {\n    parentName: \"span\",\n    \"className\": \"msupsub\"\n  }, mdx(\"span\", {\n    parentName: \"span\",\n    \"className\": \"vlist-t\"\n  }, mdx(\"span\", {\n    parentName: \"span\",\n    \"className\": \"vlist-r\"\n  }, mdx(\"span\", {\n    parentName: \"span\",\n    \"className\": \"vlist\",\n    \"style\": {\n      \"height\": \"0.8141079999999999em\"\n    }\n  }, mdx(\"span\", {\n    parentName: \"span\",\n    \"style\": {\n      \"top\": \"-3.063em\",\n      \"marginRight\": \"0.05em\"\n    }\n  }, mdx(\"span\", {\n    parentName: \"span\",\n    \"className\": \"pstrut\",\n    \"style\": {\n      \"height\": \"2.7em\"\n    }\n  }), mdx(\"span\", {\n    parentName: \"span\",\n    \"className\": \"sizing reset-size6 size3 mtight\"\n  }, mdx(\"span\", {\n    parentName: \"span\",\n    \"className\": \"mord mtight\"\n  }, \"2\")))))))), mdx(\"span\", {\n    parentName: \"span\",\n    \"className\": \"mspace\",\n    \"style\": {\n      \"marginRight\": \"0.2777777777777778em\"\n    }\n  }), mdx(\"span\", {\n    parentName: \"span\",\n    \"className\": \"mrel\"\n  }, \"=\"), mdx(\"span\", {\n    parentName: \"span\",\n    \"className\": \"mspace\",\n    \"style\": {\n      \"marginRight\": \"0.2777777777777778em\"\n    }\n  })), mdx(\"span\", {\n    parentName: \"span\",\n    \"className\": \"base\"\n  }, mdx(\"span\", {\n    parentName: \"span\",\n    \"className\": \"strut\",\n    \"style\": {\n      \"height\": \"1.064108em\",\n      \"verticalAlign\": \"-0.25em\"\n    }\n  }), mdx(\"span\", {\n    parentName: \"span\",\n    \"className\": \"mopen\"\n  }, \"(\"), mdx(\"span\", {\n    parentName: \"span\",\n    \"className\": \"mord mathnormal\",\n    \"style\": {\n      \"marginRight\": \"0.02778em\"\n    }\n  }, \"r\"), mdx(\"span\", {\n    parentName: \"span\",\n    \"className\": \"mord mathnormal\"\n  }, \"s\"), mdx(\"span\", {\n    parentName: \"span\",\n    \"className\": \"mclose\"\n  }, mdx(\"span\", {\n    parentName: \"span\",\n    \"className\": \"mclose\"\n  }, \")\"), mdx(\"span\", {\n    parentName: \"span\",\n    \"className\": \"msupsub\"\n  }, mdx(\"span\", {\n    parentName: \"span\",\n    \"className\": \"vlist-t\"\n  }, mdx(\"span\", {\n    parentName: \"span\",\n    \"className\": \"vlist-r\"\n  }, mdx(\"span\", {\n    parentName: \"span\",\n    \"className\": \"vlist\",\n    \"style\": {\n      \"height\": \"0.8141079999999999em\"\n    }\n  }, mdx(\"span\", {\n    parentName: \"span\",\n    \"style\": {\n      \"top\": \"-3.063em\",\n      \"marginRight\": \"0.05em\"\n    }\n  }, mdx(\"span\", {\n    parentName: \"span\",\n    \"className\": \"pstrut\",\n    \"style\": {\n      \"height\": \"2.7em\"\n    }\n  }), mdx(\"span\", {\n    parentName: \"span\",\n    \"className\": \"sizing reset-size6 size3 mtight\"\n  }, mdx(\"span\", {\n    parentName: \"span\",\n    \"className\": \"mord mtight\"\n  }, \"2\")))))))), mdx(\"span\", {\n    parentName: \"span\",\n    \"className\": \"mspace\",\n    \"style\": {\n      \"marginRight\": \"0.2777777777777778em\"\n    }\n  }), mdx(\"span\", {\n    parentName: \"span\",\n    \"className\": \"mrel\"\n  }, \"=\"), mdx(\"span\", {\n    parentName: \"span\",\n    \"className\": \"mspace\",\n    \"style\": {\n      \"marginRight\": \"0.2777777777777778em\"\n    }\n  })), mdx(\"span\", {\n    parentName: \"span\",\n    \"className\": \"base\"\n  }, mdx(\"span\", {\n    parentName: \"span\",\n    \"className\": \"strut\",\n    \"style\": {\n      \"height\": \"1em\",\n      \"verticalAlign\": \"-0.25em\"\n    }\n  }), mdx(\"span\", {\n    parentName: \"span\",\n    \"className\": \"mord mathnormal\"\n  }, \"e\"), mdx(\"span\", {\n    parentName: \"span\",\n    \"className\": \"mclose\"\n  }, \"\\u27E9\"))))), \" is a presentation for the dihedral group \", mdx(\"span\", {\n    parentName: \"p\",\n    \"className\": \"math math-inline\"\n  }, mdx(\"span\", {\n    parentName: \"span\",\n    \"className\": \"katex\"\n  }, mdx(\"span\", {\n    parentName: \"span\",\n    \"className\": \"katex-mathml\"\n  }, mdx(\"math\", {\n    parentName: \"span\",\n    \"xmlns\": \"http://www.w3.org/1998/Math/MathML\"\n  }, mdx(\"semantics\", {\n    parentName: \"math\"\n  }, mdx(\"mrow\", {\n    parentName: \"semantics\"\n  }, mdx(\"msub\", {\n    parentName: \"mrow\"\n  }, mdx(\"mi\", {\n    parentName: \"msub\"\n  }, \"D\"), mdx(\"mn\", {\n    parentName: \"msub\"\n  }, \"6\"))), mdx(\"annotation\", {\n    parentName: \"semantics\",\n    \"encoding\": \"application/x-tex\"\n  }, \"D_6\")))), mdx(\"span\", {\n    parentName: \"span\",\n    \"className\": \"katex-html\",\n    \"aria-hidden\": \"true\"\n  }, mdx(\"span\", {\n    parentName: \"span\",\n    \"className\": \"base\"\n  }, mdx(\"span\", {\n    parentName: \"span\",\n    \"className\": \"strut\",\n    \"style\": {\n      \"height\": \"0.83333em\",\n      \"verticalAlign\": \"-0.15em\"\n    }\n  }), mdx(\"span\", {\n    parentName: \"span\",\n    \"className\": \"mord\"\n  }, mdx(\"span\", {\n    parentName: \"span\",\n    \"className\": \"mord mathnormal\",\n    \"style\": {\n      \"marginRight\": \"0.02778em\"\n    }\n  }, \"D\"), mdx(\"span\", {\n    parentName: \"span\",\n    \"className\": \"msupsub\"\n  }, mdx(\"span\", {\n    parentName: \"span\",\n    \"className\": \"vlist-t vlist-t2\"\n  }, mdx(\"span\", {\n    parentName: \"span\",\n    \"className\": \"vlist-r\"\n  }, mdx(\"span\", {\n    parentName: \"span\",\n    \"className\": \"vlist\",\n    \"style\": {\n      \"height\": \"0.30110799999999993em\"\n    }\n  }, mdx(\"span\", {\n    parentName: \"span\",\n    \"style\": {\n      \"top\": \"-2.5500000000000003em\",\n      \"marginLeft\": \"-0.02778em\",\n      \"marginRight\": \"0.05em\"\n    }\n  }, mdx(\"span\", {\n    parentName: \"span\",\n    \"className\": \"pstrut\",\n    \"style\": {\n      \"height\": \"2.7em\"\n    }\n  }), mdx(\"span\", {\n    parentName: \"span\",\n    \"className\": \"sizing reset-size6 size3 mtight\"\n  }, mdx(\"span\", {\n    parentName: \"span\",\n    \"className\": \"mord mtight\"\n  }, \"6\")))), mdx(\"span\", {\n    parentName: \"span\",\n    \"className\": \"vlist-s\"\n  }, \"\\u200B\")), mdx(\"span\", {\n    parentName: \"span\",\n    \"className\": \"vlist-r\"\n  }, mdx(\"span\", {\n    parentName: \"span\",\n    \"className\": \"vlist\",\n    \"style\": {\n      \"height\": \"0.15em\"\n    }\n  }, mdx(\"span\", {\n    parentName: \"span\"\n  })))))))))), \". Note that presentations are not necessarily unique.\"), mdx(\"p\", null, \"The set \", mdx(\"span\", {\n    parentName: \"p\",\n    \"className\": \"math math-inline\"\n  }, mdx(\"span\", {\n    parentName: \"span\",\n    \"className\": \"katex\"\n  }, mdx(\"span\", {\n    parentName: \"span\",\n    \"className\": \"katex-mathml\"\n  }, mdx(\"math\", {\n    parentName: \"span\",\n    \"xmlns\": \"http://www.w3.org/1998/Math/MathML\"\n  }, mdx(\"semantics\", {\n    parentName: \"math\"\n  }, mdx(\"mrow\", {\n    parentName: \"semantics\"\n  }, mdx(\"mi\", {\n    parentName: \"mrow\"\n  }, \"R\")), mdx(\"annotation\", {\n    parentName: \"semantics\",\n    \"encoding\": \"application/x-tex\"\n  }, \"R\")))), mdx(\"span\", {\n    parentName: \"span\",\n    \"className\": \"katex-html\",\n    \"aria-hidden\": \"true\"\n  }, mdx(\"span\", {\n    parentName: \"span\",\n    \"className\": \"base\"\n  }, mdx(\"span\", {\n    parentName: \"span\",\n    \"className\": \"strut\",\n    \"style\": {\n      \"height\": \"0.68333em\",\n      \"verticalAlign\": \"0em\"\n    }\n  }), mdx(\"span\", {\n    parentName: \"span\",\n    \"className\": \"mord mathnormal\",\n    \"style\": {\n      \"marginRight\": \"0.00773em\"\n    }\n  }, \"R\"))))), \" may alternatively be defined to be a set of words following the form \", mdx(\"span\", {\n    parentName: \"p\",\n    \"className\": \"math math-inline\"\n  }, mdx(\"span\", {\n    parentName: \"span\",\n    \"className\": \"katex\"\n  }, mdx(\"span\", {\n    parentName: \"span\",\n    \"className\": \"katex-mathml\"\n  }, mdx(\"math\", {\n    parentName: \"span\",\n    \"xmlns\": \"http://www.w3.org/1998/Math/MathML\"\n  }, mdx(\"semantics\", {\n    parentName: \"math\"\n  }, mdx(\"mrow\", {\n    parentName: \"semantics\"\n  }, mdx(\"msub\", {\n    parentName: \"mrow\"\n  }, mdx(\"mi\", {\n    parentName: \"msub\"\n  }, \"g\"), mdx(\"mn\", {\n    parentName: \"msub\"\n  }, \"1\")), mdx(\"msub\", {\n    parentName: \"mrow\"\n  }, mdx(\"mi\", {\n    parentName: \"msub\"\n  }, \"g\"), mdx(\"mn\", {\n    parentName: \"msub\"\n  }, \"2\")), mdx(\"mi\", {\n    parentName: \"mrow\",\n    \"mathvariant\": \"normal\"\n  }, \".\"), mdx(\"mi\", {\n    parentName: \"mrow\",\n    \"mathvariant\": \"normal\"\n  }, \".\"), mdx(\"mi\", {\n    parentName: \"mrow\",\n    \"mathvariant\": \"normal\"\n  }, \".\"), mdx(\"msub\", {\n    parentName: \"mrow\"\n  }, mdx(\"mi\", {\n    parentName: \"msub\"\n  }, \"g\"), mdx(\"mi\", {\n    parentName: \"msub\"\n  }, \"n\"))), mdx(\"annotation\", {\n    parentName: \"semantics\",\n    \"encoding\": \"application/x-tex\"\n  }, \"g_1g_2...g_n\")))), mdx(\"span\", {\n    parentName: \"span\",\n    \"className\": \"katex-html\",\n    \"aria-hidden\": \"true\"\n  }, mdx(\"span\", {\n    parentName: \"span\",\n    \"className\": \"base\"\n  }, mdx(\"span\", {\n    parentName: \"span\",\n    \"className\": \"strut\",\n    \"style\": {\n      \"height\": \"0.625em\",\n      \"verticalAlign\": \"-0.19444em\"\n    }\n  }), mdx(\"span\", {\n    parentName: \"span\",\n    \"className\": \"mord\"\n  }, mdx(\"span\", {\n    parentName: \"span\",\n    \"className\": \"mord mathnormal\",\n    \"style\": {\n      \"marginRight\": \"0.03588em\"\n    }\n  }, \"g\"), mdx(\"span\", {\n    parentName: \"span\",\n    \"className\": \"msupsub\"\n  }, mdx(\"span\", {\n    parentName: \"span\",\n    \"className\": \"vlist-t vlist-t2\"\n  }, mdx(\"span\", {\n    parentName: \"span\",\n    \"className\": \"vlist-r\"\n  }, mdx(\"span\", {\n    parentName: \"span\",\n    \"className\": \"vlist\",\n    \"style\": {\n      \"height\": \"0.30110799999999993em\"\n    }\n  }, mdx(\"span\", {\n    parentName: \"span\",\n    \"style\": {\n      \"top\": \"-2.5500000000000003em\",\n      \"marginLeft\": \"-0.03588em\",\n      \"marginRight\": \"0.05em\"\n    }\n  }, mdx(\"span\", {\n    parentName: \"span\",\n    \"className\": \"pstrut\",\n    \"style\": {\n      \"height\": \"2.7em\"\n    }\n  }), mdx(\"span\", {\n    parentName: \"span\",\n    \"className\": \"sizing reset-size6 size3 mtight\"\n  }, mdx(\"span\", {\n    parentName: \"span\",\n    \"className\": \"mord mtight\"\n  }, \"1\")))), mdx(\"span\", {\n    parentName: \"span\",\n    \"className\": \"vlist-s\"\n  }, \"\\u200B\")), mdx(\"span\", {\n    parentName: \"span\",\n    \"className\": \"vlist-r\"\n  }, mdx(\"span\", {\n    parentName: \"span\",\n    \"className\": \"vlist\",\n    \"style\": {\n      \"height\": \"0.15em\"\n    }\n  }, mdx(\"span\", {\n    parentName: \"span\"\n  })))))), mdx(\"span\", {\n    parentName: \"span\",\n    \"className\": \"mord\"\n  }, mdx(\"span\", {\n    parentName: \"span\",\n    \"className\": \"mord mathnormal\",\n    \"style\": {\n      \"marginRight\": \"0.03588em\"\n    }\n  }, \"g\"), mdx(\"span\", {\n    parentName: \"span\",\n    \"className\": \"msupsub\"\n  }, mdx(\"span\", {\n    parentName: \"span\",\n    \"className\": \"vlist-t vlist-t2\"\n  }, mdx(\"span\", {\n    parentName: \"span\",\n    \"className\": \"vlist-r\"\n  }, mdx(\"span\", {\n    parentName: \"span\",\n    \"className\": \"vlist\",\n    \"style\": {\n      \"height\": \"0.30110799999999993em\"\n    }\n  }, mdx(\"span\", {\n    parentName: \"span\",\n    \"style\": {\n      \"top\": \"-2.5500000000000003em\",\n      \"marginLeft\": \"-0.03588em\",\n      \"marginRight\": \"0.05em\"\n    }\n  }, mdx(\"span\", {\n    parentName: \"span\",\n    \"className\": \"pstrut\",\n    \"style\": {\n      \"height\": \"2.7em\"\n    }\n  }), mdx(\"span\", {\n    parentName: \"span\",\n    \"className\": \"sizing reset-size6 size3 mtight\"\n  }, mdx(\"span\", {\n    parentName: \"span\",\n    \"className\": \"mord mtight\"\n  }, \"2\")))), mdx(\"span\", {\n    parentName: \"span\",\n    \"className\": \"vlist-s\"\n  }, \"\\u200B\")), mdx(\"span\", {\n    parentName: \"span\",\n    \"className\": \"vlist-r\"\n  }, mdx(\"span\", {\n    parentName: \"span\",\n    \"className\": \"vlist\",\n    \"style\": {\n      \"height\": \"0.15em\"\n    }\n  }, mdx(\"span\", {\n    parentName: \"span\"\n  })))))), mdx(\"span\", {\n    parentName: \"span\",\n    \"className\": \"mord\"\n  }, \".\"), mdx(\"span\", {\n    parentName: \"span\",\n    \"className\": \"mord\"\n  }, \".\"), mdx(\"span\", {\n    parentName: \"span\",\n    \"className\": \"mord\"\n  }, \".\"), mdx(\"span\", {\n    parentName: \"span\",\n    \"className\": \"mord\"\n  }, mdx(\"span\", {\n    parentName: \"span\",\n    \"className\": \"mord mathnormal\",\n    \"style\": {\n      \"marginRight\": \"0.03588em\"\n    }\n  }, \"g\"), mdx(\"span\", {\n    parentName: \"span\",\n    \"className\": \"msupsub\"\n  }, mdx(\"span\", {\n    parentName: \"span\",\n    \"className\": \"vlist-t vlist-t2\"\n  }, mdx(\"span\", {\n    parentName: \"span\",\n    \"className\": \"vlist-r\"\n  }, mdx(\"span\", {\n    parentName: \"span\",\n    \"className\": \"vlist\",\n    \"style\": {\n      \"height\": \"0.151392em\"\n    }\n  }, mdx(\"span\", {\n    parentName: \"span\",\n    \"style\": {\n      \"top\": \"-2.5500000000000003em\",\n      \"marginLeft\": \"-0.03588em\",\n      \"marginRight\": \"0.05em\"\n    }\n  }, mdx(\"span\", {\n    parentName: \"span\",\n    \"className\": \"pstrut\",\n    \"style\": {\n      \"height\": \"2.7em\"\n    }\n  }), mdx(\"span\", {\n    parentName: \"span\",\n    \"className\": \"sizing reset-size6 size3 mtight\"\n  }, mdx(\"span\", {\n    parentName: \"span\",\n    \"className\": \"mord mathnormal mtight\"\n  }, \"n\")))), mdx(\"span\", {\n    parentName: \"span\",\n    \"className\": \"vlist-s\"\n  }, \"\\u200B\")), mdx(\"span\", {\n    parentName: \"span\",\n    \"className\": \"vlist-r\"\n  }, mdx(\"span\", {\n    parentName: \"span\",\n    \"className\": \"vlist\",\n    \"style\": {\n      \"height\": \"0.15em\"\n    }\n  }, mdx(\"span\", {\n    parentName: \"span\"\n  })))))))))), \" with \", mdx(\"span\", {\n    parentName: \"p\",\n    \"className\": \"math math-inline\"\n  }, mdx(\"span\", {\n    parentName: \"span\",\n    \"className\": \"katex\"\n  }, mdx(\"span\", {\n    parentName: \"span\",\n    \"className\": \"katex-mathml\"\n  }, mdx(\"math\", {\n    parentName: \"span\",\n    \"xmlns\": \"http://www.w3.org/1998/Math/MathML\"\n  }, mdx(\"semantics\", {\n    parentName: \"math\"\n  }, mdx(\"mrow\", {\n    parentName: \"semantics\"\n  }, mdx(\"msub\", {\n    parentName: \"mrow\"\n  }, mdx(\"mi\", {\n    parentName: \"msub\"\n  }, \"g\"), mdx(\"mi\", {\n    parentName: \"msub\"\n  }, \"i\")), mdx(\"mo\", {\n    parentName: \"mrow\"\n  }, \"\\u2208\"), mdx(\"mi\", {\n    parentName: \"mrow\"\n  }, \"X\")), mdx(\"annotation\", {\n    parentName: \"semantics\",\n    \"encoding\": \"application/x-tex\"\n  }, \"g_i \\\\in X\")))), mdx(\"span\", {\n    parentName: \"span\",\n    \"className\": \"katex-html\",\n    \"aria-hidden\": \"true\"\n  }, mdx(\"span\", {\n    parentName: \"span\",\n    \"className\": \"base\"\n  }, mdx(\"span\", {\n    parentName: \"span\",\n    \"className\": \"strut\",\n    \"style\": {\n      \"height\": \"0.7335400000000001em\",\n      \"verticalAlign\": \"-0.19444em\"\n    }\n  }), mdx(\"span\", {\n    parentName: \"span\",\n    \"className\": \"mord\"\n  }, mdx(\"span\", {\n    parentName: \"span\",\n    \"className\": \"mord mathnormal\",\n    \"style\": {\n      \"marginRight\": \"0.03588em\"\n    }\n  }, \"g\"), mdx(\"span\", {\n    parentName: \"span\",\n    \"className\": \"msupsub\"\n  }, mdx(\"span\", {\n    parentName: \"span\",\n    \"className\": \"vlist-t vlist-t2\"\n  }, mdx(\"span\", {\n    parentName: \"span\",\n    \"className\": \"vlist-r\"\n  }, mdx(\"span\", {\n    parentName: \"span\",\n    \"className\": \"vlist\",\n    \"style\": {\n      \"height\": \"0.31166399999999994em\"\n    }\n  }, mdx(\"span\", {\n    parentName: \"span\",\n    \"style\": {\n      \"top\": \"-2.5500000000000003em\",\n      \"marginLeft\": \"-0.03588em\",\n      \"marginRight\": \"0.05em\"\n    }\n  }, mdx(\"span\", {\n    parentName: \"span\",\n    \"className\": \"pstrut\",\n    \"style\": {\n      \"height\": \"2.7em\"\n    }\n  }), mdx(\"span\", {\n    parentName: \"span\",\n    \"className\": \"sizing reset-size6 size3 mtight\"\n  }, mdx(\"span\", {\n    parentName: \"span\",\n    \"className\": \"mord mathnormal mtight\"\n  }, \"i\")))), mdx(\"span\", {\n    parentName: \"span\",\n    \"className\": \"vlist-s\"\n  }, \"\\u200B\")), mdx(\"span\", {\n    parentName: \"span\",\n    \"className\": \"vlist-r\"\n  }, mdx(\"span\", {\n    parentName: \"span\",\n    \"className\": \"vlist\",\n    \"style\": {\n      \"height\": \"0.15em\"\n    }\n  }, mdx(\"span\", {\n    parentName: \"span\"\n  })))))), mdx(\"span\", {\n    parentName: \"span\",\n    \"className\": \"mspace\",\n    \"style\": {\n      \"marginRight\": \"0.2777777777777778em\"\n    }\n  }), mdx(\"span\", {\n    parentName: \"span\",\n    \"className\": \"mrel\"\n  }, \"\\u2208\"), mdx(\"span\", {\n    parentName: \"span\",\n    \"className\": \"mspace\",\n    \"style\": {\n      \"marginRight\": \"0.2777777777777778em\"\n    }\n  })), mdx(\"span\", {\n    parentName: \"span\",\n    \"className\": \"base\"\n  }, mdx(\"span\", {\n    parentName: \"span\",\n    \"className\": \"strut\",\n    \"style\": {\n      \"height\": \"0.68333em\",\n      \"verticalAlign\": \"0em\"\n    }\n  }), mdx(\"span\", {\n    parentName: \"span\",\n    \"className\": \"mord mathnormal\",\n    \"style\": {\n      \"marginRight\": \"0.07847em\"\n    }\n  }, \"X\"))))), \" or \", mdx(\"span\", {\n    parentName: \"p\",\n    \"className\": \"math math-inline\"\n  }, mdx(\"span\", {\n    parentName: \"span\",\n    \"className\": \"katex\"\n  }, mdx(\"span\", {\n    parentName: \"span\",\n    \"className\": \"katex-mathml\"\n  }, mdx(\"math\", {\n    parentName: \"span\",\n    \"xmlns\": \"http://www.w3.org/1998/Math/MathML\"\n  }, mdx(\"semantics\", {\n    parentName: \"math\"\n  }, mdx(\"mrow\", {\n    parentName: \"semantics\"\n  }, mdx(\"msubsup\", {\n    parentName: \"mrow\"\n  }, mdx(\"mi\", {\n    parentName: \"msubsup\"\n  }, \"g\"), mdx(\"mi\", {\n    parentName: \"msubsup\"\n  }, \"i\"), mdx(\"mrow\", {\n    parentName: \"msubsup\"\n  }, mdx(\"mo\", {\n    parentName: \"mrow\"\n  }, \"\\u2212\"), mdx(\"mn\", {\n    parentName: \"mrow\"\n  }, \"1\"))), mdx(\"mo\", {\n    parentName: \"mrow\"\n  }, \"\\u2208\"), mdx(\"mi\", {\n    parentName: \"mrow\"\n  }, \"X\")), mdx(\"annotation\", {\n    parentName: \"semantics\",\n    \"encoding\": \"application/x-tex\"\n  }, \"g_i^{-1} \\\\in X\")))), mdx(\"span\", {\n    parentName: \"span\",\n    \"className\": \"katex-html\",\n    \"aria-hidden\": \"true\"\n  }, mdx(\"span\", {\n    parentName: \"span\",\n    \"className\": \"base\"\n  }, mdx(\"span\", {\n    parentName: \"span\",\n    \"className\": \"strut\",\n    \"style\": {\n      \"height\": \"1.131103em\",\n      \"verticalAlign\": \"-0.276864em\"\n    }\n  }), mdx(\"span\", {\n    parentName: \"span\",\n    \"className\": \"mord\"\n  }, mdx(\"span\", {\n    parentName: \"span\",\n    \"className\": \"mord mathnormal\",\n    \"style\": {\n      \"marginRight\": \"0.03588em\"\n    }\n  }, \"g\"), mdx(\"span\", {\n    parentName: \"span\",\n    \"className\": \"msupsub\"\n  }, mdx(\"span\", {\n    parentName: \"span\",\n    \"className\": \"vlist-t vlist-t2\"\n  }, mdx(\"span\", {\n    parentName: \"span\",\n    \"className\": \"vlist-r\"\n  }, mdx(\"span\", {\n    parentName: \"span\",\n    \"className\": \"vlist\",\n    \"style\": {\n      \"height\": \"0.854239em\"\n    }\n  }, mdx(\"span\", {\n    parentName: \"span\",\n    \"style\": {\n      \"top\": \"-2.4231360000000004em\",\n      \"marginLeft\": \"-0.03588em\",\n      \"marginRight\": \"0.05em\"\n    }\n  }, mdx(\"span\", {\n    parentName: \"span\",\n    \"className\": \"pstrut\",\n    \"style\": {\n      \"height\": \"2.7em\"\n    }\n  }), mdx(\"span\", {\n    parentName: \"span\",\n    \"className\": \"sizing reset-size6 size3 mtight\"\n  }, mdx(\"span\", {\n    parentName: \"span\",\n    \"className\": \"mord mathnormal mtight\"\n  }, \"i\"))), mdx(\"span\", {\n    parentName: \"span\",\n    \"style\": {\n      \"top\": \"-3.1031310000000003em\",\n      \"marginRight\": \"0.05em\"\n    }\n  }, mdx(\"span\", {\n    parentName: \"span\",\n    \"className\": \"pstrut\",\n    \"style\": {\n      \"height\": \"2.7em\"\n    }\n  }), mdx(\"span\", {\n    parentName: \"span\",\n    \"className\": \"sizing reset-size6 size3 mtight\"\n  }, mdx(\"span\", {\n    parentName: \"span\",\n    \"className\": \"mord mtight\"\n  }, mdx(\"span\", {\n    parentName: \"span\",\n    \"className\": \"mord mtight\"\n  }, \"\\u2212\"), mdx(\"span\", {\n    parentName: \"span\",\n    \"className\": \"mord mtight\"\n  }, \"1\"))))), mdx(\"span\", {\n    parentName: \"span\",\n    \"className\": \"vlist-s\"\n  }, \"\\u200B\")), mdx(\"span\", {\n    parentName: \"span\",\n    \"className\": \"vlist-r\"\n  }, mdx(\"span\", {\n    parentName: \"span\",\n    \"className\": \"vlist\",\n    \"style\": {\n      \"height\": \"0.276864em\"\n    }\n  }, mdx(\"span\", {\n    parentName: \"span\"\n  })))))), mdx(\"span\", {\n    parentName: \"span\",\n    \"className\": \"mspace\",\n    \"style\": {\n      \"marginRight\": \"0.2777777777777778em\"\n    }\n  }), mdx(\"span\", {\n    parentName: \"span\",\n    \"className\": \"mrel\"\n  }, \"\\u2208\"), mdx(\"span\", {\n    parentName: \"span\",\n    \"className\": \"mspace\",\n    \"style\": {\n      \"marginRight\": \"0.2777777777777778em\"\n    }\n  })), mdx(\"span\", {\n    parentName: \"span\",\n    \"className\": \"base\"\n  }, mdx(\"span\", {\n    parentName: \"span\",\n    \"className\": \"strut\",\n    \"style\": {\n      \"height\": \"0.68333em\",\n      \"verticalAlign\": \"0em\"\n    }\n  }), mdx(\"span\", {\n    parentName: \"span\",\n    \"className\": \"mord mathnormal\",\n    \"style\": {\n      \"marginRight\": \"0.07847em\"\n    }\n  }, \"X\"))))), \" such that \", mdx(\"span\", {\n    parentName: \"p\",\n    \"className\": \"math math-inline\"\n  }, mdx(\"span\", {\n    parentName: \"span\",\n    \"className\": \"katex\"\n  }, mdx(\"span\", {\n    parentName: \"span\",\n    \"className\": \"katex-mathml\"\n  }, mdx(\"math\", {\n    parentName: \"span\",\n    \"xmlns\": \"http://www.w3.org/1998/Math/MathML\"\n  }, mdx(\"semantics\", {\n    parentName: \"math\"\n  }, mdx(\"mrow\", {\n    parentName: \"semantics\"\n  }, mdx(\"msub\", {\n    parentName: \"mrow\"\n  }, mdx(\"mi\", {\n    parentName: \"msub\"\n  }, \"g\"), mdx(\"mn\", {\n    parentName: \"msub\"\n  }, \"1\")), mdx(\"msub\", {\n    parentName: \"mrow\"\n  }, mdx(\"mi\", {\n    parentName: \"msub\"\n  }, \"g\"), mdx(\"mn\", {\n    parentName: \"msub\"\n  }, \"2\")), mdx(\"mi\", {\n    parentName: \"mrow\",\n    \"mathvariant\": \"normal\"\n  }, \".\"), mdx(\"mi\", {\n    parentName: \"mrow\",\n    \"mathvariant\": \"normal\"\n  }, \".\"), mdx(\"mi\", {\n    parentName: \"mrow\",\n    \"mathvariant\": \"normal\"\n  }, \".\"), mdx(\"msub\", {\n    parentName: \"mrow\"\n  }, mdx(\"mi\", {\n    parentName: \"msub\"\n  }, \"g\"), mdx(\"mi\", {\n    parentName: \"msub\"\n  }, \"n\")), mdx(\"mo\", {\n    parentName: \"mrow\"\n  }, \"=\"), mdx(\"mi\", {\n    parentName: \"mrow\"\n  }, \"e\")), mdx(\"annotation\", {\n    parentName: \"semantics\",\n    \"encoding\": \"application/x-tex\"\n  }, \"g_1g_2...g_n=e\")))), mdx(\"span\", {\n    parentName: \"span\",\n    \"className\": \"katex-html\",\n    \"aria-hidden\": \"true\"\n  }, mdx(\"span\", {\n    parentName: \"span\",\n    \"className\": \"base\"\n  }, mdx(\"span\", {\n    parentName: \"span\",\n    \"className\": \"strut\",\n    \"style\": {\n      \"height\": \"0.625em\",\n      \"verticalAlign\": \"-0.19444em\"\n    }\n  }), mdx(\"span\", {\n    parentName: \"span\",\n    \"className\": \"mord\"\n  }, mdx(\"span\", {\n    parentName: \"span\",\n    \"className\": \"mord mathnormal\",\n    \"style\": {\n      \"marginRight\": \"0.03588em\"\n    }\n  }, \"g\"), mdx(\"span\", {\n    parentName: \"span\",\n    \"className\": \"msupsub\"\n  }, mdx(\"span\", {\n    parentName: \"span\",\n    \"className\": \"vlist-t vlist-t2\"\n  }, mdx(\"span\", {\n    parentName: \"span\",\n    \"className\": \"vlist-r\"\n  }, mdx(\"span\", {\n    parentName: \"span\",\n    \"className\": \"vlist\",\n    \"style\": {\n      \"height\": \"0.30110799999999993em\"\n    }\n  }, mdx(\"span\", {\n    parentName: \"span\",\n    \"style\": {\n      \"top\": \"-2.5500000000000003em\",\n      \"marginLeft\": \"-0.03588em\",\n      \"marginRight\": \"0.05em\"\n    }\n  }, mdx(\"span\", {\n    parentName: \"span\",\n    \"className\": \"pstrut\",\n    \"style\": {\n      \"height\": \"2.7em\"\n    }\n  }), mdx(\"span\", {\n    parentName: \"span\",\n    \"className\": \"sizing reset-size6 size3 mtight\"\n  }, mdx(\"span\", {\n    parentName: \"span\",\n    \"className\": \"mord mtight\"\n  }, \"1\")))), mdx(\"span\", {\n    parentName: \"span\",\n    \"className\": \"vlist-s\"\n  }, \"\\u200B\")), mdx(\"span\", {\n    parentName: \"span\",\n    \"className\": \"vlist-r\"\n  }, mdx(\"span\", {\n    parentName: \"span\",\n    \"className\": \"vlist\",\n    \"style\": {\n      \"height\": \"0.15em\"\n    }\n  }, mdx(\"span\", {\n    parentName: \"span\"\n  })))))), mdx(\"span\", {\n    parentName: \"span\",\n    \"className\": \"mord\"\n  }, mdx(\"span\", {\n    parentName: \"span\",\n    \"className\": \"mord mathnormal\",\n    \"style\": {\n      \"marginRight\": \"0.03588em\"\n    }\n  }, \"g\"), mdx(\"span\", {\n    parentName: \"span\",\n    \"className\": \"msupsub\"\n  }, mdx(\"span\", {\n    parentName: \"span\",\n    \"className\": \"vlist-t vlist-t2\"\n  }, mdx(\"span\", {\n    parentName: \"span\",\n    \"className\": \"vlist-r\"\n  }, mdx(\"span\", {\n    parentName: \"span\",\n    \"className\": \"vlist\",\n    \"style\": {\n      \"height\": \"0.30110799999999993em\"\n    }\n  }, mdx(\"span\", {\n    parentName: \"span\",\n    \"style\": {\n      \"top\": \"-2.5500000000000003em\",\n      \"marginLeft\": \"-0.03588em\",\n      \"marginRight\": \"0.05em\"\n    }\n  }, mdx(\"span\", {\n    parentName: \"span\",\n    \"className\": \"pstrut\",\n    \"style\": {\n      \"height\": \"2.7em\"\n    }\n  }), mdx(\"span\", {\n    parentName: \"span\",\n    \"className\": \"sizing reset-size6 size3 mtight\"\n  }, mdx(\"span\", {\n    parentName: \"span\",\n    \"className\": \"mord mtight\"\n  }, \"2\")))), mdx(\"span\", {\n    parentName: \"span\",\n    \"className\": \"vlist-s\"\n  }, \"\\u200B\")), mdx(\"span\", {\n    parentName: \"span\",\n    \"className\": \"vlist-r\"\n  }, mdx(\"span\", {\n    parentName: \"span\",\n    \"className\": \"vlist\",\n    \"style\": {\n      \"height\": \"0.15em\"\n    }\n  }, mdx(\"span\", {\n    parentName: \"span\"\n  })))))), mdx(\"span\", {\n    parentName: \"span\",\n    \"className\": \"mord\"\n  }, \".\"), mdx(\"span\", {\n    parentName: \"span\",\n    \"className\": \"mord\"\n  }, \".\"), mdx(\"span\", {\n    parentName: \"span\",\n    \"className\": \"mord\"\n  }, \".\"), mdx(\"span\", {\n    parentName: \"span\",\n    \"className\": \"mord\"\n  }, mdx(\"span\", {\n    parentName: \"span\",\n    \"className\": \"mord mathnormal\",\n    \"style\": {\n      \"marginRight\": \"0.03588em\"\n    }\n  }, \"g\"), mdx(\"span\", {\n    parentName: \"span\",\n    \"className\": \"msupsub\"\n  }, mdx(\"span\", {\n    parentName: \"span\",\n    \"className\": \"vlist-t vlist-t2\"\n  }, mdx(\"span\", {\n    parentName: \"span\",\n    \"className\": \"vlist-r\"\n  }, mdx(\"span\", {\n    parentName: \"span\",\n    \"className\": \"vlist\",\n    \"style\": {\n      \"height\": \"0.151392em\"\n    }\n  }, mdx(\"span\", {\n    parentName: \"span\",\n    \"style\": {\n      \"top\": \"-2.5500000000000003em\",\n      \"marginLeft\": \"-0.03588em\",\n      \"marginRight\": \"0.05em\"\n    }\n  }, mdx(\"span\", {\n    parentName: \"span\",\n    \"className\": \"pstrut\",\n    \"style\": {\n      \"height\": \"2.7em\"\n    }\n  }), mdx(\"span\", {\n    parentName: \"span\",\n    \"className\": \"sizing reset-size6 size3 mtight\"\n  }, mdx(\"span\", {\n    parentName: \"span\",\n    \"className\": \"mord mathnormal mtight\"\n  }, \"n\")))), mdx(\"span\", {\n    parentName: \"span\",\n    \"className\": \"vlist-s\"\n  }, \"\\u200B\")), mdx(\"span\", {\n    parentName: \"span\",\n    \"className\": \"vlist-r\"\n  }, mdx(\"span\", {\n    parentName: \"span\",\n    \"className\": \"vlist\",\n    \"style\": {\n      \"height\": \"0.15em\"\n    }\n  }, mdx(\"span\", {\n    parentName: \"span\"\n  })))))), mdx(\"span\", {\n    parentName: \"span\",\n    \"className\": \"mspace\",\n    \"style\": {\n      \"marginRight\": \"0.2777777777777778em\"\n    }\n  }), mdx(\"span\", {\n    parentName: \"span\",\n    \"className\": \"mrel\"\n  }, \"=\"), mdx(\"span\", {\n    parentName: \"span\",\n    \"className\": \"mspace\",\n    \"style\": {\n      \"marginRight\": \"0.2777777777777778em\"\n    }\n  })), mdx(\"span\", {\n    parentName: \"span\",\n    \"className\": \"base\"\n  }, mdx(\"span\", {\n    parentName: \"span\",\n    \"className\": \"strut\",\n    \"style\": {\n      \"height\": \"0.43056em\",\n      \"verticalAlign\": \"0em\"\n    }\n  }), mdx(\"span\", {\n    parentName: \"span\",\n    \"className\": \"mord mathnormal\"\n  }, \"e\"))))), \". For convenience's sake, we will use this definition from now on.\"), mdx(\"h2\", {\n    \"id\": \"group-actions\",\n    \"style\": {\n      \"position\": \"relative\"\n    }\n  }, mdx(\"a\", {\n    parentName: \"h2\",\n    \"href\": \"#group-actions\",\n    \"aria-label\": \"group actions permalink\",\n    \"className\": \"anchor before\"\n  }, mdx(\"svg\", {\n    parentName: \"a\",\n    \"aria-hidden\": \"true\",\n    \"focusable\": \"false\",\n    \"height\": \"16\",\n    \"version\": \"1.1\",\n    \"viewBox\": \"0 0 16 16\",\n    \"width\": \"16\"\n  }, mdx(\"path\", {\n    parentName: \"svg\",\n    \"fillRule\": \"evenodd\",\n    \"d\": \"M4 9h1v1H4c-1.5 0-3-1.69-3-3.5S2.55 3 4 3h4c1.45 0 3 1.69 3 3.5 0 1.41-.91 2.72-2 3.25V8.59c.58-.45 1-1.27 1-2.09C10 5.22 8.98 4 8 4H4c-.98 0-2 1.22-2 2.5S3 9 4 9zm9-3h-1v1h1c1 0 2 1.22 2 2.5S13.98 12 13 12H9c-.98 0-2-1.22-2-2.5 0-.83.42-1.64 1-2.09V6.25c-1.09.53-2 1.84-2 3.25C6 11.31 7.55 13 9 13h4c1.45 0 3-1.69 3-3.5S14.5 6 13 6z\"\n  }))), \"Group Actions\"), mdx(\"p\", null, \"Group actions are also fundamental to the theory behind the Todd-Coxeter Algorithm.\"), mdx(\"p\", null, \"Let \", mdx(\"span\", {\n    parentName: \"p\",\n    \"className\": \"math math-inline\"\n  }, mdx(\"span\", {\n    parentName: \"span\",\n    \"className\": \"katex\"\n  }, mdx(\"span\", {\n    parentName: \"span\",\n    \"className\": \"katex-mathml\"\n  }, mdx(\"math\", {\n    parentName: \"span\",\n    \"xmlns\": \"http://www.w3.org/1998/Math/MathML\"\n  }, mdx(\"semantics\", {\n    parentName: \"math\"\n  }, mdx(\"mrow\", {\n    parentName: \"semantics\"\n  }, mdx(\"mi\", {\n    parentName: \"mrow\"\n  }, \"S\")), mdx(\"annotation\", {\n    parentName: \"semantics\",\n    \"encoding\": \"application/x-tex\"\n  }, \"S\")))), mdx(\"span\", {\n    parentName: \"span\",\n    \"className\": \"katex-html\",\n    \"aria-hidden\": \"true\"\n  }, mdx(\"span\", {\n    parentName: \"span\",\n    \"className\": \"base\"\n  }, mdx(\"span\", {\n    parentName: \"span\",\n    \"className\": \"strut\",\n    \"style\": {\n      \"height\": \"0.68333em\",\n      \"verticalAlign\": \"0em\"\n    }\n  }), mdx(\"span\", {\n    parentName: \"span\",\n    \"className\": \"mord mathnormal\",\n    \"style\": {\n      \"marginRight\": \"0.05764em\"\n    }\n  }, \"S\"))))), \" be a set and let \", mdx(\"span\", {\n    parentName: \"p\",\n    \"className\": \"math math-inline\"\n  }, mdx(\"span\", {\n    parentName: \"span\",\n    \"className\": \"katex\"\n  }, mdx(\"span\", {\n    parentName: \"span\",\n    \"className\": \"katex-mathml\"\n  }, mdx(\"math\", {\n    parentName: \"span\",\n    \"xmlns\": \"http://www.w3.org/1998/Math/MathML\"\n  }, mdx(\"semantics\", {\n    parentName: \"math\"\n  }, mdx(\"mrow\", {\n    parentName: \"semantics\"\n  }, mdx(\"mi\", {\n    parentName: \"mrow\"\n  }, \"G\")), mdx(\"annotation\", {\n    parentName: \"semantics\",\n    \"encoding\": \"application/x-tex\"\n  }, \"G\")))), mdx(\"span\", {\n    parentName: \"span\",\n    \"className\": \"katex-html\",\n    \"aria-hidden\": \"true\"\n  }, mdx(\"span\", {\n    parentName: \"span\",\n    \"className\": \"base\"\n  }, mdx(\"span\", {\n    parentName: \"span\",\n    \"className\": \"strut\",\n    \"style\": {\n      \"height\": \"0.68333em\",\n      \"verticalAlign\": \"0em\"\n    }\n  }), mdx(\"span\", {\n    parentName: \"span\",\n    \"className\": \"mord mathnormal\"\n  }, \"G\"))))), \" be a group. A (left) group action of \", mdx(\"span\", {\n    parentName: \"p\",\n    \"className\": \"math math-inline\"\n  }, mdx(\"span\", {\n    parentName: \"span\",\n    \"className\": \"katex\"\n  }, mdx(\"span\", {\n    parentName: \"span\",\n    \"className\": \"katex-mathml\"\n  }, mdx(\"math\", {\n    parentName: \"span\",\n    \"xmlns\": \"http://www.w3.org/1998/Math/MathML\"\n  }, mdx(\"semantics\", {\n    parentName: \"math\"\n  }, mdx(\"mrow\", {\n    parentName: \"semantics\"\n  }, mdx(\"mi\", {\n    parentName: \"mrow\"\n  }, \"G\")), mdx(\"annotation\", {\n    parentName: \"semantics\",\n    \"encoding\": \"application/x-tex\"\n  }, \"G\")))), mdx(\"span\", {\n    parentName: \"span\",\n    \"className\": \"katex-html\",\n    \"aria-hidden\": \"true\"\n  }, mdx(\"span\", {\n    parentName: \"span\",\n    \"className\": \"base\"\n  }, mdx(\"span\", {\n    parentName: \"span\",\n    \"className\": \"strut\",\n    \"style\": {\n      \"height\": \"0.68333em\",\n      \"verticalAlign\": \"0em\"\n    }\n  }), mdx(\"span\", {\n    parentName: \"span\",\n    \"className\": \"mord mathnormal\"\n  }, \"G\"))))), \" on \", mdx(\"span\", {\n    parentName: \"p\",\n    \"className\": \"math math-inline\"\n  }, mdx(\"span\", {\n    parentName: \"span\",\n    \"className\": \"katex\"\n  }, mdx(\"span\", {\n    parentName: \"span\",\n    \"className\": \"katex-mathml\"\n  }, mdx(\"math\", {\n    parentName: \"span\",\n    \"xmlns\": \"http://www.w3.org/1998/Math/MathML\"\n  }, mdx(\"semantics\", {\n    parentName: \"math\"\n  }, mdx(\"mrow\", {\n    parentName: \"semantics\"\n  }, mdx(\"mi\", {\n    parentName: \"mrow\"\n  }, \"S\")), mdx(\"annotation\", {\n    parentName: \"semantics\",\n    \"encoding\": \"application/x-tex\"\n  }, \"S\")))), mdx(\"span\", {\n    parentName: \"span\",\n    \"className\": \"katex-html\",\n    \"aria-hidden\": \"true\"\n  }, mdx(\"span\", {\n    parentName: \"span\",\n    \"className\": \"base\"\n  }, mdx(\"span\", {\n    parentName: \"span\",\n    \"className\": \"strut\",\n    \"style\": {\n      \"height\": \"0.68333em\",\n      \"verticalAlign\": \"0em\"\n    }\n  }), mdx(\"span\", {\n    parentName: \"span\",\n    \"className\": \"mord mathnormal\",\n    \"style\": {\n      \"marginRight\": \"0.05764em\"\n    }\n  }, \"S\"))))), \" is a function \", mdx(\"span\", {\n    parentName: \"p\",\n    \"className\": \"math math-inline\"\n  }, mdx(\"span\", {\n    parentName: \"span\",\n    \"className\": \"katex\"\n  }, mdx(\"span\", {\n    parentName: \"span\",\n    \"className\": \"katex-mathml\"\n  }, mdx(\"math\", {\n    parentName: \"span\",\n    \"xmlns\": \"http://www.w3.org/1998/Math/MathML\"\n  }, mdx(\"semantics\", {\n    parentName: \"math\"\n  }, mdx(\"mrow\", {\n    parentName: \"semantics\"\n  }, mdx(\"mi\", {\n    parentName: \"mrow\"\n  }, \"\\u03B1\"), mdx(\"mo\", {\n    parentName: \"mrow\"\n  }, \":\"), mdx(\"mi\", {\n    parentName: \"mrow\"\n  }, \"G\"), mdx(\"mo\", {\n    parentName: \"mrow\"\n  }, \"\\xD7\"), mdx(\"mi\", {\n    parentName: \"mrow\"\n  }, \"S\"), mdx(\"mo\", {\n    parentName: \"mrow\"\n  }, \"\\u2192\"), mdx(\"mi\", {\n    parentName: \"mrow\"\n  }, \"S\")), mdx(\"annotation\", {\n    parentName: \"semantics\",\n    \"encoding\": \"application/x-tex\"\n  }, \"\\\\alpha: G \\\\times S \\\\rightarrow S\")))), mdx(\"span\", {\n    parentName: \"span\",\n    \"className\": \"katex-html\",\n    \"aria-hidden\": \"true\"\n  }, mdx(\"span\", {\n    parentName: \"span\",\n    \"className\": \"base\"\n  }, mdx(\"span\", {\n    parentName: \"span\",\n    \"className\": \"strut\",\n    \"style\": {\n      \"height\": \"0.43056em\",\n      \"verticalAlign\": \"0em\"\n    }\n  }), mdx(\"span\", {\n    parentName: \"span\",\n    \"className\": \"mord mathnormal\",\n    \"style\": {\n      \"marginRight\": \"0.0037em\"\n    }\n  }, \"\\u03B1\"), mdx(\"span\", {\n    parentName: \"span\",\n    \"className\": \"mspace\",\n    \"style\": {\n      \"marginRight\": \"0.2777777777777778em\"\n    }\n  }), mdx(\"span\", {\n    parentName: \"span\",\n    \"className\": \"mrel\"\n  }, \":\"), mdx(\"span\", {\n    parentName: \"span\",\n    \"className\": \"mspace\",\n    \"style\": {\n      \"marginRight\": \"0.2777777777777778em\"\n    }\n  })), mdx(\"span\", {\n    parentName: \"span\",\n    \"className\": \"base\"\n  }, mdx(\"span\", {\n    parentName: \"span\",\n    \"className\": \"strut\",\n    \"style\": {\n      \"height\": \"0.76666em\",\n      \"verticalAlign\": \"-0.08333em\"\n    }\n  }), mdx(\"span\", {\n    parentName: \"span\",\n    \"className\": \"mord mathnormal\"\n  }, \"G\"), mdx(\"span\", {\n    parentName: \"span\",\n    \"className\": \"mspace\",\n    \"style\": {\n      \"marginRight\": \"0.2222222222222222em\"\n    }\n  }), mdx(\"span\", {\n    parentName: \"span\",\n    \"className\": \"mbin\"\n  }, \"\\xD7\"), mdx(\"span\", {\n    parentName: \"span\",\n    \"className\": \"mspace\",\n    \"style\": {\n      \"marginRight\": \"0.2222222222222222em\"\n    }\n  })), mdx(\"span\", {\n    parentName: \"span\",\n    \"className\": \"base\"\n  }, mdx(\"span\", {\n    parentName: \"span\",\n    \"className\": \"strut\",\n    \"style\": {\n      \"height\": \"0.68333em\",\n      \"verticalAlign\": \"0em\"\n    }\n  }), mdx(\"span\", {\n    parentName: \"span\",\n    \"className\": \"mord mathnormal\",\n    \"style\": {\n      \"marginRight\": \"0.05764em\"\n    }\n  }, \"S\"), mdx(\"span\", {\n    parentName: \"span\",\n    \"className\": \"mspace\",\n    \"style\": {\n      \"marginRight\": \"0.2777777777777778em\"\n    }\n  }), mdx(\"span\", {\n    parentName: \"span\",\n    \"className\": \"mrel\"\n  }, \"\\u2192\"), mdx(\"span\", {\n    parentName: \"span\",\n    \"className\": \"mspace\",\n    \"style\": {\n      \"marginRight\": \"0.2777777777777778em\"\n    }\n  })), mdx(\"span\", {\n    parentName: \"span\",\n    \"className\": \"base\"\n  }, mdx(\"span\", {\n    parentName: \"span\",\n    \"className\": \"strut\",\n    \"style\": {\n      \"height\": \"0.68333em\",\n      \"verticalAlign\": \"0em\"\n    }\n  }), mdx(\"span\", {\n    parentName: \"span\",\n    \"className\": \"mord mathnormal\",\n    \"style\": {\n      \"marginRight\": \"0.05764em\"\n    }\n  }, \"S\"))))), \" that meets the following requirements.\"), mdx(\"div\", {\n    \"className\": \"math math-display\"\n  }, mdx(\"span\", {\n    parentName: \"div\",\n    \"className\": \"katex-display\"\n  }, mdx(\"span\", {\n    parentName: \"span\",\n    \"className\": \"katex\"\n  }, mdx(\"span\", {\n    parentName: \"span\",\n    \"className\": \"katex-mathml\"\n  }, mdx(\"math\", {\n    parentName: \"span\",\n    \"xmlns\": \"http://www.w3.org/1998/Math/MathML\",\n    \"display\": \"block\"\n  }, mdx(\"semantics\", {\n    parentName: \"math\"\n  }, mdx(\"mrow\", {\n    parentName: \"semantics\"\n  }, mdx(\"mi\", {\n    parentName: \"mrow\"\n  }, \"\\u03B1\"), mdx(\"mo\", {\n    parentName: \"mrow\",\n    \"stretchy\": \"false\"\n  }, \"(\"), mdx(\"mi\", {\n    parentName: \"mrow\"\n  }, \"e\"), mdx(\"mo\", {\n    parentName: \"mrow\",\n    \"separator\": \"true\"\n  }, \",\"), mdx(\"mi\", {\n    parentName: \"mrow\"\n  }, \"s\"), mdx(\"mo\", {\n    parentName: \"mrow\",\n    \"stretchy\": \"false\"\n  }, \")\"), mdx(\"mo\", {\n    parentName: \"mrow\"\n  }, \"=\"), mdx(\"mi\", {\n    parentName: \"mrow\"\n  }, \"s\")), mdx(\"annotation\", {\n    parentName: \"semantics\",\n    \"encoding\": \"application/x-tex\"\n  }, \"\\\\alpha(e, s) = s\")))), mdx(\"span\", {\n    parentName: \"span\",\n    \"className\": \"katex-html\",\n    \"aria-hidden\": \"true\"\n  }, mdx(\"span\", {\n    parentName: \"span\",\n    \"className\": \"base\"\n  }, mdx(\"span\", {\n    parentName: \"span\",\n    \"className\": \"strut\",\n    \"style\": {\n      \"height\": \"1em\",\n      \"verticalAlign\": \"-0.25em\"\n    }\n  }), mdx(\"span\", {\n    parentName: \"span\",\n    \"className\": \"mord mathnormal\",\n    \"style\": {\n      \"marginRight\": \"0.0037em\"\n    }\n  }, \"\\u03B1\"), mdx(\"span\", {\n    parentName: \"span\",\n    \"className\": \"mopen\"\n  }, \"(\"), mdx(\"span\", {\n    parentName: \"span\",\n    \"className\": \"mord mathnormal\"\n  }, \"e\"), mdx(\"span\", {\n    parentName: \"span\",\n    \"className\": \"mpunct\"\n  }, \",\"), mdx(\"span\", {\n    parentName: \"span\",\n    \"className\": \"mspace\",\n    \"style\": {\n      \"marginRight\": \"0.16666666666666666em\"\n    }\n  }), mdx(\"span\", {\n    parentName: \"span\",\n    \"className\": \"mord mathnormal\"\n  }, \"s\"), mdx(\"span\", {\n    parentName: \"span\",\n    \"className\": \"mclose\"\n  }, \")\"), mdx(\"span\", {\n    parentName: \"span\",\n    \"className\": \"mspace\",\n    \"style\": {\n      \"marginRight\": \"0.2777777777777778em\"\n    }\n  }), mdx(\"span\", {\n    parentName: \"span\",\n    \"className\": \"mrel\"\n  }, \"=\"), mdx(\"span\", {\n    parentName: \"span\",\n    \"className\": \"mspace\",\n    \"style\": {\n      \"marginRight\": \"0.2777777777777778em\"\n    }\n  })), mdx(\"span\", {\n    parentName: \"span\",\n    \"className\": \"base\"\n  }, mdx(\"span\", {\n    parentName: \"span\",\n    \"className\": \"strut\",\n    \"style\": {\n      \"height\": \"0.43056em\",\n      \"verticalAlign\": \"0em\"\n    }\n  }), mdx(\"span\", {\n    parentName: \"span\",\n    \"className\": \"mord mathnormal\"\n  }, \"s\")))))), mdx(\"div\", {\n    \"className\": \"math math-display\"\n  }, mdx(\"span\", {\n    parentName: \"div\",\n    \"className\": \"katex-display\"\n  }, mdx(\"span\", {\n    parentName: \"span\",\n    \"className\": \"katex\"\n  }, mdx(\"span\", {\n    parentName: \"span\",\n    \"className\": \"katex-mathml\"\n  }, mdx(\"math\", {\n    parentName: \"span\",\n    \"xmlns\": \"http://www.w3.org/1998/Math/MathML\",\n    \"display\": \"block\"\n  }, mdx(\"semantics\", {\n    parentName: \"math\"\n  }, mdx(\"mrow\", {\n    parentName: \"semantics\"\n  }, mdx(\"mi\", {\n    parentName: \"mrow\"\n  }, \"\\u03B1\"), mdx(\"mo\", {\n    parentName: \"mrow\",\n    \"stretchy\": \"false\"\n  }, \"(\"), mdx(\"mi\", {\n    parentName: \"mrow\"\n  }, \"g\"), mdx(\"mo\", {\n    parentName: \"mrow\",\n    \"separator\": \"true\"\n  }, \",\"), mdx(\"mi\", {\n    parentName: \"mrow\"\n  }, \"\\u03B1\"), mdx(\"mo\", {\n    parentName: \"mrow\",\n    \"stretchy\": \"false\"\n  }, \"(\"), mdx(\"mi\", {\n    parentName: \"mrow\"\n  }, \"h\"), mdx(\"mo\", {\n    parentName: \"mrow\",\n    \"separator\": \"true\"\n  }, \",\"), mdx(\"mi\", {\n    parentName: \"mrow\"\n  }, \"s\"), mdx(\"mo\", {\n    parentName: \"mrow\",\n    \"stretchy\": \"false\"\n  }, \")\"), mdx(\"mo\", {\n    parentName: \"mrow\",\n    \"stretchy\": \"false\"\n  }, \")\"), mdx(\"mo\", {\n    parentName: \"mrow\"\n  }, \"=\"), mdx(\"mi\", {\n    parentName: \"mrow\"\n  }, \"\\u03B1\"), mdx(\"mo\", {\n    parentName: \"mrow\",\n    \"stretchy\": \"false\"\n  }, \"(\"), mdx(\"mi\", {\n    parentName: \"mrow\"\n  }, \"g\"), mdx(\"mi\", {\n    parentName: \"mrow\"\n  }, \"h\"), mdx(\"mo\", {\n    parentName: \"mrow\",\n    \"separator\": \"true\"\n  }, \",\"), mdx(\"mi\", {\n    parentName: \"mrow\"\n  }, \"s\"), mdx(\"mo\", {\n    parentName: \"mrow\",\n    \"stretchy\": \"false\"\n  }, \")\"), mdx(\"mspace\", {\n    parentName: \"mrow\",\n    \"width\": \"1.4226377952755906em\"\n  }), mdx(\"mi\", {\n    parentName: \"mrow\",\n    \"mathvariant\": \"normal\"\n  }, \"\\u2200\"), mdx(\"mi\", {\n    parentName: \"mrow\"\n  }, \"g\"), mdx(\"mo\", {\n    parentName: \"mrow\",\n    \"separator\": \"true\"\n  }, \",\"), mdx(\"mi\", {\n    parentName: \"mrow\"\n  }, \"h\"), mdx(\"mo\", {\n    parentName: \"mrow\"\n  }, \"\\u2208\"), mdx(\"mi\", {\n    parentName: \"mrow\"\n  }, \"G\")), mdx(\"annotation\", {\n    parentName: \"semantics\",\n    \"encoding\": \"application/x-tex\"\n  }, \"\\\\alpha(g, \\\\alpha(h, s)) = \\\\alpha(gh, s) \\\\hspace{0.5cm} \\\\forall g,h \\\\in G\")))), mdx(\"span\", {\n    parentName: \"span\",\n    \"className\": \"katex-html\",\n    \"aria-hidden\": \"true\"\n  }, mdx(\"span\", {\n    parentName: \"span\",\n    \"className\": \"base\"\n  }, mdx(\"span\", {\n    parentName: \"span\",\n    \"className\": \"strut\",\n    \"style\": {\n      \"height\": \"1em\",\n      \"verticalAlign\": \"-0.25em\"\n    }\n  }), mdx(\"span\", {\n    parentName: \"span\",\n    \"className\": \"mord mathnormal\",\n    \"style\": {\n      \"marginRight\": \"0.0037em\"\n    }\n  }, \"\\u03B1\"), mdx(\"span\", {\n    parentName: \"span\",\n    \"className\": \"mopen\"\n  }, \"(\"), mdx(\"span\", {\n    parentName: \"span\",\n    \"className\": \"mord mathnormal\",\n    \"style\": {\n      \"marginRight\": \"0.03588em\"\n    }\n  }, \"g\"), mdx(\"span\", {\n    parentName: \"span\",\n    \"className\": \"mpunct\"\n  }, \",\"), mdx(\"span\", {\n    parentName: \"span\",\n    \"className\": \"mspace\",\n    \"style\": {\n      \"marginRight\": \"0.16666666666666666em\"\n    }\n  }), mdx(\"span\", {\n    parentName: \"span\",\n    \"className\": \"mord mathnormal\",\n    \"style\": {\n      \"marginRight\": \"0.0037em\"\n    }\n  }, \"\\u03B1\"), mdx(\"span\", {\n    parentName: \"span\",\n    \"className\": \"mopen\"\n  }, \"(\"), mdx(\"span\", {\n    parentName: \"span\",\n    \"className\": \"mord mathnormal\"\n  }, \"h\"), mdx(\"span\", {\n    parentName: \"span\",\n    \"className\": \"mpunct\"\n  }, \",\"), mdx(\"span\", {\n    parentName: \"span\",\n    \"className\": \"mspace\",\n    \"style\": {\n      \"marginRight\": \"0.16666666666666666em\"\n    }\n  }), mdx(\"span\", {\n    parentName: \"span\",\n    \"className\": \"mord mathnormal\"\n  }, \"s\"), mdx(\"span\", {\n    parentName: \"span\",\n    \"className\": \"mclose\"\n  }, \")\"), mdx(\"span\", {\n    parentName: \"span\",\n    \"className\": \"mclose\"\n  }, \")\"), mdx(\"span\", {\n    parentName: \"span\",\n    \"className\": \"mspace\",\n    \"style\": {\n      \"marginRight\": \"0.2777777777777778em\"\n    }\n  }), mdx(\"span\", {\n    parentName: \"span\",\n    \"className\": \"mrel\"\n  }, \"=\"), mdx(\"span\", {\n    parentName: \"span\",\n    \"className\": \"mspace\",\n    \"style\": {\n      \"marginRight\": \"0.2777777777777778em\"\n    }\n  })), mdx(\"span\", {\n    parentName: \"span\",\n    \"className\": \"base\"\n  }, mdx(\"span\", {\n    parentName: \"span\",\n    \"className\": \"strut\",\n    \"style\": {\n      \"height\": \"1em\",\n      \"verticalAlign\": \"-0.25em\"\n    }\n  }), mdx(\"span\", {\n    parentName: \"span\",\n    \"className\": \"mord mathnormal\",\n    \"style\": {\n      \"marginRight\": \"0.0037em\"\n    }\n  }, \"\\u03B1\"), mdx(\"span\", {\n    parentName: \"span\",\n    \"className\": \"mopen\"\n  }, \"(\"), mdx(\"span\", {\n    parentName: \"span\",\n    \"className\": \"mord mathnormal\",\n    \"style\": {\n      \"marginRight\": \"0.03588em\"\n    }\n  }, \"g\"), mdx(\"span\", {\n    parentName: \"span\",\n    \"className\": \"mord mathnormal\"\n  }, \"h\"), mdx(\"span\", {\n    parentName: \"span\",\n    \"className\": \"mpunct\"\n  }, \",\"), mdx(\"span\", {\n    parentName: \"span\",\n    \"className\": \"mspace\",\n    \"style\": {\n      \"marginRight\": \"0.16666666666666666em\"\n    }\n  }), mdx(\"span\", {\n    parentName: \"span\",\n    \"className\": \"mord mathnormal\"\n  }, \"s\"), mdx(\"span\", {\n    parentName: \"span\",\n    \"className\": \"mclose\"\n  }, \")\"), mdx(\"span\", {\n    parentName: \"span\",\n    \"className\": \"mspace\",\n    \"style\": {\n      \"marginRight\": \"1.4226377952755906em\"\n    }\n  }), mdx(\"span\", {\n    parentName: \"span\",\n    \"className\": \"mord\"\n  }, \"\\u2200\"), mdx(\"span\", {\n    parentName: \"span\",\n    \"className\": \"mord mathnormal\",\n    \"style\": {\n      \"marginRight\": \"0.03588em\"\n    }\n  }, \"g\"), mdx(\"span\", {\n    parentName: \"span\",\n    \"className\": \"mpunct\"\n  }, \",\"), mdx(\"span\", {\n    parentName: \"span\",\n    \"className\": \"mspace\",\n    \"style\": {\n      \"marginRight\": \"0.16666666666666666em\"\n    }\n  }), mdx(\"span\", {\n    parentName: \"span\",\n    \"className\": \"mord mathnormal\"\n  }, \"h\"), mdx(\"span\", {\n    parentName: \"span\",\n    \"className\": \"mspace\",\n    \"style\": {\n      \"marginRight\": \"0.2777777777777778em\"\n    }\n  }), mdx(\"span\", {\n    parentName: \"span\",\n    \"className\": \"mrel\"\n  }, \"\\u2208\"), mdx(\"span\", {\n    parentName: \"span\",\n    \"className\": \"mspace\",\n    \"style\": {\n      \"marginRight\": \"0.2777777777777778em\"\n    }\n  })), mdx(\"span\", {\n    parentName: \"span\",\n    \"className\": \"base\"\n  }, mdx(\"span\", {\n    parentName: \"span\",\n    \"className\": \"strut\",\n    \"style\": {\n      \"height\": \"0.68333em\",\n      \"verticalAlign\": \"0em\"\n    }\n  }), mdx(\"span\", {\n    parentName: \"span\",\n    \"className\": \"mord mathnormal\"\n  }, \"G\")))))), mdx(\"p\", null, \"If a group action of \", mdx(\"span\", {\n    parentName: \"p\",\n    \"className\": \"math math-inline\"\n  }, mdx(\"span\", {\n    parentName: \"span\",\n    \"className\": \"katex\"\n  }, mdx(\"span\", {\n    parentName: \"span\",\n    \"className\": \"katex-mathml\"\n  }, mdx(\"math\", {\n    parentName: \"span\",\n    \"xmlns\": \"http://www.w3.org/1998/Math/MathML\"\n  }, mdx(\"semantics\", {\n    parentName: \"math\"\n  }, mdx(\"mrow\", {\n    parentName: \"semantics\"\n  }, mdx(\"mi\", {\n    parentName: \"mrow\"\n  }, \"G\")), mdx(\"annotation\", {\n    parentName: \"semantics\",\n    \"encoding\": \"application/x-tex\"\n  }, \"G\")))), mdx(\"span\", {\n    parentName: \"span\",\n    \"className\": \"katex-html\",\n    \"aria-hidden\": \"true\"\n  }, mdx(\"span\", {\n    parentName: \"span\",\n    \"className\": \"base\"\n  }, mdx(\"span\", {\n    parentName: \"span\",\n    \"className\": \"strut\",\n    \"style\": {\n      \"height\": \"0.68333em\",\n      \"verticalAlign\": \"0em\"\n    }\n  }), mdx(\"span\", {\n    parentName: \"span\",\n    \"className\": \"mord mathnormal\"\n  }, \"G\"))))), \" on \", mdx(\"span\", {\n    parentName: \"p\",\n    \"className\": \"math math-inline\"\n  }, mdx(\"span\", {\n    parentName: \"span\",\n    \"className\": \"katex\"\n  }, mdx(\"span\", {\n    parentName: \"span\",\n    \"className\": \"katex-mathml\"\n  }, mdx(\"math\", {\n    parentName: \"span\",\n    \"xmlns\": \"http://www.w3.org/1998/Math/MathML\"\n  }, mdx(\"semantics\", {\n    parentName: \"math\"\n  }, mdx(\"mrow\", {\n    parentName: \"semantics\"\n  }, mdx(\"mi\", {\n    parentName: \"mrow\"\n  }, \"S\")), mdx(\"annotation\", {\n    parentName: \"semantics\",\n    \"encoding\": \"application/x-tex\"\n  }, \"S\")))), mdx(\"span\", {\n    parentName: \"span\",\n    \"className\": \"katex-html\",\n    \"aria-hidden\": \"true\"\n  }, mdx(\"span\", {\n    parentName: \"span\",\n    \"className\": \"base\"\n  }, mdx(\"span\", {\n    parentName: \"span\",\n    \"className\": \"strut\",\n    \"style\": {\n      \"height\": \"0.68333em\",\n      \"verticalAlign\": \"0em\"\n    }\n  }), mdx(\"span\", {\n    parentName: \"span\",\n    \"className\": \"mord mathnormal\",\n    \"style\": {\n      \"marginRight\": \"0.05764em\"\n    }\n  }, \"S\"))))), \" exists, \", mdx(\"span\", {\n    parentName: \"p\",\n    \"className\": \"math math-inline\"\n  }, mdx(\"span\", {\n    parentName: \"span\",\n    \"className\": \"katex\"\n  }, mdx(\"span\", {\n    parentName: \"span\",\n    \"className\": \"katex-mathml\"\n  }, mdx(\"math\", {\n    parentName: \"span\",\n    \"xmlns\": \"http://www.w3.org/1998/Math/MathML\"\n  }, mdx(\"semantics\", {\n    parentName: \"math\"\n  }, mdx(\"mrow\", {\n    parentName: \"semantics\"\n  }, mdx(\"mi\", {\n    parentName: \"mrow\"\n  }, \"G\")), mdx(\"annotation\", {\n    parentName: \"semantics\",\n    \"encoding\": \"application/x-tex\"\n  }, \"G\")))), mdx(\"span\", {\n    parentName: \"span\",\n    \"className\": \"katex-html\",\n    \"aria-hidden\": \"true\"\n  }, mdx(\"span\", {\n    parentName: \"span\",\n    \"className\": \"base\"\n  }, mdx(\"span\", {\n    parentName: \"span\",\n    \"className\": \"strut\",\n    \"style\": {\n      \"height\": \"0.68333em\",\n      \"verticalAlign\": \"0em\"\n    }\n  }), mdx(\"span\", {\n    parentName: \"span\",\n    \"className\": \"mord mathnormal\"\n  }, \"G\"))))), \" is said to act on \", mdx(\"span\", {\n    parentName: \"p\",\n    \"className\": \"math math-inline\"\n  }, mdx(\"span\", {\n    parentName: \"span\",\n    \"className\": \"katex\"\n  }, mdx(\"span\", {\n    parentName: \"span\",\n    \"className\": \"katex-mathml\"\n  }, mdx(\"math\", {\n    parentName: \"span\",\n    \"xmlns\": \"http://www.w3.org/1998/Math/MathML\"\n  }, mdx(\"semantics\", {\n    parentName: \"math\"\n  }, mdx(\"mrow\", {\n    parentName: \"semantics\"\n  }, mdx(\"mi\", {\n    parentName: \"mrow\"\n  }, \"S\")), mdx(\"annotation\", {\n    parentName: \"semantics\",\n    \"encoding\": \"application/x-tex\"\n  }, \"S\")))), mdx(\"span\", {\n    parentName: \"span\",\n    \"className\": \"katex-html\",\n    \"aria-hidden\": \"true\"\n  }, mdx(\"span\", {\n    parentName: \"span\",\n    \"className\": \"base\"\n  }, mdx(\"span\", {\n    parentName: \"span\",\n    \"className\": \"strut\",\n    \"style\": {\n      \"height\": \"0.68333em\",\n      \"verticalAlign\": \"0em\"\n    }\n  }), mdx(\"span\", {\n    parentName: \"span\",\n    \"className\": \"mord mathnormal\",\n    \"style\": {\n      \"marginRight\": \"0.05764em\"\n    }\n  }, \"S\"))))), \". If \", mdx(\"span\", {\n    parentName: \"p\",\n    \"className\": \"math math-inline\"\n  }, mdx(\"span\", {\n    parentName: \"span\",\n    \"className\": \"katex\"\n  }, mdx(\"span\", {\n    parentName: \"span\",\n    \"className\": \"katex-mathml\"\n  }, mdx(\"math\", {\n    parentName: \"span\",\n    \"xmlns\": \"http://www.w3.org/1998/Math/MathML\"\n  }, mdx(\"semantics\", {\n    parentName: \"math\"\n  }, mdx(\"mrow\", {\n    parentName: \"semantics\"\n  }, mdx(\"mi\", {\n    parentName: \"mrow\"\n  }, \"G\")), mdx(\"annotation\", {\n    parentName: \"semantics\",\n    \"encoding\": \"application/x-tex\"\n  }, \"G\")))), mdx(\"span\", {\n    parentName: \"span\",\n    \"className\": \"katex-html\",\n    \"aria-hidden\": \"true\"\n  }, mdx(\"span\", {\n    parentName: \"span\",\n    \"className\": \"base\"\n  }, mdx(\"span\", {\n    parentName: \"span\",\n    \"className\": \"strut\",\n    \"style\": {\n      \"height\": \"0.68333em\",\n      \"verticalAlign\": \"0em\"\n    }\n  }), mdx(\"span\", {\n    parentName: \"span\",\n    \"className\": \"mord mathnormal\"\n  }, \"G\"))))), \" acts \", mdx(\"em\", {\n    parentName: \"p\"\n  }, \"transitively\"), \" on \", mdx(\"span\", {\n    parentName: \"p\",\n    \"className\": \"math math-inline\"\n  }, mdx(\"span\", {\n    parentName: \"span\",\n    \"className\": \"katex\"\n  }, mdx(\"span\", {\n    parentName: \"span\",\n    \"className\": \"katex-mathml\"\n  }, mdx(\"math\", {\n    parentName: \"span\",\n    \"xmlns\": \"http://www.w3.org/1998/Math/MathML\"\n  }, mdx(\"semantics\", {\n    parentName: \"math\"\n  }, mdx(\"mrow\", {\n    parentName: \"semantics\"\n  }, mdx(\"mi\", {\n    parentName: \"mrow\"\n  }, \"S\")), mdx(\"annotation\", {\n    parentName: \"semantics\",\n    \"encoding\": \"application/x-tex\"\n  }, \"S\")))), mdx(\"span\", {\n    parentName: \"span\",\n    \"className\": \"katex-html\",\n    \"aria-hidden\": \"true\"\n  }, mdx(\"span\", {\n    parentName: \"span\",\n    \"className\": \"base\"\n  }, mdx(\"span\", {\n    parentName: \"span\",\n    \"className\": \"strut\",\n    \"style\": {\n      \"height\": \"0.68333em\",\n      \"verticalAlign\": \"0em\"\n    }\n  }), mdx(\"span\", {\n    parentName: \"span\",\n    \"className\": \"mord mathnormal\",\n    \"style\": {\n      \"marginRight\": \"0.05764em\"\n    }\n  }, \"S\"))))), \", then the following is also true.\"), mdx(\"div\", {\n    \"className\": \"math math-display\"\n  }, mdx(\"span\", {\n    parentName: \"div\",\n    \"className\": \"katex-display\"\n  }, mdx(\"span\", {\n    parentName: \"span\",\n    \"className\": \"katex\"\n  }, mdx(\"span\", {\n    parentName: \"span\",\n    \"className\": \"katex-mathml\"\n  }, mdx(\"math\", {\n    parentName: \"span\",\n    \"xmlns\": \"http://www.w3.org/1998/Math/MathML\",\n    \"display\": \"block\"\n  }, mdx(\"semantics\", {\n    parentName: \"math\"\n  }, mdx(\"mrow\", {\n    parentName: \"semantics\"\n  }, mdx(\"mi\", {\n    parentName: \"mrow\",\n    \"mathvariant\": \"normal\"\n  }, \"\\u2200\"), mdx(\"msub\", {\n    parentName: \"mrow\"\n  }, mdx(\"mi\", {\n    parentName: \"msub\"\n  }, \"s\"), mdx(\"mn\", {\n    parentName: \"msub\"\n  }, \"1\")), mdx(\"mo\", {\n    parentName: \"mrow\",\n    \"separator\": \"true\"\n  }, \",\"), mdx(\"msub\", {\n    parentName: \"mrow\"\n  }, mdx(\"mi\", {\n    parentName: \"msub\"\n  }, \"s\"), mdx(\"mn\", {\n    parentName: \"msub\"\n  }, \"2\")), mdx(\"mo\", {\n    parentName: \"mrow\"\n  }, \"\\u2208\"), mdx(\"mi\", {\n    parentName: \"mrow\"\n  }, \"S\"), mdx(\"mo\", {\n    parentName: \"mrow\",\n    \"separator\": \"true\"\n  }, \",\"), mdx(\"mi\", {\n    parentName: \"mrow\",\n    \"mathvariant\": \"normal\"\n  }, \"\\u2203\"), mdx(\"mi\", {\n    parentName: \"mrow\"\n  }, \"g\"), mdx(\"mo\", {\n    parentName: \"mrow\"\n  }, \"\\u2208\"), mdx(\"mi\", {\n    parentName: \"mrow\"\n  }, \"G\"), mdx(\"mo\", {\n    parentName: \"mrow\"\n  }, \"\\u220B\"), mdx(\"mi\", {\n    parentName: \"mrow\"\n  }, \"\\u03B1\"), mdx(\"mo\", {\n    parentName: \"mrow\",\n    \"stretchy\": \"false\"\n  }, \"(\"), mdx(\"mi\", {\n    parentName: \"mrow\"\n  }, \"g\"), mdx(\"mo\", {\n    parentName: \"mrow\",\n    \"separator\": \"true\"\n  }, \",\"), mdx(\"msub\", {\n    parentName: \"mrow\"\n  }, mdx(\"mi\", {\n    parentName: \"msub\"\n  }, \"s\"), mdx(\"mn\", {\n    parentName: \"msub\"\n  }, \"1\")), mdx(\"mo\", {\n    parentName: \"mrow\",\n    \"stretchy\": \"false\"\n  }, \")\"), mdx(\"mo\", {\n    parentName: \"mrow\"\n  }, \"=\"), mdx(\"msub\", {\n    parentName: \"mrow\"\n  }, mdx(\"mi\", {\n    parentName: \"msub\"\n  }, \"s\"), mdx(\"mn\", {\n    parentName: \"msub\"\n  }, \"2\"))), mdx(\"annotation\", {\n    parentName: \"semantics\",\n    \"encoding\": \"application/x-tex\"\n  }, \"\\\\forall s_1,s_2 \\\\in S, \\\\exists g \\\\in G \\\\ni\\n\\\\alpha(g, s_1) = s_2\")))), mdx(\"span\", {\n    parentName: \"span\",\n    \"className\": \"katex-html\",\n    \"aria-hidden\": \"true\"\n  }, mdx(\"span\", {\n    parentName: \"span\",\n    \"className\": \"base\"\n  }, mdx(\"span\", {\n    parentName: \"span\",\n    \"className\": \"strut\",\n    \"style\": {\n      \"height\": \"0.8888799999999999em\",\n      \"verticalAlign\": \"-0.19444em\"\n    }\n  }), mdx(\"span\", {\n    parentName: \"span\",\n    \"className\": \"mord\"\n  }, \"\\u2200\"), mdx(\"span\", {\n    parentName: \"span\",\n    \"className\": \"mord\"\n  }, mdx(\"span\", {\n    parentName: \"span\",\n    \"className\": \"mord mathnormal\"\n  }, \"s\"), mdx(\"span\", {\n    parentName: \"span\",\n    \"className\": \"msupsub\"\n  }, mdx(\"span\", {\n    parentName: \"span\",\n    \"className\": \"vlist-t vlist-t2\"\n  }, mdx(\"span\", {\n    parentName: \"span\",\n    \"className\": \"vlist-r\"\n  }, mdx(\"span\", {\n    parentName: \"span\",\n    \"className\": \"vlist\",\n    \"style\": {\n      \"height\": \"0.30110799999999993em\"\n    }\n  }, mdx(\"span\", {\n    parentName: \"span\",\n    \"style\": {\n      \"top\": \"-2.5500000000000003em\",\n      \"marginLeft\": \"0em\",\n      \"marginRight\": \"0.05em\"\n    }\n  }, mdx(\"span\", {\n    parentName: \"span\",\n    \"className\": \"pstrut\",\n    \"style\": {\n      \"height\": \"2.7em\"\n    }\n  }), mdx(\"span\", {\n    parentName: \"span\",\n    \"className\": \"sizing reset-size6 size3 mtight\"\n  }, mdx(\"span\", {\n    parentName: \"span\",\n    \"className\": \"mord mtight\"\n  }, \"1\")))), mdx(\"span\", {\n    parentName: \"span\",\n    \"className\": \"vlist-s\"\n  }, \"\\u200B\")), mdx(\"span\", {\n    parentName: \"span\",\n    \"className\": \"vlist-r\"\n  }, mdx(\"span\", {\n    parentName: \"span\",\n    \"className\": \"vlist\",\n    \"style\": {\n      \"height\": \"0.15em\"\n    }\n  }, mdx(\"span\", {\n    parentName: \"span\"\n  })))))), mdx(\"span\", {\n    parentName: \"span\",\n    \"className\": \"mpunct\"\n  }, \",\"), mdx(\"span\", {\n    parentName: \"span\",\n    \"className\": \"mspace\",\n    \"style\": {\n      \"marginRight\": \"0.16666666666666666em\"\n    }\n  }), mdx(\"span\", {\n    parentName: \"span\",\n    \"className\": \"mord\"\n  }, mdx(\"span\", {\n    parentName: \"span\",\n    \"className\": \"mord mathnormal\"\n  }, \"s\"), mdx(\"span\", {\n    parentName: \"span\",\n    \"className\": \"msupsub\"\n  }, mdx(\"span\", {\n    parentName: \"span\",\n    \"className\": \"vlist-t vlist-t2\"\n  }, mdx(\"span\", {\n    parentName: \"span\",\n    \"className\": \"vlist-r\"\n  }, mdx(\"span\", {\n    parentName: \"span\",\n    \"className\": \"vlist\",\n    \"style\": {\n      \"height\": \"0.30110799999999993em\"\n    }\n  }, mdx(\"span\", {\n    parentName: \"span\",\n    \"style\": {\n      \"top\": \"-2.5500000000000003em\",\n      \"marginLeft\": \"0em\",\n      \"marginRight\": \"0.05em\"\n    }\n  }, mdx(\"span\", {\n    parentName: \"span\",\n    \"className\": \"pstrut\",\n    \"style\": {\n      \"height\": \"2.7em\"\n    }\n  }), mdx(\"span\", {\n    parentName: \"span\",\n    \"className\": \"sizing reset-size6 size3 mtight\"\n  }, mdx(\"span\", {\n    parentName: \"span\",\n    \"className\": \"mord mtight\"\n  }, \"2\")))), mdx(\"span\", {\n    parentName: \"span\",\n    \"className\": \"vlist-s\"\n  }, \"\\u200B\")), mdx(\"span\", {\n    parentName: \"span\",\n    \"className\": \"vlist-r\"\n  }, mdx(\"span\", {\n    parentName: \"span\",\n    \"className\": \"vlist\",\n    \"style\": {\n      \"height\": \"0.15em\"\n    }\n  }, mdx(\"span\", {\n    parentName: \"span\"\n  })))))), mdx(\"span\", {\n    parentName: \"span\",\n    \"className\": \"mspace\",\n    \"style\": {\n      \"marginRight\": \"0.2777777777777778em\"\n    }\n  }), mdx(\"span\", {\n    parentName: \"span\",\n    \"className\": \"mrel\"\n  }, \"\\u2208\"), mdx(\"span\", {\n    parentName: \"span\",\n    \"className\": \"mspace\",\n    \"style\": {\n      \"marginRight\": \"0.2777777777777778em\"\n    }\n  })), mdx(\"span\", {\n    parentName: \"span\",\n    \"className\": \"base\"\n  }, mdx(\"span\", {\n    parentName: \"span\",\n    \"className\": \"strut\",\n    \"style\": {\n      \"height\": \"0.8888799999999999em\",\n      \"verticalAlign\": \"-0.19444em\"\n    }\n  }), mdx(\"span\", {\n    parentName: \"span\",\n    \"className\": \"mord mathnormal\",\n    \"style\": {\n      \"marginRight\": \"0.05764em\"\n    }\n  }, \"S\"), mdx(\"span\", {\n    parentName: \"span\",\n    \"className\": \"mpunct\"\n  }, \",\"), mdx(\"span\", {\n    parentName: \"span\",\n    \"className\": \"mspace\",\n    \"style\": {\n      \"marginRight\": \"0.16666666666666666em\"\n    }\n  }), mdx(\"span\", {\n    parentName: \"span\",\n    \"className\": \"mord\"\n  }, \"\\u2203\"), mdx(\"span\", {\n    parentName: \"span\",\n    \"className\": \"mord mathnormal\",\n    \"style\": {\n      \"marginRight\": \"0.03588em\"\n    }\n  }, \"g\"), mdx(\"span\", {\n    parentName: \"span\",\n    \"className\": \"mspace\",\n    \"style\": {\n      \"marginRight\": \"0.2777777777777778em\"\n    }\n  }), mdx(\"span\", {\n    parentName: \"span\",\n    \"className\": \"mrel\"\n  }, \"\\u2208\"), mdx(\"span\", {\n    parentName: \"span\",\n    \"className\": \"mspace\",\n    \"style\": {\n      \"marginRight\": \"0.2777777777777778em\"\n    }\n  })), mdx(\"span\", {\n    parentName: \"span\",\n    \"className\": \"base\"\n  }, mdx(\"span\", {\n    parentName: \"span\",\n    \"className\": \"strut\",\n    \"style\": {\n      \"height\": \"0.72243em\",\n      \"verticalAlign\": \"-0.0391em\"\n    }\n  }), mdx(\"span\", {\n    parentName: \"span\",\n    \"className\": \"mord mathnormal\"\n  }, \"G\"), mdx(\"span\", {\n    parentName: \"span\",\n    \"className\": \"mspace\",\n    \"style\": {\n      \"marginRight\": \"0.2777777777777778em\"\n    }\n  }), mdx(\"span\", {\n    parentName: \"span\",\n    \"className\": \"mrel\"\n  }, \"\\u220B\"), mdx(\"span\", {\n    parentName: \"span\",\n    \"className\": \"mspace\",\n    \"style\": {\n      \"marginRight\": \"0.2777777777777778em\"\n    }\n  })), mdx(\"span\", {\n    parentName: \"span\",\n    \"className\": \"base\"\n  }, mdx(\"span\", {\n    parentName: \"span\",\n    \"className\": \"strut\",\n    \"style\": {\n      \"height\": \"1em\",\n      \"verticalAlign\": \"-0.25em\"\n    }\n  }), mdx(\"span\", {\n    parentName: \"span\",\n    \"className\": \"mord mathnormal\",\n    \"style\": {\n      \"marginRight\": \"0.0037em\"\n    }\n  }, \"\\u03B1\"), mdx(\"span\", {\n    parentName: \"span\",\n    \"className\": \"mopen\"\n  }, \"(\"), mdx(\"span\", {\n    parentName: \"span\",\n    \"className\": \"mord mathnormal\",\n    \"style\": {\n      \"marginRight\": \"0.03588em\"\n    }\n  }, \"g\"), mdx(\"span\", {\n    parentName: \"span\",\n    \"className\": \"mpunct\"\n  }, \",\"), mdx(\"span\", {\n    parentName: \"span\",\n    \"className\": \"mspace\",\n    \"style\": {\n      \"marginRight\": \"0.16666666666666666em\"\n    }\n  }), mdx(\"span\", {\n    parentName: \"span\",\n    \"className\": \"mord\"\n  }, mdx(\"span\", {\n    parentName: \"span\",\n    \"className\": \"mord mathnormal\"\n  }, \"s\"), mdx(\"span\", {\n    parentName: \"span\",\n    \"className\": \"msupsub\"\n  }, mdx(\"span\", {\n    parentName: \"span\",\n    \"className\": \"vlist-t vlist-t2\"\n  }, mdx(\"span\", {\n    parentName: \"span\",\n    \"className\": \"vlist-r\"\n  }, mdx(\"span\", {\n    parentName: \"span\",\n    \"className\": \"vlist\",\n    \"style\": {\n      \"height\": \"0.30110799999999993em\"\n    }\n  }, mdx(\"span\", {\n    parentName: \"span\",\n    \"style\": {\n      \"top\": \"-2.5500000000000003em\",\n      \"marginLeft\": \"0em\",\n      \"marginRight\": \"0.05em\"\n    }\n  }, mdx(\"span\", {\n    parentName: \"span\",\n    \"className\": \"pstrut\",\n    \"style\": {\n      \"height\": \"2.7em\"\n    }\n  }), mdx(\"span\", {\n    parentName: \"span\",\n    \"className\": \"sizing reset-size6 size3 mtight\"\n  }, mdx(\"span\", {\n    parentName: \"span\",\n    \"className\": \"mord mtight\"\n  }, \"1\")))), mdx(\"span\", {\n    parentName: \"span\",\n    \"className\": \"vlist-s\"\n  }, \"\\u200B\")), mdx(\"span\", {\n    parentName: \"span\",\n    \"className\": \"vlist-r\"\n  }, mdx(\"span\", {\n    parentName: \"span\",\n    \"className\": \"vlist\",\n    \"style\": {\n      \"height\": \"0.15em\"\n    }\n  }, mdx(\"span\", {\n    parentName: \"span\"\n  })))))), mdx(\"span\", {\n    parentName: \"span\",\n    \"className\": \"mclose\"\n  }, \")\"), mdx(\"span\", {\n    parentName: \"span\",\n    \"className\": \"mspace\",\n    \"style\": {\n      \"marginRight\": \"0.2777777777777778em\"\n    }\n  }), mdx(\"span\", {\n    parentName: \"span\",\n    \"className\": \"mrel\"\n  }, \"=\"), mdx(\"span\", {\n    parentName: \"span\",\n    \"className\": \"mspace\",\n    \"style\": {\n      \"marginRight\": \"0.2777777777777778em\"\n    }\n  })), mdx(\"span\", {\n    parentName: \"span\",\n    \"className\": \"base\"\n  }, mdx(\"span\", {\n    parentName: \"span\",\n    \"className\": \"strut\",\n    \"style\": {\n      \"height\": \"0.58056em\",\n      \"verticalAlign\": \"-0.15em\"\n    }\n  }), mdx(\"span\", {\n    parentName: \"span\",\n    \"className\": \"mord\"\n  }, mdx(\"span\", {\n    parentName: \"span\",\n    \"className\": \"mord mathnormal\"\n  }, \"s\"), mdx(\"span\", {\n    parentName: \"span\",\n    \"className\": \"msupsub\"\n  }, mdx(\"span\", {\n    parentName: \"span\",\n    \"className\": \"vlist-t vlist-t2\"\n  }, mdx(\"span\", {\n    parentName: \"span\",\n    \"className\": \"vlist-r\"\n  }, mdx(\"span\", {\n    parentName: \"span\",\n    \"className\": \"vlist\",\n    \"style\": {\n      \"height\": \"0.30110799999999993em\"\n    }\n  }, mdx(\"span\", {\n    parentName: \"span\",\n    \"style\": {\n      \"top\": \"-2.5500000000000003em\",\n      \"marginLeft\": \"0em\",\n      \"marginRight\": \"0.05em\"\n    }\n  }, mdx(\"span\", {\n    parentName: \"span\",\n    \"className\": \"pstrut\",\n    \"style\": {\n      \"height\": \"2.7em\"\n    }\n  }), mdx(\"span\", {\n    parentName: \"span\",\n    \"className\": \"sizing reset-size6 size3 mtight\"\n  }, mdx(\"span\", {\n    parentName: \"span\",\n    \"className\": \"mord mtight\"\n  }, \"2\")))), mdx(\"span\", {\n    parentName: \"span\",\n    \"className\": \"vlist-s\"\n  }, \"\\u200B\")), mdx(\"span\", {\n    parentName: \"span\",\n    \"className\": \"vlist-r\"\n  }, mdx(\"span\", {\n    parentName: \"span\",\n    \"className\": \"vlist\",\n    \"style\": {\n      \"height\": \"0.15em\"\n    }\n  }, mdx(\"span\", {\n    parentName: \"span\"\n  }))))))))))), mdx(\"p\", null, \"In otherwords, \", mdx(\"span\", {\n    parentName: \"p\",\n    \"className\": \"math math-inline\"\n  }, mdx(\"span\", {\n    parentName: \"span\",\n    \"className\": \"katex\"\n  }, mdx(\"span\", {\n    parentName: \"span\",\n    \"className\": \"katex-mathml\"\n  }, mdx(\"math\", {\n    parentName: \"span\",\n    \"xmlns\": \"http://www.w3.org/1998/Math/MathML\"\n  }, mdx(\"semantics\", {\n    parentName: \"math\"\n  }, mdx(\"mrow\", {\n    parentName: \"semantics\"\n  }, mdx(\"mi\", {\n    parentName: \"mrow\"\n  }, \"S\")), mdx(\"annotation\", {\n    parentName: \"semantics\",\n    \"encoding\": \"application/x-tex\"\n  }, \"S\")))), mdx(\"span\", {\n    parentName: \"span\",\n    \"className\": \"katex-html\",\n    \"aria-hidden\": \"true\"\n  }, mdx(\"span\", {\n    parentName: \"span\",\n    \"className\": \"base\"\n  }, mdx(\"span\", {\n    parentName: \"span\",\n    \"className\": \"strut\",\n    \"style\": {\n      \"height\": \"0.68333em\",\n      \"verticalAlign\": \"0em\"\n    }\n  }), mdx(\"span\", {\n    parentName: \"span\",\n    \"className\": \"mord mathnormal\",\n    \"style\": {\n      \"marginRight\": \"0.05764em\"\n    }\n  }, \"S\"))))), \" only has one orbit.\"), mdx(\"p\", null, \"When working with group actions, \", mdx(\"span\", {\n    parentName: \"p\",\n    \"className\": \"math math-inline\"\n  }, mdx(\"span\", {\n    parentName: \"span\",\n    \"className\": \"katex\"\n  }, mdx(\"span\", {\n    parentName: \"span\",\n    \"className\": \"katex-mathml\"\n  }, mdx(\"math\", {\n    parentName: \"span\",\n    \"xmlns\": \"http://www.w3.org/1998/Math/MathML\"\n  }, mdx(\"semantics\", {\n    parentName: \"math\"\n  }, mdx(\"mrow\", {\n    parentName: \"semantics\"\n  }, mdx(\"mi\", {\n    parentName: \"mrow\"\n  }, \"\\u03B1\"), mdx(\"mo\", {\n    parentName: \"mrow\",\n    \"stretchy\": \"false\"\n  }, \"(\"), mdx(\"mi\", {\n    parentName: \"mrow\"\n  }, \"g\"), mdx(\"mo\", {\n    parentName: \"mrow\",\n    \"separator\": \"true\"\n  }, \",\"), mdx(\"mi\", {\n    parentName: \"mrow\"\n  }, \"s\"), mdx(\"mo\", {\n    parentName: \"mrow\",\n    \"stretchy\": \"false\"\n  }, \")\")), mdx(\"annotation\", {\n    parentName: \"semantics\",\n    \"encoding\": \"application/x-tex\"\n  }, \"\\\\alpha(g, s)\")))), mdx(\"span\", {\n    parentName: \"span\",\n    \"className\": \"katex-html\",\n    \"aria-hidden\": \"true\"\n  }, mdx(\"span\", {\n    parentName: \"span\",\n    \"className\": \"base\"\n  }, mdx(\"span\", {\n    parentName: \"span\",\n    \"className\": \"strut\",\n    \"style\": {\n      \"height\": \"1em\",\n      \"verticalAlign\": \"-0.25em\"\n    }\n  }), mdx(\"span\", {\n    parentName: \"span\",\n    \"className\": \"mord mathnormal\",\n    \"style\": {\n      \"marginRight\": \"0.0037em\"\n    }\n  }, \"\\u03B1\"), mdx(\"span\", {\n    parentName: \"span\",\n    \"className\": \"mopen\"\n  }, \"(\"), mdx(\"span\", {\n    parentName: \"span\",\n    \"className\": \"mord mathnormal\",\n    \"style\": {\n      \"marginRight\": \"0.03588em\"\n    }\n  }, \"g\"), mdx(\"span\", {\n    parentName: \"span\",\n    \"className\": \"mpunct\"\n  }, \",\"), mdx(\"span\", {\n    parentName: \"span\",\n    \"className\": \"mspace\",\n    \"style\": {\n      \"marginRight\": \"0.16666666666666666em\"\n    }\n  }), mdx(\"span\", {\n    parentName: \"span\",\n    \"className\": \"mord mathnormal\"\n  }, \"s\"), mdx(\"span\", {\n    parentName: \"span\",\n    \"className\": \"mclose\"\n  }, \")\"))))), \" is often simplified to \", mdx(\"span\", {\n    parentName: \"p\",\n    \"className\": \"math math-inline\"\n  }, mdx(\"span\", {\n    parentName: \"span\",\n    \"className\": \"katex\"\n  }, mdx(\"span\", {\n    parentName: \"span\",\n    \"className\": \"katex-mathml\"\n  }, mdx(\"math\", {\n    parentName: \"span\",\n    \"xmlns\": \"http://www.w3.org/1998/Math/MathML\"\n  }, mdx(\"semantics\", {\n    parentName: \"math\"\n  }, mdx(\"mrow\", {\n    parentName: \"semantics\"\n  }, mdx(\"mi\", {\n    parentName: \"mrow\"\n  }, \"g\"), mdx(\"mo\", {\n    parentName: \"mrow\"\n  }, \"\\u22C5\"), mdx(\"mi\", {\n    parentName: \"mrow\"\n  }, \"s\")), mdx(\"annotation\", {\n    parentName: \"semantics\",\n    \"encoding\": \"application/x-tex\"\n  }, \"g \\\\cdot s\")))), mdx(\"span\", {\n    parentName: \"span\",\n    \"className\": \"katex-html\",\n    \"aria-hidden\": \"true\"\n  }, mdx(\"span\", {\n    parentName: \"span\",\n    \"className\": \"base\"\n  }, mdx(\"span\", {\n    parentName: \"span\",\n    \"className\": \"strut\",\n    \"style\": {\n      \"height\": \"0.63889em\",\n      \"verticalAlign\": \"-0.19444em\"\n    }\n  }), mdx(\"span\", {\n    parentName: \"span\",\n    \"className\": \"mord mathnormal\",\n    \"style\": {\n      \"marginRight\": \"0.03588em\"\n    }\n  }, \"g\"), mdx(\"span\", {\n    parentName: \"span\",\n    \"className\": \"mspace\",\n    \"style\": {\n      \"marginRight\": \"0.2222222222222222em\"\n    }\n  }), mdx(\"span\", {\n    parentName: \"span\",\n    \"className\": \"mbin\"\n  }, \"\\u22C5\"), mdx(\"span\", {\n    parentName: \"span\",\n    \"className\": \"mspace\",\n    \"style\": {\n      \"marginRight\": \"0.2222222222222222em\"\n    }\n  })), mdx(\"span\", {\n    parentName: \"span\",\n    \"className\": \"base\"\n  }, mdx(\"span\", {\n    parentName: \"span\",\n    \"className\": \"strut\",\n    \"style\": {\n      \"height\": \"0.43056em\",\n      \"verticalAlign\": \"0em\"\n    }\n  }), mdx(\"span\", {\n    parentName: \"span\",\n    \"className\": \"mord mathnormal\"\n  }, \"s\"))))), \" or \", mdx(\"span\", {\n    parentName: \"p\",\n    \"className\": \"math math-inline\"\n  }, mdx(\"span\", {\n    parentName: \"span\",\n    \"className\": \"katex\"\n  }, mdx(\"span\", {\n    parentName: \"span\",\n    \"className\": \"katex-mathml\"\n  }, mdx(\"math\", {\n    parentName: \"span\",\n    \"xmlns\": \"http://www.w3.org/1998/Math/MathML\"\n  }, mdx(\"semantics\", {\n    parentName: \"math\"\n  }, mdx(\"mrow\", {\n    parentName: \"semantics\"\n  }, mdx(\"mi\", {\n    parentName: \"mrow\"\n  }, \"g\"), mdx(\"mi\", {\n    parentName: \"mrow\"\n  }, \"s\")), mdx(\"annotation\", {\n    parentName: \"semantics\",\n    \"encoding\": \"application/x-tex\"\n  }, \"gs\")))), mdx(\"span\", {\n    parentName: \"span\",\n    \"className\": \"katex-html\",\n    \"aria-hidden\": \"true\"\n  }, mdx(\"span\", {\n    parentName: \"span\",\n    \"className\": \"base\"\n  }, mdx(\"span\", {\n    parentName: \"span\",\n    \"className\": \"strut\",\n    \"style\": {\n      \"height\": \"0.625em\",\n      \"verticalAlign\": \"-0.19444em\"\n    }\n  }), mdx(\"span\", {\n    parentName: \"span\",\n    \"className\": \"mord mathnormal\",\n    \"style\": {\n      \"marginRight\": \"0.03588em\"\n    }\n  }, \"g\"), mdx(\"span\", {\n    parentName: \"span\",\n    \"className\": \"mord mathnormal\"\n  }, \"s\"))))), \". We will do this from now on.\"), mdx(\"h2\", {\n    \"id\": \"schreier-graphs\",\n    \"style\": {\n      \"position\": \"relative\"\n    }\n  }, mdx(\"a\", {\n    parentName: \"h2\",\n    \"href\": \"#schreier-graphs\",\n    \"aria-label\": \"schreier graphs permalink\",\n    \"className\": \"anchor before\"\n  }, mdx(\"svg\", {\n    parentName: \"a\",\n    \"aria-hidden\": \"true\",\n    \"focusable\": \"false\",\n    \"height\": \"16\",\n    \"version\": \"1.1\",\n    \"viewBox\": \"0 0 16 16\",\n    \"width\": \"16\"\n  }, mdx(\"path\", {\n    parentName: \"svg\",\n    \"fillRule\": \"evenodd\",\n    \"d\": \"M4 9h1v1H4c-1.5 0-3-1.69-3-3.5S2.55 3 4 3h4c1.45 0 3 1.69 3 3.5 0 1.41-.91 2.72-2 3.25V8.59c.58-.45 1-1.27 1-2.09C10 5.22 8.98 4 8 4H4c-.98 0-2 1.22-2 2.5S3 9 4 9zm9-3h-1v1h1c1 0 2 1.22 2 2.5S13.98 12 13 12H9c-.98 0-2-1.22-2-2.5 0-.83.42-1.64 1-2.09V6.25c-1.09.53-2 1.84-2 3.25C6 11.31 7.55 13 9 13h4c1.45 0 3-1.69 3-3.5S14.5 6 13 6z\"\n  }))), \"Schreier Graphs\"), mdx(\"p\", null, \"Now that we've defined both group presentations and group actions, we can define the Schreier graph, the fundamental data structure that underpins the Todd-Coxeter algorithm.\"), mdx(\"p\", null, \"Let \", mdx(\"span\", {\n    parentName: \"p\",\n    \"className\": \"math math-inline\"\n  }, mdx(\"span\", {\n    parentName: \"span\",\n    \"className\": \"katex\"\n  }, mdx(\"span\", {\n    parentName: \"span\",\n    \"className\": \"katex-mathml\"\n  }, mdx(\"math\", {\n    parentName: \"span\",\n    \"xmlns\": \"http://www.w3.org/1998/Math/MathML\"\n  }, mdx(\"semantics\", {\n    parentName: \"math\"\n  }, mdx(\"mrow\", {\n    parentName: \"semantics\"\n  }, mdx(\"mi\", {\n    parentName: \"mrow\"\n  }, \"G\"), mdx(\"mo\", {\n    parentName: \"mrow\"\n  }, \"=\"), mdx(\"mo\", {\n    parentName: \"mrow\",\n    \"stretchy\": \"false\"\n  }, \"\\u27E8\"), mdx(\"mi\", {\n    parentName: \"mrow\"\n  }, \"X\"), mdx(\"mo\", {\n    parentName: \"mrow\"\n  }, \"\\u2223\"), mdx(\"mi\", {\n    parentName: \"mrow\"\n  }, \"R\"), mdx(\"mo\", {\n    parentName: \"mrow\",\n    \"stretchy\": \"false\"\n  }, \"\\u27E9\")), mdx(\"annotation\", {\n    parentName: \"semantics\",\n    \"encoding\": \"application/x-tex\"\n  }, \"G = \\\\langle X \\\\mid R \\\\rangle\")))), mdx(\"span\", {\n    parentName: \"span\",\n    \"className\": \"katex-html\",\n    \"aria-hidden\": \"true\"\n  }, mdx(\"span\", {\n    parentName: \"span\",\n    \"className\": \"base\"\n  }, mdx(\"span\", {\n    parentName: \"span\",\n    \"className\": \"strut\",\n    \"style\": {\n      \"height\": \"0.68333em\",\n      \"verticalAlign\": \"0em\"\n    }\n  }), mdx(\"span\", {\n    parentName: \"span\",\n    \"className\": \"mord mathnormal\"\n  }, \"G\"), mdx(\"span\", {\n    parentName: \"span\",\n    \"className\": \"mspace\",\n    \"style\": {\n      \"marginRight\": \"0.2777777777777778em\"\n    }\n  }), mdx(\"span\", {\n    parentName: \"span\",\n    \"className\": \"mrel\"\n  }, \"=\"), mdx(\"span\", {\n    parentName: \"span\",\n    \"className\": \"mspace\",\n    \"style\": {\n      \"marginRight\": \"0.2777777777777778em\"\n    }\n  })), mdx(\"span\", {\n    parentName: \"span\",\n    \"className\": \"base\"\n  }, mdx(\"span\", {\n    parentName: \"span\",\n    \"className\": \"strut\",\n    \"style\": {\n      \"height\": \"1em\",\n      \"verticalAlign\": \"-0.25em\"\n    }\n  }), mdx(\"span\", {\n    parentName: \"span\",\n    \"className\": \"mopen\"\n  }, \"\\u27E8\"), mdx(\"span\", {\n    parentName: \"span\",\n    \"className\": \"mord mathnormal\",\n    \"style\": {\n      \"marginRight\": \"0.07847em\"\n    }\n  }, \"X\"), mdx(\"span\", {\n    parentName: \"span\",\n    \"className\": \"mspace\",\n    \"style\": {\n      \"marginRight\": \"0.2777777777777778em\"\n    }\n  }), mdx(\"span\", {\n    parentName: \"span\",\n    \"className\": \"mrel\"\n  }, \"\\u2223\"), mdx(\"span\", {\n    parentName: \"span\",\n    \"className\": \"mspace\",\n    \"style\": {\n      \"marginRight\": \"0.2777777777777778em\"\n    }\n  })), mdx(\"span\", {\n    parentName: \"span\",\n    \"className\": \"base\"\n  }, mdx(\"span\", {\n    parentName: \"span\",\n    \"className\": \"strut\",\n    \"style\": {\n      \"height\": \"1em\",\n      \"verticalAlign\": \"-0.25em\"\n    }\n  }), mdx(\"span\", {\n    parentName: \"span\",\n    \"className\": \"mord mathnormal\",\n    \"style\": {\n      \"marginRight\": \"0.00773em\"\n    }\n  }, \"R\"), mdx(\"span\", {\n    parentName: \"span\",\n    \"className\": \"mclose\"\n  }, \"\\u27E9\"))))), \" and let \", mdx(\"span\", {\n    parentName: \"p\",\n    \"className\": \"math math-inline\"\n  }, mdx(\"span\", {\n    parentName: \"span\",\n    \"className\": \"katex\"\n  }, mdx(\"span\", {\n    parentName: \"span\",\n    \"className\": \"katex-mathml\"\n  }, mdx(\"math\", {\n    parentName: \"span\",\n    \"xmlns\": \"http://www.w3.org/1998/Math/MathML\"\n  }, mdx(\"semantics\", {\n    parentName: \"math\"\n  }, mdx(\"mrow\", {\n    parentName: \"semantics\"\n  }, mdx(\"mi\", {\n    parentName: \"mrow\"\n  }, \"G\")), mdx(\"annotation\", {\n    parentName: \"semantics\",\n    \"encoding\": \"application/x-tex\"\n  }, \"G\")))), mdx(\"span\", {\n    parentName: \"span\",\n    \"className\": \"katex-html\",\n    \"aria-hidden\": \"true\"\n  }, mdx(\"span\", {\n    parentName: \"span\",\n    \"className\": \"base\"\n  }, mdx(\"span\", {\n    parentName: \"span\",\n    \"className\": \"strut\",\n    \"style\": {\n      \"height\": \"0.68333em\",\n      \"verticalAlign\": \"0em\"\n    }\n  }), mdx(\"span\", {\n    parentName: \"span\",\n    \"className\": \"mord mathnormal\"\n  }, \"G\"))))), \" act transitively on \", mdx(\"span\", {\n    parentName: \"p\",\n    \"className\": \"math math-inline\"\n  }, mdx(\"span\", {\n    parentName: \"span\",\n    \"className\": \"katex\"\n  }, mdx(\"span\", {\n    parentName: \"span\",\n    \"className\": \"katex-mathml\"\n  }, mdx(\"math\", {\n    parentName: \"span\",\n    \"xmlns\": \"http://www.w3.org/1998/Math/MathML\"\n  }, mdx(\"semantics\", {\n    parentName: \"math\"\n  }, mdx(\"mrow\", {\n    parentName: \"semantics\"\n  }, mdx(\"mi\", {\n    parentName: \"mrow\"\n  }, \"S\")), mdx(\"annotation\", {\n    parentName: \"semantics\",\n    \"encoding\": \"application/x-tex\"\n  }, \"S\")))), mdx(\"span\", {\n    parentName: \"span\",\n    \"className\": \"katex-html\",\n    \"aria-hidden\": \"true\"\n  }, mdx(\"span\", {\n    parentName: \"span\",\n    \"className\": \"base\"\n  }, mdx(\"span\", {\n    parentName: \"span\",\n    \"className\": \"strut\",\n    \"style\": {\n      \"height\": \"0.68333em\",\n      \"verticalAlign\": \"0em\"\n    }\n  }), mdx(\"span\", {\n    parentName: \"span\",\n    \"className\": \"mord mathnormal\",\n    \"style\": {\n      \"marginRight\": \"0.05764em\"\n    }\n  }, \"S\"))))), \". The Schreier graph for \", mdx(\"span\", {\n    parentName: \"p\",\n    \"className\": \"math math-inline\"\n  }, mdx(\"span\", {\n    parentName: \"span\",\n    \"className\": \"katex\"\n  }, mdx(\"span\", {\n    parentName: \"span\",\n    \"className\": \"katex-mathml\"\n  }, mdx(\"math\", {\n    parentName: \"span\",\n    \"xmlns\": \"http://www.w3.org/1998/Math/MathML\"\n  }, mdx(\"semantics\", {\n    parentName: \"math\"\n  }, mdx(\"mrow\", {\n    parentName: \"semantics\"\n  }, mdx(\"mi\", {\n    parentName: \"mrow\"\n  }, \"S\")), mdx(\"annotation\", {\n    parentName: \"semantics\",\n    \"encoding\": \"application/x-tex\"\n  }, \"S\")))), mdx(\"span\", {\n    parentName: \"span\",\n    \"className\": \"katex-html\",\n    \"aria-hidden\": \"true\"\n  }, mdx(\"span\", {\n    parentName: \"span\",\n    \"className\": \"base\"\n  }, mdx(\"span\", {\n    parentName: \"span\",\n    \"className\": \"strut\",\n    \"style\": {\n      \"height\": \"0.68333em\",\n      \"verticalAlign\": \"0em\"\n    }\n  }), mdx(\"span\", {\n    parentName: \"span\",\n    \"className\": \"mord mathnormal\",\n    \"style\": {\n      \"marginRight\": \"0.05764em\"\n    }\n  }, \"S\"))))), \" is a directed and labeled graph \", mdx(\"span\", {\n    parentName: \"p\",\n    \"className\": \"math math-inline\"\n  }, mdx(\"span\", {\n    parentName: \"span\",\n    \"className\": \"katex\"\n  }, mdx(\"span\", {\n    parentName: \"span\",\n    \"className\": \"katex-mathml\"\n  }, mdx(\"math\", {\n    parentName: \"span\",\n    \"xmlns\": \"http://www.w3.org/1998/Math/MathML\"\n  }, mdx(\"semantics\", {\n    parentName: \"math\"\n  }, mdx(\"mrow\", {\n    parentName: \"semantics\"\n  }, mdx(\"mi\", {\n    parentName: \"mrow\",\n    \"mathvariant\": \"normal\"\n  }, \"\\u0393\")), mdx(\"annotation\", {\n    parentName: \"semantics\",\n    \"encoding\": \"application/x-tex\"\n  }, \"\\\\Gamma\")))), mdx(\"span\", {\n    parentName: \"span\",\n    \"className\": \"katex-html\",\n    \"aria-hidden\": \"true\"\n  }, mdx(\"span\", {\n    parentName: \"span\",\n    \"className\": \"base\"\n  }, mdx(\"span\", {\n    parentName: \"span\",\n    \"className\": \"strut\",\n    \"style\": {\n      \"height\": \"0.68333em\",\n      \"verticalAlign\": \"0em\"\n    }\n  }), mdx(\"span\", {\n    parentName: \"span\",\n    \"className\": \"mord\"\n  }, \"\\u0393\"))))), \" with \", mdx(\"span\", {\n    parentName: \"p\",\n    \"className\": \"math math-inline\"\n  }, mdx(\"span\", {\n    parentName: \"span\",\n    \"className\": \"katex\"\n  }, mdx(\"span\", {\n    parentName: \"span\",\n    \"className\": \"katex-mathml\"\n  }, mdx(\"math\", {\n    parentName: \"span\",\n    \"xmlns\": \"http://www.w3.org/1998/Math/MathML\"\n  }, mdx(\"semantics\", {\n    parentName: \"math\"\n  }, mdx(\"mrow\", {\n    parentName: \"semantics\"\n  }, mdx(\"mi\", {\n    parentName: \"mrow\"\n  }, \"S\")), mdx(\"annotation\", {\n    parentName: \"semantics\",\n    \"encoding\": \"application/x-tex\"\n  }, \"S\")))), mdx(\"span\", {\n    parentName: \"span\",\n    \"className\": \"katex-html\",\n    \"aria-hidden\": \"true\"\n  }, mdx(\"span\", {\n    parentName: \"span\",\n    \"className\": \"base\"\n  }, mdx(\"span\", {\n    parentName: \"span\",\n    \"className\": \"strut\",\n    \"style\": {\n      \"height\": \"0.68333em\",\n      \"verticalAlign\": \"0em\"\n    }\n  }), mdx(\"span\", {\n    parentName: \"span\",\n    \"className\": \"mord mathnormal\",\n    \"style\": {\n      \"marginRight\": \"0.05764em\"\n    }\n  }, \"S\"))))), \" as its vertex set and with edges labeled \", mdx(\"span\", {\n    parentName: \"p\",\n    \"className\": \"math math-inline\"\n  }, mdx(\"span\", {\n    parentName: \"span\",\n    \"className\": \"katex\"\n  }, mdx(\"span\", {\n    parentName: \"span\",\n    \"className\": \"katex-mathml\"\n  }, mdx(\"math\", {\n    parentName: \"span\",\n    \"xmlns\": \"http://www.w3.org/1998/Math/MathML\"\n  }, mdx(\"semantics\", {\n    parentName: \"math\"\n  }, mdx(\"mrow\", {\n    parentName: \"semantics\"\n  }, mdx(\"mi\", {\n    parentName: \"mrow\"\n  }, \"g\")), mdx(\"annotation\", {\n    parentName: \"semantics\",\n    \"encoding\": \"application/x-tex\"\n  }, \"g\")))), mdx(\"span\", {\n    parentName: \"span\",\n    \"className\": \"katex-html\",\n    \"aria-hidden\": \"true\"\n  }, mdx(\"span\", {\n    parentName: \"span\",\n    \"className\": \"base\"\n  }, mdx(\"span\", {\n    parentName: \"span\",\n    \"className\": \"strut\",\n    \"style\": {\n      \"height\": \"0.625em\",\n      \"verticalAlign\": \"-0.19444em\"\n    }\n  }), mdx(\"span\", {\n    parentName: \"span\",\n    \"className\": \"mord mathnormal\",\n    \"style\": {\n      \"marginRight\": \"0.03588em\"\n    }\n  }, \"g\"))))), \" from \", mdx(\"span\", {\n    parentName: \"p\",\n    \"className\": \"math math-inline\"\n  }, mdx(\"span\", {\n    parentName: \"span\",\n    \"className\": \"katex\"\n  }, mdx(\"span\", {\n    parentName: \"span\",\n    \"className\": \"katex-mathml\"\n  }, mdx(\"math\", {\n    parentName: \"span\",\n    \"xmlns\": \"http://www.w3.org/1998/Math/MathML\"\n  }, mdx(\"semantics\", {\n    parentName: \"math\"\n  }, mdx(\"mrow\", {\n    parentName: \"semantics\"\n  }, mdx(\"mi\", {\n    parentName: \"mrow\"\n  }, \"s\")), mdx(\"annotation\", {\n    parentName: \"semantics\",\n    \"encoding\": \"application/x-tex\"\n  }, \"s\")))), mdx(\"span\", {\n    parentName: \"span\",\n    \"className\": \"katex-html\",\n    \"aria-hidden\": \"true\"\n  }, mdx(\"span\", {\n    parentName: \"span\",\n    \"className\": \"base\"\n  }, mdx(\"span\", {\n    parentName: \"span\",\n    \"className\": \"strut\",\n    \"style\": {\n      \"height\": \"0.43056em\",\n      \"verticalAlign\": \"0em\"\n    }\n  }), mdx(\"span\", {\n    parentName: \"span\",\n    \"className\": \"mord mathnormal\"\n  }, \"s\"))))), \" to \", mdx(\"span\", {\n    parentName: \"p\",\n    \"className\": \"math math-inline\"\n  }, mdx(\"span\", {\n    parentName: \"span\",\n    \"className\": \"katex\"\n  }, mdx(\"span\", {\n    parentName: \"span\",\n    \"className\": \"katex-mathml\"\n  }, mdx(\"math\", {\n    parentName: \"span\",\n    \"xmlns\": \"http://www.w3.org/1998/Math/MathML\"\n  }, mdx(\"semantics\", {\n    parentName: \"math\"\n  }, mdx(\"mrow\", {\n    parentName: \"semantics\"\n  }, mdx(\"mi\", {\n    parentName: \"mrow\"\n  }, \"g\"), mdx(\"mi\", {\n    parentName: \"mrow\"\n  }, \"s\")), mdx(\"annotation\", {\n    parentName: \"semantics\",\n    \"encoding\": \"application/x-tex\"\n  }, \"gs\")))), mdx(\"span\", {\n    parentName: \"span\",\n    \"className\": \"katex-html\",\n    \"aria-hidden\": \"true\"\n  }, mdx(\"span\", {\n    parentName: \"span\",\n    \"className\": \"base\"\n  }, mdx(\"span\", {\n    parentName: \"span\",\n    \"className\": \"strut\",\n    \"style\": {\n      \"height\": \"0.625em\",\n      \"verticalAlign\": \"-0.19444em\"\n    }\n  }), mdx(\"span\", {\n    parentName: \"span\",\n    \"className\": \"mord mathnormal\",\n    \"style\": {\n      \"marginRight\": \"0.03588em\"\n    }\n  }, \"g\"), mdx(\"span\", {\n    parentName: \"span\",\n    \"className\": \"mord mathnormal\"\n  }, \"s\"))))), \" \", mdx(\"span\", {\n    parentName: \"p\",\n    \"className\": \"math math-inline\"\n  }, mdx(\"span\", {\n    parentName: \"span\",\n    \"className\": \"katex\"\n  }, mdx(\"span\", {\n    parentName: \"span\",\n    \"className\": \"katex-mathml\"\n  }, mdx(\"math\", {\n    parentName: \"span\",\n    \"xmlns\": \"http://www.w3.org/1998/Math/MathML\"\n  }, mdx(\"semantics\", {\n    parentName: \"math\"\n  }, mdx(\"mrow\", {\n    parentName: \"semantics\"\n  }, mdx(\"mi\", {\n    parentName: \"mrow\",\n    \"mathvariant\": \"normal\"\n  }, \"\\u2200\"), mdx(\"mi\", {\n    parentName: \"mrow\"\n  }, \"s\"), mdx(\"mo\", {\n    parentName: \"mrow\"\n  }, \"\\u2208\"), mdx(\"mi\", {\n    parentName: \"mrow\"\n  }, \"S\")), mdx(\"annotation\", {\n    parentName: \"semantics\",\n    \"encoding\": \"application/x-tex\"\n  }, \"\\\\forall s \\\\in S\")))), mdx(\"span\", {\n    parentName: \"span\",\n    \"className\": \"katex-html\",\n    \"aria-hidden\": \"true\"\n  }, mdx(\"span\", {\n    parentName: \"span\",\n    \"className\": \"base\"\n  }, mdx(\"span\", {\n    parentName: \"span\",\n    \"className\": \"strut\",\n    \"style\": {\n      \"height\": \"0.73354em\",\n      \"verticalAlign\": \"-0.0391em\"\n    }\n  }), mdx(\"span\", {\n    parentName: \"span\",\n    \"className\": \"mord\"\n  }, \"\\u2200\"), mdx(\"span\", {\n    parentName: \"span\",\n    \"className\": \"mord mathnormal\"\n  }, \"s\"), mdx(\"span\", {\n    parentName: \"span\",\n    \"className\": \"mspace\",\n    \"style\": {\n      \"marginRight\": \"0.2777777777777778em\"\n    }\n  }), mdx(\"span\", {\n    parentName: \"span\",\n    \"className\": \"mrel\"\n  }, \"\\u2208\"), mdx(\"span\", {\n    parentName: \"span\",\n    \"className\": \"mspace\",\n    \"style\": {\n      \"marginRight\": \"0.2777777777777778em\"\n    }\n  })), mdx(\"span\", {\n    parentName: \"span\",\n    \"className\": \"base\"\n  }, mdx(\"span\", {\n    parentName: \"span\",\n    \"className\": \"strut\",\n    \"style\": {\n      \"height\": \"0.68333em\",\n      \"verticalAlign\": \"0em\"\n    }\n  }), mdx(\"span\", {\n    parentName: \"span\",\n    \"className\": \"mord mathnormal\",\n    \"style\": {\n      \"marginRight\": \"0.05764em\"\n    }\n  }, \"S\"))))), \" and \", mdx(\"span\", {\n    parentName: \"p\",\n    \"className\": \"math math-inline\"\n  }, mdx(\"span\", {\n    parentName: \"span\",\n    \"className\": \"katex\"\n  }, mdx(\"span\", {\n    parentName: \"span\",\n    \"className\": \"katex-mathml\"\n  }, mdx(\"math\", {\n    parentName: \"span\",\n    \"xmlns\": \"http://www.w3.org/1998/Math/MathML\"\n  }, mdx(\"semantics\", {\n    parentName: \"math\"\n  }, mdx(\"mrow\", {\n    parentName: \"semantics\"\n  }, mdx(\"mi\", {\n    parentName: \"mrow\",\n    \"mathvariant\": \"normal\"\n  }, \"\\u2200\"), mdx(\"mi\", {\n    parentName: \"mrow\"\n  }, \"g\"), mdx(\"mo\", {\n    parentName: \"mrow\"\n  }, \"\\u2208\"), mdx(\"mi\", {\n    parentName: \"mrow\"\n  }, \"X\")), mdx(\"annotation\", {\n    parentName: \"semantics\",\n    \"encoding\": \"application/x-tex\"\n  }, \"\\\\forall g \\\\in X\")))), mdx(\"span\", {\n    parentName: \"span\",\n    \"className\": \"katex-html\",\n    \"aria-hidden\": \"true\"\n  }, mdx(\"span\", {\n    parentName: \"span\",\n    \"className\": \"base\"\n  }, mdx(\"span\", {\n    parentName: \"span\",\n    \"className\": \"strut\",\n    \"style\": {\n      \"height\": \"0.8888799999999999em\",\n      \"verticalAlign\": \"-0.19444em\"\n    }\n  }), mdx(\"span\", {\n    parentName: \"span\",\n    \"className\": \"mord\"\n  }, \"\\u2200\"), mdx(\"span\", {\n    parentName: \"span\",\n    \"className\": \"mord mathnormal\",\n    \"style\": {\n      \"marginRight\": \"0.03588em\"\n    }\n  }, \"g\"), mdx(\"span\", {\n    parentName: \"span\",\n    \"className\": \"mspace\",\n    \"style\": {\n      \"marginRight\": \"0.2777777777777778em\"\n    }\n  }), mdx(\"span\", {\n    parentName: \"span\",\n    \"className\": \"mrel\"\n  }, \"\\u2208\"), mdx(\"span\", {\n    parentName: \"span\",\n    \"className\": \"mspace\",\n    \"style\": {\n      \"marginRight\": \"0.2777777777777778em\"\n    }\n  })), mdx(\"span\", {\n    parentName: \"span\",\n    \"className\": \"base\"\n  }, mdx(\"span\", {\n    parentName: \"span\",\n    \"className\": \"strut\",\n    \"style\": {\n      \"height\": \"0.68333em\",\n      \"verticalAlign\": \"0em\"\n    }\n  }), mdx(\"span\", {\n    parentName: \"span\",\n    \"className\": \"mord mathnormal\",\n    \"style\": {\n      \"marginRight\": \"0.07847em\"\n    }\n  }, \"X\"))))), \".\"), mdx(\"h3\", {\n    \"id\": \"some-observations\",\n    \"style\": {\n      \"position\": \"relative\"\n    }\n  }, mdx(\"a\", {\n    parentName: \"h3\",\n    \"href\": \"#some-observations\",\n    \"aria-label\": \"some observations permalink\",\n    \"className\": \"anchor before\"\n  }, mdx(\"svg\", {\n    parentName: \"a\",\n    \"aria-hidden\": \"true\",\n    \"focusable\": \"false\",\n    \"height\": \"16\",\n    \"version\": \"1.1\",\n    \"viewBox\": \"0 0 16 16\",\n    \"width\": \"16\"\n  }, mdx(\"path\", {\n    parentName: \"svg\",\n    \"fillRule\": \"evenodd\",\n    \"d\": \"M4 9h1v1H4c-1.5 0-3-1.69-3-3.5S2.55 3 4 3h4c1.45 0 3 1.69 3 3.5 0 1.41-.91 2.72-2 3.25V8.59c.58-.45 1-1.27 1-2.09C10 5.22 8.98 4 8 4H4c-.98 0-2 1.22-2 2.5S3 9 4 9zm9-3h-1v1h1c1 0 2 1.22 2 2.5S13.98 12 13 12H9c-.98 0-2-1.22-2-2.5 0-.83.42-1.64 1-2.09V6.25c-1.09.53-2 1.84-2 3.25C6 11.31 7.55 13 9 13h4c1.45 0 3-1.69 3-3.5S14.5 6 13 6z\"\n  }))), \"Some Observations\"), mdx(\"ul\", null, mdx(\"li\", {\n    parentName: \"ul\"\n  }, \"Since group actions act bijectively on \", mdx(\"span\", {\n    parentName: \"li\",\n    \"className\": \"math math-inline\"\n  }, mdx(\"span\", {\n    parentName: \"span\",\n    \"className\": \"katex\"\n  }, mdx(\"span\", {\n    parentName: \"span\",\n    \"className\": \"katex-mathml\"\n  }, mdx(\"math\", {\n    parentName: \"span\",\n    \"xmlns\": \"http://www.w3.org/1998/Math/MathML\"\n  }, mdx(\"semantics\", {\n    parentName: \"math\"\n  }, mdx(\"mrow\", {\n    parentName: \"semantics\"\n  }, mdx(\"mi\", {\n    parentName: \"mrow\"\n  }, \"S\")), mdx(\"annotation\", {\n    parentName: \"semantics\",\n    \"encoding\": \"application/x-tex\"\n  }, \"S\")))), mdx(\"span\", {\n    parentName: \"span\",\n    \"className\": \"katex-html\",\n    \"aria-hidden\": \"true\"\n  }, mdx(\"span\", {\n    parentName: \"span\",\n    \"className\": \"base\"\n  }, mdx(\"span\", {\n    parentName: \"span\",\n    \"className\": \"strut\",\n    \"style\": {\n      \"height\": \"0.68333em\",\n      \"verticalAlign\": \"0em\"\n    }\n  }), mdx(\"span\", {\n    parentName: \"span\",\n    \"className\": \"mord mathnormal\",\n    \"style\": {\n      \"marginRight\": \"0.05764em\"\n    }\n  }, \"S\"))))), \" for a fixed \", mdx(\"span\", {\n    parentName: \"li\",\n    \"className\": \"math math-inline\"\n  }, mdx(\"span\", {\n    parentName: \"span\",\n    \"className\": \"katex\"\n  }, mdx(\"span\", {\n    parentName: \"span\",\n    \"className\": \"katex-mathml\"\n  }, mdx(\"math\", {\n    parentName: \"span\",\n    \"xmlns\": \"http://www.w3.org/1998/Math/MathML\"\n  }, mdx(\"semantics\", {\n    parentName: \"math\"\n  }, mdx(\"mrow\", {\n    parentName: \"semantics\"\n  }, mdx(\"mi\", {\n    parentName: \"mrow\"\n  }, \"g\")), mdx(\"annotation\", {\n    parentName: \"semantics\",\n    \"encoding\": \"application/x-tex\"\n  }, \"g\")))), mdx(\"span\", {\n    parentName: \"span\",\n    \"className\": \"katex-html\",\n    \"aria-hidden\": \"true\"\n  }, mdx(\"span\", {\n    parentName: \"span\",\n    \"className\": \"base\"\n  }, mdx(\"span\", {\n    parentName: \"span\",\n    \"className\": \"strut\",\n    \"style\": {\n      \"height\": \"0.625em\",\n      \"verticalAlign\": \"-0.19444em\"\n    }\n  }), mdx(\"span\", {\n    parentName: \"span\",\n    \"className\": \"mord mathnormal\",\n    \"style\": {\n      \"marginRight\": \"0.03588em\"\n    }\n  }, \"g\"))))), \", each vertex has exactly one incomming and one outgoing edge for each label \", mdx(\"span\", {\n    parentName: \"li\",\n    \"className\": \"math math-inline\"\n  }, mdx(\"span\", {\n    parentName: \"span\",\n    \"className\": \"katex\"\n  }, mdx(\"span\", {\n    parentName: \"span\",\n    \"className\": \"katex-mathml\"\n  }, mdx(\"math\", {\n    parentName: \"span\",\n    \"xmlns\": \"http://www.w3.org/1998/Math/MathML\"\n  }, mdx(\"semantics\", {\n    parentName: \"math\"\n  }, mdx(\"mrow\", {\n    parentName: \"semantics\"\n  }, mdx(\"mi\", {\n    parentName: \"mrow\"\n  }, \"g\"), mdx(\"mo\", {\n    parentName: \"mrow\"\n  }, \"\\u2208\"), mdx(\"mi\", {\n    parentName: \"mrow\"\n  }, \"X\")), mdx(\"annotation\", {\n    parentName: \"semantics\",\n    \"encoding\": \"application/x-tex\"\n  }, \"g \\\\in X\")))), mdx(\"span\", {\n    parentName: \"span\",\n    \"className\": \"katex-html\",\n    \"aria-hidden\": \"true\"\n  }, mdx(\"span\", {\n    parentName: \"span\",\n    \"className\": \"base\"\n  }, mdx(\"span\", {\n    parentName: \"span\",\n    \"className\": \"strut\",\n    \"style\": {\n      \"height\": \"0.7335400000000001em\",\n      \"verticalAlign\": \"-0.19444em\"\n    }\n  }), mdx(\"span\", {\n    parentName: \"span\",\n    \"className\": \"mord mathnormal\",\n    \"style\": {\n      \"marginRight\": \"0.03588em\"\n    }\n  }, \"g\"), mdx(\"span\", {\n    parentName: \"span\",\n    \"className\": \"mspace\",\n    \"style\": {\n      \"marginRight\": \"0.2777777777777778em\"\n    }\n  }), mdx(\"span\", {\n    parentName: \"span\",\n    \"className\": \"mrel\"\n  }, \"\\u2208\"), mdx(\"span\", {\n    parentName: \"span\",\n    \"className\": \"mspace\",\n    \"style\": {\n      \"marginRight\": \"0.2777777777777778em\"\n    }\n  })), mdx(\"span\", {\n    parentName: \"span\",\n    \"className\": \"base\"\n  }, mdx(\"span\", {\n    parentName: \"span\",\n    \"className\": \"strut\",\n    \"style\": {\n      \"height\": \"0.68333em\",\n      \"verticalAlign\": \"0em\"\n    }\n  }), mdx(\"span\", {\n    parentName: \"span\",\n    \"className\": \"mord mathnormal\",\n    \"style\": {\n      \"marginRight\": \"0.07847em\"\n    }\n  }, \"X\"))))), \".\"), mdx(\"li\", {\n    parentName: \"ul\"\n  }, \"A starting point \", mdx(\"span\", {\n    parentName: \"li\",\n    \"className\": \"math math-inline\"\n  }, mdx(\"span\", {\n    parentName: \"span\",\n    \"className\": \"katex\"\n  }, mdx(\"span\", {\n    parentName: \"span\",\n    \"className\": \"katex-mathml\"\n  }, mdx(\"math\", {\n    parentName: \"span\",\n    \"xmlns\": \"http://www.w3.org/1998/Math/MathML\"\n  }, mdx(\"semantics\", {\n    parentName: \"math\"\n  }, mdx(\"mrow\", {\n    parentName: \"semantics\"\n  }, mdx(\"mi\", {\n    parentName: \"mrow\"\n  }, \"s\"), mdx(\"mo\", {\n    parentName: \"mrow\"\n  }, \"\\u2208\"), mdx(\"mi\", {\n    parentName: \"mrow\"\n  }, \"S\")), mdx(\"annotation\", {\n    parentName: \"semantics\",\n    \"encoding\": \"application/x-tex\"\n  }, \"s \\\\in S\")))), mdx(\"span\", {\n    parentName: \"span\",\n    \"className\": \"katex-html\",\n    \"aria-hidden\": \"true\"\n  }, mdx(\"span\", {\n    parentName: \"span\",\n    \"className\": \"base\"\n  }, mdx(\"span\", {\n    parentName: \"span\",\n    \"className\": \"strut\",\n    \"style\": {\n      \"height\": \"0.5782em\",\n      \"verticalAlign\": \"-0.0391em\"\n    }\n  }), mdx(\"span\", {\n    parentName: \"span\",\n    \"className\": \"mord mathnormal\"\n  }, \"s\"), mdx(\"span\", {\n    parentName: \"span\",\n    \"className\": \"mspace\",\n    \"style\": {\n      \"marginRight\": \"0.2777777777777778em\"\n    }\n  }), mdx(\"span\", {\n    parentName: \"span\",\n    \"className\": \"mrel\"\n  }, \"\\u2208\"), mdx(\"span\", {\n    parentName: \"span\",\n    \"className\": \"mspace\",\n    \"style\": {\n      \"marginRight\": \"0.2777777777777778em\"\n    }\n  })), mdx(\"span\", {\n    parentName: \"span\",\n    \"className\": \"base\"\n  }, mdx(\"span\", {\n    parentName: \"span\",\n    \"className\": \"strut\",\n    \"style\": {\n      \"height\": \"0.68333em\",\n      \"verticalAlign\": \"0em\"\n    }\n  }), mdx(\"span\", {\n    parentName: \"span\",\n    \"className\": \"mord mathnormal\",\n    \"style\": {\n      \"marginRight\": \"0.05764em\"\n    }\n  }, \"S\"))))), \" and a word \", mdx(\"span\", {\n    parentName: \"li\",\n    \"className\": \"math math-inline\"\n  }, mdx(\"span\", {\n    parentName: \"span\",\n    \"className\": \"katex\"\n  }, mdx(\"span\", {\n    parentName: \"span\",\n    \"className\": \"katex-mathml\"\n  }, mdx(\"math\", {\n    parentName: \"span\",\n    \"xmlns\": \"http://www.w3.org/1998/Math/MathML\"\n  }, mdx(\"semantics\", {\n    parentName: \"math\"\n  }, mdx(\"mrow\", {\n    parentName: \"semantics\"\n  }, mdx(\"msub\", {\n    parentName: \"mrow\"\n  }, mdx(\"mi\", {\n    parentName: \"msub\"\n  }, \"g\"), mdx(\"mn\", {\n    parentName: \"msub\"\n  }, \"1\")), mdx(\"msub\", {\n    parentName: \"mrow\"\n  }, mdx(\"mi\", {\n    parentName: \"msub\"\n  }, \"g\"), mdx(\"mn\", {\n    parentName: \"msub\"\n  }, \"2\")), mdx(\"mi\", {\n    parentName: \"mrow\",\n    \"mathvariant\": \"normal\"\n  }, \".\"), mdx(\"mi\", {\n    parentName: \"mrow\",\n    \"mathvariant\": \"normal\"\n  }, \".\"), mdx(\"mi\", {\n    parentName: \"mrow\",\n    \"mathvariant\": \"normal\"\n  }, \".\"), mdx(\"msub\", {\n    parentName: \"mrow\"\n  }, mdx(\"mi\", {\n    parentName: \"msub\"\n  }, \"g\"), mdx(\"mi\", {\n    parentName: \"msub\"\n  }, \"k\"))), mdx(\"annotation\", {\n    parentName: \"semantics\",\n    \"encoding\": \"application/x-tex\"\n  }, \"g_1g_2...g_k\")))), mdx(\"span\", {\n    parentName: \"span\",\n    \"className\": \"katex-html\",\n    \"aria-hidden\": \"true\"\n  }, mdx(\"span\", {\n    parentName: \"span\",\n    \"className\": \"base\"\n  }, mdx(\"span\", {\n    parentName: \"span\",\n    \"className\": \"strut\",\n    \"style\": {\n      \"height\": \"0.625em\",\n      \"verticalAlign\": \"-0.19444em\"\n    }\n  }), mdx(\"span\", {\n    parentName: \"span\",\n    \"className\": \"mord\"\n  }, mdx(\"span\", {\n    parentName: \"span\",\n    \"className\": \"mord mathnormal\",\n    \"style\": {\n      \"marginRight\": \"0.03588em\"\n    }\n  }, \"g\"), mdx(\"span\", {\n    parentName: \"span\",\n    \"className\": \"msupsub\"\n  }, mdx(\"span\", {\n    parentName: \"span\",\n    \"className\": \"vlist-t vlist-t2\"\n  }, mdx(\"span\", {\n    parentName: \"span\",\n    \"className\": \"vlist-r\"\n  }, mdx(\"span\", {\n    parentName: \"span\",\n    \"className\": \"vlist\",\n    \"style\": {\n      \"height\": \"0.30110799999999993em\"\n    }\n  }, mdx(\"span\", {\n    parentName: \"span\",\n    \"style\": {\n      \"top\": \"-2.5500000000000003em\",\n      \"marginLeft\": \"-0.03588em\",\n      \"marginRight\": \"0.05em\"\n    }\n  }, mdx(\"span\", {\n    parentName: \"span\",\n    \"className\": \"pstrut\",\n    \"style\": {\n      \"height\": \"2.7em\"\n    }\n  }), mdx(\"span\", {\n    parentName: \"span\",\n    \"className\": \"sizing reset-size6 size3 mtight\"\n  }, mdx(\"span\", {\n    parentName: \"span\",\n    \"className\": \"mord mtight\"\n  }, \"1\")))), mdx(\"span\", {\n    parentName: \"span\",\n    \"className\": \"vlist-s\"\n  }, \"\\u200B\")), mdx(\"span\", {\n    parentName: \"span\",\n    \"className\": \"vlist-r\"\n  }, mdx(\"span\", {\n    parentName: \"span\",\n    \"className\": \"vlist\",\n    \"style\": {\n      \"height\": \"0.15em\"\n    }\n  }, mdx(\"span\", {\n    parentName: \"span\"\n  })))))), mdx(\"span\", {\n    parentName: \"span\",\n    \"className\": \"mord\"\n  }, mdx(\"span\", {\n    parentName: \"span\",\n    \"className\": \"mord mathnormal\",\n    \"style\": {\n      \"marginRight\": \"0.03588em\"\n    }\n  }, \"g\"), mdx(\"span\", {\n    parentName: \"span\",\n    \"className\": \"msupsub\"\n  }, mdx(\"span\", {\n    parentName: \"span\",\n    \"className\": \"vlist-t vlist-t2\"\n  }, mdx(\"span\", {\n    parentName: \"span\",\n    \"className\": \"vlist-r\"\n  }, mdx(\"span\", {\n    parentName: \"span\",\n    \"className\": \"vlist\",\n    \"style\": {\n      \"height\": \"0.30110799999999993em\"\n    }\n  }, mdx(\"span\", {\n    parentName: \"span\",\n    \"style\": {\n      \"top\": \"-2.5500000000000003em\",\n      \"marginLeft\": \"-0.03588em\",\n      \"marginRight\": \"0.05em\"\n    }\n  }, mdx(\"span\", {\n    parentName: \"span\",\n    \"className\": \"pstrut\",\n    \"style\": {\n      \"height\": \"2.7em\"\n    }\n  }), mdx(\"span\", {\n    parentName: \"span\",\n    \"className\": \"sizing reset-size6 size3 mtight\"\n  }, mdx(\"span\", {\n    parentName: \"span\",\n    \"className\": \"mord mtight\"\n  }, \"2\")))), mdx(\"span\", {\n    parentName: \"span\",\n    \"className\": \"vlist-s\"\n  }, \"\\u200B\")), mdx(\"span\", {\n    parentName: \"span\",\n    \"className\": \"vlist-r\"\n  }, mdx(\"span\", {\n    parentName: \"span\",\n    \"className\": \"vlist\",\n    \"style\": {\n      \"height\": \"0.15em\"\n    }\n  }, mdx(\"span\", {\n    parentName: \"span\"\n  })))))), mdx(\"span\", {\n    parentName: \"span\",\n    \"className\": \"mord\"\n  }, \".\"), mdx(\"span\", {\n    parentName: \"span\",\n    \"className\": \"mord\"\n  }, \".\"), mdx(\"span\", {\n    parentName: \"span\",\n    \"className\": \"mord\"\n  }, \".\"), mdx(\"span\", {\n    parentName: \"span\",\n    \"className\": \"mord\"\n  }, mdx(\"span\", {\n    parentName: \"span\",\n    \"className\": \"mord mathnormal\",\n    \"style\": {\n      \"marginRight\": \"0.03588em\"\n    }\n  }, \"g\"), mdx(\"span\", {\n    parentName: \"span\",\n    \"className\": \"msupsub\"\n  }, mdx(\"span\", {\n    parentName: \"span\",\n    \"className\": \"vlist-t vlist-t2\"\n  }, mdx(\"span\", {\n    parentName: \"span\",\n    \"className\": \"vlist-r\"\n  }, mdx(\"span\", {\n    parentName: \"span\",\n    \"className\": \"vlist\",\n    \"style\": {\n      \"height\": \"0.33610799999999996em\"\n    }\n  }, mdx(\"span\", {\n    parentName: \"span\",\n    \"style\": {\n      \"top\": \"-2.5500000000000003em\",\n      \"marginLeft\": \"-0.03588em\",\n      \"marginRight\": \"0.05em\"\n    }\n  }, mdx(\"span\", {\n    parentName: \"span\",\n    \"className\": \"pstrut\",\n    \"style\": {\n      \"height\": \"2.7em\"\n    }\n  }), mdx(\"span\", {\n    parentName: \"span\",\n    \"className\": \"sizing reset-size6 size3 mtight\"\n  }, mdx(\"span\", {\n    parentName: \"span\",\n    \"className\": \"mord mathnormal mtight\",\n    \"style\": {\n      \"marginRight\": \"0.03148em\"\n    }\n  }, \"k\")))), mdx(\"span\", {\n    parentName: \"span\",\n    \"className\": \"vlist-s\"\n  }, \"\\u200B\")), mdx(\"span\", {\n    parentName: \"span\",\n    \"className\": \"vlist-r\"\n  }, mdx(\"span\", {\n    parentName: \"span\",\n    \"className\": \"vlist\",\n    \"style\": {\n      \"height\": \"0.15em\"\n    }\n  }, mdx(\"span\", {\n    parentName: \"span\"\n  })))))))))), \" with \", mdx(\"span\", {\n    parentName: \"li\",\n    \"className\": \"math math-inline\"\n  }, mdx(\"span\", {\n    parentName: \"span\",\n    \"className\": \"katex\"\n  }, mdx(\"span\", {\n    parentName: \"span\",\n    \"className\": \"katex-mathml\"\n  }, mdx(\"math\", {\n    parentName: \"span\",\n    \"xmlns\": \"http://www.w3.org/1998/Math/MathML\"\n  }, mdx(\"semantics\", {\n    parentName: \"math\"\n  }, mdx(\"mrow\", {\n    parentName: \"semantics\"\n  }, mdx(\"msub\", {\n    parentName: \"mrow\"\n  }, mdx(\"mi\", {\n    parentName: \"msub\"\n  }, \"g\"), mdx(\"mi\", {\n    parentName: \"msub\"\n  }, \"i\")), mdx(\"mo\", {\n    parentName: \"mrow\"\n  }, \"\\u2208\"), mdx(\"mi\", {\n    parentName: \"mrow\"\n  }, \"X\")), mdx(\"annotation\", {\n    parentName: \"semantics\",\n    \"encoding\": \"application/x-tex\"\n  }, \"g_i \\\\in X\")))), mdx(\"span\", {\n    parentName: \"span\",\n    \"className\": \"katex-html\",\n    \"aria-hidden\": \"true\"\n  }, mdx(\"span\", {\n    parentName: \"span\",\n    \"className\": \"base\"\n  }, mdx(\"span\", {\n    parentName: \"span\",\n    \"className\": \"strut\",\n    \"style\": {\n      \"height\": \"0.7335400000000001em\",\n      \"verticalAlign\": \"-0.19444em\"\n    }\n  }), mdx(\"span\", {\n    parentName: \"span\",\n    \"className\": \"mord\"\n  }, mdx(\"span\", {\n    parentName: \"span\",\n    \"className\": \"mord mathnormal\",\n    \"style\": {\n      \"marginRight\": \"0.03588em\"\n    }\n  }, \"g\"), mdx(\"span\", {\n    parentName: \"span\",\n    \"className\": \"msupsub\"\n  }, mdx(\"span\", {\n    parentName: \"span\",\n    \"className\": \"vlist-t vlist-t2\"\n  }, mdx(\"span\", {\n    parentName: \"span\",\n    \"className\": \"vlist-r\"\n  }, mdx(\"span\", {\n    parentName: \"span\",\n    \"className\": \"vlist\",\n    \"style\": {\n      \"height\": \"0.31166399999999994em\"\n    }\n  }, mdx(\"span\", {\n    parentName: \"span\",\n    \"style\": {\n      \"top\": \"-2.5500000000000003em\",\n      \"marginLeft\": \"-0.03588em\",\n      \"marginRight\": \"0.05em\"\n    }\n  }, mdx(\"span\", {\n    parentName: \"span\",\n    \"className\": \"pstrut\",\n    \"style\": {\n      \"height\": \"2.7em\"\n    }\n  }), mdx(\"span\", {\n    parentName: \"span\",\n    \"className\": \"sizing reset-size6 size3 mtight\"\n  }, mdx(\"span\", {\n    parentName: \"span\",\n    \"className\": \"mord mathnormal mtight\"\n  }, \"i\")))), mdx(\"span\", {\n    parentName: \"span\",\n    \"className\": \"vlist-s\"\n  }, \"\\u200B\")), mdx(\"span\", {\n    parentName: \"span\",\n    \"className\": \"vlist-r\"\n  }, mdx(\"span\", {\n    parentName: \"span\",\n    \"className\": \"vlist\",\n    \"style\": {\n      \"height\": \"0.15em\"\n    }\n  }, mdx(\"span\", {\n    parentName: \"span\"\n  })))))), mdx(\"span\", {\n    parentName: \"span\",\n    \"className\": \"mspace\",\n    \"style\": {\n      \"marginRight\": \"0.2777777777777778em\"\n    }\n  }), mdx(\"span\", {\n    parentName: \"span\",\n    \"className\": \"mrel\"\n  }, \"\\u2208\"), mdx(\"span\", {\n    parentName: \"span\",\n    \"className\": \"mspace\",\n    \"style\": {\n      \"marginRight\": \"0.2777777777777778em\"\n    }\n  })), mdx(\"span\", {\n    parentName: \"span\",\n    \"className\": \"base\"\n  }, mdx(\"span\", {\n    parentName: \"span\",\n    \"className\": \"strut\",\n    \"style\": {\n      \"height\": \"0.68333em\",\n      \"verticalAlign\": \"0em\"\n    }\n  }), mdx(\"span\", {\n    parentName: \"span\",\n    \"className\": \"mord mathnormal\",\n    \"style\": {\n      \"marginRight\": \"0.07847em\"\n    }\n  }, \"X\"))))), \" or \", mdx(\"span\", {\n    parentName: \"li\",\n    \"className\": \"math math-inline\"\n  }, mdx(\"span\", {\n    parentName: \"span\",\n    \"className\": \"katex\"\n  }, mdx(\"span\", {\n    parentName: \"span\",\n    \"className\": \"katex-mathml\"\n  }, mdx(\"math\", {\n    parentName: \"span\",\n    \"xmlns\": \"http://www.w3.org/1998/Math/MathML\"\n  }, mdx(\"semantics\", {\n    parentName: \"math\"\n  }, mdx(\"mrow\", {\n    parentName: \"semantics\"\n  }, mdx(\"msubsup\", {\n    parentName: \"mrow\"\n  }, mdx(\"mi\", {\n    parentName: \"msubsup\"\n  }, \"g\"), mdx(\"mi\", {\n    parentName: \"msubsup\"\n  }, \"i\"), mdx(\"mrow\", {\n    parentName: \"msubsup\"\n  }, mdx(\"mo\", {\n    parentName: \"mrow\"\n  }, \"\\u2212\"), mdx(\"mn\", {\n    parentName: \"mrow\"\n  }, \"1\"))), mdx(\"mo\", {\n    parentName: \"mrow\"\n  }, \"\\u2208\"), mdx(\"mi\", {\n    parentName: \"mrow\"\n  }, \"X\")), mdx(\"annotation\", {\n    parentName: \"semantics\",\n    \"encoding\": \"application/x-tex\"\n  }, \"g_i^{-1} \\\\in X\")))), mdx(\"span\", {\n    parentName: \"span\",\n    \"className\": \"katex-html\",\n    \"aria-hidden\": \"true\"\n  }, mdx(\"span\", {\n    parentName: \"span\",\n    \"className\": \"base\"\n  }, mdx(\"span\", {\n    parentName: \"span\",\n    \"className\": \"strut\",\n    \"style\": {\n      \"height\": \"1.131103em\",\n      \"verticalAlign\": \"-0.276864em\"\n    }\n  }), mdx(\"span\", {\n    parentName: \"span\",\n    \"className\": \"mord\"\n  }, mdx(\"span\", {\n    parentName: \"span\",\n    \"className\": \"mord mathnormal\",\n    \"style\": {\n      \"marginRight\": \"0.03588em\"\n    }\n  }, \"g\"), mdx(\"span\", {\n    parentName: \"span\",\n    \"className\": \"msupsub\"\n  }, mdx(\"span\", {\n    parentName: \"span\",\n    \"className\": \"vlist-t vlist-t2\"\n  }, mdx(\"span\", {\n    parentName: \"span\",\n    \"className\": \"vlist-r\"\n  }, mdx(\"span\", {\n    parentName: \"span\",\n    \"className\": \"vlist\",\n    \"style\": {\n      \"height\": \"0.854239em\"\n    }\n  }, mdx(\"span\", {\n    parentName: \"span\",\n    \"style\": {\n      \"top\": \"-2.4231360000000004em\",\n      \"marginLeft\": \"-0.03588em\",\n      \"marginRight\": \"0.05em\"\n    }\n  }, mdx(\"span\", {\n    parentName: \"span\",\n    \"className\": \"pstrut\",\n    \"style\": {\n      \"height\": \"2.7em\"\n    }\n  }), mdx(\"span\", {\n    parentName: \"span\",\n    \"className\": \"sizing reset-size6 size3 mtight\"\n  }, mdx(\"span\", {\n    parentName: \"span\",\n    \"className\": \"mord mathnormal mtight\"\n  }, \"i\"))), mdx(\"span\", {\n    parentName: \"span\",\n    \"style\": {\n      \"top\": \"-3.1031310000000003em\",\n      \"marginRight\": \"0.05em\"\n    }\n  }, mdx(\"span\", {\n    parentName: \"span\",\n    \"className\": \"pstrut\",\n    \"style\": {\n      \"height\": \"2.7em\"\n    }\n  }), mdx(\"span\", {\n    parentName: \"span\",\n    \"className\": \"sizing reset-size6 size3 mtight\"\n  }, mdx(\"span\", {\n    parentName: \"span\",\n    \"className\": \"mord mtight\"\n  }, mdx(\"span\", {\n    parentName: \"span\",\n    \"className\": \"mord mtight\"\n  }, \"\\u2212\"), mdx(\"span\", {\n    parentName: \"span\",\n    \"className\": \"mord mtight\"\n  }, \"1\"))))), mdx(\"span\", {\n    parentName: \"span\",\n    \"className\": \"vlist-s\"\n  }, \"\\u200B\")), mdx(\"span\", {\n    parentName: \"span\",\n    \"className\": \"vlist-r\"\n  }, mdx(\"span\", {\n    parentName: \"span\",\n    \"className\": \"vlist\",\n    \"style\": {\n      \"height\": \"0.276864em\"\n    }\n  }, mdx(\"span\", {\n    parentName: \"span\"\n  })))))), mdx(\"span\", {\n    parentName: \"span\",\n    \"className\": \"mspace\",\n    \"style\": {\n      \"marginRight\": \"0.2777777777777778em\"\n    }\n  }), mdx(\"span\", {\n    parentName: \"span\",\n    \"className\": \"mrel\"\n  }, \"\\u2208\"), mdx(\"span\", {\n    parentName: \"span\",\n    \"className\": \"mspace\",\n    \"style\": {\n      \"marginRight\": \"0.2777777777777778em\"\n    }\n  })), mdx(\"span\", {\n    parentName: \"span\",\n    \"className\": \"base\"\n  }, mdx(\"span\", {\n    parentName: \"span\",\n    \"className\": \"strut\",\n    \"style\": {\n      \"height\": \"0.68333em\",\n      \"verticalAlign\": \"0em\"\n    }\n  }), mdx(\"span\", {\n    parentName: \"span\",\n    \"className\": \"mord mathnormal\",\n    \"style\": {\n      \"marginRight\": \"0.07847em\"\n    }\n  }, \"X\"))))), \" defines a path in \", mdx(\"span\", {\n    parentName: \"li\",\n    \"className\": \"math math-inline\"\n  }, mdx(\"span\", {\n    parentName: \"span\",\n    \"className\": \"katex\"\n  }, mdx(\"span\", {\n    parentName: \"span\",\n    \"className\": \"katex-mathml\"\n  }, mdx(\"math\", {\n    parentName: \"span\",\n    \"xmlns\": \"http://www.w3.org/1998/Math/MathML\"\n  }, mdx(\"semantics\", {\n    parentName: \"math\"\n  }, mdx(\"mrow\", {\n    parentName: \"semantics\"\n  }, mdx(\"mi\", {\n    parentName: \"mrow\",\n    \"mathvariant\": \"normal\"\n  }, \"\\u0393\")), mdx(\"annotation\", {\n    parentName: \"semantics\",\n    \"encoding\": \"application/x-tex\"\n  }, \"\\\\Gamma\")))), mdx(\"span\", {\n    parentName: \"span\",\n    \"className\": \"katex-html\",\n    \"aria-hidden\": \"true\"\n  }, mdx(\"span\", {\n    parentName: \"span\",\n    \"className\": \"base\"\n  }, mdx(\"span\", {\n    parentName: \"span\",\n    \"className\": \"strut\",\n    \"style\": {\n      \"height\": \"0.68333em\",\n      \"verticalAlign\": \"0em\"\n    }\n  }), mdx(\"span\", {\n    parentName: \"span\",\n    \"className\": \"mord\"\n  }, \"\\u0393\")))))), mdx(\"li\", {\n    parentName: \"ul\"\n  }, \"Every word in \", mdx(\"span\", {\n    parentName: \"li\",\n    \"className\": \"math math-inline\"\n  }, mdx(\"span\", {\n    parentName: \"span\",\n    \"className\": \"katex\"\n  }, mdx(\"span\", {\n    parentName: \"span\",\n    \"className\": \"katex-mathml\"\n  }, mdx(\"math\", {\n    parentName: \"span\",\n    \"xmlns\": \"http://www.w3.org/1998/Math/MathML\"\n  }, mdx(\"semantics\", {\n    parentName: \"math\"\n  }, mdx(\"mrow\", {\n    parentName: \"semantics\"\n  }, mdx(\"mi\", {\n    parentName: \"mrow\"\n  }, \"R\")), mdx(\"annotation\", {\n    parentName: \"semantics\",\n    \"encoding\": \"application/x-tex\"\n  }, \"R\")))), mdx(\"span\", {\n    parentName: \"span\",\n    \"className\": \"katex-html\",\n    \"aria-hidden\": \"true\"\n  }, mdx(\"span\", {\n    parentName: \"span\",\n    \"className\": \"base\"\n  }, mdx(\"span\", {\n    parentName: \"span\",\n    \"className\": \"strut\",\n    \"style\": {\n      \"height\": \"0.68333em\",\n      \"verticalAlign\": \"0em\"\n    }\n  }), mdx(\"span\", {\n    parentName: \"span\",\n    \"className\": \"mord mathnormal\",\n    \"style\": {\n      \"marginRight\": \"0.00773em\"\n    }\n  }, \"R\"))))), \" corresponds with a loop in \", mdx(\"span\", {\n    parentName: \"li\",\n    \"className\": \"math math-inline\"\n  }, mdx(\"span\", {\n    parentName: \"span\",\n    \"className\": \"katex\"\n  }, mdx(\"span\", {\n    parentName: \"span\",\n    \"className\": \"katex-mathml\"\n  }, mdx(\"math\", {\n    parentName: \"span\",\n    \"xmlns\": \"http://www.w3.org/1998/Math/MathML\"\n  }, mdx(\"semantics\", {\n    parentName: \"math\"\n  }, mdx(\"mrow\", {\n    parentName: \"semantics\"\n  }, mdx(\"mi\", {\n    parentName: \"mrow\",\n    \"mathvariant\": \"normal\"\n  }, \"\\u0393\")), mdx(\"annotation\", {\n    parentName: \"semantics\",\n    \"encoding\": \"application/x-tex\"\n  }, \"\\\\Gamma\")))), mdx(\"span\", {\n    parentName: \"span\",\n    \"className\": \"katex-html\",\n    \"aria-hidden\": \"true\"\n  }, mdx(\"span\", {\n    parentName: \"span\",\n    \"className\": \"base\"\n  }, mdx(\"span\", {\n    parentName: \"span\",\n    \"className\": \"strut\",\n    \"style\": {\n      \"height\": \"0.68333em\",\n      \"verticalAlign\": \"0em\"\n    }\n  }), mdx(\"span\", {\n    parentName: \"span\",\n    \"className\": \"mord\"\n  }, \"\\u0393\"))))))), mdx(\"h3\", {\n    \"id\": \"an-example\",\n    \"style\": {\n      \"position\": \"relative\"\n    }\n  }, mdx(\"a\", {\n    parentName: \"h3\",\n    \"href\": \"#an-example\",\n    \"aria-label\": \"an example permalink\",\n    \"className\": \"anchor before\"\n  }, mdx(\"svg\", {\n    parentName: \"a\",\n    \"aria-hidden\": \"true\",\n    \"focusable\": \"false\",\n    \"height\": \"16\",\n    \"version\": \"1.1\",\n    \"viewBox\": \"0 0 16 16\",\n    \"width\": \"16\"\n  }, mdx(\"path\", {\n    parentName: \"svg\",\n    \"fillRule\": \"evenodd\",\n    \"d\": \"M4 9h1v1H4c-1.5 0-3-1.69-3-3.5S2.55 3 4 3h4c1.45 0 3 1.69 3 3.5 0 1.41-.91 2.72-2 3.25V8.59c.58-.45 1-1.27 1-2.09C10 5.22 8.98 4 8 4H4c-.98 0-2 1.22-2 2.5S3 9 4 9zm9-3h-1v1h1c1 0 2 1.22 2 2.5S13.98 12 13 12H9c-.98 0-2-1.22-2-2.5 0-.83.42-1.64 1-2.09V6.25c-1.09.53-2 1.84-2 3.25C6 11.31 7.55 13 9 13h4c1.45 0 3-1.69 3-3.5S14.5 6 13 6z\"\n  }))), \"An Example\"), mdx(\"p\", null, \"Let \", mdx(\"span\", {\n    parentName: \"p\",\n    \"className\": \"math math-inline\"\n  }, mdx(\"span\", {\n    parentName: \"span\",\n    \"className\": \"katex\"\n  }, mdx(\"span\", {\n    parentName: \"span\",\n    \"className\": \"katex-mathml\"\n  }, mdx(\"math\", {\n    parentName: \"span\",\n    \"xmlns\": \"http://www.w3.org/1998/Math/MathML\"\n  }, mdx(\"semantics\", {\n    parentName: \"math\"\n  }, mdx(\"mrow\", {\n    parentName: \"semantics\"\n  }, mdx(\"mi\", {\n    parentName: \"mrow\"\n  }, \"G\"), mdx(\"mo\", {\n    parentName: \"mrow\"\n  }, \"=\"), mdx(\"mo\", {\n    parentName: \"mrow\",\n    \"stretchy\": \"false\"\n  }, \"\\u27E8\"), mdx(\"mi\", {\n    parentName: \"mrow\"\n  }, \"r\"), mdx(\"mo\", {\n    parentName: \"mrow\",\n    \"separator\": \"true\"\n  }, \",\"), mdx(\"mi\", {\n    parentName: \"mrow\"\n  }, \"s\"), mdx(\"mo\", {\n    parentName: \"mrow\"\n  }, \"\\u2223\"), mdx(\"msup\", {\n    parentName: \"mrow\"\n  }, mdx(\"mi\", {\n    parentName: \"msup\"\n  }, \"r\"), mdx(\"mn\", {\n    parentName: \"msup\"\n  }, \"3\")), mdx(\"mo\", {\n    parentName: \"mrow\",\n    \"separator\": \"true\"\n  }, \",\"), mdx(\"msup\", {\n    parentName: \"mrow\"\n  }, mdx(\"mi\", {\n    parentName: \"msup\"\n  }, \"s\"), mdx(\"mn\", {\n    parentName: \"msup\"\n  }, \"2\")), mdx(\"mo\", {\n    parentName: \"mrow\",\n    \"separator\": \"true\"\n  }, \",\"), mdx(\"mo\", {\n    parentName: \"mrow\",\n    \"stretchy\": \"false\"\n  }, \"(\"), mdx(\"mi\", {\n    parentName: \"mrow\"\n  }, \"r\"), mdx(\"mi\", {\n    parentName: \"mrow\"\n  }, \"s\"), mdx(\"msup\", {\n    parentName: \"mrow\"\n  }, mdx(\"mo\", {\n    parentName: \"msup\",\n    \"stretchy\": \"false\"\n  }, \")\"), mdx(\"mn\", {\n    parentName: \"msup\"\n  }, \"2\")), mdx(\"mo\", {\n    parentName: \"mrow\",\n    \"stretchy\": \"false\"\n  }, \"\\u27E9\")), mdx(\"annotation\", {\n    parentName: \"semantics\",\n    \"encoding\": \"application/x-tex\"\n  }, \"G = \\\\langle r, s \\\\mid r^3, s^2, (rs)^2 \\\\rangle\")))), mdx(\"span\", {\n    parentName: \"span\",\n    \"className\": \"katex-html\",\n    \"aria-hidden\": \"true\"\n  }, mdx(\"span\", {\n    parentName: \"span\",\n    \"className\": \"base\"\n  }, mdx(\"span\", {\n    parentName: \"span\",\n    \"className\": \"strut\",\n    \"style\": {\n      \"height\": \"0.68333em\",\n      \"verticalAlign\": \"0em\"\n    }\n  }), mdx(\"span\", {\n    parentName: \"span\",\n    \"className\": \"mord mathnormal\"\n  }, \"G\"), mdx(\"span\", {\n    parentName: \"span\",\n    \"className\": \"mspace\",\n    \"style\": {\n      \"marginRight\": \"0.2777777777777778em\"\n    }\n  }), mdx(\"span\", {\n    parentName: \"span\",\n    \"className\": \"mrel\"\n  }, \"=\"), mdx(\"span\", {\n    parentName: \"span\",\n    \"className\": \"mspace\",\n    \"style\": {\n      \"marginRight\": \"0.2777777777777778em\"\n    }\n  })), mdx(\"span\", {\n    parentName: \"span\",\n    \"className\": \"base\"\n  }, mdx(\"span\", {\n    parentName: \"span\",\n    \"className\": \"strut\",\n    \"style\": {\n      \"height\": \"1em\",\n      \"verticalAlign\": \"-0.25em\"\n    }\n  }), mdx(\"span\", {\n    parentName: \"span\",\n    \"className\": \"mopen\"\n  }, \"\\u27E8\"), mdx(\"span\", {\n    parentName: \"span\",\n    \"className\": \"mord mathnormal\",\n    \"style\": {\n      \"marginRight\": \"0.02778em\"\n    }\n  }, \"r\"), mdx(\"span\", {\n    parentName: \"span\",\n    \"className\": \"mpunct\"\n  }, \",\"), mdx(\"span\", {\n    parentName: \"span\",\n    \"className\": \"mspace\",\n    \"style\": {\n      \"marginRight\": \"0.16666666666666666em\"\n    }\n  }), mdx(\"span\", {\n    parentName: \"span\",\n    \"className\": \"mord mathnormal\"\n  }, \"s\"), mdx(\"span\", {\n    parentName: \"span\",\n    \"className\": \"mspace\",\n    \"style\": {\n      \"marginRight\": \"0.2777777777777778em\"\n    }\n  }), mdx(\"span\", {\n    parentName: \"span\",\n    \"className\": \"mrel\"\n  }, \"\\u2223\"), mdx(\"span\", {\n    parentName: \"span\",\n    \"className\": \"mspace\",\n    \"style\": {\n      \"marginRight\": \"0.2777777777777778em\"\n    }\n  })), mdx(\"span\", {\n    parentName: \"span\",\n    \"className\": \"base\"\n  }, mdx(\"span\", {\n    parentName: \"span\",\n    \"className\": \"strut\",\n    \"style\": {\n      \"height\": \"1.064108em\",\n      \"verticalAlign\": \"-0.25em\"\n    }\n  }), mdx(\"span\", {\n    parentName: \"span\",\n    \"className\": \"mord\"\n  }, mdx(\"span\", {\n    parentName: \"span\",\n    \"className\": \"mord mathnormal\",\n    \"style\": {\n      \"marginRight\": \"0.02778em\"\n    }\n  }, \"r\"), mdx(\"span\", {\n    parentName: \"span\",\n    \"className\": \"msupsub\"\n  }, mdx(\"span\", {\n    parentName: \"span\",\n    \"className\": \"vlist-t\"\n  }, mdx(\"span\", {\n    parentName: \"span\",\n    \"className\": \"vlist-r\"\n  }, mdx(\"span\", {\n    parentName: \"span\",\n    \"className\": \"vlist\",\n    \"style\": {\n      \"height\": \"0.8141079999999999em\"\n    }\n  }, mdx(\"span\", {\n    parentName: \"span\",\n    \"style\": {\n      \"top\": \"-3.063em\",\n      \"marginRight\": \"0.05em\"\n    }\n  }, mdx(\"span\", {\n    parentName: \"span\",\n    \"className\": \"pstrut\",\n    \"style\": {\n      \"height\": \"2.7em\"\n    }\n  }), mdx(\"span\", {\n    parentName: \"span\",\n    \"className\": \"sizing reset-size6 size3 mtight\"\n  }, mdx(\"span\", {\n    parentName: \"span\",\n    \"className\": \"mord mtight\"\n  }, \"3\")))))))), mdx(\"span\", {\n    parentName: \"span\",\n    \"className\": \"mpunct\"\n  }, \",\"), mdx(\"span\", {\n    parentName: \"span\",\n    \"className\": \"mspace\",\n    \"style\": {\n      \"marginRight\": \"0.16666666666666666em\"\n    }\n  }), mdx(\"span\", {\n    parentName: \"span\",\n    \"className\": \"mord\"\n  }, mdx(\"span\", {\n    parentName: \"span\",\n    \"className\": \"mord mathnormal\"\n  }, \"s\"), mdx(\"span\", {\n    parentName: \"span\",\n    \"className\": \"msupsub\"\n  }, mdx(\"span\", {\n    parentName: \"span\",\n    \"className\": \"vlist-t\"\n  }, mdx(\"span\", {\n    parentName: \"span\",\n    \"className\": \"vlist-r\"\n  }, mdx(\"span\", {\n    parentName: \"span\",\n    \"className\": \"vlist\",\n    \"style\": {\n      \"height\": \"0.8141079999999999em\"\n    }\n  }, mdx(\"span\", {\n    parentName: \"span\",\n    \"style\": {\n      \"top\": \"-3.063em\",\n      \"marginRight\": \"0.05em\"\n    }\n  }, mdx(\"span\", {\n    parentName: \"span\",\n    \"className\": \"pstrut\",\n    \"style\": {\n      \"height\": \"2.7em\"\n    }\n  }), mdx(\"span\", {\n    parentName: \"span\",\n    \"className\": \"sizing reset-size6 size3 mtight\"\n  }, mdx(\"span\", {\n    parentName: \"span\",\n    \"className\": \"mord mtight\"\n  }, \"2\")))))))), mdx(\"span\", {\n    parentName: \"span\",\n    \"className\": \"mpunct\"\n  }, \",\"), mdx(\"span\", {\n    parentName: \"span\",\n    \"className\": \"mspace\",\n    \"style\": {\n      \"marginRight\": \"0.16666666666666666em\"\n    }\n  }), mdx(\"span\", {\n    parentName: \"span\",\n    \"className\": \"mopen\"\n  }, \"(\"), mdx(\"span\", {\n    parentName: \"span\",\n    \"className\": \"mord mathnormal\",\n    \"style\": {\n      \"marginRight\": \"0.02778em\"\n    }\n  }, \"r\"), mdx(\"span\", {\n    parentName: \"span\",\n    \"className\": \"mord mathnormal\"\n  }, \"s\"), mdx(\"span\", {\n    parentName: \"span\",\n    \"className\": \"mclose\"\n  }, mdx(\"span\", {\n    parentName: \"span\",\n    \"className\": \"mclose\"\n  }, \")\"), mdx(\"span\", {\n    parentName: \"span\",\n    \"className\": \"msupsub\"\n  }, mdx(\"span\", {\n    parentName: \"span\",\n    \"className\": \"vlist-t\"\n  }, mdx(\"span\", {\n    parentName: \"span\",\n    \"className\": \"vlist-r\"\n  }, mdx(\"span\", {\n    parentName: \"span\",\n    \"className\": \"vlist\",\n    \"style\": {\n      \"height\": \"0.8141079999999999em\"\n    }\n  }, mdx(\"span\", {\n    parentName: \"span\",\n    \"style\": {\n      \"top\": \"-3.063em\",\n      \"marginRight\": \"0.05em\"\n    }\n  }, mdx(\"span\", {\n    parentName: \"span\",\n    \"className\": \"pstrut\",\n    \"style\": {\n      \"height\": \"2.7em\"\n    }\n  }), mdx(\"span\", {\n    parentName: \"span\",\n    \"className\": \"sizing reset-size6 size3 mtight\"\n  }, mdx(\"span\", {\n    parentName: \"span\",\n    \"className\": \"mord mtight\"\n  }, \"2\")))))))), mdx(\"span\", {\n    parentName: \"span\",\n    \"className\": \"mclose\"\n  }, \"\\u27E9\"))))), \". That is, \", mdx(\"span\", {\n    parentName: \"p\",\n    \"className\": \"math math-inline\"\n  }, mdx(\"span\", {\n    parentName: \"span\",\n    \"className\": \"katex\"\n  }, mdx(\"span\", {\n    parentName: \"span\",\n    \"className\": \"katex-mathml\"\n  }, mdx(\"math\", {\n    parentName: \"span\",\n    \"xmlns\": \"http://www.w3.org/1998/Math/MathML\"\n  }, mdx(\"semantics\", {\n    parentName: \"math\"\n  }, mdx(\"mrow\", {\n    parentName: \"semantics\"\n  }, mdx(\"mi\", {\n    parentName: \"mrow\"\n  }, \"G\"), mdx(\"mo\", {\n    parentName: \"mrow\"\n  }, \"=\"), mdx(\"mo\", {\n    parentName: \"mrow\",\n    \"stretchy\": \"false\"\n  }, \"\\u27E8\"), mdx(\"mi\", {\n    parentName: \"mrow\"\n  }, \"X\"), mdx(\"mo\", {\n    parentName: \"mrow\"\n  }, \"\\u2223\"), mdx(\"mi\", {\n    parentName: \"mrow\"\n  }, \"R\"), mdx(\"mo\", {\n    parentName: \"mrow\",\n    \"stretchy\": \"false\"\n  }, \"\\u27E9\")), mdx(\"annotation\", {\n    parentName: \"semantics\",\n    \"encoding\": \"application/x-tex\"\n  }, \"G = \\\\langle X \\\\mid R \\\\rangle\")))), mdx(\"span\", {\n    parentName: \"span\",\n    \"className\": \"katex-html\",\n    \"aria-hidden\": \"true\"\n  }, mdx(\"span\", {\n    parentName: \"span\",\n    \"className\": \"base\"\n  }, mdx(\"span\", {\n    parentName: \"span\",\n    \"className\": \"strut\",\n    \"style\": {\n      \"height\": \"0.68333em\",\n      \"verticalAlign\": \"0em\"\n    }\n  }), mdx(\"span\", {\n    parentName: \"span\",\n    \"className\": \"mord mathnormal\"\n  }, \"G\"), mdx(\"span\", {\n    parentName: \"span\",\n    \"className\": \"mspace\",\n    \"style\": {\n      \"marginRight\": \"0.2777777777777778em\"\n    }\n  }), mdx(\"span\", {\n    parentName: \"span\",\n    \"className\": \"mrel\"\n  }, \"=\"), mdx(\"span\", {\n    parentName: \"span\",\n    \"className\": \"mspace\",\n    \"style\": {\n      \"marginRight\": \"0.2777777777777778em\"\n    }\n  })), mdx(\"span\", {\n    parentName: \"span\",\n    \"className\": \"base\"\n  }, mdx(\"span\", {\n    parentName: \"span\",\n    \"className\": \"strut\",\n    \"style\": {\n      \"height\": \"1em\",\n      \"verticalAlign\": \"-0.25em\"\n    }\n  }), mdx(\"span\", {\n    parentName: \"span\",\n    \"className\": \"mopen\"\n  }, \"\\u27E8\"), mdx(\"span\", {\n    parentName: \"span\",\n    \"className\": \"mord mathnormal\",\n    \"style\": {\n      \"marginRight\": \"0.07847em\"\n    }\n  }, \"X\"), mdx(\"span\", {\n    parentName: \"span\",\n    \"className\": \"mspace\",\n    \"style\": {\n      \"marginRight\": \"0.2777777777777778em\"\n    }\n  }), mdx(\"span\", {\n    parentName: \"span\",\n    \"className\": \"mrel\"\n  }, \"\\u2223\"), mdx(\"span\", {\n    parentName: \"span\",\n    \"className\": \"mspace\",\n    \"style\": {\n      \"marginRight\": \"0.2777777777777778em\"\n    }\n  })), mdx(\"span\", {\n    parentName: \"span\",\n    \"className\": \"base\"\n  }, mdx(\"span\", {\n    parentName: \"span\",\n    \"className\": \"strut\",\n    \"style\": {\n      \"height\": \"1em\",\n      \"verticalAlign\": \"-0.25em\"\n    }\n  }), mdx(\"span\", {\n    parentName: \"span\",\n    \"className\": \"mord mathnormal\",\n    \"style\": {\n      \"marginRight\": \"0.00773em\"\n    }\n  }, \"R\"), mdx(\"span\", {\n    parentName: \"span\",\n    \"className\": \"mclose\"\n  }, \"\\u27E9\"))))), \" with \", mdx(\"span\", {\n    parentName: \"p\",\n    \"className\": \"math math-inline\"\n  }, mdx(\"span\", {\n    parentName: \"span\",\n    \"className\": \"katex\"\n  }, mdx(\"span\", {\n    parentName: \"span\",\n    \"className\": \"katex-mathml\"\n  }, mdx(\"math\", {\n    parentName: \"span\",\n    \"xmlns\": \"http://www.w3.org/1998/Math/MathML\"\n  }, mdx(\"semantics\", {\n    parentName: \"math\"\n  }, mdx(\"mrow\", {\n    parentName: \"semantics\"\n  }, mdx(\"mi\", {\n    parentName: \"mrow\"\n  }, \"X\"), mdx(\"mo\", {\n    parentName: \"mrow\"\n  }, \"=\"), mdx(\"mo\", {\n    parentName: \"mrow\",\n    \"stretchy\": \"false\"\n  }, \"{\"), mdx(\"mi\", {\n    parentName: \"mrow\"\n  }, \"r\"), mdx(\"mo\", {\n    parentName: \"mrow\",\n    \"separator\": \"true\"\n  }, \",\"), mdx(\"mi\", {\n    parentName: \"mrow\"\n  }, \"s\"), mdx(\"mo\", {\n    parentName: \"mrow\",\n    \"stretchy\": \"false\"\n  }, \"}\")), mdx(\"annotation\", {\n    parentName: \"semantics\",\n    \"encoding\": \"application/x-tex\"\n  }, \"X = \\\\{r, s\\\\}\")))), mdx(\"span\", {\n    parentName: \"span\",\n    \"className\": \"katex-html\",\n    \"aria-hidden\": \"true\"\n  }, mdx(\"span\", {\n    parentName: \"span\",\n    \"className\": \"base\"\n  }, mdx(\"span\", {\n    parentName: \"span\",\n    \"className\": \"strut\",\n    \"style\": {\n      \"height\": \"0.68333em\",\n      \"verticalAlign\": \"0em\"\n    }\n  }), mdx(\"span\", {\n    parentName: \"span\",\n    \"className\": \"mord mathnormal\",\n    \"style\": {\n      \"marginRight\": \"0.07847em\"\n    }\n  }, \"X\"), mdx(\"span\", {\n    parentName: \"span\",\n    \"className\": \"mspace\",\n    \"style\": {\n      \"marginRight\": \"0.2777777777777778em\"\n    }\n  }), mdx(\"span\", {\n    parentName: \"span\",\n    \"className\": \"mrel\"\n  }, \"=\"), mdx(\"span\", {\n    parentName: \"span\",\n    \"className\": \"mspace\",\n    \"style\": {\n      \"marginRight\": \"0.2777777777777778em\"\n    }\n  })), mdx(\"span\", {\n    parentName: \"span\",\n    \"className\": \"base\"\n  }, mdx(\"span\", {\n    parentName: \"span\",\n    \"className\": \"strut\",\n    \"style\": {\n      \"height\": \"1em\",\n      \"verticalAlign\": \"-0.25em\"\n    }\n  }), mdx(\"span\", {\n    parentName: \"span\",\n    \"className\": \"mopen\"\n  }, \"{\"), mdx(\"span\", {\n    parentName: \"span\",\n    \"className\": \"mord mathnormal\",\n    \"style\": {\n      \"marginRight\": \"0.02778em\"\n    }\n  }, \"r\"), mdx(\"span\", {\n    parentName: \"span\",\n    \"className\": \"mpunct\"\n  }, \",\"), mdx(\"span\", {\n    parentName: \"span\",\n    \"className\": \"mspace\",\n    \"style\": {\n      \"marginRight\": \"0.16666666666666666em\"\n    }\n  }), mdx(\"span\", {\n    parentName: \"span\",\n    \"className\": \"mord mathnormal\"\n  }, \"s\"), mdx(\"span\", {\n    parentName: \"span\",\n    \"className\": \"mclose\"\n  }, \"}\"))))), \" and \", mdx(\"span\", {\n    parentName: \"p\",\n    \"className\": \"math math-inline\"\n  }, mdx(\"span\", {\n    parentName: \"span\",\n    \"className\": \"katex\"\n  }, mdx(\"span\", {\n    parentName: \"span\",\n    \"className\": \"katex-mathml\"\n  }, mdx(\"math\", {\n    parentName: \"span\",\n    \"xmlns\": \"http://www.w3.org/1998/Math/MathML\"\n  }, mdx(\"semantics\", {\n    parentName: \"math\"\n  }, mdx(\"mrow\", {\n    parentName: \"semantics\"\n  }, mdx(\"mi\", {\n    parentName: \"mrow\"\n  }, \"R\"), mdx(\"mo\", {\n    parentName: \"mrow\"\n  }, \"=\"), mdx(\"mo\", {\n    parentName: \"mrow\",\n    \"stretchy\": \"false\"\n  }, \"{\"), mdx(\"mi\", {\n    parentName: \"mrow\"\n  }, \"r\"), mdx(\"mi\", {\n    parentName: \"mrow\"\n  }, \"r\"), mdx(\"mi\", {\n    parentName: \"mrow\"\n  }, \"r\"), mdx(\"mo\", {\n    parentName: \"mrow\",\n    \"separator\": \"true\"\n  }, \",\"), mdx(\"mi\", {\n    parentName: \"mrow\"\n  }, \"s\"), mdx(\"mi\", {\n    parentName: \"mrow\"\n  }, \"s\"), mdx(\"mo\", {\n    parentName: \"mrow\",\n    \"separator\": \"true\"\n  }, \",\"), mdx(\"mi\", {\n    parentName: \"mrow\"\n  }, \"r\"), mdx(\"mi\", {\n    parentName: \"mrow\"\n  }, \"s\"), mdx(\"mi\", {\n    parentName: \"mrow\"\n  }, \"r\"), mdx(\"mi\", {\n    parentName: \"mrow\"\n  }, \"s\"), mdx(\"mo\", {\n    parentName: \"mrow\",\n    \"stretchy\": \"false\"\n  }, \"}\")), mdx(\"annotation\", {\n    parentName: \"semantics\",\n    \"encoding\": \"application/x-tex\"\n  }, \"R = \\\\{rrr, ss, rsrs\\\\}\")))), mdx(\"span\", {\n    parentName: \"span\",\n    \"className\": \"katex-html\",\n    \"aria-hidden\": \"true\"\n  }, mdx(\"span\", {\n    parentName: \"span\",\n    \"className\": \"base\"\n  }, mdx(\"span\", {\n    parentName: \"span\",\n    \"className\": \"strut\",\n    \"style\": {\n      \"height\": \"0.68333em\",\n      \"verticalAlign\": \"0em\"\n    }\n  }), mdx(\"span\", {\n    parentName: \"span\",\n    \"className\": \"mord mathnormal\",\n    \"style\": {\n      \"marginRight\": \"0.00773em\"\n    }\n  }, \"R\"), mdx(\"span\", {\n    parentName: \"span\",\n    \"className\": \"mspace\",\n    \"style\": {\n      \"marginRight\": \"0.2777777777777778em\"\n    }\n  }), mdx(\"span\", {\n    parentName: \"span\",\n    \"className\": \"mrel\"\n  }, \"=\"), mdx(\"span\", {\n    parentName: \"span\",\n    \"className\": \"mspace\",\n    \"style\": {\n      \"marginRight\": \"0.2777777777777778em\"\n    }\n  })), mdx(\"span\", {\n    parentName: \"span\",\n    \"className\": \"base\"\n  }, mdx(\"span\", {\n    parentName: \"span\",\n    \"className\": \"strut\",\n    \"style\": {\n      \"height\": \"1em\",\n      \"verticalAlign\": \"-0.25em\"\n    }\n  }), mdx(\"span\", {\n    parentName: \"span\",\n    \"className\": \"mopen\"\n  }, \"{\"), mdx(\"span\", {\n    parentName: \"span\",\n    \"className\": \"mord mathnormal\",\n    \"style\": {\n      \"marginRight\": \"0.02778em\"\n    }\n  }, \"r\"), mdx(\"span\", {\n    parentName: \"span\",\n    \"className\": \"mord mathnormal\",\n    \"style\": {\n      \"marginRight\": \"0.02778em\"\n    }\n  }, \"r\"), mdx(\"span\", {\n    parentName: \"span\",\n    \"className\": \"mord mathnormal\",\n    \"style\": {\n      \"marginRight\": \"0.02778em\"\n    }\n  }, \"r\"), mdx(\"span\", {\n    parentName: \"span\",\n    \"className\": \"mpunct\"\n  }, \",\"), mdx(\"span\", {\n    parentName: \"span\",\n    \"className\": \"mspace\",\n    \"style\": {\n      \"marginRight\": \"0.16666666666666666em\"\n    }\n  }), mdx(\"span\", {\n    parentName: \"span\",\n    \"className\": \"mord mathnormal\"\n  }, \"s\"), mdx(\"span\", {\n    parentName: \"span\",\n    \"className\": \"mord mathnormal\"\n  }, \"s\"), mdx(\"span\", {\n    parentName: \"span\",\n    \"className\": \"mpunct\"\n  }, \",\"), mdx(\"span\", {\n    parentName: \"span\",\n    \"className\": \"mspace\",\n    \"style\": {\n      \"marginRight\": \"0.16666666666666666em\"\n    }\n  }), mdx(\"span\", {\n    parentName: \"span\",\n    \"className\": \"mord mathnormal\",\n    \"style\": {\n      \"marginRight\": \"0.02778em\"\n    }\n  }, \"r\"), mdx(\"span\", {\n    parentName: \"span\",\n    \"className\": \"mord mathnormal\"\n  }, \"s\"), mdx(\"span\", {\n    parentName: \"span\",\n    \"className\": \"mord mathnormal\",\n    \"style\": {\n      \"marginRight\": \"0.02778em\"\n    }\n  }, \"r\"), mdx(\"span\", {\n    parentName: \"span\",\n    \"className\": \"mord mathnormal\"\n  }, \"s\"), mdx(\"span\", {\n    parentName: \"span\",\n    \"className\": \"mclose\"\n  }, \"}\"))))), \". Let \", mdx(\"span\", {\n    parentName: \"p\",\n    \"className\": \"math math-inline\"\n  }, mdx(\"span\", {\n    parentName: \"span\",\n    \"className\": \"katex\"\n  }, mdx(\"span\", {\n    parentName: \"span\",\n    \"className\": \"katex-mathml\"\n  }, mdx(\"math\", {\n    parentName: \"span\",\n    \"xmlns\": \"http://www.w3.org/1998/Math/MathML\"\n  }, mdx(\"semantics\", {\n    parentName: \"math\"\n  }, mdx(\"mrow\", {\n    parentName: \"semantics\"\n  }, mdx(\"mi\", {\n    parentName: \"mrow\"\n  }, \"S\")), mdx(\"annotation\", {\n    parentName: \"semantics\",\n    \"encoding\": \"application/x-tex\"\n  }, \"S\")))), mdx(\"span\", {\n    parentName: \"span\",\n    \"className\": \"katex-html\",\n    \"aria-hidden\": \"true\"\n  }, mdx(\"span\", {\n    parentName: \"span\",\n    \"className\": \"base\"\n  }, mdx(\"span\", {\n    parentName: \"span\",\n    \"className\": \"strut\",\n    \"style\": {\n      \"height\": \"0.68333em\",\n      \"verticalAlign\": \"0em\"\n    }\n  }), mdx(\"span\", {\n    parentName: \"span\",\n    \"className\": \"mord mathnormal\",\n    \"style\": {\n      \"marginRight\": \"0.05764em\"\n    }\n  }, \"S\"))))), \" be a set of arbitrary regular triangles represented by the ordered triplets \", mdx(\"span\", {\n    parentName: \"p\",\n    \"className\": \"math math-inline\"\n  }, mdx(\"span\", {\n    parentName: \"span\",\n    \"className\": \"katex\"\n  }, mdx(\"span\", {\n    parentName: \"span\",\n    \"className\": \"katex-mathml\"\n  }, mdx(\"math\", {\n    parentName: \"span\",\n    \"xmlns\": \"http://www.w3.org/1998/Math/MathML\"\n  }, mdx(\"semantics\", {\n    parentName: \"math\"\n  }, mdx(\"mrow\", {\n    parentName: \"semantics\"\n  }, mdx(\"mo\", {\n    parentName: \"mrow\",\n    \"stretchy\": \"false\"\n  }, \"(\"), mdx(\"mn\", {\n    parentName: \"mrow\"\n  }, \"1\"), mdx(\"mo\", {\n    parentName: \"mrow\",\n    \"separator\": \"true\"\n  }, \",\"), mdx(\"mn\", {\n    parentName: \"mrow\"\n  }, \"2\"), mdx(\"mo\", {\n    parentName: \"mrow\",\n    \"separator\": \"true\"\n  }, \",\"), mdx(\"mn\", {\n    parentName: \"mrow\"\n  }, \"3\"), mdx(\"mo\", {\n    parentName: \"mrow\",\n    \"stretchy\": \"false\"\n  }, \")\")), mdx(\"annotation\", {\n    parentName: \"semantics\",\n    \"encoding\": \"application/x-tex\"\n  }, \"(1,2,3)\")))), mdx(\"span\", {\n    parentName: \"span\",\n    \"className\": \"katex-html\",\n    \"aria-hidden\": \"true\"\n  }, mdx(\"span\", {\n    parentName: \"span\",\n    \"className\": \"base\"\n  }, mdx(\"span\", {\n    parentName: \"span\",\n    \"className\": \"strut\",\n    \"style\": {\n      \"height\": \"1em\",\n      \"verticalAlign\": \"-0.25em\"\n    }\n  }), mdx(\"span\", {\n    parentName: \"span\",\n    \"className\": \"mopen\"\n  }, \"(\"), mdx(\"span\", {\n    parentName: \"span\",\n    \"className\": \"mord\"\n  }, \"1\"), mdx(\"span\", {\n    parentName: \"span\",\n    \"className\": \"mpunct\"\n  }, \",\"), mdx(\"span\", {\n    parentName: \"span\",\n    \"className\": \"mspace\",\n    \"style\": {\n      \"marginRight\": \"0.16666666666666666em\"\n    }\n  }), mdx(\"span\", {\n    parentName: \"span\",\n    \"className\": \"mord\"\n  }, \"2\"), mdx(\"span\", {\n    parentName: \"span\",\n    \"className\": \"mpunct\"\n  }, \",\"), mdx(\"span\", {\n    parentName: \"span\",\n    \"className\": \"mspace\",\n    \"style\": {\n      \"marginRight\": \"0.16666666666666666em\"\n    }\n  }), mdx(\"span\", {\n    parentName: \"span\",\n    \"className\": \"mord\"\n  }, \"3\"), mdx(\"span\", {\n    parentName: \"span\",\n    \"className\": \"mclose\"\n  }, \")\"))))), \", \", mdx(\"span\", {\n    parentName: \"p\",\n    \"className\": \"math math-inline\"\n  }, mdx(\"span\", {\n    parentName: \"span\",\n    \"className\": \"katex\"\n  }, mdx(\"span\", {\n    parentName: \"span\",\n    \"className\": \"katex-mathml\"\n  }, mdx(\"math\", {\n    parentName: \"span\",\n    \"xmlns\": \"http://www.w3.org/1998/Math/MathML\"\n  }, mdx(\"semantics\", {\n    parentName: \"math\"\n  }, mdx(\"mrow\", {\n    parentName: \"semantics\"\n  }, mdx(\"mo\", {\n    parentName: \"mrow\",\n    \"stretchy\": \"false\"\n  }, \"(\"), mdx(\"mn\", {\n    parentName: \"mrow\"\n  }, \"2\"), mdx(\"mo\", {\n    parentName: \"mrow\",\n    \"separator\": \"true\"\n  }, \",\"), mdx(\"mn\", {\n    parentName: \"mrow\"\n  }, \"3\"), mdx(\"mo\", {\n    parentName: \"mrow\",\n    \"separator\": \"true\"\n  }, \",\"), mdx(\"mn\", {\n    parentName: \"mrow\"\n  }, \"1\"), mdx(\"mo\", {\n    parentName: \"mrow\",\n    \"stretchy\": \"false\"\n  }, \")\")), mdx(\"annotation\", {\n    parentName: \"semantics\",\n    \"encoding\": \"application/x-tex\"\n  }, \"(2,3,1)\")))), mdx(\"span\", {\n    parentName: \"span\",\n    \"className\": \"katex-html\",\n    \"aria-hidden\": \"true\"\n  }, mdx(\"span\", {\n    parentName: \"span\",\n    \"className\": \"base\"\n  }, mdx(\"span\", {\n    parentName: \"span\",\n    \"className\": \"strut\",\n    \"style\": {\n      \"height\": \"1em\",\n      \"verticalAlign\": \"-0.25em\"\n    }\n  }), mdx(\"span\", {\n    parentName: \"span\",\n    \"className\": \"mopen\"\n  }, \"(\"), mdx(\"span\", {\n    parentName: \"span\",\n    \"className\": \"mord\"\n  }, \"2\"), mdx(\"span\", {\n    parentName: \"span\",\n    \"className\": \"mpunct\"\n  }, \",\"), mdx(\"span\", {\n    parentName: \"span\",\n    \"className\": \"mspace\",\n    \"style\": {\n      \"marginRight\": \"0.16666666666666666em\"\n    }\n  }), mdx(\"span\", {\n    parentName: \"span\",\n    \"className\": \"mord\"\n  }, \"3\"), mdx(\"span\", {\n    parentName: \"span\",\n    \"className\": \"mpunct\"\n  }, \",\"), mdx(\"span\", {\n    parentName: \"span\",\n    \"className\": \"mspace\",\n    \"style\": {\n      \"marginRight\": \"0.16666666666666666em\"\n    }\n  }), mdx(\"span\", {\n    parentName: \"span\",\n    \"className\": \"mord\"\n  }, \"1\"), mdx(\"span\", {\n    parentName: \"span\",\n    \"className\": \"mclose\"\n  }, \")\"))))), \", \", mdx(\"span\", {\n    parentName: \"p\",\n    \"className\": \"math math-inline\"\n  }, mdx(\"span\", {\n    parentName: \"span\",\n    \"className\": \"katex\"\n  }, mdx(\"span\", {\n    parentName: \"span\",\n    \"className\": \"katex-mathml\"\n  }, mdx(\"math\", {\n    parentName: \"span\",\n    \"xmlns\": \"http://www.w3.org/1998/Math/MathML\"\n  }, mdx(\"semantics\", {\n    parentName: \"math\"\n  }, mdx(\"mrow\", {\n    parentName: \"semantics\"\n  }, mdx(\"mo\", {\n    parentName: \"mrow\",\n    \"stretchy\": \"false\"\n  }, \"(\"), mdx(\"mn\", {\n    parentName: \"mrow\"\n  }, \"3\"), mdx(\"mo\", {\n    parentName: \"mrow\",\n    \"separator\": \"true\"\n  }, \",\"), mdx(\"mn\", {\n    parentName: \"mrow\"\n  }, \"1\"), mdx(\"mo\", {\n    parentName: \"mrow\",\n    \"separator\": \"true\"\n  }, \",\"), mdx(\"mn\", {\n    parentName: \"mrow\"\n  }, \"2\"), mdx(\"mo\", {\n    parentName: \"mrow\",\n    \"stretchy\": \"false\"\n  }, \")\")), mdx(\"annotation\", {\n    parentName: \"semantics\",\n    \"encoding\": \"application/x-tex\"\n  }, \"(3,1,2)\")))), mdx(\"span\", {\n    parentName: \"span\",\n    \"className\": \"katex-html\",\n    \"aria-hidden\": \"true\"\n  }, mdx(\"span\", {\n    parentName: \"span\",\n    \"className\": \"base\"\n  }, mdx(\"span\", {\n    parentName: \"span\",\n    \"className\": \"strut\",\n    \"style\": {\n      \"height\": \"1em\",\n      \"verticalAlign\": \"-0.25em\"\n    }\n  }), mdx(\"span\", {\n    parentName: \"span\",\n    \"className\": \"mopen\"\n  }, \"(\"), mdx(\"span\", {\n    parentName: \"span\",\n    \"className\": \"mord\"\n  }, \"3\"), mdx(\"span\", {\n    parentName: \"span\",\n    \"className\": \"mpunct\"\n  }, \",\"), mdx(\"span\", {\n    parentName: \"span\",\n    \"className\": \"mspace\",\n    \"style\": {\n      \"marginRight\": \"0.16666666666666666em\"\n    }\n  }), mdx(\"span\", {\n    parentName: \"span\",\n    \"className\": \"mord\"\n  }, \"1\"), mdx(\"span\", {\n    parentName: \"span\",\n    \"className\": \"mpunct\"\n  }, \",\"), mdx(\"span\", {\n    parentName: \"span\",\n    \"className\": \"mspace\",\n    \"style\": {\n      \"marginRight\": \"0.16666666666666666em\"\n    }\n  }), mdx(\"span\", {\n    parentName: \"span\",\n    \"className\": \"mord\"\n  }, \"2\"), mdx(\"span\", {\n    parentName: \"span\",\n    \"className\": \"mclose\"\n  }, \")\"))))), \", \", mdx(\"span\", {\n    parentName: \"p\",\n    \"className\": \"math math-inline\"\n  }, mdx(\"span\", {\n    parentName: \"span\",\n    \"className\": \"katex\"\n  }, mdx(\"span\", {\n    parentName: \"span\",\n    \"className\": \"katex-mathml\"\n  }, mdx(\"math\", {\n    parentName: \"span\",\n    \"xmlns\": \"http://www.w3.org/1998/Math/MathML\"\n  }, mdx(\"semantics\", {\n    parentName: \"math\"\n  }, mdx(\"mrow\", {\n    parentName: \"semantics\"\n  }, mdx(\"mo\", {\n    parentName: \"mrow\",\n    \"stretchy\": \"false\"\n  }, \"(\"), mdx(\"mn\", {\n    parentName: \"mrow\"\n  }, \"1\"), mdx(\"mo\", {\n    parentName: \"mrow\",\n    \"separator\": \"true\"\n  }, \",\"), mdx(\"mn\", {\n    parentName: \"mrow\"\n  }, \"3\"), mdx(\"mo\", {\n    parentName: \"mrow\",\n    \"separator\": \"true\"\n  }, \",\"), mdx(\"mn\", {\n    parentName: \"mrow\"\n  }, \"2\"), mdx(\"mo\", {\n    parentName: \"mrow\",\n    \"stretchy\": \"false\"\n  }, \")\")), mdx(\"annotation\", {\n    parentName: \"semantics\",\n    \"encoding\": \"application/x-tex\"\n  }, \"(1,3,2)\")))), mdx(\"span\", {\n    parentName: \"span\",\n    \"className\": \"katex-html\",\n    \"aria-hidden\": \"true\"\n  }, mdx(\"span\", {\n    parentName: \"span\",\n    \"className\": \"base\"\n  }, mdx(\"span\", {\n    parentName: \"span\",\n    \"className\": \"strut\",\n    \"style\": {\n      \"height\": \"1em\",\n      \"verticalAlign\": \"-0.25em\"\n    }\n  }), mdx(\"span\", {\n    parentName: \"span\",\n    \"className\": \"mopen\"\n  }, \"(\"), mdx(\"span\", {\n    parentName: \"span\",\n    \"className\": \"mord\"\n  }, \"1\"), mdx(\"span\", {\n    parentName: \"span\",\n    \"className\": \"mpunct\"\n  }, \",\"), mdx(\"span\", {\n    parentName: \"span\",\n    \"className\": \"mspace\",\n    \"style\": {\n      \"marginRight\": \"0.16666666666666666em\"\n    }\n  }), mdx(\"span\", {\n    parentName: \"span\",\n    \"className\": \"mord\"\n  }, \"3\"), mdx(\"span\", {\n    parentName: \"span\",\n    \"className\": \"mpunct\"\n  }, \",\"), mdx(\"span\", {\n    parentName: \"span\",\n    \"className\": \"mspace\",\n    \"style\": {\n      \"marginRight\": \"0.16666666666666666em\"\n    }\n  }), mdx(\"span\", {\n    parentName: \"span\",\n    \"className\": \"mord\"\n  }, \"2\"), mdx(\"span\", {\n    parentName: \"span\",\n    \"className\": \"mclose\"\n  }, \")\"))))), \", \", mdx(\"span\", {\n    parentName: \"p\",\n    \"className\": \"math math-inline\"\n  }, mdx(\"span\", {\n    parentName: \"span\",\n    \"className\": \"katex\"\n  }, mdx(\"span\", {\n    parentName: \"span\",\n    \"className\": \"katex-mathml\"\n  }, mdx(\"math\", {\n    parentName: \"span\",\n    \"xmlns\": \"http://www.w3.org/1998/Math/MathML\"\n  }, mdx(\"semantics\", {\n    parentName: \"math\"\n  }, mdx(\"mrow\", {\n    parentName: \"semantics\"\n  }, mdx(\"mo\", {\n    parentName: \"mrow\",\n    \"stretchy\": \"false\"\n  }, \"(\"), mdx(\"mn\", {\n    parentName: \"mrow\"\n  }, \"3\"), mdx(\"mo\", {\n    parentName: \"mrow\",\n    \"separator\": \"true\"\n  }, \",\"), mdx(\"mn\", {\n    parentName: \"mrow\"\n  }, \"2\"), mdx(\"mo\", {\n    parentName: \"mrow\",\n    \"separator\": \"true\"\n  }, \",\"), mdx(\"mn\", {\n    parentName: \"mrow\"\n  }, \"1\"), mdx(\"mo\", {\n    parentName: \"mrow\",\n    \"stretchy\": \"false\"\n  }, \")\")), mdx(\"annotation\", {\n    parentName: \"semantics\",\n    \"encoding\": \"application/x-tex\"\n  }, \"(3,2,1)\")))), mdx(\"span\", {\n    parentName: \"span\",\n    \"className\": \"katex-html\",\n    \"aria-hidden\": \"true\"\n  }, mdx(\"span\", {\n    parentName: \"span\",\n    \"className\": \"base\"\n  }, mdx(\"span\", {\n    parentName: \"span\",\n    \"className\": \"strut\",\n    \"style\": {\n      \"height\": \"1em\",\n      \"verticalAlign\": \"-0.25em\"\n    }\n  }), mdx(\"span\", {\n    parentName: \"span\",\n    \"className\": \"mopen\"\n  }, \"(\"), mdx(\"span\", {\n    parentName: \"span\",\n    \"className\": \"mord\"\n  }, \"3\"), mdx(\"span\", {\n    parentName: \"span\",\n    \"className\": \"mpunct\"\n  }, \",\"), mdx(\"span\", {\n    parentName: \"span\",\n    \"className\": \"mspace\",\n    \"style\": {\n      \"marginRight\": \"0.16666666666666666em\"\n    }\n  }), mdx(\"span\", {\n    parentName: \"span\",\n    \"className\": \"mord\"\n  }, \"2\"), mdx(\"span\", {\n    parentName: \"span\",\n    \"className\": \"mpunct\"\n  }, \",\"), mdx(\"span\", {\n    parentName: \"span\",\n    \"className\": \"mspace\",\n    \"style\": {\n      \"marginRight\": \"0.16666666666666666em\"\n    }\n  }), mdx(\"span\", {\n    parentName: \"span\",\n    \"className\": \"mord\"\n  }, \"1\"), mdx(\"span\", {\n    parentName: \"span\",\n    \"className\": \"mclose\"\n  }, \")\"))))), \", and \", mdx(\"span\", {\n    parentName: \"p\",\n    \"className\": \"math math-inline\"\n  }, mdx(\"span\", {\n    parentName: \"span\",\n    \"className\": \"katex\"\n  }, mdx(\"span\", {\n    parentName: \"span\",\n    \"className\": \"katex-mathml\"\n  }, mdx(\"math\", {\n    parentName: \"span\",\n    \"xmlns\": \"http://www.w3.org/1998/Math/MathML\"\n  }, mdx(\"semantics\", {\n    parentName: \"math\"\n  }, mdx(\"mrow\", {\n    parentName: \"semantics\"\n  }, mdx(\"mo\", {\n    parentName: \"mrow\",\n    \"stretchy\": \"false\"\n  }, \"(\"), mdx(\"mn\", {\n    parentName: \"mrow\"\n  }, \"2\"), mdx(\"mo\", {\n    parentName: \"mrow\",\n    \"separator\": \"true\"\n  }, \",\"), mdx(\"mn\", {\n    parentName: \"mrow\"\n  }, \"1\"), mdx(\"mo\", {\n    parentName: \"mrow\",\n    \"separator\": \"true\"\n  }, \",\"), mdx(\"mn\", {\n    parentName: \"mrow\"\n  }, \"3\"), mdx(\"mo\", {\n    parentName: \"mrow\",\n    \"stretchy\": \"false\"\n  }, \")\")), mdx(\"annotation\", {\n    parentName: \"semantics\",\n    \"encoding\": \"application/x-tex\"\n  }, \"(2,1,3)\")))), mdx(\"span\", {\n    parentName: \"span\",\n    \"className\": \"katex-html\",\n    \"aria-hidden\": \"true\"\n  }, mdx(\"span\", {\n    parentName: \"span\",\n    \"className\": \"base\"\n  }, mdx(\"span\", {\n    parentName: \"span\",\n    \"className\": \"strut\",\n    \"style\": {\n      \"height\": \"1em\",\n      \"verticalAlign\": \"-0.25em\"\n    }\n  }), mdx(\"span\", {\n    parentName: \"span\",\n    \"className\": \"mopen\"\n  }, \"(\"), mdx(\"span\", {\n    parentName: \"span\",\n    \"className\": \"mord\"\n  }, \"2\"), mdx(\"span\", {\n    parentName: \"span\",\n    \"className\": \"mpunct\"\n  }, \",\"), mdx(\"span\", {\n    parentName: \"span\",\n    \"className\": \"mspace\",\n    \"style\": {\n      \"marginRight\": \"0.16666666666666666em\"\n    }\n  }), mdx(\"span\", {\n    parentName: \"span\",\n    \"className\": \"mord\"\n  }, \"1\"), mdx(\"span\", {\n    parentName: \"span\",\n    \"className\": \"mpunct\"\n  }, \",\"), mdx(\"span\", {\n    parentName: \"span\",\n    \"className\": \"mspace\",\n    \"style\": {\n      \"marginRight\": \"0.16666666666666666em\"\n    }\n  }), mdx(\"span\", {\n    parentName: \"span\",\n    \"className\": \"mord\"\n  }, \"3\"), mdx(\"span\", {\n    parentName: \"span\",\n    \"className\": \"mclose\"\n  }, \")\"))))), \". Finally, let \", mdx(\"span\", {\n    parentName: \"p\",\n    \"className\": \"math math-inline\"\n  }, mdx(\"span\", {\n    parentName: \"span\",\n    \"className\": \"katex\"\n  }, mdx(\"span\", {\n    parentName: \"span\",\n    \"className\": \"katex-mathml\"\n  }, mdx(\"math\", {\n    parentName: \"span\",\n    \"xmlns\": \"http://www.w3.org/1998/Math/MathML\"\n  }, mdx(\"semantics\", {\n    parentName: \"math\"\n  }, mdx(\"mrow\", {\n    parentName: \"semantics\"\n  }, mdx(\"mi\", {\n    parentName: \"mrow\"\n  }, \"G\")), mdx(\"annotation\", {\n    parentName: \"semantics\",\n    \"encoding\": \"application/x-tex\"\n  }, \"G\")))), mdx(\"span\", {\n    parentName: \"span\",\n    \"className\": \"katex-html\",\n    \"aria-hidden\": \"true\"\n  }, mdx(\"span\", {\n    parentName: \"span\",\n    \"className\": \"base\"\n  }, mdx(\"span\", {\n    parentName: \"span\",\n    \"className\": \"strut\",\n    \"style\": {\n      \"height\": \"0.68333em\",\n      \"verticalAlign\": \"0em\"\n    }\n  }), mdx(\"span\", {\n    parentName: \"span\",\n    \"className\": \"mord mathnormal\"\n  }, \"G\"))))), \" act on \", mdx(\"span\", {\n    parentName: \"p\",\n    \"className\": \"math math-inline\"\n  }, mdx(\"span\", {\n    parentName: \"span\",\n    \"className\": \"katex\"\n  }, mdx(\"span\", {\n    parentName: \"span\",\n    \"className\": \"katex-mathml\"\n  }, mdx(\"math\", {\n    parentName: \"span\",\n    \"xmlns\": \"http://www.w3.org/1998/Math/MathML\"\n  }, mdx(\"semantics\", {\n    parentName: \"math\"\n  }, mdx(\"mrow\", {\n    parentName: \"semantics\"\n  }, mdx(\"mi\", {\n    parentName: \"mrow\"\n  }, \"S\")), mdx(\"annotation\", {\n    parentName: \"semantics\",\n    \"encoding\": \"application/x-tex\"\n  }, \"S\")))), mdx(\"span\", {\n    parentName: \"span\",\n    \"className\": \"katex-html\",\n    \"aria-hidden\": \"true\"\n  }, mdx(\"span\", {\n    parentName: \"span\",\n    \"className\": \"base\"\n  }, mdx(\"span\", {\n    parentName: \"span\",\n    \"className\": \"strut\",\n    \"style\": {\n      \"height\": \"0.68333em\",\n      \"verticalAlign\": \"0em\"\n    }\n  }), mdx(\"span\", {\n    parentName: \"span\",\n    \"className\": \"mord mathnormal\",\n    \"style\": {\n      \"marginRight\": \"0.05764em\"\n    }\n  }, \"S\"))))), \" with \", mdx(\"span\", {\n    parentName: \"p\",\n    \"className\": \"math math-inline\"\n  }, mdx(\"span\", {\n    parentName: \"span\",\n    \"className\": \"katex\"\n  }, mdx(\"span\", {\n    parentName: \"span\",\n    \"className\": \"katex-mathml\"\n  }, mdx(\"math\", {\n    parentName: \"span\",\n    \"xmlns\": \"http://www.w3.org/1998/Math/MathML\"\n  }, mdx(\"semantics\", {\n    parentName: \"math\"\n  }, mdx(\"mrow\", {\n    parentName: \"semantics\"\n  }, mdx(\"mi\", {\n    parentName: \"mrow\"\n  }, \"r\"), mdx(\"mo\", {\n    parentName: \"mrow\"\n  }, \"\\u22C5\"), mdx(\"mo\", {\n    parentName: \"mrow\",\n    \"stretchy\": \"false\"\n  }, \"(\"), mdx(\"mi\", {\n    parentName: \"mrow\"\n  }, \"a\"), mdx(\"mo\", {\n    parentName: \"mrow\",\n    \"separator\": \"true\"\n  }, \",\"), mdx(\"mi\", {\n    parentName: \"mrow\"\n  }, \"b\"), mdx(\"mo\", {\n    parentName: \"mrow\",\n    \"separator\": \"true\"\n  }, \",\"), mdx(\"mi\", {\n    parentName: \"mrow\"\n  }, \"c\"), mdx(\"mo\", {\n    parentName: \"mrow\",\n    \"stretchy\": \"false\"\n  }, \")\"), mdx(\"mo\", {\n    parentName: \"mrow\"\n  }, \"=\"), mdx(\"mo\", {\n    parentName: \"mrow\",\n    \"stretchy\": \"false\"\n  }, \"(\"), mdx(\"mi\", {\n    parentName: \"mrow\"\n  }, \"b\"), mdx(\"mo\", {\n    parentName: \"mrow\",\n    \"separator\": \"true\"\n  }, \",\"), mdx(\"mi\", {\n    parentName: \"mrow\"\n  }, \"c\"), mdx(\"mo\", {\n    parentName: \"mrow\",\n    \"separator\": \"true\"\n  }, \",\"), mdx(\"mi\", {\n    parentName: \"mrow\"\n  }, \"a\"), mdx(\"mo\", {\n    parentName: \"mrow\",\n    \"stretchy\": \"false\"\n  }, \")\")), mdx(\"annotation\", {\n    parentName: \"semantics\",\n    \"encoding\": \"application/x-tex\"\n  }, \"r \\\\cdot (a,b,c) = (b,c,a)\")))), mdx(\"span\", {\n    parentName: \"span\",\n    \"className\": \"katex-html\",\n    \"aria-hidden\": \"true\"\n  }, mdx(\"span\", {\n    parentName: \"span\",\n    \"className\": \"base\"\n  }, mdx(\"span\", {\n    parentName: \"span\",\n    \"className\": \"strut\",\n    \"style\": {\n      \"height\": \"0.44445em\",\n      \"verticalAlign\": \"0em\"\n    }\n  }), mdx(\"span\", {\n    parentName: \"span\",\n    \"className\": \"mord mathnormal\",\n    \"style\": {\n      \"marginRight\": \"0.02778em\"\n    }\n  }, \"r\"), mdx(\"span\", {\n    parentName: \"span\",\n    \"className\": \"mspace\",\n    \"style\": {\n      \"marginRight\": \"0.2222222222222222em\"\n    }\n  }), mdx(\"span\", {\n    parentName: \"span\",\n    \"className\": \"mbin\"\n  }, \"\\u22C5\"), mdx(\"span\", {\n    parentName: \"span\",\n    \"className\": \"mspace\",\n    \"style\": {\n      \"marginRight\": \"0.2222222222222222em\"\n    }\n  })), mdx(\"span\", {\n    parentName: \"span\",\n    \"className\": \"base\"\n  }, mdx(\"span\", {\n    parentName: \"span\",\n    \"className\": \"strut\",\n    \"style\": {\n      \"height\": \"1em\",\n      \"verticalAlign\": \"-0.25em\"\n    }\n  }), mdx(\"span\", {\n    parentName: \"span\",\n    \"className\": \"mopen\"\n  }, \"(\"), mdx(\"span\", {\n    parentName: \"span\",\n    \"className\": \"mord mathnormal\"\n  }, \"a\"), mdx(\"span\", {\n    parentName: \"span\",\n    \"className\": \"mpunct\"\n  }, \",\"), mdx(\"span\", {\n    parentName: \"span\",\n    \"className\": \"mspace\",\n    \"style\": {\n      \"marginRight\": \"0.16666666666666666em\"\n    }\n  }), mdx(\"span\", {\n    parentName: \"span\",\n    \"className\": \"mord mathnormal\"\n  }, \"b\"), mdx(\"span\", {\n    parentName: \"span\",\n    \"className\": \"mpunct\"\n  }, \",\"), mdx(\"span\", {\n    parentName: \"span\",\n    \"className\": \"mspace\",\n    \"style\": {\n      \"marginRight\": \"0.16666666666666666em\"\n    }\n  }), mdx(\"span\", {\n    parentName: \"span\",\n    \"className\": \"mord mathnormal\"\n  }, \"c\"), mdx(\"span\", {\n    parentName: \"span\",\n    \"className\": \"mclose\"\n  }, \")\"), mdx(\"span\", {\n    parentName: \"span\",\n    \"className\": \"mspace\",\n    \"style\": {\n      \"marginRight\": \"0.2777777777777778em\"\n    }\n  }), mdx(\"span\", {\n    parentName: \"span\",\n    \"className\": \"mrel\"\n  }, \"=\"), mdx(\"span\", {\n    parentName: \"span\",\n    \"className\": \"mspace\",\n    \"style\": {\n      \"marginRight\": \"0.2777777777777778em\"\n    }\n  })), mdx(\"span\", {\n    parentName: \"span\",\n    \"className\": \"base\"\n  }, mdx(\"span\", {\n    parentName: \"span\",\n    \"className\": \"strut\",\n    \"style\": {\n      \"height\": \"1em\",\n      \"verticalAlign\": \"-0.25em\"\n    }\n  }), mdx(\"span\", {\n    parentName: \"span\",\n    \"className\": \"mopen\"\n  }, \"(\"), mdx(\"span\", {\n    parentName: \"span\",\n    \"className\": \"mord mathnormal\"\n  }, \"b\"), mdx(\"span\", {\n    parentName: \"span\",\n    \"className\": \"mpunct\"\n  }, \",\"), mdx(\"span\", {\n    parentName: \"span\",\n    \"className\": \"mspace\",\n    \"style\": {\n      \"marginRight\": \"0.16666666666666666em\"\n    }\n  }), mdx(\"span\", {\n    parentName: \"span\",\n    \"className\": \"mord mathnormal\"\n  }, \"c\"), mdx(\"span\", {\n    parentName: \"span\",\n    \"className\": \"mpunct\"\n  }, \",\"), mdx(\"span\", {\n    parentName: \"span\",\n    \"className\": \"mspace\",\n    \"style\": {\n      \"marginRight\": \"0.16666666666666666em\"\n    }\n  }), mdx(\"span\", {\n    parentName: \"span\",\n    \"className\": \"mord mathnormal\"\n  }, \"a\"), mdx(\"span\", {\n    parentName: \"span\",\n    \"className\": \"mclose\"\n  }, \")\"))))), \" and \", mdx(\"span\", {\n    parentName: \"p\",\n    \"className\": \"math math-inline\"\n  }, mdx(\"span\", {\n    parentName: \"span\",\n    \"className\": \"katex\"\n  }, mdx(\"span\", {\n    parentName: \"span\",\n    \"className\": \"katex-mathml\"\n  }, mdx(\"math\", {\n    parentName: \"span\",\n    \"xmlns\": \"http://www.w3.org/1998/Math/MathML\"\n  }, mdx(\"semantics\", {\n    parentName: \"math\"\n  }, mdx(\"mrow\", {\n    parentName: \"semantics\"\n  }, mdx(\"mi\", {\n    parentName: \"mrow\"\n  }, \"s\"), mdx(\"mo\", {\n    parentName: \"mrow\"\n  }, \"\\u22C5\"), mdx(\"mo\", {\n    parentName: \"mrow\",\n    \"stretchy\": \"false\"\n  }, \"(\"), mdx(\"mi\", {\n    parentName: \"mrow\"\n  }, \"a\"), mdx(\"mo\", {\n    parentName: \"mrow\",\n    \"separator\": \"true\"\n  }, \",\"), mdx(\"mi\", {\n    parentName: \"mrow\"\n  }, \"b\"), mdx(\"mo\", {\n    parentName: \"mrow\",\n    \"separator\": \"true\"\n  }, \",\"), mdx(\"mi\", {\n    parentName: \"mrow\"\n  }, \"c\"), mdx(\"mo\", {\n    parentName: \"mrow\",\n    \"stretchy\": \"false\"\n  }, \")\"), mdx(\"mo\", {\n    parentName: \"mrow\"\n  }, \"=\"), mdx(\"mo\", {\n    parentName: \"mrow\",\n    \"stretchy\": \"false\"\n  }, \"(\"), mdx(\"mi\", {\n    parentName: \"mrow\"\n  }, \"a\"), mdx(\"mo\", {\n    parentName: \"mrow\",\n    \"separator\": \"true\"\n  }, \",\"), mdx(\"mi\", {\n    parentName: \"mrow\"\n  }, \"c\"), mdx(\"mo\", {\n    parentName: \"mrow\",\n    \"separator\": \"true\"\n  }, \",\"), mdx(\"mi\", {\n    parentName: \"mrow\"\n  }, \"b\"), mdx(\"mo\", {\n    parentName: \"mrow\",\n    \"stretchy\": \"false\"\n  }, \")\")), mdx(\"annotation\", {\n    parentName: \"semantics\",\n    \"encoding\": \"application/x-tex\"\n  }, \"s \\\\cdot (a,b,c) = (a,c,b)\")))), mdx(\"span\", {\n    parentName: \"span\",\n    \"className\": \"katex-html\",\n    \"aria-hidden\": \"true\"\n  }, mdx(\"span\", {\n    parentName: \"span\",\n    \"className\": \"base\"\n  }, mdx(\"span\", {\n    parentName: \"span\",\n    \"className\": \"strut\",\n    \"style\": {\n      \"height\": \"0.44445em\",\n      \"verticalAlign\": \"0em\"\n    }\n  }), mdx(\"span\", {\n    parentName: \"span\",\n    \"className\": \"mord mathnormal\"\n  }, \"s\"), mdx(\"span\", {\n    parentName: \"span\",\n    \"className\": \"mspace\",\n    \"style\": {\n      \"marginRight\": \"0.2222222222222222em\"\n    }\n  }), mdx(\"span\", {\n    parentName: \"span\",\n    \"className\": \"mbin\"\n  }, \"\\u22C5\"), mdx(\"span\", {\n    parentName: \"span\",\n    \"className\": \"mspace\",\n    \"style\": {\n      \"marginRight\": \"0.2222222222222222em\"\n    }\n  })), mdx(\"span\", {\n    parentName: \"span\",\n    \"className\": \"base\"\n  }, mdx(\"span\", {\n    parentName: \"span\",\n    \"className\": \"strut\",\n    \"style\": {\n      \"height\": \"1em\",\n      \"verticalAlign\": \"-0.25em\"\n    }\n  }), mdx(\"span\", {\n    parentName: \"span\",\n    \"className\": \"mopen\"\n  }, \"(\"), mdx(\"span\", {\n    parentName: \"span\",\n    \"className\": \"mord mathnormal\"\n  }, \"a\"), mdx(\"span\", {\n    parentName: \"span\",\n    \"className\": \"mpunct\"\n  }, \",\"), mdx(\"span\", {\n    parentName: \"span\",\n    \"className\": \"mspace\",\n    \"style\": {\n      \"marginRight\": \"0.16666666666666666em\"\n    }\n  }), mdx(\"span\", {\n    parentName: \"span\",\n    \"className\": \"mord mathnormal\"\n  }, \"b\"), mdx(\"span\", {\n    parentName: \"span\",\n    \"className\": \"mpunct\"\n  }, \",\"), mdx(\"span\", {\n    parentName: \"span\",\n    \"className\": \"mspace\",\n    \"style\": {\n      \"marginRight\": \"0.16666666666666666em\"\n    }\n  }), mdx(\"span\", {\n    parentName: \"span\",\n    \"className\": \"mord mathnormal\"\n  }, \"c\"), mdx(\"span\", {\n    parentName: \"span\",\n    \"className\": \"mclose\"\n  }, \")\"), mdx(\"span\", {\n    parentName: \"span\",\n    \"className\": \"mspace\",\n    \"style\": {\n      \"marginRight\": \"0.2777777777777778em\"\n    }\n  }), mdx(\"span\", {\n    parentName: \"span\",\n    \"className\": \"mrel\"\n  }, \"=\"), mdx(\"span\", {\n    parentName: \"span\",\n    \"className\": \"mspace\",\n    \"style\": {\n      \"marginRight\": \"0.2777777777777778em\"\n    }\n  })), mdx(\"span\", {\n    parentName: \"span\",\n    \"className\": \"base\"\n  }, mdx(\"span\", {\n    parentName: \"span\",\n    \"className\": \"strut\",\n    \"style\": {\n      \"height\": \"1em\",\n      \"verticalAlign\": \"-0.25em\"\n    }\n  }), mdx(\"span\", {\n    parentName: \"span\",\n    \"className\": \"mopen\"\n  }, \"(\"), mdx(\"span\", {\n    parentName: \"span\",\n    \"className\": \"mord mathnormal\"\n  }, \"a\"), mdx(\"span\", {\n    parentName: \"span\",\n    \"className\": \"mpunct\"\n  }, \",\"), mdx(\"span\", {\n    parentName: \"span\",\n    \"className\": \"mspace\",\n    \"style\": {\n      \"marginRight\": \"0.16666666666666666em\"\n    }\n  }), mdx(\"span\", {\n    parentName: \"span\",\n    \"className\": \"mord mathnormal\"\n  }, \"c\"), mdx(\"span\", {\n    parentName: \"span\",\n    \"className\": \"mpunct\"\n  }, \",\"), mdx(\"span\", {\n    parentName: \"span\",\n    \"className\": \"mspace\",\n    \"style\": {\n      \"marginRight\": \"0.16666666666666666em\"\n    }\n  }), mdx(\"span\", {\n    parentName: \"span\",\n    \"className\": \"mord mathnormal\"\n  }, \"b\"), mdx(\"span\", {\n    parentName: \"span\",\n    \"className\": \"mclose\"\n  }, \")\"))))), \".\"), mdx(\"p\", null, \"A possible solution for the Schreier graph of \", mdx(\"span\", {\n    parentName: \"p\",\n    \"className\": \"math math-inline\"\n  }, mdx(\"span\", {\n    parentName: \"span\",\n    \"className\": \"katex\"\n  }, mdx(\"span\", {\n    parentName: \"span\",\n    \"className\": \"katex-mathml\"\n  }, mdx(\"math\", {\n    parentName: \"span\",\n    \"xmlns\": \"http://www.w3.org/1998/Math/MathML\"\n  }, mdx(\"semantics\", {\n    parentName: \"math\"\n  }, mdx(\"mrow\", {\n    parentName: \"semantics\"\n  }, mdx(\"mi\", {\n    parentName: \"mrow\"\n  }, \"S\")), mdx(\"annotation\", {\n    parentName: \"semantics\",\n    \"encoding\": \"application/x-tex\"\n  }, \"S\")))), mdx(\"span\", {\n    parentName: \"span\",\n    \"className\": \"katex-html\",\n    \"aria-hidden\": \"true\"\n  }, mdx(\"span\", {\n    parentName: \"span\",\n    \"className\": \"base\"\n  }, mdx(\"span\", {\n    parentName: \"span\",\n    \"className\": \"strut\",\n    \"style\": {\n      \"height\": \"0.68333em\",\n      \"verticalAlign\": \"0em\"\n    }\n  }), mdx(\"span\", {\n    parentName: \"span\",\n    \"className\": \"mord mathnormal\",\n    \"style\": {\n      \"marginRight\": \"0.05764em\"\n    }\n  }, \"S\"))))), \" is as follows.\"), mdx(SchreierGraphExample, {\n    mdxType: \"SchreierGraphExample\"\n  }), mdx(\"p\", null, \"Notice that the observations we just made hold for this example.\"), mdx(\"h2\", {\n    \"id\": \"the-todd-coxeter-algorithm\",\n    \"style\": {\n      \"position\": \"relative\"\n    }\n  }, mdx(\"a\", {\n    parentName: \"h2\",\n    \"href\": \"#the-todd-coxeter-algorithm\",\n    \"aria-label\": \"the todd coxeter algorithm permalink\",\n    \"className\": \"anchor before\"\n  }, mdx(\"svg\", {\n    parentName: \"a\",\n    \"aria-hidden\": \"true\",\n    \"focusable\": \"false\",\n    \"height\": \"16\",\n    \"version\": \"1.1\",\n    \"viewBox\": \"0 0 16 16\",\n    \"width\": \"16\"\n  }, mdx(\"path\", {\n    parentName: \"svg\",\n    \"fillRule\": \"evenodd\",\n    \"d\": \"M4 9h1v1H4c-1.5 0-3-1.69-3-3.5S2.55 3 4 3h4c1.45 0 3 1.69 3 3.5 0 1.41-.91 2.72-2 3.25V8.59c.58-.45 1-1.27 1-2.09C10 5.22 8.98 4 8 4H4c-.98 0-2 1.22-2 2.5S3 9 4 9zm9-3h-1v1h1c1 0 2 1.22 2 2.5S13.98 12 13 12H9c-.98 0-2-1.22-2-2.5 0-.83.42-1.64 1-2.09V6.25c-1.09.53-2 1.84-2 3.25C6 11.31 7.55 13 9 13h4c1.45 0 3-1.69 3-3.5S14.5 6 13 6z\"\n  }))), \"The Todd-Coxeter Algorithm\"), mdx(\"p\", null, \"The Todd-Coxeter Algorithm takes two inputs.\"), mdx(\"ul\", null, mdx(\"li\", {\n    parentName: \"ul\"\n  }, \"A presentation \", mdx(\"span\", {\n    parentName: \"li\",\n    \"className\": \"math math-inline\"\n  }, mdx(\"span\", {\n    parentName: \"span\",\n    \"className\": \"katex\"\n  }, mdx(\"span\", {\n    parentName: \"span\",\n    \"className\": \"katex-mathml\"\n  }, mdx(\"math\", {\n    parentName: \"span\",\n    \"xmlns\": \"http://www.w3.org/1998/Math/MathML\"\n  }, mdx(\"semantics\", {\n    parentName: \"math\"\n  }, mdx(\"mrow\", {\n    parentName: \"semantics\"\n  }, mdx(\"mi\", {\n    parentName: \"mrow\"\n  }, \"G\"), mdx(\"mo\", {\n    parentName: \"mrow\"\n  }, \"=\"), mdx(\"mo\", {\n    parentName: \"mrow\",\n    \"stretchy\": \"false\"\n  }, \"\\u27E8\"), mdx(\"mi\", {\n    parentName: \"mrow\"\n  }, \"X\"), mdx(\"mo\", {\n    parentName: \"mrow\"\n  }, \"\\u2223\"), mdx(\"mi\", {\n    parentName: \"mrow\"\n  }, \"R\"), mdx(\"mo\", {\n    parentName: \"mrow\",\n    \"stretchy\": \"false\"\n  }, \"\\u27E9\")), mdx(\"annotation\", {\n    parentName: \"semantics\",\n    \"encoding\": \"application/x-tex\"\n  }, \"G = \\\\langle X \\\\mid R \\\\rangle\")))), mdx(\"span\", {\n    parentName: \"span\",\n    \"className\": \"katex-html\",\n    \"aria-hidden\": \"true\"\n  }, mdx(\"span\", {\n    parentName: \"span\",\n    \"className\": \"base\"\n  }, mdx(\"span\", {\n    parentName: \"span\",\n    \"className\": \"strut\",\n    \"style\": {\n      \"height\": \"0.68333em\",\n      \"verticalAlign\": \"0em\"\n    }\n  }), mdx(\"span\", {\n    parentName: \"span\",\n    \"className\": \"mord mathnormal\"\n  }, \"G\"), mdx(\"span\", {\n    parentName: \"span\",\n    \"className\": \"mspace\",\n    \"style\": {\n      \"marginRight\": \"0.2777777777777778em\"\n    }\n  }), mdx(\"span\", {\n    parentName: \"span\",\n    \"className\": \"mrel\"\n  }, \"=\"), mdx(\"span\", {\n    parentName: \"span\",\n    \"className\": \"mspace\",\n    \"style\": {\n      \"marginRight\": \"0.2777777777777778em\"\n    }\n  })), mdx(\"span\", {\n    parentName: \"span\",\n    \"className\": \"base\"\n  }, mdx(\"span\", {\n    parentName: \"span\",\n    \"className\": \"strut\",\n    \"style\": {\n      \"height\": \"1em\",\n      \"verticalAlign\": \"-0.25em\"\n    }\n  }), mdx(\"span\", {\n    parentName: \"span\",\n    \"className\": \"mopen\"\n  }, \"\\u27E8\"), mdx(\"span\", {\n    parentName: \"span\",\n    \"className\": \"mord mathnormal\",\n    \"style\": {\n      \"marginRight\": \"0.07847em\"\n    }\n  }, \"X\"), mdx(\"span\", {\n    parentName: \"span\",\n    \"className\": \"mspace\",\n    \"style\": {\n      \"marginRight\": \"0.2777777777777778em\"\n    }\n  }), mdx(\"span\", {\n    parentName: \"span\",\n    \"className\": \"mrel\"\n  }, \"\\u2223\"), mdx(\"span\", {\n    parentName: \"span\",\n    \"className\": \"mspace\",\n    \"style\": {\n      \"marginRight\": \"0.2777777777777778em\"\n    }\n  })), mdx(\"span\", {\n    parentName: \"span\",\n    \"className\": \"base\"\n  }, mdx(\"span\", {\n    parentName: \"span\",\n    \"className\": \"strut\",\n    \"style\": {\n      \"height\": \"1em\",\n      \"verticalAlign\": \"-0.25em\"\n    }\n  }), mdx(\"span\", {\n    parentName: \"span\",\n    \"className\": \"mord mathnormal\",\n    \"style\": {\n      \"marginRight\": \"0.00773em\"\n    }\n  }, \"R\"), mdx(\"span\", {\n    parentName: \"span\",\n    \"className\": \"mclose\"\n  }, \"\\u27E9\"))))), \" with finite sets \", mdx(\"span\", {\n    parentName: \"li\",\n    \"className\": \"math math-inline\"\n  }, mdx(\"span\", {\n    parentName: \"span\",\n    \"className\": \"katex\"\n  }, mdx(\"span\", {\n    parentName: \"span\",\n    \"className\": \"katex-mathml\"\n  }, mdx(\"math\", {\n    parentName: \"span\",\n    \"xmlns\": \"http://www.w3.org/1998/Math/MathML\"\n  }, mdx(\"semantics\", {\n    parentName: \"math\"\n  }, mdx(\"mrow\", {\n    parentName: \"semantics\"\n  }, mdx(\"mi\", {\n    parentName: \"mrow\"\n  }, \"X\")), mdx(\"annotation\", {\n    parentName: \"semantics\",\n    \"encoding\": \"application/x-tex\"\n  }, \"X\")))), mdx(\"span\", {\n    parentName: \"span\",\n    \"className\": \"katex-html\",\n    \"aria-hidden\": \"true\"\n  }, mdx(\"span\", {\n    parentName: \"span\",\n    \"className\": \"base\"\n  }, mdx(\"span\", {\n    parentName: \"span\",\n    \"className\": \"strut\",\n    \"style\": {\n      \"height\": \"0.68333em\",\n      \"verticalAlign\": \"0em\"\n    }\n  }), mdx(\"span\", {\n    parentName: \"span\",\n    \"className\": \"mord mathnormal\",\n    \"style\": {\n      \"marginRight\": \"0.07847em\"\n    }\n  }, \"X\"))))), \" and \", mdx(\"span\", {\n    parentName: \"li\",\n    \"className\": \"math math-inline\"\n  }, mdx(\"span\", {\n    parentName: \"span\",\n    \"className\": \"katex\"\n  }, mdx(\"span\", {\n    parentName: \"span\",\n    \"className\": \"katex-mathml\"\n  }, mdx(\"math\", {\n    parentName: \"span\",\n    \"xmlns\": \"http://www.w3.org/1998/Math/MathML\"\n  }, mdx(\"semantics\", {\n    parentName: \"math\"\n  }, mdx(\"mrow\", {\n    parentName: \"semantics\"\n  }, mdx(\"mi\", {\n    parentName: \"mrow\"\n  }, \"R\")), mdx(\"annotation\", {\n    parentName: \"semantics\",\n    \"encoding\": \"application/x-tex\"\n  }, \"R\")))), mdx(\"span\", {\n    parentName: \"span\",\n    \"className\": \"katex-html\",\n    \"aria-hidden\": \"true\"\n  }, mdx(\"span\", {\n    parentName: \"span\",\n    \"className\": \"base\"\n  }, mdx(\"span\", {\n    parentName: \"span\",\n    \"className\": \"strut\",\n    \"style\": {\n      \"height\": \"0.68333em\",\n      \"verticalAlign\": \"0em\"\n    }\n  }), mdx(\"span\", {\n    parentName: \"span\",\n    \"className\": \"mord mathnormal\",\n    \"style\": {\n      \"marginRight\": \"0.00773em\"\n    }\n  }, \"R\")))))), mdx(\"li\", {\n    parentName: \"ul\"\n  }, \"A finite set \", mdx(\"span\", {\n    parentName: \"li\",\n    \"className\": \"math math-inline\"\n  }, mdx(\"span\", {\n    parentName: \"span\",\n    \"className\": \"katex\"\n  }, mdx(\"span\", {\n    parentName: \"span\",\n    \"className\": \"katex-mathml\"\n  }, mdx(\"math\", {\n    parentName: \"span\",\n    \"xmlns\": \"http://www.w3.org/1998/Math/MathML\"\n  }, mdx(\"semantics\", {\n    parentName: \"math\"\n  }, mdx(\"mrow\", {\n    parentName: \"semantics\"\n  }, mdx(\"mi\", {\n    parentName: \"mrow\"\n  }, \"Y\")), mdx(\"annotation\", {\n    parentName: \"semantics\",\n    \"encoding\": \"application/x-tex\"\n  }, \"Y\")))), mdx(\"span\", {\n    parentName: \"span\",\n    \"className\": \"katex-html\",\n    \"aria-hidden\": \"true\"\n  }, mdx(\"span\", {\n    parentName: \"span\",\n    \"className\": \"base\"\n  }, mdx(\"span\", {\n    parentName: \"span\",\n    \"className\": \"strut\",\n    \"style\": {\n      \"height\": \"0.68333em\",\n      \"verticalAlign\": \"0em\"\n    }\n  }), mdx(\"span\", {\n    parentName: \"span\",\n    \"className\": \"mord mathnormal\",\n    \"style\": {\n      \"marginRight\": \"0.22222em\"\n    }\n  }, \"Y\"))))), \" that generates \", mdx(\"span\", {\n    parentName: \"li\",\n    \"className\": \"math math-inline\"\n  }, mdx(\"span\", {\n    parentName: \"span\",\n    \"className\": \"katex\"\n  }, mdx(\"span\", {\n    parentName: \"span\",\n    \"className\": \"katex-mathml\"\n  }, mdx(\"math\", {\n    parentName: \"span\",\n    \"xmlns\": \"http://www.w3.org/1998/Math/MathML\"\n  }, mdx(\"semantics\", {\n    parentName: \"math\"\n  }, mdx(\"mrow\", {\n    parentName: \"semantics\"\n  }, mdx(\"mi\", {\n    parentName: \"mrow\"\n  }, \"H\")), mdx(\"annotation\", {\n    parentName: \"semantics\",\n    \"encoding\": \"application/x-tex\"\n  }, \"H\")))), mdx(\"span\", {\n    parentName: \"span\",\n    \"className\": \"katex-html\",\n    \"aria-hidden\": \"true\"\n  }, mdx(\"span\", {\n    parentName: \"span\",\n    \"className\": \"base\"\n  }, mdx(\"span\", {\n    parentName: \"span\",\n    \"className\": \"strut\",\n    \"style\": {\n      \"height\": \"0.68333em\",\n      \"verticalAlign\": \"0em\"\n    }\n  }), mdx(\"span\", {\n    parentName: \"span\",\n    \"className\": \"mord mathnormal\",\n    \"style\": {\n      \"marginRight\": \"0.08125em\"\n    }\n  }, \"H\"))))), \", a subgroup of \", mdx(\"span\", {\n    parentName: \"li\",\n    \"className\": \"math math-inline\"\n  }, mdx(\"span\", {\n    parentName: \"span\",\n    \"className\": \"katex\"\n  }, mdx(\"span\", {\n    parentName: \"span\",\n    \"className\": \"katex-mathml\"\n  }, mdx(\"math\", {\n    parentName: \"span\",\n    \"xmlns\": \"http://www.w3.org/1998/Math/MathML\"\n  }, mdx(\"semantics\", {\n    parentName: \"math\"\n  }, mdx(\"mrow\", {\n    parentName: \"semantics\"\n  }, mdx(\"mi\", {\n    parentName: \"mrow\"\n  }, \"G\")), mdx(\"annotation\", {\n    parentName: \"semantics\",\n    \"encoding\": \"application/x-tex\"\n  }, \"G\")))), mdx(\"span\", {\n    parentName: \"span\",\n    \"className\": \"katex-html\",\n    \"aria-hidden\": \"true\"\n  }, mdx(\"span\", {\n    parentName: \"span\",\n    \"className\": \"base\"\n  }, mdx(\"span\", {\n    parentName: \"span\",\n    \"className\": \"strut\",\n    \"style\": {\n      \"height\": \"0.68333em\",\n      \"verticalAlign\": \"0em\"\n    }\n  }), mdx(\"span\", {\n    parentName: \"span\",\n    \"className\": \"mord mathnormal\"\n  }, \"G\"))))))), mdx(\"p\", null, \"The output of the algorithm is the Schreier graph for the set of left cosets of \", mdx(\"span\", {\n    parentName: \"p\",\n    \"className\": \"math math-inline\"\n  }, mdx(\"span\", {\n    parentName: \"span\",\n    \"className\": \"katex\"\n  }, mdx(\"span\", {\n    parentName: \"span\",\n    \"className\": \"katex-mathml\"\n  }, mdx(\"math\", {\n    parentName: \"span\",\n    \"xmlns\": \"http://www.w3.org/1998/Math/MathML\"\n  }, mdx(\"semantics\", {\n    parentName: \"math\"\n  }, mdx(\"mrow\", {\n    parentName: \"semantics\"\n  }, mdx(\"mi\", {\n    parentName: \"mrow\"\n  }, \"H\")), mdx(\"annotation\", {\n    parentName: \"semantics\",\n    \"encoding\": \"application/x-tex\"\n  }, \"H\")))), mdx(\"span\", {\n    parentName: \"span\",\n    \"className\": \"katex-html\",\n    \"aria-hidden\": \"true\"\n  }, mdx(\"span\", {\n    parentName: \"span\",\n    \"className\": \"base\"\n  }, mdx(\"span\", {\n    parentName: \"span\",\n    \"className\": \"strut\",\n    \"style\": {\n      \"height\": \"0.68333em\",\n      \"verticalAlign\": \"0em\"\n    }\n  }), mdx(\"span\", {\n    parentName: \"span\",\n    \"className\": \"mord mathnormal\",\n    \"style\": {\n      \"marginRight\": \"0.08125em\"\n    }\n  }, \"H\"))))), \" in \", mdx(\"span\", {\n    parentName: \"p\",\n    \"className\": \"math math-inline\"\n  }, mdx(\"span\", {\n    parentName: \"span\",\n    \"className\": \"katex\"\n  }, mdx(\"span\", {\n    parentName: \"span\",\n    \"className\": \"katex-mathml\"\n  }, mdx(\"math\", {\n    parentName: \"span\",\n    \"xmlns\": \"http://www.w3.org/1998/Math/MathML\"\n  }, mdx(\"semantics\", {\n    parentName: \"math\"\n  }, mdx(\"mrow\", {\n    parentName: \"semantics\"\n  }, mdx(\"mi\", {\n    parentName: \"mrow\"\n  }, \"G\")), mdx(\"annotation\", {\n    parentName: \"semantics\",\n    \"encoding\": \"application/x-tex\"\n  }, \"G\")))), mdx(\"span\", {\n    parentName: \"span\",\n    \"className\": \"katex-html\",\n    \"aria-hidden\": \"true\"\n  }, mdx(\"span\", {\n    parentName: \"span\",\n    \"className\": \"base\"\n  }, mdx(\"span\", {\n    parentName: \"span\",\n    \"className\": \"strut\",\n    \"style\": {\n      \"height\": \"0.68333em\",\n      \"verticalAlign\": \"0em\"\n    }\n  }), mdx(\"span\", {\n    parentName: \"span\",\n    \"className\": \"mord mathnormal\"\n  }, \"G\"))))), \", \", mdx(\"span\", {\n    parentName: \"p\",\n    \"className\": \"math math-inline\"\n  }, mdx(\"span\", {\n    parentName: \"span\",\n    \"className\": \"katex\"\n  }, mdx(\"span\", {\n    parentName: \"span\",\n    \"className\": \"katex-mathml\"\n  }, mdx(\"math\", {\n    parentName: \"span\",\n    \"xmlns\": \"http://www.w3.org/1998/Math/MathML\"\n  }, mdx(\"semantics\", {\n    parentName: \"math\"\n  }, mdx(\"mrow\", {\n    parentName: \"semantics\"\n  }, mdx(\"mi\", {\n    parentName: \"mrow\"\n  }, \"G\"), mdx(\"mi\", {\n    parentName: \"mrow\",\n    \"mathvariant\": \"normal\"\n  }, \"/\"), mdx(\"mi\", {\n    parentName: \"mrow\"\n  }, \"H\")), mdx(\"annotation\", {\n    parentName: \"semantics\",\n    \"encoding\": \"application/x-tex\"\n  }, \"G/H\")))), mdx(\"span\", {\n    parentName: \"span\",\n    \"className\": \"katex-html\",\n    \"aria-hidden\": \"true\"\n  }, mdx(\"span\", {\n    parentName: \"span\",\n    \"className\": \"base\"\n  }, mdx(\"span\", {\n    parentName: \"span\",\n    \"className\": \"strut\",\n    \"style\": {\n      \"height\": \"1em\",\n      \"verticalAlign\": \"-0.25em\"\n    }\n  }), mdx(\"span\", {\n    parentName: \"span\",\n    \"className\": \"mord mathnormal\"\n  }, \"G\"), mdx(\"span\", {\n    parentName: \"span\",\n    \"className\": \"mord\"\n  }, \"/\"), mdx(\"span\", {\n    parentName: \"span\",\n    \"className\": \"mord mathnormal\",\n    \"style\": {\n      \"marginRight\": \"0.08125em\"\n    }\n  }, \"H\"))))), \", with the following group action.\"), mdx(\"div\", {\n    \"className\": \"math math-display\"\n  }, mdx(\"span\", {\n    parentName: \"div\",\n    \"className\": \"katex-display\"\n  }, mdx(\"span\", {\n    parentName: \"span\",\n    \"className\": \"katex\"\n  }, mdx(\"span\", {\n    parentName: \"span\",\n    \"className\": \"katex-mathml\"\n  }, mdx(\"math\", {\n    parentName: \"span\",\n    \"xmlns\": \"http://www.w3.org/1998/Math/MathML\",\n    \"display\": \"block\"\n  }, mdx(\"semantics\", {\n    parentName: \"math\"\n  }, mdx(\"mrow\", {\n    parentName: \"semantics\"\n  }, mdx(\"mi\", {\n    parentName: \"mrow\"\n  }, \"\\u03B1\"), mdx(\"mo\", {\n    parentName: \"mrow\"\n  }, \":\"), mdx(\"mi\", {\n    parentName: \"mrow\"\n  }, \"G\"), mdx(\"mo\", {\n    parentName: \"mrow\"\n  }, \"\\xD7\"), mdx(\"mi\", {\n    parentName: \"mrow\"\n  }, \"G\"), mdx(\"mi\", {\n    parentName: \"mrow\",\n    \"mathvariant\": \"normal\"\n  }, \"/\"), mdx(\"mi\", {\n    parentName: \"mrow\"\n  }, \"H\"), mdx(\"mo\", {\n    parentName: \"mrow\"\n  }, \"\\u2192\"), mdx(\"mi\", {\n    parentName: \"mrow\"\n  }, \"G\"), mdx(\"mi\", {\n    parentName: \"mrow\",\n    \"mathvariant\": \"normal\"\n  }, \"/\"), mdx(\"mi\", {\n    parentName: \"mrow\"\n  }, \"H\")), mdx(\"annotation\", {\n    parentName: \"semantics\",\n    \"encoding\": \"application/x-tex\"\n  }, \"\\\\alpha: G \\\\times G/H \\\\rightarrow G/H\")))), mdx(\"span\", {\n    parentName: \"span\",\n    \"className\": \"katex-html\",\n    \"aria-hidden\": \"true\"\n  }, mdx(\"span\", {\n    parentName: \"span\",\n    \"className\": \"base\"\n  }, mdx(\"span\", {\n    parentName: \"span\",\n    \"className\": \"strut\",\n    \"style\": {\n      \"height\": \"0.43056em\",\n      \"verticalAlign\": \"0em\"\n    }\n  }), mdx(\"span\", {\n    parentName: \"span\",\n    \"className\": \"mord mathnormal\",\n    \"style\": {\n      \"marginRight\": \"0.0037em\"\n    }\n  }, \"\\u03B1\"), mdx(\"span\", {\n    parentName: \"span\",\n    \"className\": \"mspace\",\n    \"style\": {\n      \"marginRight\": \"0.2777777777777778em\"\n    }\n  }), mdx(\"span\", {\n    parentName: \"span\",\n    \"className\": \"mrel\"\n  }, \":\"), mdx(\"span\", {\n    parentName: \"span\",\n    \"className\": \"mspace\",\n    \"style\": {\n      \"marginRight\": \"0.2777777777777778em\"\n    }\n  })), mdx(\"span\", {\n    parentName: \"span\",\n    \"className\": \"base\"\n  }, mdx(\"span\", {\n    parentName: \"span\",\n    \"className\": \"strut\",\n    \"style\": {\n      \"height\": \"0.76666em\",\n      \"verticalAlign\": \"-0.08333em\"\n    }\n  }), mdx(\"span\", {\n    parentName: \"span\",\n    \"className\": \"mord mathnormal\"\n  }, \"G\"), mdx(\"span\", {\n    parentName: \"span\",\n    \"className\": \"mspace\",\n    \"style\": {\n      \"marginRight\": \"0.2222222222222222em\"\n    }\n  }), mdx(\"span\", {\n    parentName: \"span\",\n    \"className\": \"mbin\"\n  }, \"\\xD7\"), mdx(\"span\", {\n    parentName: \"span\",\n    \"className\": \"mspace\",\n    \"style\": {\n      \"marginRight\": \"0.2222222222222222em\"\n    }\n  })), mdx(\"span\", {\n    parentName: \"span\",\n    \"className\": \"base\"\n  }, mdx(\"span\", {\n    parentName: \"span\",\n    \"className\": \"strut\",\n    \"style\": {\n      \"height\": \"1em\",\n      \"verticalAlign\": \"-0.25em\"\n    }\n  }), mdx(\"span\", {\n    parentName: \"span\",\n    \"className\": \"mord mathnormal\"\n  }, \"G\"), mdx(\"span\", {\n    parentName: \"span\",\n    \"className\": \"mord\"\n  }, \"/\"), mdx(\"span\", {\n    parentName: \"span\",\n    \"className\": \"mord mathnormal\",\n    \"style\": {\n      \"marginRight\": \"0.08125em\"\n    }\n  }, \"H\"), mdx(\"span\", {\n    parentName: \"span\",\n    \"className\": \"mspace\",\n    \"style\": {\n      \"marginRight\": \"0.2777777777777778em\"\n    }\n  }), mdx(\"span\", {\n    parentName: \"span\",\n    \"className\": \"mrel\"\n  }, \"\\u2192\"), mdx(\"span\", {\n    parentName: \"span\",\n    \"className\": \"mspace\",\n    \"style\": {\n      \"marginRight\": \"0.2777777777777778em\"\n    }\n  })), mdx(\"span\", {\n    parentName: \"span\",\n    \"className\": \"base\"\n  }, mdx(\"span\", {\n    parentName: \"span\",\n    \"className\": \"strut\",\n    \"style\": {\n      \"height\": \"1em\",\n      \"verticalAlign\": \"-0.25em\"\n    }\n  }), mdx(\"span\", {\n    parentName: \"span\",\n    \"className\": \"mord mathnormal\"\n  }, \"G\"), mdx(\"span\", {\n    parentName: \"span\",\n    \"className\": \"mord\"\n  }, \"/\"), mdx(\"span\", {\n    parentName: \"span\",\n    \"className\": \"mord mathnormal\",\n    \"style\": {\n      \"marginRight\": \"0.08125em\"\n    }\n  }, \"H\")))))), mdx(\"div\", {\n    \"className\": \"math math-display\"\n  }, mdx(\"span\", {\n    parentName: \"div\",\n    \"className\": \"katex-display\"\n  }, mdx(\"span\", {\n    parentName: \"span\",\n    \"className\": \"katex\"\n  }, mdx(\"span\", {\n    parentName: \"span\",\n    \"className\": \"katex-mathml\"\n  }, mdx(\"math\", {\n    parentName: \"span\",\n    \"xmlns\": \"http://www.w3.org/1998/Math/MathML\",\n    \"display\": \"block\"\n  }, mdx(\"semantics\", {\n    parentName: \"math\"\n  }, mdx(\"mrow\", {\n    parentName: \"semantics\"\n  }, mdx(\"mi\", {\n    parentName: \"mrow\"\n  }, \"\\u03B1\"), mdx(\"mo\", {\n    parentName: \"mrow\",\n    \"stretchy\": \"false\"\n  }, \"(\"), mdx(\"msub\", {\n    parentName: \"mrow\"\n  }, mdx(\"mi\", {\n    parentName: \"msub\"\n  }, \"g\"), mdx(\"mn\", {\n    parentName: \"msub\"\n  }, \"1\")), mdx(\"mo\", {\n    parentName: \"mrow\",\n    \"separator\": \"true\"\n  }, \",\"), mdx(\"msub\", {\n    parentName: \"mrow\"\n  }, mdx(\"mi\", {\n    parentName: \"msub\"\n  }, \"g\"), mdx(\"mn\", {\n    parentName: \"msub\"\n  }, \"2\")), mdx(\"mi\", {\n    parentName: \"mrow\"\n  }, \"H\"), mdx(\"mo\", {\n    parentName: \"mrow\",\n    \"stretchy\": \"false\"\n  }, \")\"), mdx(\"mo\", {\n    parentName: \"mrow\"\n  }, \"=\"), mdx(\"mo\", {\n    parentName: \"mrow\",\n    \"stretchy\": \"false\"\n  }, \"(\"), mdx(\"msub\", {\n    parentName: \"mrow\"\n  }, mdx(\"mi\", {\n    parentName: \"msub\"\n  }, \"g\"), mdx(\"mn\", {\n    parentName: \"msub\"\n  }, \"1\")), mdx(\"msub\", {\n    parentName: \"mrow\"\n  }, mdx(\"mi\", {\n    parentName: \"msub\"\n  }, \"g\"), mdx(\"mn\", {\n    parentName: \"msub\"\n  }, \"2\")), mdx(\"mo\", {\n    parentName: \"mrow\",\n    \"stretchy\": \"false\"\n  }, \")\"), mdx(\"mi\", {\n    parentName: \"mrow\"\n  }, \"H\")), mdx(\"annotation\", {\n    parentName: \"semantics\",\n    \"encoding\": \"application/x-tex\"\n  }, \"\\\\alpha(g_1, g_2H) = (g_1g_2)H\")))), mdx(\"span\", {\n    parentName: \"span\",\n    \"className\": \"katex-html\",\n    \"aria-hidden\": \"true\"\n  }, mdx(\"span\", {\n    parentName: \"span\",\n    \"className\": \"base\"\n  }, mdx(\"span\", {\n    parentName: \"span\",\n    \"className\": \"strut\",\n    \"style\": {\n      \"height\": \"1em\",\n      \"verticalAlign\": \"-0.25em\"\n    }\n  }), mdx(\"span\", {\n    parentName: \"span\",\n    \"className\": \"mord mathnormal\",\n    \"style\": {\n      \"marginRight\": \"0.0037em\"\n    }\n  }, \"\\u03B1\"), mdx(\"span\", {\n    parentName: \"span\",\n    \"className\": \"mopen\"\n  }, \"(\"), mdx(\"span\", {\n    parentName: \"span\",\n    \"className\": \"mord\"\n  }, mdx(\"span\", {\n    parentName: \"span\",\n    \"className\": \"mord mathnormal\",\n    \"style\": {\n      \"marginRight\": \"0.03588em\"\n    }\n  }, \"g\"), mdx(\"span\", {\n    parentName: \"span\",\n    \"className\": \"msupsub\"\n  }, mdx(\"span\", {\n    parentName: \"span\",\n    \"className\": \"vlist-t vlist-t2\"\n  }, mdx(\"span\", {\n    parentName: \"span\",\n    \"className\": \"vlist-r\"\n  }, mdx(\"span\", {\n    parentName: \"span\",\n    \"className\": \"vlist\",\n    \"style\": {\n      \"height\": \"0.30110799999999993em\"\n    }\n  }, mdx(\"span\", {\n    parentName: \"span\",\n    \"style\": {\n      \"top\": \"-2.5500000000000003em\",\n      \"marginLeft\": \"-0.03588em\",\n      \"marginRight\": \"0.05em\"\n    }\n  }, mdx(\"span\", {\n    parentName: \"span\",\n    \"className\": \"pstrut\",\n    \"style\": {\n      \"height\": \"2.7em\"\n    }\n  }), mdx(\"span\", {\n    parentName: \"span\",\n    \"className\": \"sizing reset-size6 size3 mtight\"\n  }, mdx(\"span\", {\n    parentName: \"span\",\n    \"className\": \"mord mtight\"\n  }, \"1\")))), mdx(\"span\", {\n    parentName: \"span\",\n    \"className\": \"vlist-s\"\n  }, \"\\u200B\")), mdx(\"span\", {\n    parentName: \"span\",\n    \"className\": \"vlist-r\"\n  }, mdx(\"span\", {\n    parentName: \"span\",\n    \"className\": \"vlist\",\n    \"style\": {\n      \"height\": \"0.15em\"\n    }\n  }, mdx(\"span\", {\n    parentName: \"span\"\n  })))))), mdx(\"span\", {\n    parentName: \"span\",\n    \"className\": \"mpunct\"\n  }, \",\"), mdx(\"span\", {\n    parentName: \"span\",\n    \"className\": \"mspace\",\n    \"style\": {\n      \"marginRight\": \"0.16666666666666666em\"\n    }\n  }), mdx(\"span\", {\n    parentName: \"span\",\n    \"className\": \"mord\"\n  }, mdx(\"span\", {\n    parentName: \"span\",\n    \"className\": \"mord mathnormal\",\n    \"style\": {\n      \"marginRight\": \"0.03588em\"\n    }\n  }, \"g\"), mdx(\"span\", {\n    parentName: \"span\",\n    \"className\": \"msupsub\"\n  }, mdx(\"span\", {\n    parentName: \"span\",\n    \"className\": \"vlist-t vlist-t2\"\n  }, mdx(\"span\", {\n    parentName: \"span\",\n    \"className\": \"vlist-r\"\n  }, mdx(\"span\", {\n    parentName: \"span\",\n    \"className\": \"vlist\",\n    \"style\": {\n      \"height\": \"0.30110799999999993em\"\n    }\n  }, mdx(\"span\", {\n    parentName: \"span\",\n    \"style\": {\n      \"top\": \"-2.5500000000000003em\",\n      \"marginLeft\": \"-0.03588em\",\n      \"marginRight\": \"0.05em\"\n    }\n  }, mdx(\"span\", {\n    parentName: \"span\",\n    \"className\": \"pstrut\",\n    \"style\": {\n      \"height\": \"2.7em\"\n    }\n  }), mdx(\"span\", {\n    parentName: \"span\",\n    \"className\": \"sizing reset-size6 size3 mtight\"\n  }, mdx(\"span\", {\n    parentName: \"span\",\n    \"className\": \"mord mtight\"\n  }, \"2\")))), mdx(\"span\", {\n    parentName: \"span\",\n    \"className\": \"vlist-s\"\n  }, \"\\u200B\")), mdx(\"span\", {\n    parentName: \"span\",\n    \"className\": \"vlist-r\"\n  }, mdx(\"span\", {\n    parentName: \"span\",\n    \"className\": \"vlist\",\n    \"style\": {\n      \"height\": \"0.15em\"\n    }\n  }, mdx(\"span\", {\n    parentName: \"span\"\n  })))))), mdx(\"span\", {\n    parentName: \"span\",\n    \"className\": \"mord mathnormal\",\n    \"style\": {\n      \"marginRight\": \"0.08125em\"\n    }\n  }, \"H\"), mdx(\"span\", {\n    parentName: \"span\",\n    \"className\": \"mclose\"\n  }, \")\"), mdx(\"span\", {\n    parentName: \"span\",\n    \"className\": \"mspace\",\n    \"style\": {\n      \"marginRight\": \"0.2777777777777778em\"\n    }\n  }), mdx(\"span\", {\n    parentName: \"span\",\n    \"className\": \"mrel\"\n  }, \"=\"), mdx(\"span\", {\n    parentName: \"span\",\n    \"className\": \"mspace\",\n    \"style\": {\n      \"marginRight\": \"0.2777777777777778em\"\n    }\n  })), mdx(\"span\", {\n    parentName: \"span\",\n    \"className\": \"base\"\n  }, mdx(\"span\", {\n    parentName: \"span\",\n    \"className\": \"strut\",\n    \"style\": {\n      \"height\": \"1em\",\n      \"verticalAlign\": \"-0.25em\"\n    }\n  }), mdx(\"span\", {\n    parentName: \"span\",\n    \"className\": \"mopen\"\n  }, \"(\"), mdx(\"span\", {\n    parentName: \"span\",\n    \"className\": \"mord\"\n  }, mdx(\"span\", {\n    parentName: \"span\",\n    \"className\": \"mord mathnormal\",\n    \"style\": {\n      \"marginRight\": \"0.03588em\"\n    }\n  }, \"g\"), mdx(\"span\", {\n    parentName: \"span\",\n    \"className\": \"msupsub\"\n  }, mdx(\"span\", {\n    parentName: \"span\",\n    \"className\": \"vlist-t vlist-t2\"\n  }, mdx(\"span\", {\n    parentName: \"span\",\n    \"className\": \"vlist-r\"\n  }, mdx(\"span\", {\n    parentName: \"span\",\n    \"className\": \"vlist\",\n    \"style\": {\n      \"height\": \"0.30110799999999993em\"\n    }\n  }, mdx(\"span\", {\n    parentName: \"span\",\n    \"style\": {\n      \"top\": \"-2.5500000000000003em\",\n      \"marginLeft\": \"-0.03588em\",\n      \"marginRight\": \"0.05em\"\n    }\n  }, mdx(\"span\", {\n    parentName: \"span\",\n    \"className\": \"pstrut\",\n    \"style\": {\n      \"height\": \"2.7em\"\n    }\n  }), mdx(\"span\", {\n    parentName: \"span\",\n    \"className\": \"sizing reset-size6 size3 mtight\"\n  }, mdx(\"span\", {\n    parentName: \"span\",\n    \"className\": \"mord mtight\"\n  }, \"1\")))), mdx(\"span\", {\n    parentName: \"span\",\n    \"className\": \"vlist-s\"\n  }, \"\\u200B\")), mdx(\"span\", {\n    parentName: \"span\",\n    \"className\": \"vlist-r\"\n  }, mdx(\"span\", {\n    parentName: \"span\",\n    \"className\": \"vlist\",\n    \"style\": {\n      \"height\": \"0.15em\"\n    }\n  }, mdx(\"span\", {\n    parentName: \"span\"\n  })))))), mdx(\"span\", {\n    parentName: \"span\",\n    \"className\": \"mord\"\n  }, mdx(\"span\", {\n    parentName: \"span\",\n    \"className\": \"mord mathnormal\",\n    \"style\": {\n      \"marginRight\": \"0.03588em\"\n    }\n  }, \"g\"), mdx(\"span\", {\n    parentName: \"span\",\n    \"className\": \"msupsub\"\n  }, mdx(\"span\", {\n    parentName: \"span\",\n    \"className\": \"vlist-t vlist-t2\"\n  }, mdx(\"span\", {\n    parentName: \"span\",\n    \"className\": \"vlist-r\"\n  }, mdx(\"span\", {\n    parentName: \"span\",\n    \"className\": \"vlist\",\n    \"style\": {\n      \"height\": \"0.30110799999999993em\"\n    }\n  }, mdx(\"span\", {\n    parentName: \"span\",\n    \"style\": {\n      \"top\": \"-2.5500000000000003em\",\n      \"marginLeft\": \"-0.03588em\",\n      \"marginRight\": \"0.05em\"\n    }\n  }, mdx(\"span\", {\n    parentName: \"span\",\n    \"className\": \"pstrut\",\n    \"style\": {\n      \"height\": \"2.7em\"\n    }\n  }), mdx(\"span\", {\n    parentName: \"span\",\n    \"className\": \"sizing reset-size6 size3 mtight\"\n  }, mdx(\"span\", {\n    parentName: \"span\",\n    \"className\": \"mord mtight\"\n  }, \"2\")))), mdx(\"span\", {\n    parentName: \"span\",\n    \"className\": \"vlist-s\"\n  }, \"\\u200B\")), mdx(\"span\", {\n    parentName: \"span\",\n    \"className\": \"vlist-r\"\n  }, mdx(\"span\", {\n    parentName: \"span\",\n    \"className\": \"vlist\",\n    \"style\": {\n      \"height\": \"0.15em\"\n    }\n  }, mdx(\"span\", {\n    parentName: \"span\"\n  })))))), mdx(\"span\", {\n    parentName: \"span\",\n    \"className\": \"mclose\"\n  }, \")\"), mdx(\"span\", {\n    parentName: \"span\",\n    \"className\": \"mord mathnormal\",\n    \"style\": {\n      \"marginRight\": \"0.08125em\"\n    }\n  }, \"H\")))))), mdx(\"h3\", {\n    \"id\": \"the-procedure\",\n    \"style\": {\n      \"position\": \"relative\"\n    }\n  }, mdx(\"a\", {\n    parentName: \"h3\",\n    \"href\": \"#the-procedure\",\n    \"aria-label\": \"the procedure permalink\",\n    \"className\": \"anchor before\"\n  }, mdx(\"svg\", {\n    parentName: \"a\",\n    \"aria-hidden\": \"true\",\n    \"focusable\": \"false\",\n    \"height\": \"16\",\n    \"version\": \"1.1\",\n    \"viewBox\": \"0 0 16 16\",\n    \"width\": \"16\"\n  }, mdx(\"path\", {\n    parentName: \"svg\",\n    \"fillRule\": \"evenodd\",\n    \"d\": \"M4 9h1v1H4c-1.5 0-3-1.69-3-3.5S2.55 3 4 3h4c1.45 0 3 1.69 3 3.5 0 1.41-.91 2.72-2 3.25V8.59c.58-.45 1-1.27 1-2.09C10 5.22 8.98 4 8 4H4c-.98 0-2 1.22-2 2.5S3 9 4 9zm9-3h-1v1h1c1 0 2 1.22 2 2.5S13.98 12 13 12H9c-.98 0-2-1.22-2-2.5 0-.83.42-1.64 1-2.09V6.25c-1.09.53-2 1.84-2 3.25C6 11.31 7.55 13 9 13h4c1.45 0 3-1.69 3-3.5S14.5 6 13 6z\"\n  }))), \"The Procedure\"), mdx(\"p\", null, \"From a theoretical standpoint, we start with the Schreier graph for the free group generated by \", mdx(\"span\", {\n    parentName: \"p\",\n    \"className\": \"math math-inline\"\n  }, mdx(\"span\", {\n    parentName: \"span\",\n    \"className\": \"katex\"\n  }, mdx(\"span\", {\n    parentName: \"span\",\n    \"className\": \"katex-mathml\"\n  }, mdx(\"math\", {\n    parentName: \"span\",\n    \"xmlns\": \"http://www.w3.org/1998/Math/MathML\"\n  }, mdx(\"semantics\", {\n    parentName: \"math\"\n  }, mdx(\"mrow\", {\n    parentName: \"semantics\"\n  }, mdx(\"mi\", {\n    parentName: \"mrow\"\n  }, \"X\")), mdx(\"annotation\", {\n    parentName: \"semantics\",\n    \"encoding\": \"application/x-tex\"\n  }, \"X\")))), mdx(\"span\", {\n    parentName: \"span\",\n    \"className\": \"katex-html\",\n    \"aria-hidden\": \"true\"\n  }, mdx(\"span\", {\n    parentName: \"span\",\n    \"className\": \"base\"\n  }, mdx(\"span\", {\n    parentName: \"span\",\n    \"className\": \"strut\",\n    \"style\": {\n      \"height\": \"0.68333em\",\n      \"verticalAlign\": \"0em\"\n    }\n  }), mdx(\"span\", {\n    parentName: \"span\",\n    \"className\": \"mord mathnormal\",\n    \"style\": {\n      \"marginRight\": \"0.07847em\"\n    }\n  }, \"X\"))))), \". It need not (and indeed cannot, since it is infinite) be entirely represented in memory. Then, we follow the steps below.\"), mdx(\"ol\", null, mdx(\"li\", {\n    parentName: \"ol\"\n  }, mdx(\"p\", {\n    parentName: \"li\"\n  }, \"Label the vertex corresponding to the coset \", mdx(\"span\", {\n    parentName: \"p\",\n    \"className\": \"math math-inline\"\n  }, mdx(\"span\", {\n    parentName: \"span\",\n    \"className\": \"katex\"\n  }, mdx(\"span\", {\n    parentName: \"span\",\n    \"className\": \"katex-mathml\"\n  }, mdx(\"math\", {\n    parentName: \"span\",\n    \"xmlns\": \"http://www.w3.org/1998/Math/MathML\"\n  }, mdx(\"semantics\", {\n    parentName: \"math\"\n  }, mdx(\"mrow\", {\n    parentName: \"semantics\"\n  }, mdx(\"mi\", {\n    parentName: \"mrow\"\n  }, \"H\")), mdx(\"annotation\", {\n    parentName: \"semantics\",\n    \"encoding\": \"application/x-tex\"\n  }, \"H\")))), mdx(\"span\", {\n    parentName: \"span\",\n    \"className\": \"katex-html\",\n    \"aria-hidden\": \"true\"\n  }, mdx(\"span\", {\n    parentName: \"span\",\n    \"className\": \"base\"\n  }, mdx(\"span\", {\n    parentName: \"span\",\n    \"className\": \"strut\",\n    \"style\": {\n      \"height\": \"0.68333em\",\n      \"verticalAlign\": \"0em\"\n    }\n  }), mdx(\"span\", {\n    parentName: \"span\",\n    \"className\": \"mord mathnormal\",\n    \"style\": {\n      \"marginRight\": \"0.08125em\"\n    }\n  }, \"H\"))))), \" with the label \", mdx(\"span\", {\n    parentName: \"p\",\n    \"className\": \"math math-inline\"\n  }, mdx(\"span\", {\n    parentName: \"span\",\n    \"className\": \"katex\"\n  }, mdx(\"span\", {\n    parentName: \"span\",\n    \"className\": \"katex-mathml\"\n  }, mdx(\"math\", {\n    parentName: \"span\",\n    \"xmlns\": \"http://www.w3.org/1998/Math/MathML\"\n  }, mdx(\"semantics\", {\n    parentName: \"math\"\n  }, mdx(\"mrow\", {\n    parentName: \"semantics\"\n  }, mdx(\"mn\", {\n    parentName: \"mrow\"\n  }, \"1\")), mdx(\"annotation\", {\n    parentName: \"semantics\",\n    \"encoding\": \"application/x-tex\"\n  }, \"1\")))), mdx(\"span\", {\n    parentName: \"span\",\n    \"className\": \"katex-html\",\n    \"aria-hidden\": \"true\"\n  }, mdx(\"span\", {\n    parentName: \"span\",\n    \"className\": \"base\"\n  }, mdx(\"span\", {\n    parentName: \"span\",\n    \"className\": \"strut\",\n    \"style\": {\n      \"height\": \"0.64444em\",\n      \"verticalAlign\": \"0em\"\n    }\n  }), mdx(\"span\", {\n    parentName: \"span\",\n    \"className\": \"mord\"\n  }, \"1\"))))), \" (this \", mdx(\"em\", {\n    parentName: \"p\"\n  }, \"is\"), \" represented in memory).\")), mdx(\"li\", {\n    parentName: \"ol\"\n  }, mdx(\"p\", {\n    parentName: \"li\"\n  }, \"For each word \", mdx(\"span\", {\n    parentName: \"p\",\n    \"className\": \"math math-inline\"\n  }, mdx(\"span\", {\n    parentName: \"span\",\n    \"className\": \"katex\"\n  }, mdx(\"span\", {\n    parentName: \"span\",\n    \"className\": \"katex-mathml\"\n  }, mdx(\"math\", {\n    parentName: \"span\",\n    \"xmlns\": \"http://www.w3.org/1998/Math/MathML\"\n  }, mdx(\"semantics\", {\n    parentName: \"math\"\n  }, mdx(\"mrow\", {\n    parentName: \"semantics\"\n  }, mdx(\"mi\", {\n    parentName: \"mrow\"\n  }, \"h\"), mdx(\"mo\", {\n    parentName: \"mrow\"\n  }, \"\\u2208\"), mdx(\"mi\", {\n    parentName: \"mrow\"\n  }, \"H\")), mdx(\"annotation\", {\n    parentName: \"semantics\",\n    \"encoding\": \"application/x-tex\"\n  }, \"h \\\\in H\")))), mdx(\"span\", {\n    parentName: \"span\",\n    \"className\": \"katex-html\",\n    \"aria-hidden\": \"true\"\n  }, mdx(\"span\", {\n    parentName: \"span\",\n    \"className\": \"base\"\n  }, mdx(\"span\", {\n    parentName: \"span\",\n    \"className\": \"strut\",\n    \"style\": {\n      \"height\": \"0.73354em\",\n      \"verticalAlign\": \"-0.0391em\"\n    }\n  }), mdx(\"span\", {\n    parentName: \"span\",\n    \"className\": \"mord mathnormal\"\n  }, \"h\"), mdx(\"span\", {\n    parentName: \"span\",\n    \"className\": \"mspace\",\n    \"style\": {\n      \"marginRight\": \"0.2777777777777778em\"\n    }\n  }), mdx(\"span\", {\n    parentName: \"span\",\n    \"className\": \"mrel\"\n  }, \"\\u2208\"), mdx(\"span\", {\n    parentName: \"span\",\n    \"className\": \"mspace\",\n    \"style\": {\n      \"marginRight\": \"0.2777777777777778em\"\n    }\n  })), mdx(\"span\", {\n    parentName: \"span\",\n    \"className\": \"base\"\n  }, mdx(\"span\", {\n    parentName: \"span\",\n    \"className\": \"strut\",\n    \"style\": {\n      \"height\": \"0.68333em\",\n      \"verticalAlign\": \"0em\"\n    }\n  }), mdx(\"span\", {\n    parentName: \"span\",\n    \"className\": \"mord mathnormal\",\n    \"style\": {\n      \"marginRight\": \"0.08125em\"\n    }\n  }, \"H\"))))), \", start at vertex \", mdx(\"span\", {\n    parentName: \"p\",\n    \"className\": \"math math-inline\"\n  }, mdx(\"span\", {\n    parentName: \"span\",\n    \"className\": \"katex\"\n  }, mdx(\"span\", {\n    parentName: \"span\",\n    \"className\": \"katex-mathml\"\n  }, mdx(\"math\", {\n    parentName: \"span\",\n    \"xmlns\": \"http://www.w3.org/1998/Math/MathML\"\n  }, mdx(\"semantics\", {\n    parentName: \"math\"\n  }, mdx(\"mrow\", {\n    parentName: \"semantics\"\n  }, mdx(\"mn\", {\n    parentName: \"mrow\"\n  }, \"1\")), mdx(\"annotation\", {\n    parentName: \"semantics\",\n    \"encoding\": \"application/x-tex\"\n  }, \"1\")))), mdx(\"span\", {\n    parentName: \"span\",\n    \"className\": \"katex-html\",\n    \"aria-hidden\": \"true\"\n  }, mdx(\"span\", {\n    parentName: \"span\",\n    \"className\": \"base\"\n  }, mdx(\"span\", {\n    parentName: \"span\",\n    \"className\": \"strut\",\n    \"style\": {\n      \"height\": \"0.64444em\",\n      \"verticalAlign\": \"0em\"\n    }\n  }), mdx(\"span\", {\n    parentName: \"span\",\n    \"className\": \"mord\"\n  }, \"1\"))))), \" and follow the path defined by \", mdx(\"span\", {\n    parentName: \"p\",\n    \"className\": \"math math-inline\"\n  }, mdx(\"span\", {\n    parentName: \"span\",\n    \"className\": \"katex\"\n  }, mdx(\"span\", {\n    parentName: \"span\",\n    \"className\": \"katex-mathml\"\n  }, mdx(\"math\", {\n    parentName: \"span\",\n    \"xmlns\": \"http://www.w3.org/1998/Math/MathML\"\n  }, mdx(\"semantics\", {\n    parentName: \"math\"\n  }, mdx(\"mrow\", {\n    parentName: \"semantics\"\n  }, mdx(\"mi\", {\n    parentName: \"mrow\"\n  }, \"h\")), mdx(\"annotation\", {\n    parentName: \"semantics\",\n    \"encoding\": \"application/x-tex\"\n  }, \"h\")))), mdx(\"span\", {\n    parentName: \"span\",\n    \"className\": \"katex-html\",\n    \"aria-hidden\": \"true\"\n  }, mdx(\"span\", {\n    parentName: \"span\",\n    \"className\": \"base\"\n  }, mdx(\"span\", {\n    parentName: \"span\",\n    \"className\": \"strut\",\n    \"style\": {\n      \"height\": \"0.69444em\",\n      \"verticalAlign\": \"0em\"\n    }\n  }), mdx(\"span\", {\n    parentName: \"span\",\n    \"className\": \"mord mathnormal\"\n  }, \"h\"))))), \". Give the vertices along this path new labels and \", mdx(\"em\", {\n    parentName: \"p\"\n  }, \"identify\"), \" the vertex at the end with vertex \", mdx(\"span\", {\n    parentName: \"p\",\n    \"className\": \"math math-inline\"\n  }, mdx(\"span\", {\n    parentName: \"span\",\n    \"className\": \"katex\"\n  }, mdx(\"span\", {\n    parentName: \"span\",\n    \"className\": \"katex-mathml\"\n  }, mdx(\"math\", {\n    parentName: \"span\",\n    \"xmlns\": \"http://www.w3.org/1998/Math/MathML\"\n  }, mdx(\"semantics\", {\n    parentName: \"math\"\n  }, mdx(\"mrow\", {\n    parentName: \"semantics\"\n  }, mdx(\"mn\", {\n    parentName: \"mrow\"\n  }, \"1\")), mdx(\"annotation\", {\n    parentName: \"semantics\",\n    \"encoding\": \"application/x-tex\"\n  }, \"1\")))), mdx(\"span\", {\n    parentName: \"span\",\n    \"className\": \"katex-html\",\n    \"aria-hidden\": \"true\"\n  }, mdx(\"span\", {\n    parentName: \"span\",\n    \"className\": \"base\"\n  }, mdx(\"span\", {\n    parentName: \"span\",\n    \"className\": \"strut\",\n    \"style\": {\n      \"height\": \"0.64444em\",\n      \"verticalAlign\": \"0em\"\n    }\n  }), mdx(\"span\", {\n    parentName: \"span\",\n    \"className\": \"mord\"\n  }, \"1\"))))), \".\"))), mdx(\"blockquote\", null, mdx(\"p\", {\n    parentName: \"blockquote\"\n  }, \"To identify two vertices, remove the one with the higher label and then merge its edges with the edges of the other vertex. If there are two outgoing edges with the same label or two incoming edges with the same label, the vertecies at the other end of those edges must also be identified so that we are left with at most one outgoing edge and one incoming edge for each label.\")), mdx(\"ol\", {\n    \"start\": 3\n  }, mdx(\"li\", {\n    parentName: \"ol\"\n  }, \"For each vertex that is labeled or that will be labeled (including the ones that will be labeled during this step), define a path starting at that vertex for each word in \", mdx(\"span\", {\n    parentName: \"li\",\n    \"className\": \"math math-inline\"\n  }, mdx(\"span\", {\n    parentName: \"span\",\n    \"className\": \"katex\"\n  }, mdx(\"span\", {\n    parentName: \"span\",\n    \"className\": \"katex-mathml\"\n  }, mdx(\"math\", {\n    parentName: \"span\",\n    \"xmlns\": \"http://www.w3.org/1998/Math/MathML\"\n  }, mdx(\"semantics\", {\n    parentName: \"math\"\n  }, mdx(\"mrow\", {\n    parentName: \"semantics\"\n  }, mdx(\"mi\", {\n    parentName: \"mrow\"\n  }, \"R\")), mdx(\"annotation\", {\n    parentName: \"semantics\",\n    \"encoding\": \"application/x-tex\"\n  }, \"R\")))), mdx(\"span\", {\n    parentName: \"span\",\n    \"className\": \"katex-html\",\n    \"aria-hidden\": \"true\"\n  }, mdx(\"span\", {\n    parentName: \"span\",\n    \"className\": \"base\"\n  }, mdx(\"span\", {\n    parentName: \"span\",\n    \"className\": \"strut\",\n    \"style\": {\n      \"height\": \"0.68333em\",\n      \"verticalAlign\": \"0em\"\n    }\n  }), mdx(\"span\", {\n    parentName: \"span\",\n    \"className\": \"mord mathnormal\",\n    \"style\": {\n      \"marginRight\": \"0.00773em\"\n    }\n  }, \"R\"))))), \" (so, if \", mdx(\"span\", {\n    parentName: \"li\",\n    \"className\": \"math math-inline\"\n  }, mdx(\"span\", {\n    parentName: \"span\",\n    \"className\": \"katex\"\n  }, mdx(\"span\", {\n    parentName: \"span\",\n    \"className\": \"katex-mathml\"\n  }, mdx(\"math\", {\n    parentName: \"span\",\n    \"xmlns\": \"http://www.w3.org/1998/Math/MathML\"\n  }, mdx(\"semantics\", {\n    parentName: \"math\"\n  }, mdx(\"mrow\", {\n    parentName: \"semantics\"\n  }, mdx(\"mi\", {\n    parentName: \"mrow\"\n  }, \"S\")), mdx(\"annotation\", {\n    parentName: \"semantics\",\n    \"encoding\": \"application/x-tex\"\n  }, \"S\")))), mdx(\"span\", {\n    parentName: \"span\",\n    \"className\": \"katex-html\",\n    \"aria-hidden\": \"true\"\n  }, mdx(\"span\", {\n    parentName: \"span\",\n    \"className\": \"base\"\n  }, mdx(\"span\", {\n    parentName: \"span\",\n    \"className\": \"strut\",\n    \"style\": {\n      \"height\": \"0.68333em\",\n      \"verticalAlign\": \"0em\"\n    }\n  }), mdx(\"span\", {\n    parentName: \"span\",\n    \"className\": \"mord mathnormal\",\n    \"style\": {\n      \"marginRight\": \"0.05764em\"\n    }\n  }, \"S\"))))), \" is the set of all vertices that will eventually be labeled, there should be \", mdx(\"span\", {\n    parentName: \"li\",\n    \"className\": \"math math-inline\"\n  }, mdx(\"span\", {\n    parentName: \"span\",\n    \"className\": \"katex\"\n  }, mdx(\"span\", {\n    parentName: \"span\",\n    \"className\": \"katex-mathml\"\n  }, mdx(\"math\", {\n    parentName: \"span\",\n    \"xmlns\": \"http://www.w3.org/1998/Math/MathML\"\n  }, mdx(\"semantics\", {\n    parentName: \"math\"\n  }, mdx(\"mrow\", {\n    parentName: \"semantics\"\n  }, mdx(\"mi\", {\n    parentName: \"mrow\",\n    \"mathvariant\": \"normal\"\n  }, \"\\u2223\"), mdx(\"mi\", {\n    parentName: \"mrow\"\n  }, \"S\"), mdx(\"mi\", {\n    parentName: \"mrow\",\n    \"mathvariant\": \"normal\"\n  }, \"\\u2223\"), mdx(\"mo\", {\n    parentName: \"mrow\"\n  }, \"\\u22C5\"), mdx(\"mi\", {\n    parentName: \"mrow\",\n    \"mathvariant\": \"normal\"\n  }, \"\\u2223\"), mdx(\"mi\", {\n    parentName: \"mrow\"\n  }, \"R\"), mdx(\"mi\", {\n    parentName: \"mrow\",\n    \"mathvariant\": \"normal\"\n  }, \"\\u2223\")), mdx(\"annotation\", {\n    parentName: \"semantics\",\n    \"encoding\": \"application/x-tex\"\n  }, \"|S|\\\\cdot|R|\")))), mdx(\"span\", {\n    parentName: \"span\",\n    \"className\": \"katex-html\",\n    \"aria-hidden\": \"true\"\n  }, mdx(\"span\", {\n    parentName: \"span\",\n    \"className\": \"base\"\n  }, mdx(\"span\", {\n    parentName: \"span\",\n    \"className\": \"strut\",\n    \"style\": {\n      \"height\": \"1em\",\n      \"verticalAlign\": \"-0.25em\"\n    }\n  }), mdx(\"span\", {\n    parentName: \"span\",\n    \"className\": \"mord\"\n  }, \"\\u2223\"), mdx(\"span\", {\n    parentName: \"span\",\n    \"className\": \"mord mathnormal\",\n    \"style\": {\n      \"marginRight\": \"0.05764em\"\n    }\n  }, \"S\"), mdx(\"span\", {\n    parentName: \"span\",\n    \"className\": \"mord\"\n  }, \"\\u2223\"), mdx(\"span\", {\n    parentName: \"span\",\n    \"className\": \"mspace\",\n    \"style\": {\n      \"marginRight\": \"0.2222222222222222em\"\n    }\n  }), mdx(\"span\", {\n    parentName: \"span\",\n    \"className\": \"mbin\"\n  }, \"\\u22C5\"), mdx(\"span\", {\n    parentName: \"span\",\n    \"className\": \"mspace\",\n    \"style\": {\n      \"marginRight\": \"0.2222222222222222em\"\n    }\n  })), mdx(\"span\", {\n    parentName: \"span\",\n    \"className\": \"base\"\n  }, mdx(\"span\", {\n    parentName: \"span\",\n    \"className\": \"strut\",\n    \"style\": {\n      \"height\": \"1em\",\n      \"verticalAlign\": \"-0.25em\"\n    }\n  }), mdx(\"span\", {\n    parentName: \"span\",\n    \"className\": \"mord\"\n  }, \"\\u2223\"), mdx(\"span\", {\n    parentName: \"span\",\n    \"className\": \"mord mathnormal\",\n    \"style\": {\n      \"marginRight\": \"0.00773em\"\n    }\n  }, \"R\"), mdx(\"span\", {\n    parentName: \"span\",\n    \"className\": \"mord\"\n  }, \"\\u2223\"))))), \" paths in total). Then, for each path \", mdx(\"span\", {\n    parentName: \"li\",\n    \"className\": \"math math-inline\"\n  }, mdx(\"span\", {\n    parentName: \"span\",\n    \"className\": \"katex\"\n  }, mdx(\"span\", {\n    parentName: \"span\",\n    \"className\": \"katex-mathml\"\n  }, mdx(\"math\", {\n    parentName: \"span\",\n    \"xmlns\": \"http://www.w3.org/1998/Math/MathML\"\n  }, mdx(\"semantics\", {\n    parentName: \"math\"\n  }, mdx(\"mrow\", {\n    parentName: \"semantics\"\n  }, mdx(\"mi\", {\n    parentName: \"mrow\"\n  }, \"p\")), mdx(\"annotation\", {\n    parentName: \"semantics\",\n    \"encoding\": \"application/x-tex\"\n  }, \"p\")))), mdx(\"span\", {\n    parentName: \"span\",\n    \"className\": \"katex-html\",\n    \"aria-hidden\": \"true\"\n  }, mdx(\"span\", {\n    parentName: \"span\",\n    \"className\": \"base\"\n  }, mdx(\"span\", {\n    parentName: \"span\",\n    \"className\": \"strut\",\n    \"style\": {\n      \"height\": \"0.625em\",\n      \"verticalAlign\": \"-0.19444em\"\n    }\n  }), mdx(\"span\", {\n    parentName: \"span\",\n    \"className\": \"mord mathnormal\"\n  }, \"p\"))))), \", label the vertices along \", mdx(\"span\", {\n    parentName: \"li\",\n    \"className\": \"math math-inline\"\n  }, mdx(\"span\", {\n    parentName: \"span\",\n    \"className\": \"katex\"\n  }, mdx(\"span\", {\n    parentName: \"span\",\n    \"className\": \"katex-mathml\"\n  }, mdx(\"math\", {\n    parentName: \"span\",\n    \"xmlns\": \"http://www.w3.org/1998/Math/MathML\"\n  }, mdx(\"semantics\", {\n    parentName: \"math\"\n  }, mdx(\"mrow\", {\n    parentName: \"semantics\"\n  }, mdx(\"mi\", {\n    parentName: \"mrow\"\n  }, \"p\")), mdx(\"annotation\", {\n    parentName: \"semantics\",\n    \"encoding\": \"application/x-tex\"\n  }, \"p\")))), mdx(\"span\", {\n    parentName: \"span\",\n    \"className\": \"katex-html\",\n    \"aria-hidden\": \"true\"\n  }, mdx(\"span\", {\n    parentName: \"span\",\n    \"className\": \"base\"\n  }, mdx(\"span\", {\n    parentName: \"span\",\n    \"className\": \"strut\",\n    \"style\": {\n      \"height\": \"0.625em\",\n      \"verticalAlign\": \"-0.19444em\"\n    }\n  }), mdx(\"span\", {\n    parentName: \"span\",\n    \"className\": \"mord mathnormal\"\n  }, \"p\"))))), \" and identify starting point of \", mdx(\"span\", {\n    parentName: \"li\",\n    \"className\": \"math math-inline\"\n  }, mdx(\"span\", {\n    parentName: \"span\",\n    \"className\": \"katex\"\n  }, mdx(\"span\", {\n    parentName: \"span\",\n    \"className\": \"katex-mathml\"\n  }, mdx(\"math\", {\n    parentName: \"span\",\n    \"xmlns\": \"http://www.w3.org/1998/Math/MathML\"\n  }, mdx(\"semantics\", {\n    parentName: \"math\"\n  }, mdx(\"mrow\", {\n    parentName: \"semantics\"\n  }, mdx(\"mi\", {\n    parentName: \"mrow\"\n  }, \"p\")), mdx(\"annotation\", {\n    parentName: \"semantics\",\n    \"encoding\": \"application/x-tex\"\n  }, \"p\")))), mdx(\"span\", {\n    parentName: \"span\",\n    \"className\": \"katex-html\",\n    \"aria-hidden\": \"true\"\n  }, mdx(\"span\", {\n    parentName: \"span\",\n    \"className\": \"base\"\n  }, mdx(\"span\", {\n    parentName: \"span\",\n    \"className\": \"strut\",\n    \"style\": {\n      \"height\": \"0.625em\",\n      \"verticalAlign\": \"-0.19444em\"\n    }\n  }), mdx(\"span\", {\n    parentName: \"span\",\n    \"className\": \"mord mathnormal\"\n  }, \"p\"))))), \" with the endpoint of \", mdx(\"span\", {\n    parentName: \"li\",\n    \"className\": \"math math-inline\"\n  }, mdx(\"span\", {\n    parentName: \"span\",\n    \"className\": \"katex\"\n  }, mdx(\"span\", {\n    parentName: \"span\",\n    \"className\": \"katex-mathml\"\n  }, mdx(\"math\", {\n    parentName: \"span\",\n    \"xmlns\": \"http://www.w3.org/1998/Math/MathML\"\n  }, mdx(\"semantics\", {\n    parentName: \"math\"\n  }, mdx(\"mrow\", {\n    parentName: \"semantics\"\n  }, mdx(\"mi\", {\n    parentName: \"mrow\"\n  }, \"p\")), mdx(\"annotation\", {\n    parentName: \"semantics\",\n    \"encoding\": \"application/x-tex\"\n  }, \"p\")))), mdx(\"span\", {\n    parentName: \"span\",\n    \"className\": \"katex-html\",\n    \"aria-hidden\": \"true\"\n  }, mdx(\"span\", {\n    parentName: \"span\",\n    \"className\": \"base\"\n  }, mdx(\"span\", {\n    parentName: \"span\",\n    \"className\": \"strut\",\n    \"style\": {\n      \"height\": \"0.625em\",\n      \"verticalAlign\": \"-0.19444em\"\n    }\n  }), mdx(\"span\", {\n    parentName: \"span\",\n    \"className\": \"mord mathnormal\"\n  }, \"p\"))))), \".\")), mdx(\"p\", null, \"If and when this final step terminates, we will be left with a Schreier graph for \", mdx(\"span\", {\n    parentName: \"p\",\n    \"className\": \"math math-inline\"\n  }, mdx(\"span\", {\n    parentName: \"span\",\n    \"className\": \"katex\"\n  }, mdx(\"span\", {\n    parentName: \"span\",\n    \"className\": \"katex-mathml\"\n  }, mdx(\"math\", {\n    parentName: \"span\",\n    \"xmlns\": \"http://www.w3.org/1998/Math/MathML\"\n  }, mdx(\"semantics\", {\n    parentName: \"math\"\n  }, mdx(\"mrow\", {\n    parentName: \"semantics\"\n  }, mdx(\"mi\", {\n    parentName: \"mrow\"\n  }, \"G\"), mdx(\"mi\", {\n    parentName: \"mrow\",\n    \"mathvariant\": \"normal\"\n  }, \"/\"), mdx(\"mi\", {\n    parentName: \"mrow\"\n  }, \"H\")), mdx(\"annotation\", {\n    parentName: \"semantics\",\n    \"encoding\": \"application/x-tex\"\n  }, \"G/H\")))), mdx(\"span\", {\n    parentName: \"span\",\n    \"className\": \"katex-html\",\n    \"aria-hidden\": \"true\"\n  }, mdx(\"span\", {\n    parentName: \"span\",\n    \"className\": \"base\"\n  }, mdx(\"span\", {\n    parentName: \"span\",\n    \"className\": \"strut\",\n    \"style\": {\n      \"height\": \"1em\",\n      \"verticalAlign\": \"-0.25em\"\n    }\n  }), mdx(\"span\", {\n    parentName: \"span\",\n    \"className\": \"mord mathnormal\"\n  }, \"G\"), mdx(\"span\", {\n    parentName: \"span\",\n    \"className\": \"mord\"\n  }, \"/\"), mdx(\"span\", {\n    parentName: \"span\",\n    \"className\": \"mord mathnormal\",\n    \"style\": {\n      \"marginRight\": \"0.08125em\"\n    }\n  }, \"H\"))))), \" that is completely labeled.\"), mdx(\"h3\", {\n    \"id\": \"some-observations-1\",\n    \"style\": {\n      \"position\": \"relative\"\n    }\n  }, mdx(\"a\", {\n    parentName: \"h3\",\n    \"href\": \"#some-observations-1\",\n    \"aria-label\": \"some observations 1 permalink\",\n    \"className\": \"anchor before\"\n  }, mdx(\"svg\", {\n    parentName: \"a\",\n    \"aria-hidden\": \"true\",\n    \"focusable\": \"false\",\n    \"height\": \"16\",\n    \"version\": \"1.1\",\n    \"viewBox\": \"0 0 16 16\",\n    \"width\": \"16\"\n  }, mdx(\"path\", {\n    parentName: \"svg\",\n    \"fillRule\": \"evenodd\",\n    \"d\": \"M4 9h1v1H4c-1.5 0-3-1.69-3-3.5S2.55 3 4 3h4c1.45 0 3 1.69 3 3.5 0 1.41-.91 2.72-2 3.25V8.59c.58-.45 1-1.27 1-2.09C10 5.22 8.98 4 8 4H4c-.98 0-2 1.22-2 2.5S3 9 4 9zm9-3h-1v1h1c1 0 2 1.22 2 2.5S13.98 12 13 12H9c-.98 0-2-1.22-2-2.5 0-.83.42-1.64 1-2.09V6.25c-1.09.53-2 1.84-2 3.25C6 11.31 7.55 13 9 13h4c1.45 0 3-1.69 3-3.5S14.5 6 13 6z\"\n  }))), \"Some Observations\"), mdx(\"ul\", null, mdx(\"li\", {\n    parentName: \"ul\"\n  }, \"If H is trivial then the Schreier graph represents \", mdx(\"span\", {\n    parentName: \"li\",\n    \"className\": \"math math-inline\"\n  }, mdx(\"span\", {\n    parentName: \"span\",\n    \"className\": \"katex\"\n  }, mdx(\"span\", {\n    parentName: \"span\",\n    \"className\": \"katex-mathml\"\n  }, mdx(\"math\", {\n    parentName: \"span\",\n    \"xmlns\": \"http://www.w3.org/1998/Math/MathML\"\n  }, mdx(\"semantics\", {\n    parentName: \"math\"\n  }, mdx(\"mrow\", {\n    parentName: \"semantics\"\n  }, mdx(\"mi\", {\n    parentName: \"mrow\"\n  }, \"G\")), mdx(\"annotation\", {\n    parentName: \"semantics\",\n    \"encoding\": \"application/x-tex\"\n  }, \"G\")))), mdx(\"span\", {\n    parentName: \"span\",\n    \"className\": \"katex-html\",\n    \"aria-hidden\": \"true\"\n  }, mdx(\"span\", {\n    parentName: \"span\",\n    \"className\": \"base\"\n  }, mdx(\"span\", {\n    parentName: \"span\",\n    \"className\": \"strut\",\n    \"style\": {\n      \"height\": \"0.68333em\",\n      \"verticalAlign\": \"0em\"\n    }\n  }), mdx(\"span\", {\n    parentName: \"span\",\n    \"className\": \"mord mathnormal\"\n  }, \"G\"))))), \" since \", mdx(\"span\", {\n    parentName: \"li\",\n    \"className\": \"math math-inline\"\n  }, mdx(\"span\", {\n    parentName: \"span\",\n    \"className\": \"katex\"\n  }, mdx(\"span\", {\n    parentName: \"span\",\n    \"className\": \"katex-mathml\"\n  }, mdx(\"math\", {\n    parentName: \"span\",\n    \"xmlns\": \"http://www.w3.org/1998/Math/MathML\"\n  }, mdx(\"semantics\", {\n    parentName: \"math\"\n  }, mdx(\"mrow\", {\n    parentName: \"semantics\"\n  }, mdx(\"mi\", {\n    parentName: \"mrow\"\n  }, \"G\"), mdx(\"mi\", {\n    parentName: \"mrow\",\n    \"mathvariant\": \"normal\"\n  }, \"/\"), mdx(\"mo\", {\n    parentName: \"mrow\",\n    \"stretchy\": \"false\"\n  }, \"{\"), mdx(\"mi\", {\n    parentName: \"mrow\"\n  }, \"e\"), mdx(\"mo\", {\n    parentName: \"mrow\",\n    \"stretchy\": \"false\"\n  }, \"}\"), mdx(\"mo\", {\n    parentName: \"mrow\"\n  }, \"\\u2245\"), mdx(\"mi\", {\n    parentName: \"mrow\"\n  }, \"G\")), mdx(\"annotation\", {\n    parentName: \"semantics\",\n    \"encoding\": \"application/x-tex\"\n  }, \"G/\\\\{e\\\\} \\\\cong G\")))), mdx(\"span\", {\n    parentName: \"span\",\n    \"className\": \"katex-html\",\n    \"aria-hidden\": \"true\"\n  }, mdx(\"span\", {\n    parentName: \"span\",\n    \"className\": \"base\"\n  }, mdx(\"span\", {\n    parentName: \"span\",\n    \"className\": \"strut\",\n    \"style\": {\n      \"height\": \"1em\",\n      \"verticalAlign\": \"-0.25em\"\n    }\n  }), mdx(\"span\", {\n    parentName: \"span\",\n    \"className\": \"mord mathnormal\"\n  }, \"G\"), mdx(\"span\", {\n    parentName: \"span\",\n    \"className\": \"mord\"\n  }, \"/\"), mdx(\"span\", {\n    parentName: \"span\",\n    \"className\": \"mopen\"\n  }, \"{\"), mdx(\"span\", {\n    parentName: \"span\",\n    \"className\": \"mord mathnormal\"\n  }, \"e\"), mdx(\"span\", {\n    parentName: \"span\",\n    \"className\": \"mclose\"\n  }, \"}\"), mdx(\"span\", {\n    parentName: \"span\",\n    \"className\": \"mspace\",\n    \"style\": {\n      \"marginRight\": \"0.2777777777777778em\"\n    }\n  }), mdx(\"span\", {\n    parentName: \"span\",\n    \"className\": \"mrel\"\n  }, \"\\u2245\"), mdx(\"span\", {\n    parentName: \"span\",\n    \"className\": \"mspace\",\n    \"style\": {\n      \"marginRight\": \"0.2777777777777778em\"\n    }\n  })), mdx(\"span\", {\n    parentName: \"span\",\n    \"className\": \"base\"\n  }, mdx(\"span\", {\n    parentName: \"span\",\n    \"className\": \"strut\",\n    \"style\": {\n      \"height\": \"0.68333em\",\n      \"verticalAlign\": \"0em\"\n    }\n  }), mdx(\"span\", {\n    parentName: \"span\",\n    \"className\": \"mord mathnormal\"\n  }, \"G\")))))), mdx(\"li\", {\n    parentName: \"ul\"\n  }, \"A spanning tree rooted at vertex \", mdx(\"span\", {\n    parentName: \"li\",\n    \"className\": \"math math-inline\"\n  }, mdx(\"span\", {\n    parentName: \"span\",\n    \"className\": \"katex\"\n  }, mdx(\"span\", {\n    parentName: \"span\",\n    \"className\": \"katex-mathml\"\n  }, mdx(\"math\", {\n    parentName: \"span\",\n    \"xmlns\": \"http://www.w3.org/1998/Math/MathML\"\n  }, mdx(\"semantics\", {\n    parentName: \"math\"\n  }, mdx(\"mrow\", {\n    parentName: \"semantics\"\n  }, mdx(\"mn\", {\n    parentName: \"mrow\"\n  }, \"1\")), mdx(\"annotation\", {\n    parentName: \"semantics\",\n    \"encoding\": \"application/x-tex\"\n  }, \"1\")))), mdx(\"span\", {\n    parentName: \"span\",\n    \"className\": \"katex-html\",\n    \"aria-hidden\": \"true\"\n  }, mdx(\"span\", {\n    parentName: \"span\",\n    \"className\": \"base\"\n  }, mdx(\"span\", {\n    parentName: \"span\",\n    \"className\": \"strut\",\n    \"style\": {\n      \"height\": \"0.64444em\",\n      \"verticalAlign\": \"0em\"\n    }\n  }), mdx(\"span\", {\n    parentName: \"span\",\n    \"className\": \"mord\"\n  }, \"1\"))))), \" gives us a way to recover all of the cosets of \", mdx(\"span\", {\n    parentName: \"li\",\n    \"className\": \"math math-inline\"\n  }, mdx(\"span\", {\n    parentName: \"span\",\n    \"className\": \"katex\"\n  }, mdx(\"span\", {\n    parentName: \"span\",\n    \"className\": \"katex-mathml\"\n  }, mdx(\"math\", {\n    parentName: \"span\",\n    \"xmlns\": \"http://www.w3.org/1998/Math/MathML\"\n  }, mdx(\"semantics\", {\n    parentName: \"math\"\n  }, mdx(\"mrow\", {\n    parentName: \"semantics\"\n  }, mdx(\"mi\", {\n    parentName: \"mrow\"\n  }, \"H\")), mdx(\"annotation\", {\n    parentName: \"semantics\",\n    \"encoding\": \"application/x-tex\"\n  }, \"H\")))), mdx(\"span\", {\n    parentName: \"span\",\n    \"className\": \"katex-html\",\n    \"aria-hidden\": \"true\"\n  }, mdx(\"span\", {\n    parentName: \"span\",\n    \"className\": \"base\"\n  }, mdx(\"span\", {\n    parentName: \"span\",\n    \"className\": \"strut\",\n    \"style\": {\n      \"height\": \"0.68333em\",\n      \"verticalAlign\": \"0em\"\n    }\n  }), mdx(\"span\", {\n    parentName: \"span\",\n    \"className\": \"mord mathnormal\",\n    \"style\": {\n      \"marginRight\": \"0.08125em\"\n    }\n  }, \"H\"))))), \" (or the elements of \", mdx(\"span\", {\n    parentName: \"li\",\n    \"className\": \"math math-inline\"\n  }, mdx(\"span\", {\n    parentName: \"span\",\n    \"className\": \"katex\"\n  }, mdx(\"span\", {\n    parentName: \"span\",\n    \"className\": \"katex-mathml\"\n  }, mdx(\"math\", {\n    parentName: \"span\",\n    \"xmlns\": \"http://www.w3.org/1998/Math/MathML\"\n  }, mdx(\"semantics\", {\n    parentName: \"math\"\n  }, mdx(\"mrow\", {\n    parentName: \"semantics\"\n  }, mdx(\"mi\", {\n    parentName: \"mrow\"\n  }, \"G\")), mdx(\"annotation\", {\n    parentName: \"semantics\",\n    \"encoding\": \"application/x-tex\"\n  }, \"G\")))), mdx(\"span\", {\n    parentName: \"span\",\n    \"className\": \"katex-html\",\n    \"aria-hidden\": \"true\"\n  }, mdx(\"span\", {\n    parentName: \"span\",\n    \"className\": \"base\"\n  }, mdx(\"span\", {\n    parentName: \"span\",\n    \"className\": \"strut\",\n    \"style\": {\n      \"height\": \"0.68333em\",\n      \"verticalAlign\": \"0em\"\n    }\n  }), mdx(\"span\", {\n    parentName: \"span\",\n    \"className\": \"mord mathnormal\"\n  }, \"G\"))))), \" if \", mdx(\"span\", {\n    parentName: \"li\",\n    \"className\": \"math math-inline\"\n  }, mdx(\"span\", {\n    parentName: \"span\",\n    \"className\": \"katex\"\n  }, mdx(\"span\", {\n    parentName: \"span\",\n    \"className\": \"katex-mathml\"\n  }, mdx(\"math\", {\n    parentName: \"span\",\n    \"xmlns\": \"http://www.w3.org/1998/Math/MathML\"\n  }, mdx(\"semantics\", {\n    parentName: \"math\"\n  }, mdx(\"mrow\", {\n    parentName: \"semantics\"\n  }, mdx(\"mi\", {\n    parentName: \"mrow\"\n  }, \"H\")), mdx(\"annotation\", {\n    parentName: \"semantics\",\n    \"encoding\": \"application/x-tex\"\n  }, \"H\")))), mdx(\"span\", {\n    parentName: \"span\",\n    \"className\": \"katex-html\",\n    \"aria-hidden\": \"true\"\n  }, mdx(\"span\", {\n    parentName: \"span\",\n    \"className\": \"base\"\n  }, mdx(\"span\", {\n    parentName: \"span\",\n    \"className\": \"strut\",\n    \"style\": {\n      \"height\": \"0.68333em\",\n      \"verticalAlign\": \"0em\"\n    }\n  }), mdx(\"span\", {\n    parentName: \"span\",\n    \"className\": \"mord mathnormal\",\n    \"style\": {\n      \"marginRight\": \"0.08125em\"\n    }\n  }, \"H\"))))), \" is trivial) using only the generators in \", mdx(\"span\", {\n    parentName: \"li\",\n    \"className\": \"math math-inline\"\n  }, mdx(\"span\", {\n    parentName: \"span\",\n    \"className\": \"katex\"\n  }, mdx(\"span\", {\n    parentName: \"span\",\n    \"className\": \"katex-mathml\"\n  }, mdx(\"math\", {\n    parentName: \"span\",\n    \"xmlns\": \"http://www.w3.org/1998/Math/MathML\"\n  }, mdx(\"semantics\", {\n    parentName: \"math\"\n  }, mdx(\"mrow\", {\n    parentName: \"semantics\"\n  }, mdx(\"mi\", {\n    parentName: \"mrow\"\n  }, \"X\")), mdx(\"annotation\", {\n    parentName: \"semantics\",\n    \"encoding\": \"application/x-tex\"\n  }, \"X\")))), mdx(\"span\", {\n    parentName: \"span\",\n    \"className\": \"katex-html\",\n    \"aria-hidden\": \"true\"\n  }, mdx(\"span\", {\n    parentName: \"span\",\n    \"className\": \"base\"\n  }, mdx(\"span\", {\n    parentName: \"span\",\n    \"className\": \"strut\",\n    \"style\": {\n      \"height\": \"0.68333em\",\n      \"verticalAlign\": \"0em\"\n    }\n  }), mdx(\"span\", {\n    parentName: \"span\",\n    \"className\": \"mord mathnormal\",\n    \"style\": {\n      \"marginRight\": \"0.07847em\"\n    }\n  }, \"X\"))))))), mdx(\"h3\", {\n    \"id\": \"an-interactive-example\",\n    \"style\": {\n      \"position\": \"relative\"\n    }\n  }, mdx(\"a\", {\n    parentName: \"h3\",\n    \"href\": \"#an-interactive-example\",\n    \"aria-label\": \"an interactive example permalink\",\n    \"className\": \"anchor before\"\n  }, mdx(\"svg\", {\n    parentName: \"a\",\n    \"aria-hidden\": \"true\",\n    \"focusable\": \"false\",\n    \"height\": \"16\",\n    \"version\": \"1.1\",\n    \"viewBox\": \"0 0 16 16\",\n    \"width\": \"16\"\n  }, mdx(\"path\", {\n    parentName: \"svg\",\n    \"fillRule\": \"evenodd\",\n    \"d\": \"M4 9h1v1H4c-1.5 0-3-1.69-3-3.5S2.55 3 4 3h4c1.45 0 3 1.69 3 3.5 0 1.41-.91 2.72-2 3.25V8.59c.58-.45 1-1.27 1-2.09C10 5.22 8.98 4 8 4H4c-.98 0-2 1.22-2 2.5S3 9 4 9zm9-3h-1v1h1c1 0 2 1.22 2 2.5S13.98 12 13 12H9c-.98 0-2-1.22-2-2.5 0-.83.42-1.64 1-2.09V6.25c-1.09.53-2 1.84-2 3.25C6 11.31 7.55 13 9 13h4c1.45 0 3-1.69 3-3.5S14.5 6 13 6z\"\n  }))), \"An Interactive Example\"), mdx(\"p\", null, \"Let \", mdx(\"span\", {\n    parentName: \"p\",\n    \"className\": \"math math-inline\"\n  }, mdx(\"span\", {\n    parentName: \"span\",\n    \"className\": \"katex\"\n  }, mdx(\"span\", {\n    parentName: \"span\",\n    \"className\": \"katex-mathml\"\n  }, mdx(\"math\", {\n    parentName: \"span\",\n    \"xmlns\": \"http://www.w3.org/1998/Math/MathML\"\n  }, mdx(\"semantics\", {\n    parentName: \"math\"\n  }, mdx(\"mrow\", {\n    parentName: \"semantics\"\n  }, mdx(\"mi\", {\n    parentName: \"mrow\"\n  }, \"G\"), mdx(\"mo\", {\n    parentName: \"mrow\"\n  }, \"=\"), mdx(\"msub\", {\n    parentName: \"mrow\"\n  }, mdx(\"mi\", {\n    parentName: \"msub\"\n  }, \"D\"), mdx(\"mn\", {\n    parentName: \"msub\"\n  }, \"6\")), mdx(\"mo\", {\n    parentName: \"mrow\"\n  }, \"=\"), mdx(\"mo\", {\n    parentName: \"mrow\",\n    \"stretchy\": \"false\"\n  }, \"\\u27E8\"), mdx(\"mi\", {\n    parentName: \"mrow\"\n  }, \"r\"), mdx(\"mo\", {\n    parentName: \"mrow\",\n    \"separator\": \"true\"\n  }, \",\"), mdx(\"mi\", {\n    parentName: \"mrow\"\n  }, \"s\"), mdx(\"mo\", {\n    parentName: \"mrow\"\n  }, \"\\u2223\"), mdx(\"msup\", {\n    parentName: \"mrow\"\n  }, mdx(\"mi\", {\n    parentName: \"msup\"\n  }, \"r\"), mdx(\"mn\", {\n    parentName: \"msup\"\n  }, \"6\")), mdx(\"mo\", {\n    parentName: \"mrow\",\n    \"separator\": \"true\"\n  }, \",\"), mdx(\"msup\", {\n    parentName: \"mrow\"\n  }, mdx(\"mi\", {\n    parentName: \"msup\"\n  }, \"s\"), mdx(\"mn\", {\n    parentName: \"msup\"\n  }, \"2\")), mdx(\"mo\", {\n    parentName: \"mrow\",\n    \"separator\": \"true\"\n  }, \",\"), mdx(\"mo\", {\n    parentName: \"mrow\",\n    \"stretchy\": \"false\"\n  }, \"(\"), mdx(\"mi\", {\n    parentName: \"mrow\"\n  }, \"r\"), mdx(\"mi\", {\n    parentName: \"mrow\"\n  }, \"s\"), mdx(\"msup\", {\n    parentName: \"mrow\"\n  }, mdx(\"mo\", {\n    parentName: \"msup\",\n    \"stretchy\": \"false\"\n  }, \")\"), mdx(\"mn\", {\n    parentName: \"msup\"\n  }, \"2\")), mdx(\"mo\", {\n    parentName: \"mrow\",\n    \"stretchy\": \"false\"\n  }, \"\\u27E9\")), mdx(\"annotation\", {\n    parentName: \"semantics\",\n    \"encoding\": \"application/x-tex\"\n  }, \"G = D_6 = \\\\langle r,s \\\\mid r^6, s^2, (rs)^2 \\\\rangle\")))), mdx(\"span\", {\n    parentName: \"span\",\n    \"className\": \"katex-html\",\n    \"aria-hidden\": \"true\"\n  }, mdx(\"span\", {\n    parentName: \"span\",\n    \"className\": \"base\"\n  }, mdx(\"span\", {\n    parentName: \"span\",\n    \"className\": \"strut\",\n    \"style\": {\n      \"height\": \"0.68333em\",\n      \"verticalAlign\": \"0em\"\n    }\n  }), mdx(\"span\", {\n    parentName: \"span\",\n    \"className\": \"mord mathnormal\"\n  }, \"G\"), mdx(\"span\", {\n    parentName: \"span\",\n    \"className\": \"mspace\",\n    \"style\": {\n      \"marginRight\": \"0.2777777777777778em\"\n    }\n  }), mdx(\"span\", {\n    parentName: \"span\",\n    \"className\": \"mrel\"\n  }, \"=\"), mdx(\"span\", {\n    parentName: \"span\",\n    \"className\": \"mspace\",\n    \"style\": {\n      \"marginRight\": \"0.2777777777777778em\"\n    }\n  })), mdx(\"span\", {\n    parentName: \"span\",\n    \"className\": \"base\"\n  }, mdx(\"span\", {\n    parentName: \"span\",\n    \"className\": \"strut\",\n    \"style\": {\n      \"height\": \"0.83333em\",\n      \"verticalAlign\": \"-0.15em\"\n    }\n  }), mdx(\"span\", {\n    parentName: \"span\",\n    \"className\": \"mord\"\n  }, mdx(\"span\", {\n    parentName: \"span\",\n    \"className\": \"mord mathnormal\",\n    \"style\": {\n      \"marginRight\": \"0.02778em\"\n    }\n  }, \"D\"), mdx(\"span\", {\n    parentName: \"span\",\n    \"className\": \"msupsub\"\n  }, mdx(\"span\", {\n    parentName: \"span\",\n    \"className\": \"vlist-t vlist-t2\"\n  }, mdx(\"span\", {\n    parentName: \"span\",\n    \"className\": \"vlist-r\"\n  }, mdx(\"span\", {\n    parentName: \"span\",\n    \"className\": \"vlist\",\n    \"style\": {\n      \"height\": \"0.30110799999999993em\"\n    }\n  }, mdx(\"span\", {\n    parentName: \"span\",\n    \"style\": {\n      \"top\": \"-2.5500000000000003em\",\n      \"marginLeft\": \"-0.02778em\",\n      \"marginRight\": \"0.05em\"\n    }\n  }, mdx(\"span\", {\n    parentName: \"span\",\n    \"className\": \"pstrut\",\n    \"style\": {\n      \"height\": \"2.7em\"\n    }\n  }), mdx(\"span\", {\n    parentName: \"span\",\n    \"className\": \"sizing reset-size6 size3 mtight\"\n  }, mdx(\"span\", {\n    parentName: \"span\",\n    \"className\": \"mord mtight\"\n  }, \"6\")))), mdx(\"span\", {\n    parentName: \"span\",\n    \"className\": \"vlist-s\"\n  }, \"\\u200B\")), mdx(\"span\", {\n    parentName: \"span\",\n    \"className\": \"vlist-r\"\n  }, mdx(\"span\", {\n    parentName: \"span\",\n    \"className\": \"vlist\",\n    \"style\": {\n      \"height\": \"0.15em\"\n    }\n  }, mdx(\"span\", {\n    parentName: \"span\"\n  })))))), mdx(\"span\", {\n    parentName: \"span\",\n    \"className\": \"mspace\",\n    \"style\": {\n      \"marginRight\": \"0.2777777777777778em\"\n    }\n  }), mdx(\"span\", {\n    parentName: \"span\",\n    \"className\": \"mrel\"\n  }, \"=\"), mdx(\"span\", {\n    parentName: \"span\",\n    \"className\": \"mspace\",\n    \"style\": {\n      \"marginRight\": \"0.2777777777777778em\"\n    }\n  })), mdx(\"span\", {\n    parentName: \"span\",\n    \"className\": \"base\"\n  }, mdx(\"span\", {\n    parentName: \"span\",\n    \"className\": \"strut\",\n    \"style\": {\n      \"height\": \"1em\",\n      \"verticalAlign\": \"-0.25em\"\n    }\n  }), mdx(\"span\", {\n    parentName: \"span\",\n    \"className\": \"mopen\"\n  }, \"\\u27E8\"), mdx(\"span\", {\n    parentName: \"span\",\n    \"className\": \"mord mathnormal\",\n    \"style\": {\n      \"marginRight\": \"0.02778em\"\n    }\n  }, \"r\"), mdx(\"span\", {\n    parentName: \"span\",\n    \"className\": \"mpunct\"\n  }, \",\"), mdx(\"span\", {\n    parentName: \"span\",\n    \"className\": \"mspace\",\n    \"style\": {\n      \"marginRight\": \"0.16666666666666666em\"\n    }\n  }), mdx(\"span\", {\n    parentName: \"span\",\n    \"className\": \"mord mathnormal\"\n  }, \"s\"), mdx(\"span\", {\n    parentName: \"span\",\n    \"className\": \"mspace\",\n    \"style\": {\n      \"marginRight\": \"0.2777777777777778em\"\n    }\n  }), mdx(\"span\", {\n    parentName: \"span\",\n    \"className\": \"mrel\"\n  }, \"\\u2223\"), mdx(\"span\", {\n    parentName: \"span\",\n    \"className\": \"mspace\",\n    \"style\": {\n      \"marginRight\": \"0.2777777777777778em\"\n    }\n  })), mdx(\"span\", {\n    parentName: \"span\",\n    \"className\": \"base\"\n  }, mdx(\"span\", {\n    parentName: \"span\",\n    \"className\": \"strut\",\n    \"style\": {\n      \"height\": \"1.064108em\",\n      \"verticalAlign\": \"-0.25em\"\n    }\n  }), mdx(\"span\", {\n    parentName: \"span\",\n    \"className\": \"mord\"\n  }, mdx(\"span\", {\n    parentName: \"span\",\n    \"className\": \"mord mathnormal\",\n    \"style\": {\n      \"marginRight\": \"0.02778em\"\n    }\n  }, \"r\"), mdx(\"span\", {\n    parentName: \"span\",\n    \"className\": \"msupsub\"\n  }, mdx(\"span\", {\n    parentName: \"span\",\n    \"className\": \"vlist-t\"\n  }, mdx(\"span\", {\n    parentName: \"span\",\n    \"className\": \"vlist-r\"\n  }, mdx(\"span\", {\n    parentName: \"span\",\n    \"className\": \"vlist\",\n    \"style\": {\n      \"height\": \"0.8141079999999999em\"\n    }\n  }, mdx(\"span\", {\n    parentName: \"span\",\n    \"style\": {\n      \"top\": \"-3.063em\",\n      \"marginRight\": \"0.05em\"\n    }\n  }, mdx(\"span\", {\n    parentName: \"span\",\n    \"className\": \"pstrut\",\n    \"style\": {\n      \"height\": \"2.7em\"\n    }\n  }), mdx(\"span\", {\n    parentName: \"span\",\n    \"className\": \"sizing reset-size6 size3 mtight\"\n  }, mdx(\"span\", {\n    parentName: \"span\",\n    \"className\": \"mord mtight\"\n  }, \"6\")))))))), mdx(\"span\", {\n    parentName: \"span\",\n    \"className\": \"mpunct\"\n  }, \",\"), mdx(\"span\", {\n    parentName: \"span\",\n    \"className\": \"mspace\",\n    \"style\": {\n      \"marginRight\": \"0.16666666666666666em\"\n    }\n  }), mdx(\"span\", {\n    parentName: \"span\",\n    \"className\": \"mord\"\n  }, mdx(\"span\", {\n    parentName: \"span\",\n    \"className\": \"mord mathnormal\"\n  }, \"s\"), mdx(\"span\", {\n    parentName: \"span\",\n    \"className\": \"msupsub\"\n  }, mdx(\"span\", {\n    parentName: \"span\",\n    \"className\": \"vlist-t\"\n  }, mdx(\"span\", {\n    parentName: \"span\",\n    \"className\": \"vlist-r\"\n  }, mdx(\"span\", {\n    parentName: \"span\",\n    \"className\": \"vlist\",\n    \"style\": {\n      \"height\": \"0.8141079999999999em\"\n    }\n  }, mdx(\"span\", {\n    parentName: \"span\",\n    \"style\": {\n      \"top\": \"-3.063em\",\n      \"marginRight\": \"0.05em\"\n    }\n  }, mdx(\"span\", {\n    parentName: \"span\",\n    \"className\": \"pstrut\",\n    \"style\": {\n      \"height\": \"2.7em\"\n    }\n  }), mdx(\"span\", {\n    parentName: \"span\",\n    \"className\": \"sizing reset-size6 size3 mtight\"\n  }, mdx(\"span\", {\n    parentName: \"span\",\n    \"className\": \"mord mtight\"\n  }, \"2\")))))))), mdx(\"span\", {\n    parentName: \"span\",\n    \"className\": \"mpunct\"\n  }, \",\"), mdx(\"span\", {\n    parentName: \"span\",\n    \"className\": \"mspace\",\n    \"style\": {\n      \"marginRight\": \"0.16666666666666666em\"\n    }\n  }), mdx(\"span\", {\n    parentName: \"span\",\n    \"className\": \"mopen\"\n  }, \"(\"), mdx(\"span\", {\n    parentName: \"span\",\n    \"className\": \"mord mathnormal\",\n    \"style\": {\n      \"marginRight\": \"0.02778em\"\n    }\n  }, \"r\"), mdx(\"span\", {\n    parentName: \"span\",\n    \"className\": \"mord mathnormal\"\n  }, \"s\"), mdx(\"span\", {\n    parentName: \"span\",\n    \"className\": \"mclose\"\n  }, mdx(\"span\", {\n    parentName: \"span\",\n    \"className\": \"mclose\"\n  }, \")\"), mdx(\"span\", {\n    parentName: \"span\",\n    \"className\": \"msupsub\"\n  }, mdx(\"span\", {\n    parentName: \"span\",\n    \"className\": \"vlist-t\"\n  }, mdx(\"span\", {\n    parentName: \"span\",\n    \"className\": \"vlist-r\"\n  }, mdx(\"span\", {\n    parentName: \"span\",\n    \"className\": \"vlist\",\n    \"style\": {\n      \"height\": \"0.8141079999999999em\"\n    }\n  }, mdx(\"span\", {\n    parentName: \"span\",\n    \"style\": {\n      \"top\": \"-3.063em\",\n      \"marginRight\": \"0.05em\"\n    }\n  }, mdx(\"span\", {\n    parentName: \"span\",\n    \"className\": \"pstrut\",\n    \"style\": {\n      \"height\": \"2.7em\"\n    }\n  }), mdx(\"span\", {\n    parentName: \"span\",\n    \"className\": \"sizing reset-size6 size3 mtight\"\n  }, mdx(\"span\", {\n    parentName: \"span\",\n    \"className\": \"mord mtight\"\n  }, \"2\")))))))), mdx(\"span\", {\n    parentName: \"span\",\n    \"className\": \"mclose\"\n  }, \"\\u27E9\"))))), \" and let \", mdx(\"span\", {\n    parentName: \"p\",\n    \"className\": \"math math-inline\"\n  }, mdx(\"span\", {\n    parentName: \"span\",\n    \"className\": \"katex\"\n  }, mdx(\"span\", {\n    parentName: \"span\",\n    \"className\": \"katex-mathml\"\n  }, mdx(\"math\", {\n    parentName: \"span\",\n    \"xmlns\": \"http://www.w3.org/1998/Math/MathML\"\n  }, mdx(\"semantics\", {\n    parentName: \"math\"\n  }, mdx(\"mrow\", {\n    parentName: \"semantics\"\n  }, mdx(\"mi\", {\n    parentName: \"mrow\"\n  }, \"H\"), mdx(\"mo\", {\n    parentName: \"mrow\"\n  }, \"=\"), mdx(\"mo\", {\n    parentName: \"mrow\",\n    \"stretchy\": \"false\"\n  }, \"\\u27E8\"), mdx(\"msup\", {\n    parentName: \"mrow\"\n  }, mdx(\"mi\", {\n    parentName: \"msup\"\n  }, \"r\"), mdx(\"mn\", {\n    parentName: \"msup\"\n  }, \"3\")), mdx(\"mo\", {\n    parentName: \"mrow\",\n    \"stretchy\": \"false\"\n  }, \"\\u27E9\")), mdx(\"annotation\", {\n    parentName: \"semantics\",\n    \"encoding\": \"application/x-tex\"\n  }, \"H=\\\\langle r^3 \\\\rangle\")))), mdx(\"span\", {\n    parentName: \"span\",\n    \"className\": \"katex-html\",\n    \"aria-hidden\": \"true\"\n  }, mdx(\"span\", {\n    parentName: \"span\",\n    \"className\": \"base\"\n  }, mdx(\"span\", {\n    parentName: \"span\",\n    \"className\": \"strut\",\n    \"style\": {\n      \"height\": \"0.68333em\",\n      \"verticalAlign\": \"0em\"\n    }\n  }), mdx(\"span\", {\n    parentName: \"span\",\n    \"className\": \"mord mathnormal\",\n    \"style\": {\n      \"marginRight\": \"0.08125em\"\n    }\n  }, \"H\"), mdx(\"span\", {\n    parentName: \"span\",\n    \"className\": \"mspace\",\n    \"style\": {\n      \"marginRight\": \"0.2777777777777778em\"\n    }\n  }), mdx(\"span\", {\n    parentName: \"span\",\n    \"className\": \"mrel\"\n  }, \"=\"), mdx(\"span\", {\n    parentName: \"span\",\n    \"className\": \"mspace\",\n    \"style\": {\n      \"marginRight\": \"0.2777777777777778em\"\n    }\n  })), mdx(\"span\", {\n    parentName: \"span\",\n    \"className\": \"base\"\n  }, mdx(\"span\", {\n    parentName: \"span\",\n    \"className\": \"strut\",\n    \"style\": {\n      \"height\": \"1.064108em\",\n      \"verticalAlign\": \"-0.25em\"\n    }\n  }), mdx(\"span\", {\n    parentName: \"span\",\n    \"className\": \"mopen\"\n  }, \"\\u27E8\"), mdx(\"span\", {\n    parentName: \"span\",\n    \"className\": \"mord\"\n  }, mdx(\"span\", {\n    parentName: \"span\",\n    \"className\": \"mord mathnormal\",\n    \"style\": {\n      \"marginRight\": \"0.02778em\"\n    }\n  }, \"r\"), mdx(\"span\", {\n    parentName: \"span\",\n    \"className\": \"msupsub\"\n  }, mdx(\"span\", {\n    parentName: \"span\",\n    \"className\": \"vlist-t\"\n  }, mdx(\"span\", {\n    parentName: \"span\",\n    \"className\": \"vlist-r\"\n  }, mdx(\"span\", {\n    parentName: \"span\",\n    \"className\": \"vlist\",\n    \"style\": {\n      \"height\": \"0.8141079999999999em\"\n    }\n  }, mdx(\"span\", {\n    parentName: \"span\",\n    \"style\": {\n      \"top\": \"-3.063em\",\n      \"marginRight\": \"0.05em\"\n    }\n  }, mdx(\"span\", {\n    parentName: \"span\",\n    \"className\": \"pstrut\",\n    \"style\": {\n      \"height\": \"2.7em\"\n    }\n  }), mdx(\"span\", {\n    parentName: \"span\",\n    \"className\": \"sizing reset-size6 size3 mtight\"\n  }, mdx(\"span\", {\n    parentName: \"span\",\n    \"className\": \"mord mtight\"\n  }, \"3\")))))))), mdx(\"span\", {\n    parentName: \"span\",\n    \"className\": \"mclose\"\n  }, \"\\u27E9\"))))), \". So, the inputs for the Todd-Coxeter Algorithm are as follows.\"), mdx(\"div\", {\n    \"className\": \"math math-display\"\n  }, mdx(\"span\", {\n    parentName: \"div\",\n    \"className\": \"katex-display\"\n  }, mdx(\"span\", {\n    parentName: \"span\",\n    \"className\": \"katex\"\n  }, mdx(\"span\", {\n    parentName: \"span\",\n    \"className\": \"katex-mathml\"\n  }, mdx(\"math\", {\n    parentName: \"span\",\n    \"xmlns\": \"http://www.w3.org/1998/Math/MathML\",\n    \"display\": \"block\"\n  }, mdx(\"semantics\", {\n    parentName: \"math\"\n  }, mdx(\"mrow\", {\n    parentName: \"semantics\"\n  }, mdx(\"mi\", {\n    parentName: \"mrow\"\n  }, \"X\"), mdx(\"mo\", {\n    parentName: \"mrow\"\n  }, \"=\"), mdx(\"mo\", {\n    parentName: \"mrow\",\n    \"stretchy\": \"false\"\n  }, \"{\"), mdx(\"mi\", {\n    parentName: \"mrow\"\n  }, \"r\"), mdx(\"mo\", {\n    parentName: \"mrow\",\n    \"separator\": \"true\"\n  }, \",\"), mdx(\"mi\", {\n    parentName: \"mrow\"\n  }, \"s\"), mdx(\"mo\", {\n    parentName: \"mrow\",\n    \"stretchy\": \"false\"\n  }, \"}\")), mdx(\"annotation\", {\n    parentName: \"semantics\",\n    \"encoding\": \"application/x-tex\"\n  }, \"X = \\\\{r,s\\\\}\")))), mdx(\"span\", {\n    parentName: \"span\",\n    \"className\": \"katex-html\",\n    \"aria-hidden\": \"true\"\n  }, mdx(\"span\", {\n    parentName: \"span\",\n    \"className\": \"base\"\n  }, mdx(\"span\", {\n    parentName: \"span\",\n    \"className\": \"strut\",\n    \"style\": {\n      \"height\": \"0.68333em\",\n      \"verticalAlign\": \"0em\"\n    }\n  }), mdx(\"span\", {\n    parentName: \"span\",\n    \"className\": \"mord mathnormal\",\n    \"style\": {\n      \"marginRight\": \"0.07847em\"\n    }\n  }, \"X\"), mdx(\"span\", {\n    parentName: \"span\",\n    \"className\": \"mspace\",\n    \"style\": {\n      \"marginRight\": \"0.2777777777777778em\"\n    }\n  }), mdx(\"span\", {\n    parentName: \"span\",\n    \"className\": \"mrel\"\n  }, \"=\"), mdx(\"span\", {\n    parentName: \"span\",\n    \"className\": \"mspace\",\n    \"style\": {\n      \"marginRight\": \"0.2777777777777778em\"\n    }\n  })), mdx(\"span\", {\n    parentName: \"span\",\n    \"className\": \"base\"\n  }, mdx(\"span\", {\n    parentName: \"span\",\n    \"className\": \"strut\",\n    \"style\": {\n      \"height\": \"1em\",\n      \"verticalAlign\": \"-0.25em\"\n    }\n  }), mdx(\"span\", {\n    parentName: \"span\",\n    \"className\": \"mopen\"\n  }, \"{\"), mdx(\"span\", {\n    parentName: \"span\",\n    \"className\": \"mord mathnormal\",\n    \"style\": {\n      \"marginRight\": \"0.02778em\"\n    }\n  }, \"r\"), mdx(\"span\", {\n    parentName: \"span\",\n    \"className\": \"mpunct\"\n  }, \",\"), mdx(\"span\", {\n    parentName: \"span\",\n    \"className\": \"mspace\",\n    \"style\": {\n      \"marginRight\": \"0.16666666666666666em\"\n    }\n  }), mdx(\"span\", {\n    parentName: \"span\",\n    \"className\": \"mord mathnormal\"\n  }, \"s\"), mdx(\"span\", {\n    parentName: \"span\",\n    \"className\": \"mclose\"\n  }, \"}\")))))), mdx(\"div\", {\n    \"className\": \"math math-display\"\n  }, mdx(\"span\", {\n    parentName: \"div\",\n    \"className\": \"katex-display\"\n  }, mdx(\"span\", {\n    parentName: \"span\",\n    \"className\": \"katex\"\n  }, mdx(\"span\", {\n    parentName: \"span\",\n    \"className\": \"katex-mathml\"\n  }, mdx(\"math\", {\n    parentName: \"span\",\n    \"xmlns\": \"http://www.w3.org/1998/Math/MathML\",\n    \"display\": \"block\"\n  }, mdx(\"semantics\", {\n    parentName: \"math\"\n  }, mdx(\"mrow\", {\n    parentName: \"semantics\"\n  }, mdx(\"mi\", {\n    parentName: \"mrow\"\n  }, \"R\"), mdx(\"mo\", {\n    parentName: \"mrow\"\n  }, \"=\"), mdx(\"mo\", {\n    parentName: \"mrow\",\n    \"stretchy\": \"false\"\n  }, \"{\"), mdx(\"mi\", {\n    parentName: \"mrow\"\n  }, \"r\"), mdx(\"mi\", {\n    parentName: \"mrow\"\n  }, \"r\"), mdx(\"mi\", {\n    parentName: \"mrow\"\n  }, \"r\"), mdx(\"mi\", {\n    parentName: \"mrow\"\n  }, \"r\"), mdx(\"mi\", {\n    parentName: \"mrow\"\n  }, \"r\"), mdx(\"mi\", {\n    parentName: \"mrow\"\n  }, \"r\"), mdx(\"mo\", {\n    parentName: \"mrow\",\n    \"separator\": \"true\"\n  }, \",\"), mdx(\"mi\", {\n    parentName: \"mrow\"\n  }, \"s\"), mdx(\"mi\", {\n    parentName: \"mrow\"\n  }, \"s\"), mdx(\"mo\", {\n    parentName: \"mrow\",\n    \"separator\": \"true\"\n  }, \",\"), mdx(\"mi\", {\n    parentName: \"mrow\"\n  }, \"r\"), mdx(\"mi\", {\n    parentName: \"mrow\"\n  }, \"s\"), mdx(\"mi\", {\n    parentName: \"mrow\"\n  }, \"r\"), mdx(\"mi\", {\n    parentName: \"mrow\"\n  }, \"s\"), mdx(\"mo\", {\n    parentName: \"mrow\",\n    \"stretchy\": \"false\"\n  }, \"}\")), mdx(\"annotation\", {\n    parentName: \"semantics\",\n    \"encoding\": \"application/x-tex\"\n  }, \"R = \\\\{rrrrrr, ss, rsrs\\\\}\")))), mdx(\"span\", {\n    parentName: \"span\",\n    \"className\": \"katex-html\",\n    \"aria-hidden\": \"true\"\n  }, mdx(\"span\", {\n    parentName: \"span\",\n    \"className\": \"base\"\n  }, mdx(\"span\", {\n    parentName: \"span\",\n    \"className\": \"strut\",\n    \"style\": {\n      \"height\": \"0.68333em\",\n      \"verticalAlign\": \"0em\"\n    }\n  }), mdx(\"span\", {\n    parentName: \"span\",\n    \"className\": \"mord mathnormal\",\n    \"style\": {\n      \"marginRight\": \"0.00773em\"\n    }\n  }, \"R\"), mdx(\"span\", {\n    parentName: \"span\",\n    \"className\": \"mspace\",\n    \"style\": {\n      \"marginRight\": \"0.2777777777777778em\"\n    }\n  }), mdx(\"span\", {\n    parentName: \"span\",\n    \"className\": \"mrel\"\n  }, \"=\"), mdx(\"span\", {\n    parentName: \"span\",\n    \"className\": \"mspace\",\n    \"style\": {\n      \"marginRight\": \"0.2777777777777778em\"\n    }\n  })), mdx(\"span\", {\n    parentName: \"span\",\n    \"className\": \"base\"\n  }, mdx(\"span\", {\n    parentName: \"span\",\n    \"className\": \"strut\",\n    \"style\": {\n      \"height\": \"1em\",\n      \"verticalAlign\": \"-0.25em\"\n    }\n  }), mdx(\"span\", {\n    parentName: \"span\",\n    \"className\": \"mopen\"\n  }, \"{\"), mdx(\"span\", {\n    parentName: \"span\",\n    \"className\": \"mord mathnormal\",\n    \"style\": {\n      \"marginRight\": \"0.02778em\"\n    }\n  }, \"r\"), mdx(\"span\", {\n    parentName: \"span\",\n    \"className\": \"mord mathnormal\",\n    \"style\": {\n      \"marginRight\": \"0.02778em\"\n    }\n  }, \"r\"), mdx(\"span\", {\n    parentName: \"span\",\n    \"className\": \"mord mathnormal\",\n    \"style\": {\n      \"marginRight\": \"0.02778em\"\n    }\n  }, \"r\"), mdx(\"span\", {\n    parentName: \"span\",\n    \"className\": \"mord mathnormal\",\n    \"style\": {\n      \"marginRight\": \"0.02778em\"\n    }\n  }, \"r\"), mdx(\"span\", {\n    parentName: \"span\",\n    \"className\": \"mord mathnormal\",\n    \"style\": {\n      \"marginRight\": \"0.02778em\"\n    }\n  }, \"r\"), mdx(\"span\", {\n    parentName: \"span\",\n    \"className\": \"mord mathnormal\",\n    \"style\": {\n      \"marginRight\": \"0.02778em\"\n    }\n  }, \"r\"), mdx(\"span\", {\n    parentName: \"span\",\n    \"className\": \"mpunct\"\n  }, \",\"), mdx(\"span\", {\n    parentName: \"span\",\n    \"className\": \"mspace\",\n    \"style\": {\n      \"marginRight\": \"0.16666666666666666em\"\n    }\n  }), mdx(\"span\", {\n    parentName: \"span\",\n    \"className\": \"mord mathnormal\"\n  }, \"s\"), mdx(\"span\", {\n    parentName: \"span\",\n    \"className\": \"mord mathnormal\"\n  }, \"s\"), mdx(\"span\", {\n    parentName: \"span\",\n    \"className\": \"mpunct\"\n  }, \",\"), mdx(\"span\", {\n    parentName: \"span\",\n    \"className\": \"mspace\",\n    \"style\": {\n      \"marginRight\": \"0.16666666666666666em\"\n    }\n  }), mdx(\"span\", {\n    parentName: \"span\",\n    \"className\": \"mord mathnormal\",\n    \"style\": {\n      \"marginRight\": \"0.02778em\"\n    }\n  }, \"r\"), mdx(\"span\", {\n    parentName: \"span\",\n    \"className\": \"mord mathnormal\"\n  }, \"s\"), mdx(\"span\", {\n    parentName: \"span\",\n    \"className\": \"mord mathnormal\",\n    \"style\": {\n      \"marginRight\": \"0.02778em\"\n    }\n  }, \"r\"), mdx(\"span\", {\n    parentName: \"span\",\n    \"className\": \"mord mathnormal\"\n  }, \"s\"), mdx(\"span\", {\n    parentName: \"span\",\n    \"className\": \"mclose\"\n  }, \"}\")))))), mdx(\"div\", {\n    \"className\": \"math math-display\"\n  }, mdx(\"span\", {\n    parentName: \"div\",\n    \"className\": \"katex-display\"\n  }, mdx(\"span\", {\n    parentName: \"span\",\n    \"className\": \"katex\"\n  }, mdx(\"span\", {\n    parentName: \"span\",\n    \"className\": \"katex-mathml\"\n  }, mdx(\"math\", {\n    parentName: \"span\",\n    \"xmlns\": \"http://www.w3.org/1998/Math/MathML\",\n    \"display\": \"block\"\n  }, mdx(\"semantics\", {\n    parentName: \"math\"\n  }, mdx(\"mrow\", {\n    parentName: \"semantics\"\n  }, mdx(\"mi\", {\n    parentName: \"mrow\"\n  }, \"Y\"), mdx(\"mo\", {\n    parentName: \"mrow\"\n  }, \"=\"), mdx(\"mo\", {\n    parentName: \"mrow\",\n    \"stretchy\": \"false\"\n  }, \"{\"), mdx(\"mi\", {\n    parentName: \"mrow\"\n  }, \"r\"), mdx(\"mi\", {\n    parentName: \"mrow\"\n  }, \"r\"), mdx(\"mi\", {\n    parentName: \"mrow\"\n  }, \"r\"), mdx(\"mo\", {\n    parentName: \"mrow\",\n    \"stretchy\": \"false\"\n  }, \"}\")), mdx(\"annotation\", {\n    parentName: \"semantics\",\n    \"encoding\": \"application/x-tex\"\n  }, \"Y = \\\\{rrr\\\\}\")))), mdx(\"span\", {\n    parentName: \"span\",\n    \"className\": \"katex-html\",\n    \"aria-hidden\": \"true\"\n  }, mdx(\"span\", {\n    parentName: \"span\",\n    \"className\": \"base\"\n  }, mdx(\"span\", {\n    parentName: \"span\",\n    \"className\": \"strut\",\n    \"style\": {\n      \"height\": \"0.68333em\",\n      \"verticalAlign\": \"0em\"\n    }\n  }), mdx(\"span\", {\n    parentName: \"span\",\n    \"className\": \"mord mathnormal\",\n    \"style\": {\n      \"marginRight\": \"0.22222em\"\n    }\n  }, \"Y\"), mdx(\"span\", {\n    parentName: \"span\",\n    \"className\": \"mspace\",\n    \"style\": {\n      \"marginRight\": \"0.2777777777777778em\"\n    }\n  }), mdx(\"span\", {\n    parentName: \"span\",\n    \"className\": \"mrel\"\n  }, \"=\"), mdx(\"span\", {\n    parentName: \"span\",\n    \"className\": \"mspace\",\n    \"style\": {\n      \"marginRight\": \"0.2777777777777778em\"\n    }\n  })), mdx(\"span\", {\n    parentName: \"span\",\n    \"className\": \"base\"\n  }, mdx(\"span\", {\n    parentName: \"span\",\n    \"className\": \"strut\",\n    \"style\": {\n      \"height\": \"1em\",\n      \"verticalAlign\": \"-0.25em\"\n    }\n  }), mdx(\"span\", {\n    parentName: \"span\",\n    \"className\": \"mopen\"\n  }, \"{\"), mdx(\"span\", {\n    parentName: \"span\",\n    \"className\": \"mord mathnormal\",\n    \"style\": {\n      \"marginRight\": \"0.02778em\"\n    }\n  }, \"r\"), mdx(\"span\", {\n    parentName: \"span\",\n    \"className\": \"mord mathnormal\",\n    \"style\": {\n      \"marginRight\": \"0.02778em\"\n    }\n  }, \"r\"), mdx(\"span\", {\n    parentName: \"span\",\n    \"className\": \"mord mathnormal\",\n    \"style\": {\n      \"marginRight\": \"0.02778em\"\n    }\n  }, \"r\"), mdx(\"span\", {\n    parentName: \"span\",\n    \"className\": \"mclose\"\n  }, \"}\")))))), mdx(ToddCoxeterExample, {\n    mdxType: \"ToddCoxeterExample\"\n  }), mdx(\"p\", null, mdx(\"strong\", {\n    parentName: \"p\"\n  }, \"Note:\"), \" Some steps are skipped since they don't permanently affect the tree\"), mdx(\"h2\", {\n    \"id\": \"implementation\",\n    \"style\": {\n      \"position\": \"relative\"\n    }\n  }, mdx(\"a\", {\n    parentName: \"h2\",\n    \"href\": \"#implementation\",\n    \"aria-label\": \"implementation permalink\",\n    \"className\": \"anchor before\"\n  }, mdx(\"svg\", {\n    parentName: \"a\",\n    \"aria-hidden\": \"true\",\n    \"focusable\": \"false\",\n    \"height\": \"16\",\n    \"version\": \"1.1\",\n    \"viewBox\": \"0 0 16 16\",\n    \"width\": \"16\"\n  }, mdx(\"path\", {\n    parentName: \"svg\",\n    \"fillRule\": \"evenodd\",\n    \"d\": \"M4 9h1v1H4c-1.5 0-3-1.69-3-3.5S2.55 3 4 3h4c1.45 0 3 1.69 3 3.5 0 1.41-.91 2.72-2 3.25V8.59c.58-.45 1-1.27 1-2.09C10 5.22 8.98 4 8 4H4c-.98 0-2 1.22-2 2.5S3 9 4 9zm9-3h-1v1h1c1 0 2 1.22 2 2.5S13.98 12 13 12H9c-.98 0-2-1.22-2-2.5 0-.83.42-1.64 1-2.09V6.25c-1.09.53-2 1.84-2 3.25C6 11.31 7.55 13 9 13h4c1.45 0 3-1.69 3-3.5S14.5 6 13 6z\"\n  }))), \"Implementation\"), mdx(\"p\", null, \"An implementation of this algorithm written in python can be found on GitHub \", mdx(\"a\", {\n    parentName: \"p\",\n    \"href\": \"https://github.com/jsimonrichard/jsimonrichard/blob/main/src/pages/blog/todd-coxeter/todd-coxeter.py\"\n  }, \"here\"), \" or downloaded \", mdx(\"a\", {\n    href: \"https://gitcdn.link/cdn/jsimonrichard/jsimonrichard/main/src/pages/blog/todd-coxeter/todd-coxeter.py\",\n    download: \"todd-coxeter.py\"\n  }, \"here\"), \". Most of its core logic was taken from Kyle Miller's implementation\", mdx(RefLink, {\n    href: \"#resources\",\n    mdxType: \"RefLink\"\n  }, \"3\"), \", but it was rewritten using classes. This, in my opinion, makes it a lot easier to read. It was also written as a terminal application in order to increase its ease of use.\"), mdx(\"p\", null, \"To use this program, download it and then run the following command to get more usage information.\"), mdx(\"div\", {\n    \"className\": \"gatsby-highlight\",\n    \"data-language\": \"text\"\n  }, mdx(\"pre\", {\n    parentName: \"div\",\n    \"className\": \"language-text\"\n  }, mdx(\"code\", {\n    parentName: \"pre\",\n    \"className\": \"language-text\"\n  }, \"python3 todd-coxeter.py -h\"))), mdx(\"p\", null, \"To run this program for the example above, use the following command.\"), mdx(\"div\", {\n    \"className\": \"gatsby-highlight\",\n    \"data-language\": \"text\"\n  }, mdx(\"pre\", {\n    parentName: \"div\",\n    \"className\": \"language-text\"\n  }, mdx(\"code\", {\n    parentName: \"pre\",\n    \"className\": \"language-text\"\n  }, \"python3 todd-coxeter.py --ngens 2 --rels 1,1,1,1,1,1 2,2 1,2,1,2 --hgens 1,1,1\"))), mdx(\"p\", null, \"In this command, \", mdx(\"code\", {\n    parentName: \"p\",\n    \"className\": \"language-text\"\n  }, \"--ngens 2\"), \" is used to specify that there are two generators (they will be labeled \", mdx(\"span\", {\n    parentName: \"p\",\n    \"className\": \"math math-inline\"\n  }, mdx(\"span\", {\n    parentName: \"span\",\n    \"className\": \"katex\"\n  }, mdx(\"span\", {\n    parentName: \"span\",\n    \"className\": \"katex-mathml\"\n  }, mdx(\"math\", {\n    parentName: \"span\",\n    \"xmlns\": \"http://www.w3.org/1998/Math/MathML\"\n  }, mdx(\"semantics\", {\n    parentName: \"math\"\n  }, mdx(\"mrow\", {\n    parentName: \"semantics\"\n  }, mdx(\"mn\", {\n    parentName: \"mrow\"\n  }, \"1\")), mdx(\"annotation\", {\n    parentName: \"semantics\",\n    \"encoding\": \"application/x-tex\"\n  }, \"1\")))), mdx(\"span\", {\n    parentName: \"span\",\n    \"className\": \"katex-html\",\n    \"aria-hidden\": \"true\"\n  }, mdx(\"span\", {\n    parentName: \"span\",\n    \"className\": \"base\"\n  }, mdx(\"span\", {\n    parentName: \"span\",\n    \"className\": \"strut\",\n    \"style\": {\n      \"height\": \"0.64444em\",\n      \"verticalAlign\": \"0em\"\n    }\n  }), mdx(\"span\", {\n    parentName: \"span\",\n    \"className\": \"mord\"\n  }, \"1\"))))), \" and \", mdx(\"span\", {\n    parentName: \"p\",\n    \"className\": \"math math-inline\"\n  }, mdx(\"span\", {\n    parentName: \"span\",\n    \"className\": \"katex\"\n  }, mdx(\"span\", {\n    parentName: \"span\",\n    \"className\": \"katex-mathml\"\n  }, mdx(\"math\", {\n    parentName: \"span\",\n    \"xmlns\": \"http://www.w3.org/1998/Math/MathML\"\n  }, mdx(\"semantics\", {\n    parentName: \"math\"\n  }, mdx(\"mrow\", {\n    parentName: \"semantics\"\n  }, mdx(\"mn\", {\n    parentName: \"mrow\"\n  }, \"2\")), mdx(\"annotation\", {\n    parentName: \"semantics\",\n    \"encoding\": \"application/x-tex\"\n  }, \"2\")))), mdx(\"span\", {\n    parentName: \"span\",\n    \"className\": \"katex-html\",\n    \"aria-hidden\": \"true\"\n  }, mdx(\"span\", {\n    parentName: \"span\",\n    \"className\": \"base\"\n  }, mdx(\"span\", {\n    parentName: \"span\",\n    \"className\": \"strut\",\n    \"style\": {\n      \"height\": \"0.64444em\",\n      \"verticalAlign\": \"0em\"\n    }\n  }), mdx(\"span\", {\n    parentName: \"span\",\n    \"className\": \"mord\"\n  }, \"2\"))))), \", corresponding to \", mdx(\"span\", {\n    parentName: \"p\",\n    \"className\": \"math math-inline\"\n  }, mdx(\"span\", {\n    parentName: \"span\",\n    \"className\": \"katex\"\n  }, mdx(\"span\", {\n    parentName: \"span\",\n    \"className\": \"katex-mathml\"\n  }, mdx(\"math\", {\n    parentName: \"span\",\n    \"xmlns\": \"http://www.w3.org/1998/Math/MathML\"\n  }, mdx(\"semantics\", {\n    parentName: \"math\"\n  }, mdx(\"mrow\", {\n    parentName: \"semantics\"\n  }, mdx(\"mi\", {\n    parentName: \"mrow\"\n  }, \"r\")), mdx(\"annotation\", {\n    parentName: \"semantics\",\n    \"encoding\": \"application/x-tex\"\n  }, \"r\")))), mdx(\"span\", {\n    parentName: \"span\",\n    \"className\": \"katex-html\",\n    \"aria-hidden\": \"true\"\n  }, mdx(\"span\", {\n    parentName: \"span\",\n    \"className\": \"base\"\n  }, mdx(\"span\", {\n    parentName: \"span\",\n    \"className\": \"strut\",\n    \"style\": {\n      \"height\": \"0.43056em\",\n      \"verticalAlign\": \"0em\"\n    }\n  }), mdx(\"span\", {\n    parentName: \"span\",\n    \"className\": \"mord mathnormal\",\n    \"style\": {\n      \"marginRight\": \"0.02778em\"\n    }\n  }, \"r\"))))), \" and \", mdx(\"span\", {\n    parentName: \"p\",\n    \"className\": \"math math-inline\"\n  }, mdx(\"span\", {\n    parentName: \"span\",\n    \"className\": \"katex\"\n  }, mdx(\"span\", {\n    parentName: \"span\",\n    \"className\": \"katex-mathml\"\n  }, mdx(\"math\", {\n    parentName: \"span\",\n    \"xmlns\": \"http://www.w3.org/1998/Math/MathML\"\n  }, mdx(\"semantics\", {\n    parentName: \"math\"\n  }, mdx(\"mrow\", {\n    parentName: \"semantics\"\n  }, mdx(\"mi\", {\n    parentName: \"mrow\"\n  }, \"s\")), mdx(\"annotation\", {\n    parentName: \"semantics\",\n    \"encoding\": \"application/x-tex\"\n  }, \"s\")))), mdx(\"span\", {\n    parentName: \"span\",\n    \"className\": \"katex-html\",\n    \"aria-hidden\": \"true\"\n  }, mdx(\"span\", {\n    parentName: \"span\",\n    \"className\": \"base\"\n  }, mdx(\"span\", {\n    parentName: \"span\",\n    \"className\": \"strut\",\n    \"style\": {\n      \"height\": \"0.43056em\",\n      \"verticalAlign\": \"0em\"\n    }\n  }), mdx(\"span\", {\n    parentName: \"span\",\n    \"className\": \"mord mathnormal\"\n  }, \"s\"))))), \" respectively, and their inverses will be labeled \", mdx(\"span\", {\n    parentName: \"p\",\n    \"className\": \"math math-inline\"\n  }, mdx(\"span\", {\n    parentName: \"span\",\n    \"className\": \"katex\"\n  }, mdx(\"span\", {\n    parentName: \"span\",\n    \"className\": \"katex-mathml\"\n  }, mdx(\"math\", {\n    parentName: \"span\",\n    \"xmlns\": \"http://www.w3.org/1998/Math/MathML\"\n  }, mdx(\"semantics\", {\n    parentName: \"math\"\n  }, mdx(\"mrow\", {\n    parentName: \"semantics\"\n  }, mdx(\"mo\", {\n    parentName: \"mrow\"\n  }, \"\\u2212\"), mdx(\"mn\", {\n    parentName: \"mrow\"\n  }, \"1\")), mdx(\"annotation\", {\n    parentName: \"semantics\",\n    \"encoding\": \"application/x-tex\"\n  }, \"-1\")))), mdx(\"span\", {\n    parentName: \"span\",\n    \"className\": \"katex-html\",\n    \"aria-hidden\": \"true\"\n  }, mdx(\"span\", {\n    parentName: \"span\",\n    \"className\": \"base\"\n  }, mdx(\"span\", {\n    parentName: \"span\",\n    \"className\": \"strut\",\n    \"style\": {\n      \"height\": \"0.72777em\",\n      \"verticalAlign\": \"-0.08333em\"\n    }\n  }), mdx(\"span\", {\n    parentName: \"span\",\n    \"className\": \"mord\"\n  }, \"\\u2212\"), mdx(\"span\", {\n    parentName: \"span\",\n    \"className\": \"mord\"\n  }, \"1\"))))), \" and \", mdx(\"span\", {\n    parentName: \"p\",\n    \"className\": \"math math-inline\"\n  }, mdx(\"span\", {\n    parentName: \"span\",\n    \"className\": \"katex\"\n  }, mdx(\"span\", {\n    parentName: \"span\",\n    \"className\": \"katex-mathml\"\n  }, mdx(\"math\", {\n    parentName: \"span\",\n    \"xmlns\": \"http://www.w3.org/1998/Math/MathML\"\n  }, mdx(\"semantics\", {\n    parentName: \"math\"\n  }, mdx(\"mrow\", {\n    parentName: \"semantics\"\n  }, mdx(\"mo\", {\n    parentName: \"mrow\"\n  }, \"\\u2212\"), mdx(\"mn\", {\n    parentName: \"mrow\"\n  }, \"2\")), mdx(\"annotation\", {\n    parentName: \"semantics\",\n    \"encoding\": \"application/x-tex\"\n  }, \"-2\")))), mdx(\"span\", {\n    parentName: \"span\",\n    \"className\": \"katex-html\",\n    \"aria-hidden\": \"true\"\n  }, mdx(\"span\", {\n    parentName: \"span\",\n    \"className\": \"base\"\n  }, mdx(\"span\", {\n    parentName: \"span\",\n    \"className\": \"strut\",\n    \"style\": {\n      \"height\": \"0.72777em\",\n      \"verticalAlign\": \"-0.08333em\"\n    }\n  }), mdx(\"span\", {\n    parentName: \"span\",\n    \"className\": \"mord\"\n  }, \"\\u2212\"), mdx(\"span\", {\n    parentName: \"span\",\n    \"className\": \"mord\"\n  }, \"2\"))))), \"). After the \", mdx(\"code\", {\n    parentName: \"p\",\n    \"className\": \"language-text\"\n  }, \"--rels\"), \" flag, the relations in \", mdx(\"span\", {\n    parentName: \"p\",\n    \"className\": \"math math-inline\"\n  }, mdx(\"span\", {\n    parentName: \"span\",\n    \"className\": \"katex\"\n  }, mdx(\"span\", {\n    parentName: \"span\",\n    \"className\": \"katex-mathml\"\n  }, mdx(\"math\", {\n    parentName: \"span\",\n    \"xmlns\": \"http://www.w3.org/1998/Math/MathML\"\n  }, mdx(\"semantics\", {\n    parentName: \"math\"\n  }, mdx(\"mrow\", {\n    parentName: \"semantics\"\n  }, mdx(\"mi\", {\n    parentName: \"mrow\"\n  }, \"R\")), mdx(\"annotation\", {\n    parentName: \"semantics\",\n    \"encoding\": \"application/x-tex\"\n  }, \"R\")))), mdx(\"span\", {\n    parentName: \"span\",\n    \"className\": \"katex-html\",\n    \"aria-hidden\": \"true\"\n  }, mdx(\"span\", {\n    parentName: \"span\",\n    \"className\": \"base\"\n  }, mdx(\"span\", {\n    parentName: \"span\",\n    \"className\": \"strut\",\n    \"style\": {\n      \"height\": \"0.68333em\",\n      \"verticalAlign\": \"0em\"\n    }\n  }), mdx(\"span\", {\n    parentName: \"span\",\n    \"className\": \"mord mathnormal\",\n    \"style\": {\n      \"marginRight\": \"0.00773em\"\n    }\n  }, \"R\"))))), \" are specified using the following format: each generator is separated with a comma, and each word in \", mdx(\"span\", {\n    parentName: \"p\",\n    \"className\": \"math math-inline\"\n  }, mdx(\"span\", {\n    parentName: \"span\",\n    \"className\": \"katex\"\n  }, mdx(\"span\", {\n    parentName: \"span\",\n    \"className\": \"katex-mathml\"\n  }, mdx(\"math\", {\n    parentName: \"span\",\n    \"xmlns\": \"http://www.w3.org/1998/Math/MathML\"\n  }, mdx(\"semantics\", {\n    parentName: \"math\"\n  }, mdx(\"mrow\", {\n    parentName: \"semantics\"\n  }, mdx(\"mi\", {\n    parentName: \"mrow\"\n  }, \"R\")), mdx(\"annotation\", {\n    parentName: \"semantics\",\n    \"encoding\": \"application/x-tex\"\n  }, \"R\")))), mdx(\"span\", {\n    parentName: \"span\",\n    \"className\": \"katex-html\",\n    \"aria-hidden\": \"true\"\n  }, mdx(\"span\", {\n    parentName: \"span\",\n    \"className\": \"base\"\n  }, mdx(\"span\", {\n    parentName: \"span\",\n    \"className\": \"strut\",\n    \"style\": {\n      \"height\": \"0.68333em\",\n      \"verticalAlign\": \"0em\"\n    }\n  }), mdx(\"span\", {\n    parentName: \"span\",\n    \"className\": \"mord mathnormal\",\n    \"style\": {\n      \"marginRight\": \"0.00773em\"\n    }\n  }, \"R\"))))), \" is separated by a space. After the \", mdx(\"code\", {\n    parentName: \"p\",\n    \"className\": \"language-text\"\n  }, \"--hgens\"), \" flag, the generators for \", mdx(\"span\", {\n    parentName: \"p\",\n    \"className\": \"math math-inline\"\n  }, mdx(\"span\", {\n    parentName: \"span\",\n    \"className\": \"katex\"\n  }, mdx(\"span\", {\n    parentName: \"span\",\n    \"className\": \"katex-mathml\"\n  }, mdx(\"math\", {\n    parentName: \"span\",\n    \"xmlns\": \"http://www.w3.org/1998/Math/MathML\"\n  }, mdx(\"semantics\", {\n    parentName: \"math\"\n  }, mdx(\"mrow\", {\n    parentName: \"semantics\"\n  }, mdx(\"mi\", {\n    parentName: \"mrow\"\n  }, \"H\")), mdx(\"annotation\", {\n    parentName: \"semantics\",\n    \"encoding\": \"application/x-tex\"\n  }, \"H\")))), mdx(\"span\", {\n    parentName: \"span\",\n    \"className\": \"katex-html\",\n    \"aria-hidden\": \"true\"\n  }, mdx(\"span\", {\n    parentName: \"span\",\n    \"className\": \"base\"\n  }, mdx(\"span\", {\n    parentName: \"span\",\n    \"className\": \"strut\",\n    \"style\": {\n      \"height\": \"0.68333em\",\n      \"verticalAlign\": \"0em\"\n    }\n  }), mdx(\"span\", {\n    parentName: \"span\",\n    \"className\": \"mord mathnormal\",\n    \"style\": {\n      \"marginRight\": \"0.08125em\"\n    }\n  }, \"H\"))))), \" are specified using the same format.\"), mdx(\"p\", null, \"The rest of this section will outline the general structure of this implementation. If you are interested in the exact syntax used, I would encourage you to look directly at the source code.\"), mdx(\"h3\", {\n    \"id\": \"data-structures-and-classes\",\n    \"style\": {\n      \"position\": \"relative\"\n    }\n  }, mdx(\"a\", {\n    parentName: \"h3\",\n    \"href\": \"#data-structures-and-classes\",\n    \"aria-label\": \"data structures and classes permalink\",\n    \"className\": \"anchor before\"\n  }, mdx(\"svg\", {\n    parentName: \"a\",\n    \"aria-hidden\": \"true\",\n    \"focusable\": \"false\",\n    \"height\": \"16\",\n    \"version\": \"1.1\",\n    \"viewBox\": \"0 0 16 16\",\n    \"width\": \"16\"\n  }, mdx(\"path\", {\n    parentName: \"svg\",\n    \"fillRule\": \"evenodd\",\n    \"d\": \"M4 9h1v1H4c-1.5 0-3-1.69-3-3.5S2.55 3 4 3h4c1.45 0 3 1.69 3 3.5 0 1.41-.91 2.72-2 3.25V8.59c.58-.45 1-1.27 1-2.09C10 5.22 8.98 4 8 4H4c-.98 0-2 1.22-2 2.5S3 9 4 9zm9-3h-1v1h1c1 0 2 1.22 2 2.5S13.98 12 13 12H9c-.98 0-2-1.22-2-2.5 0-.83.42-1.64 1-2.09V6.25c-1.09.53-2 1.84-2 3.25C6 11.31 7.55 13 9 13h4c1.45 0 3-1.69 3-3.5S14.5 6 13 6z\"\n  }))), \"Data Structures and Classes\"), mdx(\"p\", null, \"There are two main data structures used within this implementation: a disjoint-set (or union-find) data structure implemented by the \", mdx(\"code\", {\n    parentName: \"p\",\n    \"className\": \"language-text\"\n  }, \"UnionFind\"), \" class and a graph represented by an adjecency list (implemented with a list of dictionaries). These two data structures are combined to create the \", mdx(\"code\", {\n    parentName: \"p\",\n    \"className\": \"language-text\"\n  }, \"PartialSchreierGraph\"), \" class, which represents the Schreier graph before the Todd-Coxeter Algorithm terminates.\"), mdx(\"p\", null, \"The \", mdx(\"code\", {\n    parentName: \"p\",\n    \"className\": \"language-text\"\n  }, \"SchreierGraph\"), \" class inherites from \", mdx(\"code\", {\n    parentName: \"p\",\n    \"className\": \"language-text\"\n  }, \"PartialSchreierGraph\"), \" and contains the logic for the Todd-Coxeter Algorithm. This algorithm is executed within the constructor of \", mdx(\"code\", {\n    parentName: \"p\",\n    \"className\": \"language-text\"\n  }, \"SchreierGraph\"), \" (i.e. it must terminate for an instance of \", mdx(\"code\", {\n    parentName: \"p\",\n    \"className\": \"language-text\"\n  }, \"SchreierGraph\"), \" to finish being constructed) so that all instances are guaranteed to represent a valid Schreier graph for \", mdx(\"span\", {\n    parentName: \"p\",\n    \"className\": \"math math-inline\"\n  }, mdx(\"span\", {\n    parentName: \"span\",\n    \"className\": \"katex\"\n  }, mdx(\"span\", {\n    parentName: \"span\",\n    \"className\": \"katex-mathml\"\n  }, mdx(\"math\", {\n    parentName: \"span\",\n    \"xmlns\": \"http://www.w3.org/1998/Math/MathML\"\n  }, mdx(\"semantics\", {\n    parentName: \"math\"\n  }, mdx(\"mrow\", {\n    parentName: \"semantics\"\n  }, mdx(\"mi\", {\n    parentName: \"mrow\"\n  }, \"G\"), mdx(\"mi\", {\n    parentName: \"mrow\",\n    \"mathvariant\": \"normal\"\n  }, \"/\"), mdx(\"mi\", {\n    parentName: \"mrow\"\n  }, \"H\")), mdx(\"annotation\", {\n    parentName: \"semantics\",\n    \"encoding\": \"application/x-tex\"\n  }, \"G/H\")))), mdx(\"span\", {\n    parentName: \"span\",\n    \"className\": \"katex-html\",\n    \"aria-hidden\": \"true\"\n  }, mdx(\"span\", {\n    parentName: \"span\",\n    \"className\": \"base\"\n  }, mdx(\"span\", {\n    parentName: \"span\",\n    \"className\": \"strut\",\n    \"style\": {\n      \"height\": \"1em\",\n      \"verticalAlign\": \"-0.25em\"\n    }\n  }), mdx(\"span\", {\n    parentName: \"span\",\n    \"className\": \"mord mathnormal\"\n  }, \"G\"), mdx(\"span\", {\n    parentName: \"span\",\n    \"className\": \"mord\"\n  }, \"/\"), mdx(\"span\", {\n    parentName: \"span\",\n    \"className\": \"mord mathnormal\",\n    \"style\": {\n      \"marginRight\": \"0.08125em\"\n    }\n  }, \"H\"))))), \". This class, in conjuction with the \", mdx(\"code\", {\n    parentName: \"p\",\n    \"className\": \"language-text\"\n  }, \"Permutation\"), \" class, also provides a way to interpret the graph without displaying it in its entirety. Instead, for each generator, it displays a product of cycles that corresponds with how that generator permutes the cosets of \", mdx(\"span\", {\n    parentName: \"p\",\n    \"className\": \"math math-inline\"\n  }, mdx(\"span\", {\n    parentName: \"span\",\n    \"className\": \"katex\"\n  }, mdx(\"span\", {\n    parentName: \"span\",\n    \"className\": \"katex-mathml\"\n  }, mdx(\"math\", {\n    parentName: \"span\",\n    \"xmlns\": \"http://www.w3.org/1998/Math/MathML\"\n  }, mdx(\"semantics\", {\n    parentName: \"math\"\n  }, mdx(\"mrow\", {\n    parentName: \"semantics\"\n  }, mdx(\"mi\", {\n    parentName: \"mrow\"\n  }, \"H\")), mdx(\"annotation\", {\n    parentName: \"semantics\",\n    \"encoding\": \"application/x-tex\"\n  }, \"H\")))), mdx(\"span\", {\n    parentName: \"span\",\n    \"className\": \"katex-html\",\n    \"aria-hidden\": \"true\"\n  }, mdx(\"span\", {\n    parentName: \"span\",\n    \"className\": \"base\"\n  }, mdx(\"span\", {\n    parentName: \"span\",\n    \"className\": \"strut\",\n    \"style\": {\n      \"height\": \"0.68333em\",\n      \"verticalAlign\": \"0em\"\n    }\n  }), mdx(\"span\", {\n    parentName: \"span\",\n    \"className\": \"mord mathnormal\",\n    \"style\": {\n      \"marginRight\": \"0.08125em\"\n    }\n  }, \"H\"))))), \".\"), mdx(\"h3\", {\n    \"id\": \"a-closer-look-at-unionfind-and-its-role-in-partialschreiergraph\",\n    \"style\": {\n      \"position\": \"relative\"\n    }\n  }, mdx(\"a\", {\n    parentName: \"h3\",\n    \"href\": \"#a-closer-look-at-unionfind-and-its-role-in-partialschreiergraph\",\n    \"aria-label\": \"a closer look at unionfind and its role in partialschreiergraph permalink\",\n    \"className\": \"anchor before\"\n  }, mdx(\"svg\", {\n    parentName: \"a\",\n    \"aria-hidden\": \"true\",\n    \"focusable\": \"false\",\n    \"height\": \"16\",\n    \"version\": \"1.1\",\n    \"viewBox\": \"0 0 16 16\",\n    \"width\": \"16\"\n  }, mdx(\"path\", {\n    parentName: \"svg\",\n    \"fillRule\": \"evenodd\",\n    \"d\": \"M4 9h1v1H4c-1.5 0-3-1.69-3-3.5S2.55 3 4 3h4c1.45 0 3 1.69 3 3.5 0 1.41-.91 2.72-2 3.25V8.59c.58-.45 1-1.27 1-2.09C10 5.22 8.98 4 8 4H4c-.98 0-2 1.22-2 2.5S3 9 4 9zm9-3h-1v1h1c1 0 2 1.22 2 2.5S13.98 12 13 12H9c-.98 0-2-1.22-2-2.5 0-.83.42-1.64 1-2.09V6.25c-1.09.53-2 1.84-2 3.25C6 11.31 7.55 13 9 13h4c1.45 0 3-1.69 3-3.5S14.5 6 13 6z\"\n  }))), \"A Closer Look at UnionFind and its Role in PartialSchreierGraph\"), mdx(\"p\", null, \"The disjoint-set (or union-find) data structure represents a set of disjoint sets using disjoint trees. This forest is represented by a single list \", mdx(\"code\", {\n    parentName: \"p\",\n    \"className\": \"language-text\"\n  }, \"parent\"), \" with the following constraint.\"), mdx(\"div\", {\n    \"className\": \"gatsby-highlight\",\n    \"data-language\": \"text\"\n  }, mdx(\"pre\", {\n    parentName: \"div\",\n    \"className\": \"language-text\"\n  }, mdx(\"code\", {\n    parentName: \"pre\",\n    \"className\": \"language-text\"\n  }, \"parent[index/label of child] = index/label of parent\"))), mdx(\"p\", null, \"When using disjoint-sets, we have access to two operations.\"), mdx(\"ul\", null, mdx(\"li\", {\n    parentName: \"ul\"\n  }, mdx(\"strong\", {\n    parentName: \"li\"\n  }, \"Find:\"), \" For any given label, find the root of the tree that contains that label\"), mdx(\"li\", {\n    parentName: \"ul\"\n  }, mdx(\"strong\", {\n    parentName: \"li\"\n  }, \"Union:\"), \" For any two labels, if those labels are a part of different trees, combine those two trees. In our implementation, the root with the lower label is used as the root of the new tree.\")), mdx(\"p\", null, \"More information about this data structure can be found \", mdx(\"a\", {\n    parentName: \"p\",\n    \"href\": \"https://en.wikipedia.org/wiki/Disjoint-set_data_structure\"\n  }, \"here\"), \".\"), mdx(\"p\", null, \"Within the \", mdx(\"code\", {\n    parentName: \"p\",\n    \"className\": \"language-text\"\n  }, \"PartialSchreierGraph\"), \" class, the disjoint-set data structure is used to keep track of vertex labels. We could just use a single label for each vertex, but if a label is removed (and this happens quite a lot during identification) then all references to that label must be updated or removed. That would require looping through all of the edges of the graph, which is inefficient. With the disjoint-set keeping track of labels, we don't need to worry about this. Instead, whenever we want to run an operation on a vertex label, we first run the \", mdx(\"strong\", {\n    parentName: \"p\"\n  }, \"find\"), \" operation on that label to get the \", mdx(\"em\", {\n    parentName: \"p\"\n  }, \"actual\"), \" (that is, the lowest) label for that vertex. And, whenever we identify two nodes, we run the \", mdx(\"strong\", {\n    parentName: \"p\"\n  }, \"union\"), \" operation on their labels.\"), mdx(\"h3\", {\n    \"id\": \"supporting-inverses\",\n    \"style\": {\n      \"position\": \"relative\"\n    }\n  }, mdx(\"a\", {\n    parentName: \"h3\",\n    \"href\": \"#supporting-inverses\",\n    \"aria-label\": \"supporting inverses permalink\",\n    \"className\": \"anchor before\"\n  }, mdx(\"svg\", {\n    parentName: \"a\",\n    \"aria-hidden\": \"true\",\n    \"focusable\": \"false\",\n    \"height\": \"16\",\n    \"version\": \"1.1\",\n    \"viewBox\": \"0 0 16 16\",\n    \"width\": \"16\"\n  }, mdx(\"path\", {\n    parentName: \"svg\",\n    \"fillRule\": \"evenodd\",\n    \"d\": \"M4 9h1v1H4c-1.5 0-3-1.69-3-3.5S2.55 3 4 3h4c1.45 0 3 1.69 3 3.5 0 1.41-.91 2.72-2 3.25V8.59c.58-.45 1-1.27 1-2.09C10 5.22 8.98 4 8 4H4c-.98 0-2 1.22-2 2.5S3 9 4 9zm9-3h-1v1h1c1 0 2 1.22 2 2.5S13.98 12 13 12H9c-.98 0-2-1.22-2-2.5 0-.83.42-1.64 1-2.09V6.25c-1.09.53-2 1.84-2 3.25C6 11.31 7.55 13 9 13h4c1.45 0 3-1.69 3-3.5S14.5 6 13 6z\"\n  }))), \"Supporting Inverses\"), mdx(\"p\", null, \"It is not technically necessary to keep track of inverses within the adjacency list for our Schreier graph since every incoming edge is an outgoing edge for some other vertex. However, we would like to be able to include inverses in the words in \", mdx(\"span\", {\n    parentName: \"p\",\n    \"className\": \"math math-inline\"\n  }, mdx(\"span\", {\n    parentName: \"span\",\n    \"className\": \"katex\"\n  }, mdx(\"span\", {\n    parentName: \"span\",\n    \"className\": \"katex-mathml\"\n  }, mdx(\"math\", {\n    parentName: \"span\",\n    \"xmlns\": \"http://www.w3.org/1998/Math/MathML\"\n  }, mdx(\"semantics\", {\n    parentName: \"math\"\n  }, mdx(\"mrow\", {\n    parentName: \"semantics\"\n  }, mdx(\"mi\", {\n    parentName: \"mrow\"\n  }, \"R\")), mdx(\"annotation\", {\n    parentName: \"semantics\",\n    \"encoding\": \"application/x-tex\"\n  }, \"R\")))), mdx(\"span\", {\n    parentName: \"span\",\n    \"className\": \"katex-html\",\n    \"aria-hidden\": \"true\"\n  }, mdx(\"span\", {\n    parentName: \"span\",\n    \"className\": \"base\"\n  }, mdx(\"span\", {\n    parentName: \"span\",\n    \"className\": \"strut\",\n    \"style\": {\n      \"height\": \"0.68333em\",\n      \"verticalAlign\": \"0em\"\n    }\n  }), mdx(\"span\", {\n    parentName: \"span\",\n    \"className\": \"mord mathnormal\",\n    \"style\": {\n      \"marginRight\": \"0.00773em\"\n    }\n  }, \"R\"))))), \" and \", mdx(\"span\", {\n    parentName: \"p\",\n    \"className\": \"math math-inline\"\n  }, mdx(\"span\", {\n    parentName: \"span\",\n    \"className\": \"katex\"\n  }, mdx(\"span\", {\n    parentName: \"span\",\n    \"className\": \"katex-mathml\"\n  }, mdx(\"math\", {\n    parentName: \"span\",\n    \"xmlns\": \"http://www.w3.org/1998/Math/MathML\"\n  }, mdx(\"semantics\", {\n    parentName: \"math\"\n  }, mdx(\"mrow\", {\n    parentName: \"semantics\"\n  }, mdx(\"mi\", {\n    parentName: \"mrow\"\n  }, \"Y\")), mdx(\"annotation\", {\n    parentName: \"semantics\",\n    \"encoding\": \"application/x-tex\"\n  }, \"Y\")))), mdx(\"span\", {\n    parentName: \"span\",\n    \"className\": \"katex-html\",\n    \"aria-hidden\": \"true\"\n  }, mdx(\"span\", {\n    parentName: \"span\",\n    \"className\": \"base\"\n  }, mdx(\"span\", {\n    parentName: \"span\",\n    \"className\": \"strut\",\n    \"style\": {\n      \"height\": \"0.68333em\",\n      \"verticalAlign\": \"0em\"\n    }\n  }), mdx(\"span\", {\n    parentName: \"span\",\n    \"className\": \"mord mathnormal\",\n    \"style\": {\n      \"marginRight\": \"0.22222em\"\n    }\n  }, \"Y\"))))), \", and therefore we need to be able to calculate \", mdx(\"span\", {\n    parentName: \"p\",\n    \"className\": \"math math-inline\"\n  }, mdx(\"span\", {\n    parentName: \"span\",\n    \"className\": \"katex\"\n  }, mdx(\"span\", {\n    parentName: \"span\",\n    \"className\": \"katex-mathml\"\n  }, mdx(\"math\", {\n    parentName: \"span\",\n    \"xmlns\": \"http://www.w3.org/1998/Math/MathML\"\n  }, mdx(\"semantics\", {\n    parentName: \"math\"\n  }, mdx(\"mrow\", {\n    parentName: \"semantics\"\n  }, mdx(\"msup\", {\n    parentName: \"mrow\"\n  }, mdx(\"mi\", {\n    parentName: \"msup\"\n  }, \"g\"), mdx(\"mrow\", {\n    parentName: \"msup\"\n  }, mdx(\"mo\", {\n    parentName: \"mrow\"\n  }, \"\\u2212\"), mdx(\"mn\", {\n    parentName: \"mrow\"\n  }, \"1\"))), mdx(\"mi\", {\n    parentName: \"mrow\"\n  }, \"s\")), mdx(\"annotation\", {\n    parentName: \"semantics\",\n    \"encoding\": \"application/x-tex\"\n  }, \"g^{-1}s\")))), mdx(\"span\", {\n    parentName: \"span\",\n    \"className\": \"katex-html\",\n    \"aria-hidden\": \"true\"\n  }, mdx(\"span\", {\n    parentName: \"span\",\n    \"className\": \"base\"\n  }, mdx(\"span\", {\n    parentName: \"span\",\n    \"className\": \"strut\",\n    \"style\": {\n      \"height\": \"1.008548em\",\n      \"verticalAlign\": \"-0.19444em\"\n    }\n  }), mdx(\"span\", {\n    parentName: \"span\",\n    \"className\": \"mord\"\n  }, mdx(\"span\", {\n    parentName: \"span\",\n    \"className\": \"mord mathnormal\",\n    \"style\": {\n      \"marginRight\": \"0.03588em\"\n    }\n  }, \"g\"), mdx(\"span\", {\n    parentName: \"span\",\n    \"className\": \"msupsub\"\n  }, mdx(\"span\", {\n    parentName: \"span\",\n    \"className\": \"vlist-t\"\n  }, mdx(\"span\", {\n    parentName: \"span\",\n    \"className\": \"vlist-r\"\n  }, mdx(\"span\", {\n    parentName: \"span\",\n    \"className\": \"vlist\",\n    \"style\": {\n      \"height\": \"0.8141079999999999em\"\n    }\n  }, mdx(\"span\", {\n    parentName: \"span\",\n    \"style\": {\n      \"top\": \"-3.063em\",\n      \"marginRight\": \"0.05em\"\n    }\n  }, mdx(\"span\", {\n    parentName: \"span\",\n    \"className\": \"pstrut\",\n    \"style\": {\n      \"height\": \"2.7em\"\n    }\n  }), mdx(\"span\", {\n    parentName: \"span\",\n    \"className\": \"sizing reset-size6 size3 mtight\"\n  }, mdx(\"span\", {\n    parentName: \"span\",\n    \"className\": \"mord mtight\"\n  }, mdx(\"span\", {\n    parentName: \"span\",\n    \"className\": \"mord mtight\"\n  }, \"\\u2212\"), mdx(\"span\", {\n    parentName: \"span\",\n    \"className\": \"mord mtight\"\n  }, \"1\"))))))))), mdx(\"span\", {\n    parentName: \"span\",\n    \"className\": \"mord mathnormal\"\n  }, \"s\"))))), \" quickly. For this reason, we do include inverses in our adjacency list.\"), mdx(\"p\", null, \"To keep the inverse edges pointing in the right direction, we add a trivial relation \", mdx(\"span\", {\n    parentName: \"p\",\n    \"className\": \"math math-inline\"\n  }, mdx(\"span\", {\n    parentName: \"span\",\n    \"className\": \"katex\"\n  }, mdx(\"span\", {\n    parentName: \"span\",\n    \"className\": \"katex-mathml\"\n  }, mdx(\"math\", {\n    parentName: \"span\",\n    \"xmlns\": \"http://www.w3.org/1998/Math/MathML\"\n  }, mdx(\"semantics\", {\n    parentName: \"math\"\n  }, mdx(\"mrow\", {\n    parentName: \"semantics\"\n  }, mdx(\"mi\", {\n    parentName: \"mrow\"\n  }, \"g\"), mdx(\"msup\", {\n    parentName: \"mrow\"\n  }, mdx(\"mi\", {\n    parentName: \"msup\"\n  }, \"g\"), mdx(\"mrow\", {\n    parentName: \"msup\"\n  }, mdx(\"mo\", {\n    parentName: \"mrow\"\n  }, \"\\u2212\"), mdx(\"mn\", {\n    parentName: \"mrow\"\n  }, \"1\")))), mdx(\"annotation\", {\n    parentName: \"semantics\",\n    \"encoding\": \"application/x-tex\"\n  }, \"gg^{-1}\")))), mdx(\"span\", {\n    parentName: \"span\",\n    \"className\": \"katex-html\",\n    \"aria-hidden\": \"true\"\n  }, mdx(\"span\", {\n    parentName: \"span\",\n    \"className\": \"base\"\n  }, mdx(\"span\", {\n    parentName: \"span\",\n    \"className\": \"strut\",\n    \"style\": {\n      \"height\": \"1.008548em\",\n      \"verticalAlign\": \"-0.19444em\"\n    }\n  }), mdx(\"span\", {\n    parentName: \"span\",\n    \"className\": \"mord mathnormal\",\n    \"style\": {\n      \"marginRight\": \"0.03588em\"\n    }\n  }, \"g\"), mdx(\"span\", {\n    parentName: \"span\",\n    \"className\": \"mord\"\n  }, mdx(\"span\", {\n    parentName: \"span\",\n    \"className\": \"mord mathnormal\",\n    \"style\": {\n      \"marginRight\": \"0.03588em\"\n    }\n  }, \"g\"), mdx(\"span\", {\n    parentName: \"span\",\n    \"className\": \"msupsub\"\n  }, mdx(\"span\", {\n    parentName: \"span\",\n    \"className\": \"vlist-t\"\n  }, mdx(\"span\", {\n    parentName: \"span\",\n    \"className\": \"vlist-r\"\n  }, mdx(\"span\", {\n    parentName: \"span\",\n    \"className\": \"vlist\",\n    \"style\": {\n      \"height\": \"0.8141079999999999em\"\n    }\n  }, mdx(\"span\", {\n    parentName: \"span\",\n    \"style\": {\n      \"top\": \"-3.063em\",\n      \"marginRight\": \"0.05em\"\n    }\n  }, mdx(\"span\", {\n    parentName: \"span\",\n    \"className\": \"pstrut\",\n    \"style\": {\n      \"height\": \"2.7em\"\n    }\n  }), mdx(\"span\", {\n    parentName: \"span\",\n    \"className\": \"sizing reset-size6 size3 mtight\"\n  }, mdx(\"span\", {\n    parentName: \"span\",\n    \"className\": \"mord mtight\"\n  }, mdx(\"span\", {\n    parentName: \"span\",\n    \"className\": \"mord mtight\"\n  }, \"\\u2212\"), mdx(\"span\", {\n    parentName: \"span\",\n    \"className\": \"mord mtight\"\n  }, \"1\"))))))))))))), \" to \", mdx(\"span\", {\n    parentName: \"p\",\n    \"className\": \"math math-inline\"\n  }, mdx(\"span\", {\n    parentName: \"span\",\n    \"className\": \"katex\"\n  }, mdx(\"span\", {\n    parentName: \"span\",\n    \"className\": \"katex-mathml\"\n  }, mdx(\"math\", {\n    parentName: \"span\",\n    \"xmlns\": \"http://www.w3.org/1998/Math/MathML\"\n  }, mdx(\"semantics\", {\n    parentName: \"math\"\n  }, mdx(\"mrow\", {\n    parentName: \"semantics\"\n  }, mdx(\"mi\", {\n    parentName: \"mrow\"\n  }, \"R\")), mdx(\"annotation\", {\n    parentName: \"semantics\",\n    \"encoding\": \"application/x-tex\"\n  }, \"R\")))), mdx(\"span\", {\n    parentName: \"span\",\n    \"className\": \"katex-html\",\n    \"aria-hidden\": \"true\"\n  }, mdx(\"span\", {\n    parentName: \"span\",\n    \"className\": \"base\"\n  }, mdx(\"span\", {\n    parentName: \"span\",\n    \"className\": \"strut\",\n    \"style\": {\n      \"height\": \"0.68333em\",\n      \"verticalAlign\": \"0em\"\n    }\n  }), mdx(\"span\", {\n    parentName: \"span\",\n    \"className\": \"mord mathnormal\",\n    \"style\": {\n      \"marginRight\": \"0.00773em\"\n    }\n  }, \"R\"))))), \" for each \", mdx(\"span\", {\n    parentName: \"p\",\n    \"className\": \"math math-inline\"\n  }, mdx(\"span\", {\n    parentName: \"span\",\n    \"className\": \"katex\"\n  }, mdx(\"span\", {\n    parentName: \"span\",\n    \"className\": \"katex-mathml\"\n  }, mdx(\"math\", {\n    parentName: \"span\",\n    \"xmlns\": \"http://www.w3.org/1998/Math/MathML\"\n  }, mdx(\"semantics\", {\n    parentName: \"math\"\n  }, mdx(\"mrow\", {\n    parentName: \"semantics\"\n  }, mdx(\"mi\", {\n    parentName: \"mrow\"\n  }, \"g\"), mdx(\"mo\", {\n    parentName: \"mrow\"\n  }, \"\\u2208\"), mdx(\"mi\", {\n    parentName: \"mrow\"\n  }, \"X\")), mdx(\"annotation\", {\n    parentName: \"semantics\",\n    \"encoding\": \"application/x-tex\"\n  }, \"g \\\\in X\")))), mdx(\"span\", {\n    parentName: \"span\",\n    \"className\": \"katex-html\",\n    \"aria-hidden\": \"true\"\n  }, mdx(\"span\", {\n    parentName: \"span\",\n    \"className\": \"base\"\n  }, mdx(\"span\", {\n    parentName: \"span\",\n    \"className\": \"strut\",\n    \"style\": {\n      \"height\": \"0.7335400000000001em\",\n      \"verticalAlign\": \"-0.19444em\"\n    }\n  }), mdx(\"span\", {\n    parentName: \"span\",\n    \"className\": \"mord mathnormal\",\n    \"style\": {\n      \"marginRight\": \"0.03588em\"\n    }\n  }, \"g\"), mdx(\"span\", {\n    parentName: \"span\",\n    \"className\": \"mspace\",\n    \"style\": {\n      \"marginRight\": \"0.2777777777777778em\"\n    }\n  }), mdx(\"span\", {\n    parentName: \"span\",\n    \"className\": \"mrel\"\n  }, \"\\u2208\"), mdx(\"span\", {\n    parentName: \"span\",\n    \"className\": \"mspace\",\n    \"style\": {\n      \"marginRight\": \"0.2777777777777778em\"\n    }\n  })), mdx(\"span\", {\n    parentName: \"span\",\n    \"className\": \"base\"\n  }, mdx(\"span\", {\n    parentName: \"span\",\n    \"className\": \"strut\",\n    \"style\": {\n      \"height\": \"0.68333em\",\n      \"verticalAlign\": \"0em\"\n    }\n  }), mdx(\"span\", {\n    parentName: \"span\",\n    \"className\": \"mord mathnormal\",\n    \"style\": {\n      \"marginRight\": \"0.07847em\"\n    }\n  }, \"X\"))))), \". This ensures that, after the completion of the algorithm, we are left with a valid Schreier graph. No other changes are necessary.\"), mdx(\"h2\", {\n    \"id\": \"conclusion\",\n    \"style\": {\n      \"position\": \"relative\"\n    }\n  }, mdx(\"a\", {\n    parentName: \"h2\",\n    \"href\": \"#conclusion\",\n    \"aria-label\": \"conclusion permalink\",\n    \"className\": \"anchor before\"\n  }, mdx(\"svg\", {\n    parentName: \"a\",\n    \"aria-hidden\": \"true\",\n    \"focusable\": \"false\",\n    \"height\": \"16\",\n    \"version\": \"1.1\",\n    \"viewBox\": \"0 0 16 16\",\n    \"width\": \"16\"\n  }, mdx(\"path\", {\n    parentName: \"svg\",\n    \"fillRule\": \"evenodd\",\n    \"d\": \"M4 9h1v1H4c-1.5 0-3-1.69-3-3.5S2.55 3 4 3h4c1.45 0 3 1.69 3 3.5 0 1.41-.91 2.72-2 3.25V8.59c.58-.45 1-1.27 1-2.09C10 5.22 8.98 4 8 4H4c-.98 0-2 1.22-2 2.5S3 9 4 9zm9-3h-1v1h1c1 0 2 1.22 2 2.5S13.98 12 13 12H9c-.98 0-2-1.22-2-2.5 0-.83.42-1.64 1-2.09V6.25c-1.09.53-2 1.84-2 3.25C6 11.31 7.55 13 9 13h4c1.45 0 3-1.69 3-3.5S14.5 6 13 6z\"\n  }))), \"Conclusion\"), mdx(\"p\", null, \"Although this post is not quite mathematically complete, I hope that it has provided some valuable insight into the Todd-Coxeter Algorithm from a mathematical perspective and from the perspective of computer science. \"), mdx(\"p\", null, \"In addition to being a fun project, this post was also an assignment for a class taken at Cleveland State University in cooperation with the Jack, Joseph and Morton Mandel Honors College. Special thanks to Dr. Galetto for his guidence during this project.\"), mdx(\"p\", null, \"If you have any questions or find any errata, feel free to email me at \", mdx(\"a\", {\n    parentName: \"p\",\n    \"href\": \"mailto:jsimonrichard@gmail.com\"\n  }, \"jsimonrichard@gmail.com\"), \" or create a GitHub issue \", mdx(\"a\", {\n    parentName: \"p\",\n    \"href\": \"https://github.com/jsimonrichard/jsimonrichard/issues\"\n  }, \"here\"), \" (if that's your kind of thing). Also, keep in mind that this entire website is open source, so if you want to learn how to make a website like this or a interactive graph like the one I have above, feel free to check out its source code \", mdx(\"a\", {\n    parentName: \"p\",\n    \"href\": \"https://github.com/jsimonrichard/jsimonrichard\"\n  }, \"here\"), \".\"), mdx(\"h2\", {\n    \"id\": \"resources\",\n    \"style\": {\n      \"position\": \"relative\"\n    }\n  }, mdx(\"a\", {\n    parentName: \"h2\",\n    \"href\": \"#resources\",\n    \"aria-label\": \"resources permalink\",\n    \"className\": \"anchor before\"\n  }, mdx(\"svg\", {\n    parentName: \"a\",\n    \"aria-hidden\": \"true\",\n    \"focusable\": \"false\",\n    \"height\": \"16\",\n    \"version\": \"1.1\",\n    \"viewBox\": \"0 0 16 16\",\n    \"width\": \"16\"\n  }, mdx(\"path\", {\n    parentName: \"svg\",\n    \"fillRule\": \"evenodd\",\n    \"d\": \"M4 9h1v1H4c-1.5 0-3-1.69-3-3.5S2.55 3 4 3h4c1.45 0 3 1.69 3 3.5 0 1.41-.91 2.72-2 3.25V8.59c.58-.45 1-1.27 1-2.09C10 5.22 8.98 4 8 4H4c-.98 0-2 1.22-2 2.5S3 9 4 9zm9-3h-1v1h1c1 0 2 1.22 2 2.5S13.98 12 13 12H9c-.98 0-2-1.22-2-2.5 0-.83.42-1.64 1-2.09V6.25c-1.09.53-2 1.84-2 3.25C6 11.31 7.55 13 9 13h4c1.45 0 3-1.69 3-3.5S14.5 6 13 6z\"\n  }))), \"Resources\"), mdx(\"ol\", null, mdx(\"li\", {\n    parentName: \"ol\"\n  }, mdx(\"p\", {\n    parentName: \"li\"\n  }, \"Holt, Derek. (2013). Presentation of Groups. \", mdx(\"a\", {\n    parentName: \"p\",\n    \"href\": \"https://warwick.ac.uk/fac/sci/maths/people/staff/fbouyer/presentation_of_group.pdf\"\n  }, \"https://warwick.ac.uk/fac/sci/maths/people/staff/fbouyer/presentation_of_group.pdf\"))), mdx(\"li\", {\n    parentName: \"ol\"\n  }, mdx(\"p\", {\n    parentName: \"li\"\n  }, \"Todd, J., & Coxeter, H. (1936). A practical method for enumerating cosets of a finite abstract group. Proceedings of the Edinburgh Mathematical Society, 5(1), 26-34. doi:10.1017/S0013091500008221\\n(pdf: \", mdx(\"a\", {\n    parentName: \"p\",\n    \"href\": \"https://www.cambridge.org/core/services/aop-cambridge-core/content/view/S0013091500008221\"\n  }, \"https://www.cambridge.org/core/services/aop-cambridge-core/content/view/S0013091500008221\"), \")\")), mdx(\"li\", {\n    parentName: \"ol\"\n  }, mdx(\"p\", {\n    parentName: \"li\"\n  }, \"Miller, Kyle. (2016). The Todd-Coxeter algorithm. \", mdx(\"a\", {\n    parentName: \"p\",\n    \"href\": \"https://math.berkeley.edu/~kmill/notes/todd_coxeter.html\"\n  }, \"https://math.berkeley.edu/~kmill/notes/todd_coxeter.html\"))), mdx(\"li\", {\n    parentName: \"ol\"\n  }, mdx(\"p\", {\n    parentName: \"li\"\n  }, \"vis.js: \", mdx(\"a\", {\n    parentName: \"p\",\n    \"href\": \"https://visjs.org/\"\n  }, \"https://visjs.org/\"), \". Used to display the interactive graphs\")), mdx(\"li\", {\n    parentName: \"ol\"\n  }, mdx(\"p\", {\n    parentName: \"li\"\n  }, \"react-graph-vis: \", mdx(\"a\", {\n    parentName: \"p\",\n    \"href\": \"https://github.com/crubier/react-graph-vis\"\n  }, \"https://github.com/crubier/react-graph-vis\"), \". A vis.js wrapper for ReactJS\"))));\n}\n;\nMDXContent.isMDXComponent = true;"}},"pageContext":{"slug":"/blog/todd-coxeter/"}},
    "staticQueryHashes": []}